id,repo,body,url,issue_url,issue_title,created_at,user
1637159156,WICG/webcomponents,My first impressions of this are positive. It's an interesting way to sidestep the syntax question a,https://github.com/WICG/webcomponents/issues/1019#issuecomment-1637159156,https://github.com/WICG/webcomponents/issues/1019,[dom-parts] HTMLTemplateElement.fromStrings() API,2023-07-16T18:34:25Z,EisenbergEffect
1637153738,WICG/webcomponents,"We've gone through a couple of these APIs in lit-html, which has nearly an identical concept to Attr",https://github.com/WICG/webcomponents/issues/1011#issuecomment-1637153738,https://github.com/WICG/webcomponents/issues/1011,[dom-parts] Attribute Grouping,2023-07-16T18:06:27Z,justinfagnani
1637147705,whatwg/html,Invited,https://github.com/whatwg/html/issues/9515#issuecomment-1637147705,https://github.com/whatwg/html/issues/9515,Upcoming HTML standard issue triage meeting on 7/27/2023,2023-07-16T17:40:39Z,smaug----
1637145826,WICG/webcomponents,"How long are the sessions? Given the potentially very long list of WC topics, would it make sense to",https://github.com/WICG/webcomponents/issues/1018#issuecomment-1637145826,https://github.com/WICG/webcomponents/issues/1018,2023 TPAC F2F discussion?,2023-07-16T17:31:26Z,justinfagnani
1637056408,w3ctag/design-reviews,"Hi folks - I'm going to close this one for now. Please feel free to re-open when you're ready for a ",https://github.com/w3ctag/design-reviews/issues/836#issuecomment-1637056408,https://github.com/w3ctag/design-reviews/issues/836,WebRTC Codec selection API,2023-07-16T11:17:17Z,torgo
1636918406,WICG/webcomponents,"Alright, I've migrated the list of topics from that page: - [Cross Root ARIA](https://docs.google.c",https://github.com/WICG/webcomponents/issues/1018#issuecomment-1636918406,https://github.com/WICG/webcomponents/issues/1018,2023 TPAC F2F discussion?,2023-07-15T23:47:56Z,rniwa
1636744592,whatwg/html,If they offer a password reveal button in their password inputs I would suggest yes else it will lea,https://github.com/whatwg/html/issues/7293#issuecomment-1636744592,https://github.com/whatwg/html/issues/7293,<input type=password> should provide UI to show/hide its value,2023-07-15T11:47:53Z,lukewarlow
1636651198,whatwg/html,The compat spec is really here to describe things which need to be implemented when there is no spec,https://github.com/whatwg/html/issues/7293#issuecomment-1636651198,https://github.com/whatwg/html/issues/7293,<input type=password> should provide UI to show/hide its value,2023-07-15T04:09:44Z,karlcow
1636640005,WICG/webcomponents,Absolutely would love to meet and discuss web components topics. The Web Components CG has started a,https://github.com/WICG/webcomponents/issues/1018#issuecomment-1636640005,https://github.com/WICG/webcomponents/issues/1018,2023 TPAC F2F discussion?,2023-07-15T03:18:10Z,EisenbergEffect
1636605353,whatwg/html,Could you invite me to this triage meeting assuming https://github.com/whatwg/html/pull/8467#issueco,https://github.com/whatwg/html/issues/9515#issuecomment-1636605353,https://github.com/whatwg/html/issues/9515,Upcoming HTML standard issue triage meeting on 7/27/2023,2023-07-15T01:10:45Z,rniwa
1636603102,whatwg/html,"(I won't be able to attend the meeting anytime soon, but it would be good to get the above feedback ",https://github.com/whatwg/html/pull/8467#issuecomment-1636603102,https://github.com/whatwg/html/pull/8467,Add custom state pseudo class,2023-07-15T01:05:46Z,annevk
1636569140,w3c/editcontext,I think any limit on the amount of text that can be sent to the IME would be the same whether that t,https://github.com/w3c/edit-context/issues/38#issuecomment-1636569140,https://github.com/w3c/edit-context/issues/38,What happens when an editing host is associated with an EditContext?,2023-07-14T23:58:02Z,dandclark
1636565525,whatwg/webidl,Would the handlers implement the methods/attributes with own-property semantics? (perhaps achieved l,https://github.com/whatwg/webidl/issues/1342#issuecomment-1636565525,https://github.com/whatwg/webidl/issues/1342,"Make ObservableArray ""subclassable""",2023-07-14T23:49:53Z,bathos
1636515068,whatwg/html,"> This code doesn't seem to copy over the ""is srcdoc document"" bit from what I can see. But, I guess",https://github.com/whatwg/html/issues/9514#issuecomment-1636515068,https://github.com/whatwg/html/issues/9514,What to do with non-srcdoc about:srcdoc documents,2023-07-14T22:33:03Z,domfarolino
1636491954,whatwg/webidl,"Hm, that said, we've (purposely, I believe) moved away from ObservableArrays being constructable obj",https://github.com/whatwg/webidl/issues/1342#issuecomment-1636491954,https://github.com/whatwg/webidl/issues/1342,"Make ObservableArray ""subclassable""",2023-07-14T22:02:35Z,tabatkins
1636414420,whatwg/html,"The spec now explicitly does (2), probably since https://github.com/whatwg/html/pull/8253 that made ",https://github.com/whatwg/html/issues/3746#issuecomment-1636414420,https://github.com/whatwg/html/issues/3746,"Confusing ""async"" completion of script fetching",2023-07-14T20:40:03Z,nicolo-ribaudo
1636401959,whatwg/html,Have you checked out https://datatracker.ietf.org/doc/html/rfc6838#section-4.2 ?  It says subtypes,https://github.com/whatwg/html/pull/9486#issuecomment-1636401959,https://github.com/whatwg/html/pull/9486,Use appropriate fetch destination for JSON&CSS modules,2023-07-14T20:29:31Z,clshortfuse
1636383815,whatwg/html,"After this PR I will open one to replace all the ""settings object"" parameters of the various loading",https://github.com/whatwg/html/pull/9520#issuecomment-1636383815,https://github.com/whatwg/html/pull/9520,Propagate the fetch settings object when loading module graphs,2023-07-14T20:20:03Z,nicolo-ribaudo
1636199423,w3c/editcontext,"@dandclark Ok, and how about in practice in the only implementation that exists so far? I understand",https://github.com/w3c/edit-context/issues/38#issuecomment-1636199423,https://github.com/w3c/edit-context/issues/38,What happens when an editing host is associated with an EditContext?,2023-07-14T18:00:07Z,johanneswilm
1636184497,whatwg/html,I've reworked the wording a bit with more references to CSSCONTAIN now that it defines viewport prox,https://github.com/whatwg/html/pull/9312#issuecomment-1636184497,https://github.com/whatwg/html/pull/9312,Update RO loop to include content-visibility,2023-07-14T17:46:00Z,vmpstr
1636118380,w3c/editcontext,I don't think there's any length restrictions imposed by the spec.,https://github.com/w3c/edit-context/issues/38#issuecomment-1636118380,https://github.com/w3c/edit-context/issues/38,What happens when an editing host is associated with an EditContext?,2023-07-14T16:48:58Z,dandclark
1636031514,webkit/standards-positions,Apologies for the wall of text. A few thoughts...  I know many folks on this thread are very passi,https://github.com/WebKit/standards-positions/issues/97#issuecomment-1636031514,https://github.com/WebKit/standards-positions/issues/97,Customized built-in elements,2023-07-14T15:33:12Z,EisenbergEffect
1635914545,webkit/standards-positions,I am not sure I understand the *namespace* issue (which other browsers either have as well or solved,https://github.com/WebKit/standards-positions/issues/97#issuecomment-1635914545,https://github.com/WebKit/standards-positions/issues/97,Customized built-in elements,2023-07-14T14:05:11Z,WebReflection
1635902113,w3ctag/design-reviews,"Heads up, an Editor's draft for the spec is [here](https://drafts.csswg.org/css-view-transitions-2/)",https://github.com/w3ctag/design-reviews/issues/851#issuecomment-1635902113,https://github.com/w3ctag/design-reviews/issues/851,Cross-document View Transitions API,2023-07-14T13:55:37Z,khushalsagar
1635880163,webkit/standards-positions,I think we're conflating two things:  * A better solution to `[is]` from a developer experience *,https://github.com/WebKit/standards-positions/issues/97#issuecomment-1635880163,https://github.com/WebKit/standards-positions/issues/97,Customized built-in elements,2023-07-14T13:38:33Z,clshortfuse
1635761812,webkit/standards-positions,@WebReflection We could add that or an `ownerChangedCallback` but those callbacks would be reflected,https://github.com/WebKit/standards-positions/issues/97#issuecomment-1635761812,https://github.com/WebKit/standards-positions/issues/97,Customized built-in elements,2023-07-14T12:01:09Z,EisenbergEffect
1635680465,whatwg/html,Apologies if this is better suited to the CSSWG issue.  Would people consider standardising the `:,https://github.com/whatwg/html/issues/7293#issuecomment-1635680465,https://github.com/whatwg/html/issues/7293,<input type=password> should provide UI to show/hide its value,2023-07-14T10:49:46Z,lukewarlow
1635489316,webkit/standards-positions,@EisenbergEffect an attribute can exist without an owner element and can be removed as node and re-a,https://github.com/WebKit/standards-positions/issues/97#issuecomment-1635489316,https://github.com/WebKit/standards-positions/issues/97,Customized built-in elements,2023-07-14T08:22:25Z,WebReflection
1635409283,whatwg/html,> I'm not sure if there will be many more similar attributes after these two.  It depends on how m,https://github.com/whatwg/html/pull/9456#issuecomment-1635409283,https://github.com/whatwg/html/pull/9456,add dialogmodaltarget attribute,2023-07-14T07:17:02Z,keithamus
1635221512,whatwg/html,"I'm quite sure they should use ""matches about:blank"". Adding WPTs at the same time we fix this would",https://github.com/whatwg/html/issues/9488#issuecomment-1635221512,https://github.com/whatwg/html/issues/9488,"Should #fallback-base-url and #navigate use ""matches"" about:blank?",2023-07-14T03:40:20Z,domenic
1635143218,whatwg/html,It'd be good to run those WPTs in cases involving `about:srcdoc?bar#foo` as well. (Where the URL cha,https://github.com/whatwg/html/issues/9514#issuecomment-1635143218,https://github.com/whatwg/html/issues/9514,What to do with non-srcdoc about:srcdoc documents,2023-07-14T01:47:57Z,domenic
1635140455,whatwg/html,"> Just to make sure we're on the same page, the difference here would be that the referrer for reque",https://github.com/whatwg/html/issues/9514#issuecomment-1635140455,https://github.com/whatwg/html/issues/9514,What to do with non-srcdoc about:srcdoc documents,2023-07-14T01:46:37Z,domenic
1635024100,webkit/standards-positions,"Personally, I would prefer to have ""custom attributes"" [as described at TPAC last year](https://w3c.",https://github.com/WebKit/standards-positions/issues/97#issuecomment-1635024100,https://github.com/WebKit/standards-positions/issues/97,Customized built-in elements,2023-07-13T22:46:54Z,EisenbergEffect
1635019098,whatwg/html,"CC @emilio ",https://github.com/whatwg/html/issues/9518#issuecomment-1635019098,https://github.com/whatwg/html/issues/9518,Define the block flow and inline base directions for dom-focus,2023-07-13T22:43:22Z,dlrobertson
1634919091,WICG/webcomponents,@rniwa aria attributes are not the only feature difficult to work with due to lack of customized bui,https://github.com/WICG/webcomponents/issues/509#issuecomment-1634919091,https://github.com/WICG/webcomponents/issues/509,"The is="""" attribute is confusing? Maybe we should encourage only ES6 class-based extension.",2023-07-13T21:04:52Z,trusktr
1634899321,whatwg/html,> Impacts on [referrer determination](https://w3c.github.io/webappsec-referrer-policy/#determine-req,https://github.com/whatwg/html/issues/9514#issuecomment-1634899321,https://github.com/whatwg/html/issues/9514,What to do with non-srcdoc about:srcdoc documents,2023-07-13T20:50:01Z,domfarolino
1634833731,mozilla/standards-positions,"Done, sorry for the duplicate.",https://github.com/mozilla/standards-positions/issues/847#issuecomment-1634833731,https://github.com/mozilla/standards-positions/issues/847,Request for position update on Web Serial with add-on gating,2023-07-13T20:04:50Z,Merlin04
1634833530,mozilla/standards-positions,moving my comment to here from the duplicate issue I inadvertently created:  Web MIDI [has been im,https://github.com/mozilla/standards-positions/issues/687#issuecomment-1634833530,https://github.com/mozilla/standards-positions/issues/687,Re-request for postion on Web Serial/Serial API,2023-07-13T20:04:39Z,Merlin04
1634813508,mozilla/standards-positions,Thanks @nschonni. Closing as duplicate of #687. @Merlin04 please go ahead and make your comment rega,https://github.com/mozilla/standards-positions/issues/847#issuecomment-1634813508,https://github.com/mozilla/standards-positions/issues/847,Request for position update on Web Serial with add-on gating,2023-07-13T19:46:11Z,tantek
1634804056,whatwg/html,"> *  > * @mfreed7 will add the ""addition/proposal"" label to the non-blocking [issues for Popover](h",https://github.com/whatwg/html/issues/9474#issuecomment-1634804056,https://github.com/whatwg/html/issues/9474,Upcoming HTML standard issue triage meeting on 7/13/2023,2023-07-13T19:37:28Z,mfreed7
1634803103,whatwg/html,Can this issue be closed?,https://github.com/whatwg/html/issues/8970#issuecomment-1634803103,https://github.com/whatwg/html/issues/8970,Should popover use the flat tree,2023-07-13T19:36:35Z,mfreed7
1634802182,whatwg/html,"I think we can close this issue. Chrome shipped Popover in M114, and while there were a few issues (",https://github.com/whatwg/html/issues/9042#issuecomment-1634802182,https://github.com/whatwg/html/issues/9042,popover attribute may not be web compatible,2023-07-13T19:35:46Z,mfreed7
1634765452,whatwg/html,"This isn't about just two attributes, this is also about being able to extend the platform for more ",https://github.com/whatwg/html/pull/9456#issuecomment-1634765452,https://github.com/whatwg/html/pull/9456,add dialogmodaltarget attribute,2023-07-13T19:16:37Z,nt1m
1634749557,whatwg/html,> My concern is more about extensibility and developer experience. If we add more declarative attrib,https://github.com/whatwg/html/pull/9456#issuecomment-1634749557,https://github.com/whatwg/html/pull/9456,add dialogmodaltarget attribute,2023-07-13T19:03:07Z,mfreed7
1634731126,whatwg/html,A benefit of individual properties which hasn't been mentioned yet (after only quickly skimming this,https://github.com/whatwg/html/pull/9456#issuecomment-1634731126,https://github.com/whatwg/html/pull/9456,add dialogmodaltarget attribute,2023-07-13T18:49:22Z,bramus
1634650234,whatwg/html,"> We have a general aversion to adding more attributes to the platform, and I'm not sure I understan",https://github.com/whatwg/html/pull/9456#issuecomment-1634650234,https://github.com/whatwg/html/pull/9456,add dialogmodaltarget attribute,2023-07-13T17:43:40Z,nt1m
1634646713,mozilla/standards-positions,Duplicate of https://github.com/mozilla/standards-positions/issues/687,https://github.com/mozilla/standards-positions/issues/847#issuecomment-1634646713,https://github.com/mozilla/standards-positions/issues/847,Request for position update on Web Serial with add-on gating,2023-07-13T17:40:44Z,nschonni
1634643538,whatwg/html,"I'm happy to keep the proposal as it stands, with `dialogmodaltarget`. @smaug---- and @nt1m do you w",https://github.com/whatwg/html/pull/9456#issuecomment-1634643538,https://github.com/whatwg/html/pull/9456,add dialogmodaltarget attribute,2023-07-13T17:38:03Z,keithamus
1634551351,w3c/editcontext,@dandclark How about the length of the editable text? Are there any restrictions on how much text ca,https://github.com/w3c/edit-context/issues/38#issuecomment-1634551351,https://github.com/w3c/edit-context/issues/38,What happens when an editing host is associated with an EditContext?,2023-07-13T16:34:34Z,johanneswilm
1634547484,w3c/editcontext,"I agree, it makes sense to make it behave like `contenteditable` as much as possible so that it's ea",https://github.com/w3c/edit-context/issues/53#issuecomment-1634547484,https://github.com/w3c/edit-context/issues/53,Event firing and editability for nested editable elements,2023-07-13T16:31:28Z,johanneswilm
1634513320,w3c/editcontext,"Good point, agreed that `contenteditable=false` is not strictly needed to work for EditContext.  I",https://github.com/w3c/edit-context/issues/53#issuecomment-1634513320,https://github.com/w3c/edit-context/issues/53,Event firing and editability for nested editable elements,2023-07-13T16:06:23Z,dandclark
1634508897,whatwg/html,"Reading through how the discussion here, and considering the various possibilities people have put f",https://github.com/whatwg/html/pull/9456#issuecomment-1634508897,https://github.com/whatwg/html/pull/9456,add dialogmodaltarget attribute,2023-07-13T16:03:11Z,hidde
1634504751,w3c/editcontext,"Thanks @johanneswilm for taking a look!  > `EditContext` when associated with an HTML is supposed ",https://github.com/w3c/edit-context/issues/38#issuecomment-1634504751,https://github.com/w3c/edit-context/issues/38,What happens when an editing host is associated with an EditContext?,2023-07-13T16:00:20Z,dandclark
1634497774,whatwg/html,> From a spectator's point of view this all sounds very complicated to be honest. `dialogmodaltarget,https://github.com/whatwg/html/pull/9456#issuecomment-1634497774,https://github.com/whatwg/html/pull/9456,add dialogmodaltarget attribute,2023-07-13T15:55:36Z,mfreed7
1634495355,whatwg/html,"OK I _think_ I'm happy with the changes I've made to this PR. Please read the new OP that describes ",https://github.com/whatwg/html/pull/9494#issuecomment-1634495355,https://github.com/whatwg/html/pull/9494,Populate document state origin/initiator origin upon creation,2023-07-13T15:54:00Z,domfarolino
1634167512,whatwg/html,@domenic thnx for the quick response. Still trying to understand the problem space here: if I unders,https://github.com/whatwg/html/issues/9516#issuecomment-1634167512,https://github.com/whatwg/html/issues/9516,Add support for `<fieldset>` like custom elements using `ElementInternals`,2023-07-13T12:35:47Z,jpzwarte
1634141557,whatwg/html,"Form field values are always strings. That is how they are submitted to the server, using the variou",https://github.com/whatwg/html/issues/9516#issuecomment-1634141557,https://github.com/whatwg/html/issues/9516,Add support for `<fieldset>` like custom elements using `ElementInternals`,2023-07-13T12:16:57Z,domenic
1634126025,whatwg/html,"Dynamic imports inside of module works will use the worker script's settings object though, right?",https://github.com/whatwg/html/issues/9513#issuecomment-1634126025,https://github.com/whatwg/html/issues/9513,Module worker descendant script fetching regression,2023-07-13T12:05:25Z,domfarolino
1634120833,w3ctag/design-reviews,"Yeah, we're slowly trying to update _everything_ to use Protected Audience instead of the other two ",https://github.com/w3ctag/design-reviews/issues/838#issuecomment-1634120833,https://github.com/w3ctag/design-reviews/issues/838,Specification review for fenced frames,2023-07-13T12:01:48Z,domfarolino
1634069589,w3c/editcontext,"The point of having contenteditable=false inside of content-editable true, and maybe even a like on ",https://github.com/w3c/edit-context/issues/53#issuecomment-1634069589,https://github.com/w3c/edit-context/issues/53,Event firing and editability for nested editable elements,2023-07-13T11:21:47Z,johanneswilm
1634069276,w3c/editcontext,"Hey again @dandclark thanks to your help offline, I was able to do some basic testing. As far as I c",https://github.com/w3c/edit-context/issues/38#issuecomment-1634069276,https://github.com/w3c/edit-context/issues/38,What happens when an editing host is associated with an EditContext?,2023-07-13T11:21:33Z,johanneswilm
1633838845,whatwg/html,"> Because after fetching the top-level worker module script, worker will have its own environment se",https://github.com/whatwg/html/issues/9513#issuecomment-1633838845,https://github.com/whatwg/html/issues/9513,Module worker descendant script fetching regression,2023-07-13T08:55:41Z,domenic
1633835056,whatwg/html,@domenic Can you explain why fetching the descendants needs the environment settings object from the,https://github.com/whatwg/html/issues/9513#issuecomment-1633835056,https://github.com/whatwg/html/issues/9513,Module worker descendant script fetching regression,2023-07-13T08:52:59Z,allstarschh
1633807041,whatwg/html,Thank you to Olli for not letting this be a solo meeting today! Here are the notes from this meeting,https://github.com/whatwg/html/issues/9474#issuecomment-1633807041,https://github.com/whatwg/html/issues/9474,Upcoming HTML standard issue triage meeting on 7/13/2023,2023-07-13T08:34:13Z,past
1633778836,whatwg/html,"Yes I can work on this ðŸ‘ ",https://github.com/whatwg/html/issues/9513#issuecomment-1633778836,https://github.com/whatwg/html/issues/9513,Module worker descendant script fetching regression,2023-07-13T08:14:51Z,nicolo-ribaudo
1633748262,w3ctag/design-reviews,"This isn't the only substantive change, although it's probably the most platform-impacting one.  T",https://github.com/w3ctag/design-reviews/issues/837#issuecomment-1633748262,https://github.com/w3ctag/design-reviews/issues/837,"WebRTC-SVC (Scalable Video Coding) ",2023-07-13T07:54:11Z,dontcallmedom
1633672422,w3ctag/design-reviews,Hi folks -     Thanks for sending us this review.  Given what @adoba wrote above concerning the ch,https://github.com/w3ctag/design-reviews/issues/837#issuecomment-1633672422,https://github.com/w3ctag/design-reviews/issues/837,"WebRTC-SVC (Scalable Video Coding) ",2023-07-13T06:57:50Z,torgo
1633665406,w3ctag/design-reviews,> @Orphis I had the same question. The only major change in the API from the last TAG review was the,https://github.com/w3ctag/design-reviews/issues/837#issuecomment-1633665406,https://github.com/w3ctag/design-reviews/issues/837,"WebRTC-SVC (Scalable Video Coding) ",2023-07-13T06:52:30Z,hober
1633640263,w3ctag/design-reviews,"@rhiaro wrote: > A smaller point - FLEDGE, Turtledove and Protected Audience are used interchangeab",https://github.com/w3ctag/design-reviews/issues/838#issuecomment-1633640263,https://github.com/w3ctag/design-reviews/issues/838,Specification review for fenced frames,2023-07-13T06:37:11Z,torgo
1633530115,whatwg/html,Tests for object and embed would be appreciated but definitely not blocking. There are so many inter,https://github.com/whatwg/html/pull/9464#issuecomment-1633530115,https://github.com/whatwg/html/pull/9464,Snapshot fallback base URL for about:-schemed Documents,2023-07-13T04:33:09Z,domenic
1633529129,whatwg/html,"Yeah, I think I changed my mind while composing that comment. A null initiator origin makes sense to",https://github.com/whatwg/html/pull/9494#issuecomment-1633529129,https://github.com/whatwg/html/pull/9494,Populate document state origin/initiator origin upon creation,2023-07-13T04:31:40Z,domenic
1633527905,whatwg/html,It looks like there's been a regression there indeed. Let's continue the conversation in a non-close,https://github.com/whatwg/html/issues/9499#issuecomment-1633527905,https://github.com/whatwg/html/issues/9499,fetch client settings object isn't used in `fetch the descendants of and link a module script`,2023-07-13T04:29:53Z,domenic
1633392485,whatwg/html,"This is not possible.  All documents that are even put into session history, are created through a",https://github.com/whatwg/html/issues/9509#issuecomment-1633392485,https://github.com/whatwg/html/issues/9509,Can a fully active document have a null browsing context?,2023-07-13T01:09:05Z,domenic
1633332961,whatwg/html,"> I'm tempted to say we don't really need to address this, it's like the case you're putting a popov",https://github.com/whatwg/html/issues/9487#issuecomment-1633332961,https://github.com/whatwg/html/issues/9487,"Showing only a child popover causes ""beforetoggle"" and ""toggle"" events but popover is invisble",2023-07-12T23:31:37Z,josepharhar
1633325399,whatwg/html,Here is our proposal to adjust the wording of 4.10.18.7.1 Autofill to allow for [editing host](https,https://github.com/whatwg/html/issues/9065#issuecomment-1633325399,https://github.com/whatwg/html/issues/9065,Autocomplete on 'contenteditable' Elements,2023-07-12T23:19:25Z,bmathwig
1633176398,whatwg/html,"> so does that mean fetching the top-level module worker script is using document's settings, wherea",https://github.com/whatwg/html/issues/9499#issuecomment-1633176398,https://github.com/whatwg/html/issues/9499,fetch client settings object isn't used in `fetch the descendants of and link a module script`,2023-07-12T20:31:43Z,domfarolino
1633058158,w3c/editcontext,@dandclark We discussed earlier that it should be possible to combine `contenteditable` with `EditCo,https://github.com/w3c/edit-context/issues/38#issuecomment-1633058158,https://github.com/w3c/edit-context/issues/38,What happens when an editing host is associated with an EditContext?,2023-07-12T19:03:18Z,johanneswilm
1632982045,whatwg/html,"Initiator origin's nullability is confusing to me, as it doesn't _seem_ to need to be null at all at",https://github.com/whatwg/html/pull/9494#issuecomment-1632982045,https://github.com/whatwg/html/pull/9494,Populate document state origin/initiator origin upon creation,2023-07-12T18:03:01Z,domfarolino
1632923562,whatwg/html,seems like this could be updated to say something like: >...that consist of the column labels (head,https://github.com/whatwg/html/issues/8650#issuecomment-1632923562,https://github.com/whatwg/html/issues/8650,Do `<td>` elements inside a `<thead>` get automagically promoted to act like `<th>`,2023-07-12T17:22:20Z,scottaohara
1632878168,w3ctag/design-reviews,"> @schwering and @stephenmcgruer, although you have likely already received input from some stakehol",https://github.com/w3ctag/design-reviews/issues/831#issuecomment-1632878168,https://github.com/w3ctag/design-reviews/issues/831,Eligibility for autofill,2023-07-12T16:46:32Z,stephenmcgruer
