id,repo,body,url,issue_url,issue_title,created_at,user
2456953188,whatwg/html,"It has been discussed, also in this issue (https://github.com/whatwg/html/issues/10520#issuecomment-",https://github.com/whatwg/html/issues/10520#issuecomment-2456953188,https://github.com/whatwg/html/issues/10520,Timing of cloning for the `<selectedoption>` element,2024-11-05T11:44:24Z,smaug----
2456939443,whatwg/html,MessageEventTarget concept seems reasonable.,https://github.com/whatwg/html/pull/10738#issuecomment-2456939443,https://github.com/whatwg/html/pull/10738,"[editorial] dfn worker's outside/inside port, and clarify event retargeting",2024-11-05T11:36:54Z,smaug----
2456906721,whatwg/html,@annevk I changed this to now store the EventTarget for the message/messageerror events on the Messa,https://github.com/whatwg/html/pull/10738#issuecomment-2456906721,https://github.com/whatwg/html/pull/10738,"[editorial] dfn worker's outside/inside port, and clarify event retargeting",2024-11-05T11:19:49Z,nicolo-ribaudo
2456872411,whatwg/html,"I guess there are two options for the parsing case:  - clone when the `option` is popped - clone ",https://github.com/whatwg/html/issues/10520#issuecomment-2456872411,https://github.com/whatwg/html/issues/10520,Timing of cloning for the `<selectedoption>` element,2024-11-05T11:02:37Z,zcorpan
2456743969,whatwg/html,What's the use case for disabling pressing `Esc`? Is https://github.com/whatwg/html/issues/9373#issu,https://github.com/whatwg/html/issues/9373#issuecomment-2456743969,https://github.com/whatwg/html/issues/9373,Add light dismiss functionality to `<dialog>`,2024-11-05T10:03:35Z,annevk
2456655282,whatwg/html,@sideshowbarker might have an opinion on conformance.,https://github.com/whatwg/html/issues/10719#issuecomment-2456655282,https://github.com/whatwg/html/issues/10719,Should `<object data=...>` support `javascript:` URLs?,2024-11-05T09:24:53Z,annevk
2456613835,whatwg/html,You cannot use testdriver with reftests? That seems like something that ought to be fixed if true.,https://github.com/whatwg/html/issues/10604#issuecomment-2456613835,https://github.com/whatwg/html/issues/10604,Is it ok for `appearance:base` `<select>` not to require user activation before `showPicker()`?,2024-11-05T09:06:57Z,annevk
2456465629,w3ctag/design-reviews,@Westbrook's example I think illustrates why this problem gets very hard for me to reason about from,https://github.com/w3ctag/design-reviews/issues/961#issuecomment-2456465629,https://github.com/w3ctag/design-reviews/issues/961,Reference Target,2024-11-05T07:52:55Z,alice
2456252511,w3ctag/design-reviews,# Masonry Syntax Debate Overview #  ## Introduction ##  The CSSWG has published a [consensus FPW,https://github.com/w3ctag/design-reviews/issues/1003#issuecomment-2456252511,https://github.com/w3ctag/design-reviews/issues/1003,CSS Masonry Layout,2024-11-05T05:14:22Z,fantasai
2456006312,whatwg/html,"I'll make this better tomorrow ",https://github.com/whatwg/html/pull/10738#issuecomment-2456006312,https://github.com/whatwg/html/pull/10738,"[editorial] dfn worker's outside/inside port, and clarify event retargeting",2024-11-05T00:59:46Z,nicolo-ribaudo
2455978544,whatwg/html,"As I'm working to spec and implement a prototype of this behavior, an interesting case arose:  ```",https://github.com/whatwg/html/issues/9373#issuecomment-2455978544,https://github.com/whatwg/html/issues/9373,Add light dismiss functionality to `<dialog>`,2024-11-05T00:30:03Z,mfreed7
2455882953,whatwg/html,adding `position: sticky; top: 0;` to the `<summary>` may approach the experience you're looking for,https://github.com/whatwg/html/issues/10741#issuecomment-2455882953,https://github.com/whatwg/html/issues/10741,"When details element is open, it would be helpful to have an upward pointing triangle at the end of the text (to allow it to be closed)",2024-11-04T23:06:47Z,nektro
2455709965,whatwg/html,"I _think_ it does not matter because there is only one listener on that internal object, and the eve",https://github.com/whatwg/html/pull/10738#issuecomment-2455709965,https://github.com/whatwg/html/pull/10738,"[editorial] dfn worker's outside/inside port, and clarify event retargeting",2024-11-04T21:11:19Z,nicolo-ribaudo
2455593266,whatwg/html,The end tag parsing cloning will clone when the newly appended option is selected. Since the first o,https://github.com/whatwg/html/issues/10520#issuecomment-2455593266,https://github.com/whatwg/html/issues/10520,Timing of cloning for the `<selectedoption>` element,2024-11-04T20:01:56Z,josepharhar
2455495509,mozilla/standards-positions,"Hey Ben, thanks for taking a look!  > Would this end up merging into whatwg/fetch?  Yes, ideally",https://github.com/mozilla/standards-positions/issues/1084#issuecomment-2455495509,https://github.com/mozilla/standards-positions/issues/1084,Storage Access Headers,2024-11-04T19:09:21Z,cfredric
2455444553,WICG/webcomponents,Can reflection be changed to work one way with no `-` names (and legacy `-`) names and differently w,https://github.com/WICG/webcomponents/issues/1029#issuecomment-2455444553,https://github.com/WICG/webcomponents/issues/1029,"Proposal: Custom attributes for all elements, enhancements for more complex use cases",2024-11-04T18:41:25Z,jimmyfrasche
2455434253,whatwg/html,Jake is correct. I'm not currently planning on adding any behavior which specifically accounts for o,https://github.com/whatwg/html/issues/10520#issuecomment-2455434253,https://github.com/whatwg/html/issues/10520,Timing of cloning for the `<selectedoption>` element,2024-11-04T18:35:40Z,josepharhar
2455419613,whatwg/html,I just made some changes: - Renamed from `<selectedoption>` to `<selectedcontent>` based on the res,https://github.com/whatwg/html/pull/10633#issuecomment-2455419613,https://github.com/whatwg/html/pull/10633,Define the `<selectedcontent>` element,2024-11-04T18:27:25Z,josepharhar
2455384027,whatwg/html,"Doh, only `dispatchEvent()` is guarded. But stop propagation and such seems like it would matter? Or",https://github.com/whatwg/html/pull/10738#issuecomment-2455384027,https://github.com/whatwg/html/pull/10738,"[editorial] dfn worker's outside/inside port, and clarify event retargeting",2024-11-04T18:09:24Z,annevk
2455362515,webkit/standards-positions,Apologies. This is a more readable link:  https://webassembly.github.io/js-promise-integration/js-,https://github.com/WebKit/standards-positions/issues/422#issuecomment-2455362515,https://github.com/WebKit/standards-positions/issues/422,JavaScript Promise Integration (JSPI),2024-11-04T17:58:06Z,fgmccabe
2455357250,whatwg/html,"> E.g., I strongly expect event's ""dispatch flag"" to still be set at this point.  Yes, it is. Howe",https://github.com/whatwg/html/pull/10738#issuecomment-2455357250,https://github.com/whatwg/html/pull/10738,"[editorial] dfn worker's outside/inside port, and clarify event retargeting",2024-11-04T17:55:23Z,nicolo-ribaudo
2455320714,mozilla/standards-positions,"All browsers, including Firefox, [support `align-content`](https://web.dev/blog/align-content-block)",https://github.com/mozilla/standards-positions/issues/941#issuecomment-2455320714,https://github.com/mozilla/standards-positions/issues/941,CSS Box Alignment Module Level 3,2024-11-04T17:37:21Z,o-t-w
2455309857,w3ctag/design-reviews,> We could try to switch all three over to the open/close event set  Another consideration here is t,https://github.com/w3ctag/design-reviews/issues/1005#issuecomment-2455309857,https://github.com/w3ctag/design-reviews/issues/1005,Dispatching Toggle Events for Dialog open/close,2024-11-04T17:32:09Z,keithamus
2455301527,whatwg/html,cc @wanderview @asutherland,https://github.com/whatwg/html/pull/10738#issuecomment-2455301527,https://github.com/whatwg/html/pull/10738,"[editorial] dfn worker's outside/inside port, and clarify event retargeting",2024-11-04T17:28:33Z,annevk
2455267170,w3ctag/design-reviews,"@keithamus Perfect, thanks! It looks like the idea of unifying the `*open` and `*close` events into ",https://github.com/w3ctag/design-reviews/issues/1005#issuecomment-2455267170,https://github.com/w3ctag/design-reviews/issues/1005,Dispatching Toggle Events for Dialog open/close,2024-11-04T17:13:24Z,jyasskin
2455266400,webkit/standards-positions,"This seems reasonable and I would suggest we resolve this as ""position: support"" one week from now. ",https://github.com/WebKit/standards-positions/issues/406#issuecomment-2455266400,https://github.com/WebKit/standards-positions/issues/406,`focus-without-user-activation` feature policy,2024-11-04T17:13:01Z,annevk
2455262311,webkit/standards-positions,"Given rniwa's feedback at TPAC I suggest we mark this as ""position: support"" one week from now.",https://github.com/WebKit/standards-positions/issues/376#issuecomment-2455262311,https://github.com/WebKit/standards-positions/issues/376,Selection API: getComposedRanges,2024-11-04T17:11:05Z,annevk
2455238748,webkit/standards-positions,@pascoej as per https://github.com/WebKit/standards-positions?tab=readme-ov-file#resolving-an-issue-,https://github.com/WebKit/standards-positions/issues/400#issuecomment-2455238748,https://github.com/WebKit/standards-positions/issues/400,Web Authentication's PublicKeyCredential signal* methods,2024-11-04T17:01:25Z,annevk
2455238153,WICG/webcomponents,"Btw in case it's useful, I just did some research on existing native props, and I'm now less optimis",https://github.com/WICG/webcomponents/issues/1029#issuecomment-2455238153,https://github.com/WICG/webcomponents/issues/1029,"Proposal: Custom attributes for all elements, enhancements for more complex use cases",2024-11-04T17:01:13Z,LeaVerou
2455234691,webkit/standards-positions,@mdubet as per https://github.com/WebKit/standards-positions?tab=readme-ov-file#resolving-an-issue-w,https://github.com/WebKit/standards-positions/issues/369#issuecomment-2455234691,https://github.com/WebKit/standards-positions/issues/369,CSS Nesting: The Nested Declarations Rule,2024-11-04T16:59:46Z,annevk
2455166850,WICG/webcomponents,"To me it seems quite straightforward for a component to integrate with a custom attribute by wiring ",https://github.com/WICG/webcomponents/issues/1029#issuecomment-2455166850,https://github.com/WICG/webcomponents/issues/1029,"Proposal: Custom attributes for all elements, enhancements for more complex use cases",2024-11-04T16:30:11Z,keithamus
2455157121,whatwg/dom,"Gecko has a variant of ""event group"", so called system event group, and listeners in that are called",https://github.com/whatwg/dom/issues/1320#issuecomment-2455157121,https://github.com/whatwg/dom/issues/1320,Allow custom activation behavior to be added to an event,2024-11-04T16:25:52Z,smaug----
2455151067,whatwg/html,I thought the resolution there was that cloning wouldn't happen until the end tag was parsed?,https://github.com/whatwg/html/issues/10520#issuecomment-2455151067,https://github.com/whatwg/html/issues/10520,Timing of cloning for the `<selectedoption>` element,2024-11-04T16:23:23Z,jakearchibald
2455141347,WICG/webcomponents,@keithamus   > However I would like to point out that we could easily specify a deny list that cla,https://github.com/WICG/webcomponents/issues/1029#issuecomment-2455141347,https://github.com/WICG/webcomponents/issues/1029,"Proposal: Custom attributes for all elements, enhancements for more complex use cases",2024-11-04T16:19:06Z,jakearchibald
2455136111,whatwg/html,"We still need to account for the initial parse somehow, tho, right?  E.g. a large option with the ",https://github.com/whatwg/html/issues/10520#issuecomment-2455136111,https://github.com/whatwg/html/issues/10520,Timing of cloning for the `<selectedoption>` element,2024-11-04T16:16:53Z,emilio
2455135305,WICG/webcomponents,@jakearchibald Great point wrt prop namespacing. Some ideas off the top of my head: 1. A `dataset`-,https://github.com/WICG/webcomponents/issues/1029#issuecomment-2455135305,https://github.com/WICG/webcomponents/issues/1029,"Proposal: Custom attributes for all elements, enhancements for more complex use cases",2024-11-04T16:16:33Z,LeaVerou
2455126289,whatwg/html,> Maybe a new property on `FormDataEvent` could be added to indicate that it was initiated from `req,https://github.com/whatwg/html/issues/10694#issuecomment-2455126289,https://github.com/whatwg/html/issues/10694,Add an event for when a user attempts to submit,2024-11-04T16:12:52Z,noamr
2455125948,WICG/webcomponents,> I'm assuming that the dashes requirement is to avoid clashes with 'official' attributes. This does,https://github.com/WICG/webcomponents/issues/1029#issuecomment-2455125948,https://github.com/WICG/webcomponents/issues/1029,"Proposal: Custom attributes for all elements, enhancements for more complex use cases",2024-11-04T16:12:44Z,keithamus
2455120918,whatwg/html,Presumably you can tell whether a file changes by looking at `<input>.files`? There's even a require,https://github.com/whatwg/html/issues/10724#issuecomment-2455120918,https://github.com/whatwg/html/issues/10724,Should `<input type=file>` fire a change event when the user chooses the same file twice?,2024-11-04T16:10:43Z,annevk
2455106635,whatwg/html,Maybe a new property on `FormDataEvent` could be added to indicate that it was initiated from `reque,https://github.com/whatwg/html/issues/10694#issuecomment-2455106635,https://github.com/whatwg/html/issues/10694,Add an event for when a user attempts to submit,2024-11-04T16:05:00Z,zcorpan
2455090548,mozilla/standards-positions,"I can only wish this will be reopend, a man can dream of a brighter future for the web....",https://github.com/mozilla/standards-positions/issues/431#issuecomment-2455090548,https://github.com/mozilla/standards-positions/issues/431,Raw Sockets API,2024-11-04T15:58:28Z,dignifiedquire
2455081568,whatwg/html,"Seems like the behavior in Firefox is quite reasonable, and implementation doesn't need to keep trac",https://github.com/whatwg/html/issues/10724#issuecomment-2455081568,https://github.com/whatwg/html/issues/10724,Should `<input type=file>` fire a change event when the user chooses the same file twice?,2024-11-04T15:54:52Z,smaug----
2454991200,WICG/webcomponents,"I haven't consumed this whole thread, but I'm pretty sure these points haven't been raised:  I'm a",https://github.com/WICG/webcomponents/issues/1029#issuecomment-2454991200,https://github.com/WICG/webcomponents/issues/1029,"Proposal: Custom attributes for all elements, enhancements for more complex use cases",2024-11-04T15:18:52Z,jakearchibald
2454929317,webkit/standards-positions,"Hi Maciej, thanks for taking a look! Yes, it's a placeholder. I think @cfredric has been hacking awa",https://github.com/WebKit/standards-positions/issues/412#issuecomment-2454929317,https://github.com/WebKit/standards-positions/issues/412,Storage Access Headers,2024-11-04T14:54:52Z,johannhof
2454857239,WICG/webcomponents,@knowler your comment reminded me to import the list of custom attribute use cases I have been maint,https://github.com/WICG/webcomponents/issues/1029#issuecomment-2454857239,https://github.com/WICG/webcomponents/issues/1029,"Proposal: Custom attributes for all elements, enhancements for more complex use cases",2024-11-04T14:26:13Z,LeaVerou
2454829858,whatwg/html,"Hopefully the new title and line wrapping is satisfactory @annevk ",https://github.com/whatwg/html/pull/10091#issuecomment-2454829858,https://github.com/whatwg/html/pull/10091,Dispatch beforetoggle & toggle events during dialog open/close/showModal,2024-11-04T14:14:56Z,keithamus
2454804303,WICG/webcomponents,I have a use case (which might resemble many other use cases).  I want to create a “current nav li,https://github.com/WICG/webcomponents/issues/1029#issuecomment-2454804303,https://github.com/WICG/webcomponents/issues/1029,"Proposal: Custom attributes for all elements, enhancements for more complex use cases",2024-11-04T14:04:51Z,knowler
2454779707,whatwg/html,My conclusion is the same as @annevk .  > If there is no [template](https://html.spec.whatwg.org/#,https://github.com/whatwg/html/issues/10739#issuecomment-2454779707,https://github.com/whatwg/html/issues/10739,HTML parser: interaction between SVG foreignObject and HTML template,2024-11-04T13:54:46Z,zcorpan
2454774561,whatwg/html,"Ah, got it. Then we've definitely made a mistake in our parser by only looking at the tag names when",https://github.com/whatwg/html/issues/10739#issuecomment-2454774561,https://github.com/whatwg/html/issues/10739,HTML parser: interaction between SVG foreignObject and HTML template,2024-11-04T13:52:27Z,awesomekling
2454772198,whatwg/dom,"In the specification activation behavior is associated with the event target, not the event. And it'",https://github.com/whatwg/dom/issues/1320#issuecomment-2454772198,https://github.com/whatwg/dom/issues/1320,Allow custom activation behavior to be added to an event,2024-11-04T13:51:24Z,annevk
2454757627,whatwg/dom,"if we could append a ShadowRoot as entity a part detached from its parent, that'd be it indeed ... b",https://github.com/whatwg/dom/issues/736#issuecomment-2454757627,https://github.com/whatwg/dom/issues/736,Proposal: a DocumentFragment whose nodes do not get removed once inserted,2024-11-04T13:45:39Z,WebReflection
2454735709,whatwg/html,"Presumably the commit title should not be ""dispatch toggleevents for dialog open/close""? Can you cla",https://github.com/whatwg/html/pull/10091#issuecomment-2454735709,https://github.com/whatwg/html/pull/10091,Dispatch beforetoggle & toggle events during dialog open/close/showModal,2024-11-04T13:36:01Z,annevk
2454711868,whatwg/html,"I think this is handled because the stack check (that ""template"" end tags do first) is for an elemen",https://github.com/whatwg/html/issues/10739#issuecomment-2454711868,https://github.com/whatwg/html/issues/10739,HTML parser: interaction between SVG foreignObject and HTML template,2024-11-04T13:25:25Z,annevk
2454682433,webkit/standards-positions,Colleagues and I consider this a reasonable improvement to Import Maps. As such I suggest we mark it,https://github.com/WebKit/standards-positions/issues/381#issuecomment-2454682433,https://github.com/WebKit/standards-positions/issues/381,Multiple Import Maps,2024-11-04T13:12:15Z,annevk
2454514297,w3ctag/design-reviews,"FWIW it would not be as simple as `open`/`close`; you'd need `beforeopen`/`beforeclose` also.  This ",https://github.com/w3ctag/design-reviews/issues/1005#issuecomment-2454514297,https://github.com/w3ctag/design-reviews/issues/1005,Dispatching Toggle Events for Dialog open/close,2024-11-04T11:53:10Z,keithamus
2454104373,whatwg/html,But that requires that the _unload_ event is fired which may not be always the case...,https://github.com/whatwg/html/issues/1766#issuecomment-2454104373,https://github.com/whatwg/html/issues/1766,Add onclose event to MessagePort,2024-11-04T08:39:36Z,jjkola-eskosystems
2454065576,whatwg/dom,"So in terms of the actual API shape, I'm thinking that we want some kind of a way to query across sh",https://github.com/whatwg/dom/issues/1321#issuecomment-2454065576,https://github.com/whatwg/dom/issues/1321,Extension only API to query across shadow trees,2024-11-04T08:18:25Z,rniwa
2454021841,whatwg/dom,Perhaps we could add something like `[Exposed=Extensions]` to IDL and have a corresponding check ava,https://github.com/whatwg/dom/issues/1321#issuecomment-2454021841,https://github.com/whatwg/dom/issues/1321,Extension only API to query across shadow trees,2024-11-04T07:50:29Z,annevk
2453863810,w3ctag/design-reviews,@josepharhar I'd love to see the popover discussion that settled on `toggle` events instead of `open,https://github.com/w3ctag/design-reviews/issues/1005#issuecomment-2453863810,https://github.com/w3ctag/design-reviews/issues/1005,Dispatching Toggle Events for Dialog open/close,2024-11-04T05:40:53Z,jyasskin
2453858089,w3ctag/design-reviews,"FWIW, https://github.com/WICG/turtledove/blob/main/FLEDGE_browser_bidding_and_auction_API.md doesn't",https://github.com/w3ctag/design-reviews/issues/1009#issuecomment-2453858089,https://github.com/w3ctag/design-reviews/issues/1009,Review for Protected Audiences Bidding and Auction Services API,2024-11-04T05:34:21Z,jyasskin
2453671805,whatwg/dom,"> Sorry if this has been mentioned already, but re:security and encapsulation concerns: but develope",https://github.com/whatwg/dom/issues/412#issuecomment-2453671805,https://github.com/whatwg/dom/issues/412,[Proposal] Add EventTarget.getEventListeners(),2024-11-04T01:11:43Z,subhanahmed047
2453601373,whatwg/html,"In my opinion, putting CSS styles inside `<script type=""css-module"" specifier=""/foo.css"">...</script",https://github.com/whatwg/html/issues/10673#issuecomment-2453601373,https://github.com/whatwg/html/issues/10673,Declarative CSS Modules and Declarative Shadow DOM `adoptedstylesheets` attribute,2024-11-03T22:31:44Z,niutech
2453512552,whatwg/html,This is a really exciting proposal! One potential issue I want to raise is with polyfills: could the,https://github.com/whatwg/html/issues/10673#issuecomment-2453512552,https://github.com/whatwg/html/issues/10673,Declarative CSS Modules and Declarative Shadow DOM `adoptedstylesheets` attribute,2024-11-03T17:59:01Z,nolanlawson
2453418995,whatwg/dom,"- ",https://github.com/whatwg/dom/issues/1321#issuecomment-2453418995,https://github.com/whatwg/dom/issues/1321,Extension only API to query across shadow trees,2024-11-03T12:57:42Z,Joejoshara
2453194328,webkit/standards-positions,The “spec” here is just a skeleton pointing to the explainer: https://github.com/privacycg/storage-a,https://github.com/WebKit/standards-positions/issues/412#issuecomment-2453194328,https://github.com/WebKit/standards-positions/issues/412,Storage Access Headers,2024-11-02T22:05:06Z,othermaciej
2453177932,webkit/standards-positions,Is COLRv1 a standard? The links provided are to a Microsoft documentation page and a Google explaine,https://github.com/WebKit/standards-positions/issues/415#issuecomment-2453177932,https://github.com/WebKit/standards-positions/issues/415,COLRv1 fonts,2024-11-02T21:55:06Z,othermaciej
2453170976,webkit/standards-positions,Ok this was a bit confusing but it seems the changes in the fork are actually merged to the W3C Inte,https://github.com/WebKit/standards-positions/issues/416#issuecomment-2453170976,https://github.com/WebKit/standards-positions/issues/416,IntersectionObserver V2: Detecting occlusion and visual effects,2024-11-02T21:50:42Z,othermaciej
2453137668,webkit/standards-positions,@bkardell the Mozilla standards-positions URL field is meant to be for a link to an issue in Mozilla,https://github.com/WebKit/standards-positions/issues/416#issuecomment-2453137668,https://github.com/WebKit/standards-positions/issues/416,IntersectionObserver V2: Detecting occlusion and visual effects,2024-11-02T21:13:48Z,othermaciej
2453136234,webkit/standards-positions,"@fgmccabe could you proved a link to a human-readable formatted copy of the spec, if there is one? T",https://github.com/WebKit/standards-positions/issues/422#issuecomment-2453136234,https://github.com/WebKit/standards-positions/issues/422,JavaScript Promise Integration (JSPI),2024-11-02T21:07:03Z,othermaciej
2453132328,webkit/standards-positions,"It looks like @rniwa ’s issue regarding imprecision may be addressed, I will let him comment whether",https://github.com/WebKit/standards-positions/issues/420#issuecomment-2453132328,https://github.com/WebKit/standards-positions/issues/420,Event Timing,2024-11-02T21:03:37Z,othermaciej
2453131160,whatwg/dom,"Yup, looking back to my use cases, this would be an actual part of the DOM in terms of parentNode/ch",https://github.com/whatwg/dom/issues/736#issuecomment-2453131160,https://github.com/whatwg/dom/issues/736,Proposal: a DocumentFragment whose nodes do not get removed once inserted,2024-11-02T21:02:49Z,LeaVerou
2453126015,webkit/standards-positions,"From the previous discussion, it seems like the previous concerns were potential duplication/overlap",https://github.com/WebKit/standards-positions/issues/420#issuecomment-2453126015,https://github.com/WebKit/standards-positions/issues/420,Event Timing,2024-11-02T20:58:26Z,othermaciej
2453124641,whatwg/html,"I wonder if one of the editors would like to review this, given it'll be shipping in 2 browsers very",https://github.com/whatwg/html/pull/10091#issuecomment-2453124641,https://github.com/whatwg/html/pull/10091,Dispatch beforetoggle & toggle events during dialog open/close/showModal,2024-11-02T20:51:36Z,keithamus
2453107586,whatwg/dom,From the title I was expecting this to be a standard `ParentNode & ChildNode` without any behavioral,https://github.com/whatwg/dom/issues/736#issuecomment-2453107586,https://github.com/whatwg/dom/issues/736,Proposal: a DocumentFragment whose nodes do not get removed once inserted,2024-11-02T19:42:41Z,DeepDoge
2453091838,mozilla/standards-positions,"A post about Chrome now having this (behind a developer flag) is trending on HN, this issue may need",https://github.com/mozilla/standards-positions/issues/431#issuecomment-2453091838,https://github.com/mozilla/standards-positions/issues/431,Raw Sockets API,2024-11-02T18:46:05Z,eqvinox
2453031295,webkit/standards-positions,My initial concerns are described at https://github.com/WICG/canvas-place-element/issues/15,https://github.com/WebKit/standards-positions/issues/403#issuecomment-2453031295,https://github.com/WebKit/standards-positions/issues/403,[HTML] Canvas place element,2024-11-02T15:59:51Z,smfr
2452978502,mozilla/standards-positions,"And this is why nobody is using Firefox anymore. Sad development. ",https://github.com/mozilla/standards-positions/issues/431#issuecomment-2452978502,https://github.com/mozilla/standards-positions/issues/431,Raw Sockets API,2024-11-02T12:42:22Z,sabbaticaldev
