id,repo,body,url,issue_url,issue_title,created_at,user
2463419470,whatwg/html,Thank you all for attending the meeting today and a special thank you to Joey for taking meeting not,https://github.com/whatwg/html/issues/10734#issuecomment-2463419470,https://github.com/whatwg/html/issues/10734,Upcoming WHATNOT meeting on 2024-11-7,2024-11-07T23:23:58Z,past
2463363750,whatwg/html,"None of those items (especially item 2) seems to be something that can _only_ be solved by making a ",https://github.com/whatwg/html/issues/10125#issuecomment-2463363750,https://github.com/whatwg/html/issues/10125,Read-only state for buttons?,2024-11-07T22:36:00Z,aardrian
2463231417,mozilla/standards-positions,I think we can say positive here to what landed to the spec (that shouldn't leak cross origin inform,https://github.com/mozilla/standards-positions/issues/766#issuecomment-2463231417,https://github.com/mozilla/standards-positions/issues/766,Back/forward cache NotRestoredReasons API,2024-11-07T21:17:01Z,smaug----
2463133567,whatwg/html,"We discussed, in two OpenUI meetings now, the utility of `popover=hint` in isolation. I.e. without a",https://github.com/whatwg/html/pull/9778#issuecomment-2463133567,https://github.com/whatwg/html/pull/9778,Add popover=hint,2024-11-07T20:18:35Z,mfreed7
2463129240,webkit/standards-positions,I just want to quickly mention that we've been discussing the touchscreen interaction pattern for th,https://github.com/WebKit/standards-positions/issues/305#issuecomment-2463129240,https://github.com/WebKit/standards-positions/issues/305,popover=hint,2024-11-07T20:15:52Z,mfreed7
2463028369,whatwg/html,> is marking a button as read only going to actually solve anything though? >  > messaging as to w,https://github.com/whatwg/html/issues/10125#issuecomment-2463028369,https://github.com/whatwg/html/issues/10125,Read-only state for buttons?,2024-11-07T19:16:38Z,mbgower
2463026531,whatwg/html,"Thanks for confirming. Will change Chrome's behavior to ""as-if-click"".",https://github.com/whatwg/html/issues/10597#issuecomment-2463026531,https://github.com/whatwg/html/issues/10597,Adjust Scroll Restoration Behavior for Reloads,2024-11-07T19:15:31Z,LiangTheDev
2462868853,whatwg/html,> @chrishtr post above cites a number of CSS WG issues I brought up that lack replies from Google an,https://github.com/whatwg/html/issues/4180#issuecomment-2462868853,https://github.com/whatwg/html/issues/4180,<input type=checkbox switch>,2024-11-07T17:45:37Z,chrishtr
2462822854,whatwg/html,"I'm also in support of ""as-if-click,"" which is consistent with Firefox.  That means scrolling to the",https://github.com/whatwg/html/issues/10597#issuecomment-2462822854,https://github.com/whatwg/html/issues/10597,Adjust Scroll Restoration Behavior for Reloads,2024-11-07T17:24:12Z,csreis
2462801738,whatwg/html,FWIW I wrote a test for this: https://wpt.fyi/results/html/semantics/embedded-content/the-img-elemen,https://github.com/whatwg/html/issues/10671#issuecomment-2462801738,https://github.com/whatwg/html/issues/10671,[images] Lazy loading and out of band loads.,2024-11-07T17:14:40Z,emilio
2462725404,mozilla/standards-positions,"I've made a new website here. To preview, check out this branch and start a local server (`python3 -",https://github.com/mozilla/standards-positions/pull/1063#issuecomment-2462725404,https://github.com/mozilla/standards-positions/pull/1063,Switch to YAML and GitHub data (WIP),2024-11-07T16:44:15Z,zcorpan
2462708973,whatwg/html,As-if-click is what I had mind when I wrote https://github.com/whatwg/html/issues/10597#issuecomment,https://github.com/whatwg/html/issues/10597#issuecomment-2462708973,https://github.com/whatwg/html/issues/10597,Adjust Scroll Restoration Behavior for Reloads,2024-11-07T16:39:28Z,skobes-chromium
2462217805,whatwg/html,"I think generally if the consensus is that engines could do more work to make it faster, we don't as",https://github.com/whatwg/html/pull/10718#issuecomment-2462217805,https://github.com/whatwg/html/pull/10718,Add expect-no-linked-resources Document-Policy to Speculative parsing,2024-11-07T13:17:30Z,annevk
2461523557,whatwg/html,> There shouldn't be compat issues.  It's not about compatibility issues though. It's about decidi,https://github.com/whatwg/html/issues/4180#issuecomment-2461523557,https://github.com/whatwg/html/issues/4180,<input type=checkbox switch>,2024-11-07T07:39:30Z,annevk
2461448109,whatwg/html,"> MQ are specified by the CSSWG in a language-agnostic way  This does not seem obvious as it uses ",https://github.com/whatwg/html/issues/6064#issuecomment-2461448109,https://github.com/whatwg/html/issues/6064,Loading CSS Style Sheet with Feature Queries,2024-11-07T06:46:30Z,cdoublev
2461234146,w3c/pointerevents,Indeed.,https://github.com/w3c/pointerevents/issues/511#issuecomment-2461234146,https://github.com/w3c/pointerevents/issues/511,Shouldn't dispatch `gotpointercapture` and `lostpointercapture` events if `pointerrawupdate` event is fired without the following `pointermove`?,2024-11-07T03:14:55Z,masayuki-nakano
2461232504,w3c/pointerevents,"Yeah, I think so. I'm not sure whether this can be testable with WPT because of the document boundar",https://github.com/w3c/pointerevents/issues/510#issuecomment-2461232504,https://github.com/w3c/pointerevents/issues/510,Clarify whether `pointermove` will be dispatched if `pointerrawupdate` listener removes the document,2024-11-07T03:12:52Z,masayuki-nakano
2461229035,w3c/pointerevents,"Okay, then, there should be a test to check it.",https://github.com/w3c/pointerevents/issues/509#issuecomment-2461229035,https://github.com/w3c/pointerevents/issues/509,Clarify the event target of `pointermove` if an event listener of the preceding `pointerrawupdate` explicitly release pointer capture,2024-11-07T03:10:33Z,masayuki-nakano
2461209118,whatwg/html,"If the speculative parsing step isn't conducted as a separate step, there might trivial to no benefi",https://github.com/whatwg/html/pull/10718#issuecomment-2461209118,https://github.com/whatwg/html/pull/10718,Add expect-no-linked-resources Document-Policy to Speculative parsing,2024-11-07T02:53:12Z,alexnj
2461178154,whatwg/html,+1 to favour Firefox's behavior,https://github.com/whatwg/html/issues/10185#issuecomment-2461178154,https://github.com/whatwg/html/issues/10185,should search for draggable attribute follow dom tree or flattened tree?,2024-11-07T02:17:49Z,woody-li
2461100050,whatwg/html,"We just tripped on that rocket science today... ",https://github.com/whatwg/html/issues/4362#issuecomment-2461100050,https://github.com/whatwg/html/issues/4362,Specify filenames when downloading blob URLs backed by File instances?,2024-11-07T00:53:13Z,jsoref
2461076591,whatwg/html,It seems that we are all supportive of changing Chrome's behavior to not restore scroll position whe,https://github.com/whatwg/html/issues/10597#issuecomment-2461076591,https://github.com/whatwg/html/issues/10597,Adjust Scroll Restoration Behavior for Reloads,2024-11-07T00:28:04Z,LiangTheDev
2461026625,w3ctag/design-reviews,"Yes, this feature is for both focus navigation and the accessibility tree (the order in which AX nod",https://github.com/w3ctag/design-reviews/issues/978#issuecomment-2461026625,https://github.com/w3ctag/design-reviews/issues/978,CSS reading-flow property,2024-11-06T23:49:01Z,dizhang168
2461008923,whatwg/html,We still need to choose a name on https://github.com/w3c/csswg-drafts/issues/10908 but there's enoug,https://github.com/whatwg/html/issues/10730#issuecomment-2461008923,https://github.com/whatwg/html/issues/10730,Meeting 10 for joint OpenUI-WHATWG/HTML-CSSWG task force on styleable form controls,2024-11-06T23:32:56Z,josepharhar
2460908022,whatwg/html,> ...requires solving it for most form controls as they are all rather similar in their opaqueness w,https://github.com/whatwg/html/issues/4180#issuecomment-2460908022,https://github.com/whatwg/html/issues/4180,<input type=checkbox switch>,2024-11-06T22:19:56Z,mfreed7
2460802557,w3ctag/design-reviews,"Correct, focusable elements are just the easiest way to demonstrate this without requiring people to",https://github.com/w3ctag/design-reviews/issues/978#issuecomment-2460802557,https://github.com/w3ctag/design-reviews/issues/978,CSS reading-flow property,2024-11-06T21:17:48Z,tabatkins
2460752849,w3ctag/design-reviews,"Hi @dizhang168, thanks for your review request. I have an accessibility question: the examples that ",https://github.com/w3ctag/design-reviews/issues/978#issuecomment-2460752849,https://github.com/w3ctag/design-reviews/issues/978,CSS reading-flow property,2024-11-06T20:50:36Z,matatk
2460651361,whatwg/html,"When I try:  ```html <style id=""disabledStyle"" disabled>     body {         border: 2px dashed ",https://github.com/whatwg/html/issues/10710#issuecomment-2460651361,https://github.com/whatwg/html/issues/10710,Declarative CSS Modules - <script> vs <style> for defining modules,2024-11-06T19:54:49Z,robglidden
2460592691,whatwg/html,"What if we assumed that `adoptedstylesheets=""/foo.css""` was instead a reference to a genuine, regula",https://github.com/whatwg/html/issues/10711#issuecomment-2460592691,https://github.com/whatwg/html/issues/10711,Declarative CSS Modules - should they initiate a fetch?,2024-11-06T19:23:31Z,robglidden
2460552866,w3c/pointerevents,"OK, I think I found it. The text here: https://w3c.github.io/pointerevents/#ref-for-dfn-pending-poin",https://github.com/w3c/pointerevents/issues/526#issuecomment-2460552866,https://github.com/w3c/pointerevents/issues/526,[DOM integration] No state is reset on node removal,2024-11-06T19:01:27Z,domfarolino
2460519693,whatwg/html,Using the # symbol as a dedicated inline module specifier could also untangle the race-conditiony du,https://github.com/whatwg/html/issues/10673#issuecomment-2460519693,https://github.com/whatwg/html/issues/10673,Declarative CSS Modules and Declarative Shadow DOM `adoptedstylesheets` attribute,2024-11-06T18:43:43Z,socketdigital
2460360822,w3c/pointerevents,"thanks for the suggestion/clarification @jyasskin ... added that in. otherwise, does this look appro",https://github.com/w3c/pointerevents/pull/527#issuecomment-2460360822,https://github.com/w3c/pointerevents/pull/527,Clarify predicted events privacy implication,2024-11-06T17:20:53Z,patrickhlauke
2460300421,w3ctag/design-reviews,"A couple questions here: 1. Is `scroll-start-target: auto` a developer-friendly way to say ""please ",https://github.com/w3ctag/design-reviews/issues/1011#issuecomment-2460300421,https://github.com/w3ctag/design-reviews/issues/1011,Spec Review for scroll-start-target,2024-11-06T16:53:20Z,jyasskin
2460268426,w3c/pointerevents,"In other words, I think the spec is fine. It is clear enough that pointermove is a separate event. S",https://github.com/w3c/pointerevents/issues/510#issuecomment-2460268426,https://github.com/w3c/pointerevents/issues/510,Clarify whether `pointermove` will be dispatched if `pointerrawupdate` listener removes the document,2024-11-06T16:40:07Z,smaug----
2460113716,w3c/pointerevents,"@jyasskin I've had an initial stab at clarifying this, but noting that the spec itself does not actu",https://github.com/w3c/pointerevents/issues/518#issuecomment-2460113716,https://github.com/w3c/pointerevents/issues/518,Ensure predicted events only use input from the current partition,2024-11-06T15:44:52Z,patrickhlauke
2460035481,mozilla/standards-positions,`finalResponseHeadersStart` is the timing when the last response came. This is useful to see the tim,https://github.com/mozilla/standards-positions/issues/1108#issuecomment-2460035481,https://github.com/mozilla/standards-positions/issues/1108,Add `finalResponseHeadersStart` to resource timing,2024-11-06T15:15:51Z,sefeng211
2459941587,whatwg/html,Hopefully soon: https://github.com/whatwg/html/pull/10126,https://github.com/whatwg/html/issues/10743#issuecomment-2459941587,https://github.com/whatwg/html/issues/10743,"""Show the picker"" steps never dismisses the picker upon node removal",2024-11-06T14:44:08Z,annevk
2459918015,whatwg/html,Does `:open` exist? I can't find anything about that pseudoselector on MDN.,https://github.com/whatwg/html/issues/10743#issuecomment-2459918015,https://github.com/whatwg/html/issues/10743,"""Show the picker"" steps never dismisses the picker upon node removal",2024-11-06T14:34:24Z,domfarolino
2459878630,w3c/pointerevents,"The target can be different, isn't "" final position of the event which is used for finding the targe",https://github.com/w3c/pointerevents/issues/509#issuecomment-2459878630,https://github.com/w3c/pointerevents/issues/509,Clarify the event target of `pointermove` if an event listener of the preceding `pointerrawupdate` explicitly release pointer capture,2024-11-06T14:18:48Z,smaug----
2459865919,w3c/pointerevents,"@masayuki-nakano  So we could close this? ",https://github.com/w3c/pointerevents/issues/511#issuecomment-2459865919,https://github.com/w3c/pointerevents/issues/511,Shouldn't dispatch `gotpointercapture` and `lostpointercapture` events if `pointerrawupdate` event is fired without the following `pointermove`?,2024-11-06T14:13:48Z,smaug----
2459835749,w3c/pointerevents,"hasPointerCapture() would return false, because of https://w3c.github.io/pointerevents/#dom-element-",https://github.com/w3c/pointerevents/issues/526#issuecomment-2459835749,https://github.com/w3c/pointerevents/issues/526,[DOM integration] No state is reset on node removal,2024-11-06T14:01:51Z,smaug----
2459821296,whatwg/html,"Oh I see, the problem is the dirty value flag guard. That seems very similar to what we probably nee",https://github.com/whatwg/html/issues/10360#issuecomment-2459821296,https://github.com/whatwg/html/issues/10360,Provide native validation messages for native validity states on Form Associated Custom Elements,2024-11-06T13:55:59Z,annevk
2459799739,whatwg/html,> I don't really understand this. Is the problem that you are displaying the validation messages you,https://github.com/whatwg/html/issues/10360#issuecomment-2459799739,https://github.com/whatwg/html/issues/10360,Provide native validation messages for native validity states on Form Associated Custom Elements,2024-11-06T13:47:08Z,KonnorRogers
2459422847,whatwg/html,I'd love to see some kind of evidence or pointer that indicates this has indeed changed as I don't r,https://github.com/whatwg/html/issues/10744#issuecomment-2459422847,https://github.com/whatwg/html/issues/10744,"Required ""Attribute"" requires javascript for custom error messages",2024-11-06T10:50:59Z,annevk
2459421642,whatwg/html,I don't really understand this. Is the problem that you are displaying the validation messages yours,https://github.com/whatwg/html/issues/10360#issuecomment-2459421642,https://github.com/whatwg/html/issues/10360,Provide native validation messages for native validity states on Form Associated Custom Elements,2024-11-06T10:50:20Z,annevk
2459322583,mozilla/standards-positions,> Bas Schouten (not sure re the github handle?)  I think it's @Bas-moz,https://github.com/mozilla/standards-positions/issues/1108#issuecomment-2459322583,https://github.com/mozilla/standards-positions/issues/1108,Add `finalResponseHeadersStart` to resource timing,2024-11-06T10:32:50Z,tunetheweb
2459150066,w3c/pointerevents,"@mustaqahmed is there anything we can/should do for this for v3, or does it require more fundamental",https://github.com/w3c/pointerevents/issues/507#issuecomment-2459150066,https://github.com/w3c/pointerevents/issues/507,Clarify (or override) `dblclick` event target,2024-11-06T09:46:03Z,patrickhlauke
2459145133,w3c/pointerevents,We should address this (likely only requires some wordsmithing in our prose?),https://github.com/w3c/pointerevents/issues/504#issuecomment-2459145133,https://github.com/w3c/pointerevents/issues/504,"Clarify what ""suppressing a pointer event stream"" really means",2024-11-06T09:43:49Z,patrickhlauke
2459066504,mozilla/standards-positions,Network error logging can provide useful feedback to servers regarding network failures across diffe,https://github.com/mozilla/standards-positions/issues/99#issuecomment-2459066504,https://github.com/mozilla/standards-positions/issues/99,Network Error Logging (NEL),2024-11-06T09:06:13Z,valenting
2459061774,whatwg/html,You're right that modern browsers still use the title attribute for error messages when there’s a pa,https://github.com/whatwg/html/issues/10744#issuecomment-2459061774,https://github.com/whatwg/html/issues/10744,"Required ""Attribute"" requires javascript for custom error messages",2024-11-06T09:03:57Z,EIevations
2459041087,whatwg/html,"I think all browsers make use of the `title` attribute when there is a `pattern` attribute mismatch ",https://github.com/whatwg/html/issues/10744#issuecomment-2459041087,https://github.com/whatwg/html/issues/10744,"Required ""Attribute"" requires javascript for custom error messages",2024-11-06T08:54:02Z,annevk
2459027848,mozilla/standards-positions,I've added the link in #1047,https://github.com/mozilla/standards-positions/pull/1106#issuecomment-2459027848,https://github.com/mozilla/standards-positions/pull/1106,Add a link to issue WICG/cookie-store #241 about the Cookie-Store API subset,2024-11-06T08:48:49Z,zcorpan
2459027717,whatwg/html,> Can you point to the change you are talking about? I've no recollection of such a change.  Hones,https://github.com/whatwg/html/issues/10744#issuecomment-2459027717,https://github.com/whatwg/html/issues/10744,"Required ""Attribute"" requires javascript for custom error messages",2024-11-06T08:48:45Z,EIevations
2458978186,whatwg/dom,"For the record, this was reverted in https://github.com/whatwg/dom/commit/809bfa24535b1d55d761d8add3",https://github.com/whatwg/dom/pull/1258#issuecomment-2458978186,https://github.com/whatwg/dom/pull/1258,Integration with trusted types inside of node conversion,2024-11-06T08:23:19Z,fred-wang
2458933634,whatwg/html,Can you point to the change you are talking about? I've no recollection of such a change.,https://github.com/whatwg/html/issues/10744#issuecomment-2458933634,https://github.com/whatwg/html/issues/10744,"Required ""Attribute"" requires javascript for custom error messages",2024-11-06T07:57:40Z,annevk
2458927984,whatwg/html,"While not strictly speaking observable to websites (although maybe it is through `:open`?), it proba",https://github.com/whatwg/html/issues/10743#issuecomment-2458927984,https://github.com/whatwg/html/issues/10743,"""Show the picker"" steps never dismisses the picker upon node removal",2024-11-06T07:54:01Z,annevk
2458612426,whatwg/html,"> Also, this looks really good overall! And also seems like a great privacy improvement! Thanks for ",https://github.com/whatwg/html/pull/10731#issuecomment-2458612426,https://github.com/whatwg/html/pull/10731,Enforce noopener on cross-top-level-site Blob URLs,2024-11-06T02:36:29Z,recvfrom
2458396418,w3ctag/design-reviews,One option that has not been explored: using relative selectors. It both solves the ordering issue _,https://github.com/w3ctag/design-reviews/issues/961#issuecomment-2458396418,https://github.com/w3ctag/design-reviews/issues/961,Reference Target,2024-11-05T23:23:50Z,LeaVerou
2458369814,whatwg/dom,"> For input fields and forms, we have ""change"" and ""submit""  ""submit"" is another problem event her",https://github.com/whatwg/dom/issues/1320#issuecomment-2458369814,https://github.com/whatwg/dom/issues/1320,Allow custom activation behavior to be added to an event,2024-11-05T23:06:49Z,jakearchibald
2458279958,whatwg/dom,It might be good to check in with folks writing accessibility auditing tools who have been asking fo,https://github.com/whatwg/dom/issues/1321#issuecomment-2458279958,https://github.com/whatwg/dom/issues/1321,Extension only API to query across shadow trees,2024-11-05T22:38:33Z,alice
2458239363,whatwg/html,next meeting: https://github.com/whatwg/html/issues/10730,https://github.com/whatwg/html/issues/10702#issuecomment-2458239363,https://github.com/whatwg/html/issues/10702,Meeting 9 for joint OpenUI-WHATWG/HTML-CSSWG task force on styleable form controls,2024-11-05T22:06:43Z,josepharhar
2458041207,whatwg/html,> mostly unreadable when layered over other text.  i didnt include it in my last message because i,https://github.com/whatwg/html/issues/10741#issuecomment-2458041207,https://github.com/whatwg/html/issues/10741,"When details element is open, it would be helpful to have an upward pointing triangle at the end of the text (to allow it to be closed)",2024-11-05T19:56:58Z,nektro
2457911731,whatwg/dom,"For input fields and forms, we have ""change"" and ""submit"" events as happening after processing a low",https://github.com/whatwg/dom/issues/1320#issuecomment-2457911731,https://github.com/whatwg/dom/issues/1320,Allow custom activation behavior to be added to an event,2024-11-05T18:43:00Z,Krinkle
2457869429,w3ctag/design-reviews,"Thanks for the summary @sorvell! I'd add to the disadvantages of the current approach that it makes ",https://github.com/w3ctag/design-reviews/issues/961#issuecomment-2457869429,https://github.com/w3ctag/design-reviews/issues/961,Reference Target,2024-11-05T18:18:33Z,LeaVerou
2457667230,w3ctag/design-reviews,"Not sure what I prefer but trying to think it through, I *think* this captures most of the points me",https://github.com/w3ctag/design-reviews/issues/961#issuecomment-2457667230,https://github.com/w3ctag/design-reviews/issues/961,Reference Target,2024-11-05T16:40:29Z,sorvell
2457650482,whatwg/html,Hey @pepelsbey! There's a PR for this feature over at https://github.com/whatwg/html/pull/9546 but t,https://github.com/whatwg/html/issues/4180#issuecomment-2457650482,https://github.com/whatwg/html/issues/4180,<input type=checkbox switch>,2024-11-05T16:33:18Z,annevk
2457617652,whatwg/html,"No rush, I don't have any concrete need for this patch and it was just a possible improvement I spot",https://github.com/whatwg/html/pull/10738#issuecomment-2457617652,https://github.com/whatwg/html/pull/10738,"[editorial] dfn worker's outside/inside port, and clarify event retargeting",2024-11-05T16:19:44Z,nicolo-ribaudo
2457601931,whatwg/html,> What's the use case for disabling pressing `Esc`?  Some folks want to require an action within t,https://github.com/whatwg/html/issues/9373#issuecomment-2457601931,https://github.com/whatwg/html/issues/9373,Add light dismiss functionality to `<dialog>`,2024-11-05T16:12:55Z,mfreed7
2457596402,whatwg/html,Given that [Safari 17.4 shipped](https://developer.apple.com/documentation/safari-release-notes/safa,https://github.com/whatwg/html/issues/4180#issuecomment-2457596402,https://github.com/whatwg/html/issues/4180,<input type=checkbox switch>,2024-11-05T16:10:42Z,pepelsbey
2457573238,w3ctag/design-reviews,"If we go with the current id-based syntax, I wonder what ergonomics improvements we could make: - """,https://github.com/w3ctag/design-reviews/issues/961#issuecomment-2457573238,https://github.com/w3ctag/design-reviews/issues/961,Reference Target,2024-11-05T16:01:08Z,LeaVerou
2457461862,mozilla/standards-positions,See https://github.com/mozilla/standards-positions/pull/1106,https://github.com/mozilla/standards-positions/pull/1047#issuecomment-2457461862,https://github.com/mozilla/standards-positions/pull/1047,Positive on the Cookie Store API (subset),2024-11-05T15:23:00Z,bakulf
2457460082,whatwg/dom,"> EventTargets could perhaps have some callback for activation behavior, and that could either overr",https://github.com/whatwg/dom/issues/1320#issuecomment-2457460082,https://github.com/whatwg/dom/issues/1320,Allow custom activation behavior to be added to an event,2024-11-05T15:22:18Z,jakearchibald
2457435063,whatwg/html,"Also, this looks really good overall! And also seems like a great privacy improvement! Thanks for ta",https://github.com/whatwg/html/pull/10731#issuecomment-2457435063,https://github.com/whatwg/html/pull/10731,Enforce noopener on cross-top-level-site Blob URLs,2024-11-05T15:12:33Z,annevk
2457429407,w3c/pointerevents,As per [this text](https://w3c.github.io/pointerevents/#ref-for-dfn-pending-pointer-capture-target-o,https://github.com/w3c/pointerevents/issues/526#issuecomment-2457429407,https://github.com/w3c/pointerevents/issues/526,[DOM integration] No state is reset on node removal,2024-11-05T15:10:18Z,mustaqahmed
2457424321,mozilla/standards-positions,> > Why does allowed-origin exist? The client must send the Origin header in the request so the serv,https://github.com/mozilla/standards-positions/issues/1084#issuecomment-2457424321,https://github.com/mozilla/standards-positions/issues/1084,Storage Access Headers,2024-11-05T15:08:18Z,bvandersloot-mozilla
2457403206,whatwg/html,"It can be made readable if the colors are adjusted when ""details[open"" - this removes the disorienta",https://github.com/whatwg/html/issues/10741#issuecomment-2457403206,https://github.com/whatwg/html/issues/10741,"When details element is open, it would be helpful to have an upward pointing triangle at the end of the text (to allow it to be closed)",2024-11-05T14:59:44Z,JimLewis
2457322171,whatwg/html,I think this would end up being weird as the `ElementInternals` would end up having to be public API,https://github.com/whatwg/html/issues/10723#issuecomment-2457322171,https://github.com/whatwg/html/issues/10723,Custom states & default ARIA for slotted built-ins,2024-11-05T14:27:01Z,annevk
2457278611,whatwg/html,@nektro   That certainly does something.   Having it float on top of other text is a really disorien,https://github.com/whatwg/html/issues/10741#issuecomment-2457278611,https://github.com/whatwg/html/issues/10741,"When details element is open, it would be helpful to have an upward pointing triangle at the end of the text (to allow it to be closed)",2024-11-05T14:09:29Z,JimLewis
