id,repo,body,url,issue_url,issue_title,created_at,user
1885970536,WICG/webcomponents,i don’t think HTML modules goes very far to supporting scoping in MFE use cases does it? it might if,https://github.com/WICG/webcomponents/issues/1043#issuecomment-1885970536,https://github.com/WICG/webcomponents/issues/1043,[scoped-registries] Consider future expansion to allow using a registry without new API,2024-01-11T00:18:54Z,michaelwarren1106
1885963199,WICG/webcomponents,"This is a nice idea, and I'm thinking it probably should be an explicit choice. The html modules pro",https://github.com/WICG/webcomponents/issues/1043#issuecomment-1885963199,https://github.com/WICG/webcomponents/issues/1043,[scoped-registries] Consider future expansion to allow using a registry without new API,2024-01-11T00:11:41Z,sorvell
1885868472,WICG/webcomponents,What if this is what was on offer for users of https://github.com/w3ctag/design-reviews/issues/334 (,https://github.com/WICG/webcomponents/issues/1043#issuecomment-1885868472,https://github.com/WICG/webcomponents/issues/1043,[scoped-registries] Consider future expansion to allow using a registry without new API,2024-01-10T22:48:34Z,Westbrook
1885806638,WICG/webcomponents,"As far as i know, there is a huge fraction of developers that embrace the cascade (One small example",https://github.com/WICG/webcomponents/issues/909#issuecomment-1885806638,https://github.com/WICG/webcomponents/issues/909,"""open-stylable"" Shadow Roots",2024-01-10T22:00:09Z,jens-struct
1885711028,mozilla/standards-positions,Updated the position in #959,https://github.com/mozilla/standards-positions/issues/687#issuecomment-1885711028,https://github.com/mozilla/standards-positions/issues/687,Re-request for postion on Web Serial/Serial API,2024-01-10T20:50:45Z,bgrins
1885691115,WICG/webcomponents,"OK, I just chatted with @rwaldron (who knows way more about this stuff than I do). Basically, our us",https://github.com/WICG/webcomponents/issues/1043#issuecomment-1885691115,https://github.com/WICG/webcomponents/issues/1043,[scoped-registries] Consider future expansion to allow using a registry without new API,2024-01-10T20:42:53Z,nolanlawson
1885642025,mozilla/standards-positions,LGTM,https://github.com/mozilla/standards-positions/pull/959#issuecomment-1885642025,https://github.com/mozilla/standards-positions/pull/959,Update Serial position,2024-01-10T20:08:47Z,bholley
1885640485,WICG/webcomponents,Notes from this week's discussion: https://docs.google.com/document/d/1NRI_Ns8dw33LA21Fj2F21J-aTI-Qb,https://github.com/WICG/webcomponents/issues/1031#issuecomment-1885640485,https://github.com/WICG/webcomponents/issues/1031,Quarterly Face to Face Scheduling,2024-01-10T20:07:41Z,Westbrook
1885604338,WICG/webcomponents,New when2meet: https://www.when2meet.com/?23049035-SYv8n,https://github.com/WICG/webcomponents/issues/1027#issuecomment-1885604338,https://github.com/WICG/webcomponents/issues/1027,DOM Parts Quarterly Meeting,2024-01-10T19:47:58Z,rniwa
1885596016,WICG/webcomponents,"@justinfagnani Your code example may be a bit contentious for some framework authors, since I imagin",https://github.com/WICG/webcomponents/issues/1043#issuecomment-1885596016,https://github.com/WICG/webcomponents/issues/1043,[scoped-registries] Consider future expansion to allow using a registry without new API,2024-01-10T19:43:43Z,nolanlawson
1885575383,mozilla/standards-positions,Fixes #687,https://github.com/mozilla/standards-positions/pull/959#issuecomment-1885575383,https://github.com/mozilla/standards-positions/pull/959,Update Serial position,2024-01-10T19:30:55Z,bgrins
1885481227,WICG/webcomponents,"@sorvell Thank you, the code example explains it perfectly. I agree that people will want to do that",https://github.com/WICG/webcomponents/issues/909#issuecomment-1885481227,https://github.com/WICG/webcomponents/issues/909,"""open-stylable"" Shadow Roots",2024-01-10T19:11:48Z,matthewp
1885356884,whatwg/html,I updated the explainer to be `<select>` instead of `<selectlist>`: https://open-ui.org/components/s,https://github.com/whatwg/html/issues/9799#issuecomment-1885356884,https://github.com/whatwg/html/issues/9799,The `<selectlist>` element,2024-01-10T18:01:38Z,josepharhar
1885352180,WICG/webcomponents,One way that I’d like to articulate [my proposal](https://github.com/WICG/webcomponents/issues/909#i,https://github.com/WICG/webcomponents/issues/909#issuecomment-1885352180,https://github.com/WICG/webcomponents/issues/909,"""open-stylable"" Shadow Roots",2024-01-10T17:59:39Z,knowler
1885333583,WICG/webcomponents,This is contrived but it seems very likely this will come up in the wild:  ```css // in the page.,https://github.com/WICG/webcomponents/issues/909#issuecomment-1885333583,https://github.com/WICG/webcomponents/issues/909,"""open-stylable"" Shadow Roots",2024-01-10T17:46:50Z,sorvell
1885332017,whatwg/html,> I think this issue can now be closed? Would anyone care to double check that we've got them all? (,https://github.com/whatwg/html/issues/9832#issuecomment-1885332017,https://github.com/whatwg/html/issues/9832,The spec language for `enumerated attributes` is not consistent,2024-01-10T17:45:44Z,mfreed7
1885331500,WICG/webcomponents,"@nolanlawson I don't agree that coordination means that you need to own the entire page. JS modules ",https://github.com/WICG/webcomponents/issues/909#issuecomment-1885331500,https://github.com/WICG/webcomponents/issues/909,"""open-stylable"" Shadow Roots",2024-01-10T17:45:22Z,matthewp
1885305856,WICG/webcomponents,@sorvell can you provide a code example of what will not work? I read that comment but do not unders,https://github.com/WICG/webcomponents/issues/909#issuecomment-1885305856,https://github.com/WICG/webcomponents/issues/909,"""open-stylable"" Shadow Roots",2024-01-10T17:35:39Z,matthewp
1885304977,WICG/webcomponents,"@matthewp Sure, I might be confusing things by telling stories from different vantage points. (Rasho",https://github.com/WICG/webcomponents/issues/909#issuecomment-1885304977,https://github.com/WICG/webcomponents/issues/909,"""open-stylable"" Shadow Roots",2024-01-10T17:35:04Z,nolanlawson
1885297577,WICG/webcomponents,I want to emphasize that this feature is not a pancea for global styling since it [almost certainly],https://github.com/WICG/webcomponents/issues/909#issuecomment-1885297577,https://github.com/WICG/webcomponents/issues/909,"""open-stylable"" Shadow Roots",2024-01-10T17:30:40Z,sorvell
1885262344,WICG/webcomponents,"@nolanlawson   > Everything that's been proposed above solves some part of this, but not the whole",https://github.com/WICG/webcomponents/issues/909#issuecomment-1885262344,https://github.com/WICG/webcomponents/issues/909,"""open-stylable"" Shadow Roots",2024-01-10T17:12:16Z,matthewp
1885193378,WICG/webcomponents,"Good discussion, I think one of the core issues here is that fundamentally Shadow DOM provides two (",https://github.com/WICG/webcomponents/issues/909#issuecomment-1885193378,https://github.com/WICG/webcomponents/issues/909,"""open-stylable"" Shadow Roots",2024-01-10T16:32:06Z,sorvell
1885141783,WICG/webcomponents,"> Nolan's point, if I understand it, is that some people will want to override the wishes of the com",https://github.com/WICG/webcomponents/issues/909#issuecomment-1885141783,https://github.com/WICG/webcomponents/issues/909,"""open-stylable"" Shadow Roots",2024-01-10T16:03:17Z,nolanlawson
1885100323,mozilla/standards-positions,This should also be aligned with Microsoft trying to do something similar in https://github.com/Micr,https://github.com/mozilla/standards-positions/issues/912#issuecomment-1885100323,https://github.com/mozilla/standards-positions/issues/912,Device Bound Session Credentials,2024-01-10T15:41:23Z,simon-friedberger
1885080538,whatwg/html,"~The build is fine here~, so let me close and re-open this which I _think_ is the trick for getting ",https://github.com/whatwg/html/pull/9907#issuecomment-1885080538,https://github.com/whatwg/html/pull/9907,Overhaul document unloading/destruction/aborting,2024-01-10T15:31:00Z,domfarolino
1885041505,whatwg/html,@annevk Do I understand correctly that all browsers have a bug here because the disabled radio butto,https://github.com/whatwg/html/issues/7168#issuecomment-1885041505,https://github.com/whatwg/html/issues/7168,Behavior of disabled with input type=radio and option is unclear,2024-01-10T15:15:44Z,JAWS-test
1884969262,WICG/webcomponents,"> Just to clarify, I believe in general if there is no global definition, you won't have to use Shad",https://github.com/WICG/webcomponents/issues/1043#issuecomment-1884969262,https://github.com/WICG/webcomponents/issues/1043,[scoped-registries] Consider future expansion to allow using a registry without new API,2024-01-10T14:36:46Z,michaelwarren1106
1884968648,WICG/webcomponents,@bkardell I don't think the point in your blog post is really the same as Nolan's here. Using a non-,https://github.com/WICG/webcomponents/issues/909#issuecomment-1884968648,https://github.com/WICG/webcomponents/issues/909,"""open-stylable"" Shadow Roots",2024-01-10T14:36:26Z,matthewp
1884933559,WICG/webcomponents,> @nolanlawson I haven't heard anyone that wants to have the consumer override the component on this,https://github.com/WICG/webcomponents/issues/909#issuecomment-1884933559,https://github.com/WICG/webcomponents/issues/909,"""open-stylable"" Shadow Roots",2024-01-10T14:16:42Z,bkardell
1884795408,WICG/webcomponents,I remember a similar discussion some years ago: https://github.com/WICG/webcomponents/issues/864#is,https://github.com/WICG/webcomponents/issues/909#issuecomment-1884795408,https://github.com/WICG/webcomponents/issues/909,"""open-stylable"" Shadow Roots",2024-01-10T12:52:23Z,dflorey
1884729444,whatwg/html,I think one I reviewed yesterday was all lowercase. I'm fine either way though.,https://github.com/whatwg/html/pull/10045#issuecomment-1884729444,https://github.com/whatwg/html/pull/10045,Editorial: add enumerated attribute table for formmethod,2024-01-10T12:08:54Z,annevk
1884728145,WICG/webcomponents,@nolanlawson I haven't heard anyone that wants to have the consumer override the component on this m,https://github.com/WICG/webcomponents/issues/909#issuecomment-1884728145,https://github.com/WICG/webcomponents/issues/909,"""open-stylable"" Shadow Roots",2024-01-10T12:07:57Z,matthewp
1884715639,webkit/standards-positions,Bump,https://github.com/WebKit/standards-positions/issues/183#issuecomment-1884715639,https://github.com/WebKit/standards-positions/issues/183,WebAuthn PRF extension,2024-01-10T11:59:23Z,thecodrr
1884715118,mozilla/standards-positions,Any update on this?,https://github.com/mozilla/standards-positions/issues/798#issuecomment-1884715118,https://github.com/mozilla/standards-positions/issues/798,WebAuthn PRF extension,2024-01-10T11:59:01Z,thecodrr
1884701000,whatwg/html,"@domenic No worries, I think I've done that now. I read the thing saying *""...I represent that I do ",https://github.com/whatwg/html/pull/10041#issuecomment-1884701000,https://github.com/whatwg/html/pull/10041,Fix #10028 - minor error in import map example,2024-01-10T11:48:51Z,farsightsoftware
1884601335,mozilla/standards-positions,The proposal seems sound but it's not clear that it is a good investment of engineering time. I've a,https://github.com/mozilla/standards-positions/issues/912#issuecomment-1884601335,https://github.com/mozilla/standards-positions/issues/912,Device Bound Session Credentials,2024-01-10T10:42:13Z,simon-friedberger
1884590208,whatwg/html,What do you think about the U+0000 case?,https://github.com/whatwg/html/issues/4015#issuecomment-1884590208,https://github.com/whatwg/html/issues/4015,"""in foreign content"" is missing from list of insertion modes",2024-01-10T10:34:52Z,annevk
1884580996,whatwg/dom,@rniwa I guess what you are suggesting is that the HTML parser completely ignores subsequent `shadow,https://github.com/whatwg/dom/issues/1235#issuecomment-1884580996,https://github.com/whatwg/dom/issues/1235,Should attachShadow throw or override when an existing declarative shadow root doesn't match?,2024-01-10T10:29:42Z,annevk
1884533346,whatwg/html,> This is probably one of the more compelling examples in that two of these states are HTTP verbs wh,https://github.com/whatwg/html/pull/10045#issuecomment-1884533346,https://github.com/whatwg/html/pull/10045,Editorial: add enumerated attribute table for formmethod,2024-01-10T09:59:58Z,domenic
1884372450,whatwg/html,"Thanks! However, you seem to have signed as an organization, whereas `@farsightsoftware` is actually",https://github.com/whatwg/html/pull/10041#issuecomment-1884372450,https://github.com/whatwg/html/pull/10041,Fix #10028 - minor error in import map example,2024-01-10T08:13:11Z,domenic
1884315389,whatwg/html,"""in foreign content"" indeed isn't an insertion mode.  My understanding of the reason why CDATA sec",https://github.com/whatwg/html/issues/4015#issuecomment-1884315389,https://github.com/whatwg/html/issues/4015,"""in foreign content"" is missing from list of insertion modes",2024-01-10T07:22:58Z,hsivonen
1884303338,whatwg/html,@domenic - Done.,https://github.com/whatwg/html/pull/10041#issuecomment-1884303338,https://github.com/whatwg/html/pull/10041,Fix #10028 - minor error in import map example,2024-01-10T07:10:56Z,farsightsoftware
1884210351,WICG/webcomponents,> _**Who** is opting-in the shadow root to become stylable by its container – the component author o,https://github.com/WICG/webcomponents/issues/909#issuecomment-1884210351,https://github.com/WICG/webcomponents/issues/909,"""open-stylable"" Shadow Roots",2024-01-10T05:22:57Z,knowler
1884116742,whatwg/html,"Thanks! Can you sign the participation agreement?  (Uh, I'm not sure which GitHub username you sho",https://github.com/whatwg/html/pull/10041#issuecomment-1884116742,https://github.com/whatwg/html/pull/10041,Fix #10028 - minor error in import map example,2024-01-10T03:02:47Z,domenic
1884072078,whatwg/html,Amazing work; thank you!!  Biggest easy thing I'd like to see fixed: inconsistent empty string key,https://github.com/whatwg/html/issues/9832#issuecomment-1884072078,https://github.com/whatwg/html/issues/9832,The spec language for `enumerated attributes` is not consistent,2024-01-10T02:00:55Z,domenic
1884071922,WICG/webcomponents,I wrote [a lengthy blog post](https://nolanlawson.com/2023/12/30/shadow-dom-and-the-problem-of-encap,https://github.com/WICG/webcomponents/issues/909#issuecomment-1884071922,https://github.com/WICG/webcomponents/issues/909,"""open-stylable"" Shadow Roots",2024-01-10T02:00:39Z,nolanlawson
1883929284,whatwg/dom,It seems like the first template should win in this case.,https://github.com/whatwg/dom/issues/1235#issuecomment-1883929284,https://github.com/whatwg/dom/issues/1235,Should attachShadow throw or override when an existing declarative shadow root doesn't match?,2024-01-09T22:56:48Z,rniwa
1883909734,whatwg/dom,"I was getting started thinking about this change, and another case comes up. What should happen here",https://github.com/whatwg/dom/issues/1235#issuecomment-1883909734,https://github.com/whatwg/dom/issues/1235,Should attachShadow throw or override when an existing declarative shadow root doesn't match?,2024-01-09T22:36:50Z,mfreed7
1883862236,whatwg/html,Adding agenda+ to move this to stage 1,https://github.com/whatwg/html/issues/9799#issuecomment-1883862236,https://github.com/whatwg/html/issues/9799,The `<selectlist>` element,2024-01-09T21:57:19Z,josepharhar
1883808781,whatwg/dom,"4.2.2 should be safe to remove since both 4.2.3 and 4.2.4 would be no-ops for a duplicate source. I ",https://github.com/whatwg/dom/pull/1244#issuecomment-1883808781,https://github.com/whatwg/dom/pull/1244,Prevent AbortSignal.any() from causing duplicates in source signals,2024-01-09T21:19:07Z,shaseley
1883706300,WICG/webcomponents,"I'm not really understanding how FOUC is related to web components. FOUC is a general problem which ",https://github.com/WICG/webcomponents/issues/1033#issuecomment-1883706300,https://github.com/WICG/webcomponents/issues/1033,Allow customElementRegistry definitions to persist across page loads,2024-01-09T20:08:07Z,sorvell
1883688813,mozilla/standards-positions,I think this is reasonable and useful. My main concern is that it might be a bit too easy to block r,https://github.com/mozilla/standards-positions/issues/608#issuecomment-1883688813,https://github.com/mozilla/standards-positions/issues/608,"Request for position: blocking=""render"" attribute on <link>, <script> and <style>",2024-01-09T19:55:02Z,zcorpan
1883674420,WICG/webcomponents,"Just to clarify, I believe in general _if there is no global definition_, you won't have to use `Sha",https://github.com/WICG/webcomponents/issues/1043#issuecomment-1883674420,https://github.com/WICG/webcomponents/issues/1043,[scoped-registries] Consider future expansion to allow using a registry without new API,2024-01-09T19:44:23Z,sorvell
1883663587,mozilla/standards-positions,[WPT test results for `cICP` in PNG](https://wpt.fyi/results/png/cicp-chunk.html?label=experimental&,https://github.com/mozilla/standards-positions/issues/922#issuecomment-1883663587,https://github.com/mozilla/standards-positions/issues/922,Coding Independent Code Points (CICP) and PNG `cICP`,2024-01-09T19:36:25Z,svgeesus
1883525876,WICG/webcomponents,@knowler I really think you're onto something here. Setting aside the technical feasibility of how t,https://github.com/WICG/webcomponents/issues/909#issuecomment-1883525876,https://github.com/WICG/webcomponents/issues/909,"""open-stylable"" Shadow Roots",2024-01-09T17:55:01Z,jaredcwhite
1883480640,WICG/webcomponents,I see two problems to be solved here:  1. Allowing consumers more control over styling 2. Allowin,https://github.com/WICG/webcomponents/issues/909#issuecomment-1883480640,https://github.com/WICG/webcomponents/issues/909,"""open-stylable"" Shadow Roots",2024-01-09T17:24:40Z,knowler
1883480452,WICG/webcomponents,"This proposal already does that in the form of `ShadowRoot.createElement()`, etc. My hope is that wh",https://github.com/WICG/webcomponents/issues/1043#issuecomment-1883480452,https://github.com/WICG/webcomponents/issues/1043,[scoped-registries] Consider future expansion to allow using a registry without new API,2024-01-09T17:24:33Z,justinfagnani
1883435021,WICG/webcomponents,"> Do what exactly?  I mean ""expose explicit scoped APIs that the framework must use."" E.g. `regist",https://github.com/WICG/webcomponents/issues/1043#issuecomment-1883435021,https://github.com/WICG/webcomponents/issues/1043,[scoped-registries] Consider future expansion to allow using a registry without new API,2024-01-09T17:00:22Z,nolanlawson
1883432007,whatwg/html,I think this issue can now be closed? Would anyone care to double check that we've got them all? (pe,https://github.com/whatwg/html/issues/9832#issuecomment-1883432007,https://github.com/whatwg/html/issues/9832,The spec language for `enumerated attributes` is not consistent,2024-01-09T16:58:44Z,keithamus
1883424955,WICG/webcomponents,`registry.run()` is an interesting idea... I'd have to think about ways it could break. It's similar,https://github.com/WICG/webcomponents/issues/1043#issuecomment-1883424955,https://github.com/WICG/webcomponents/issues/1043,[scoped-registries] Consider future expansion to allow using a registry without new API,2024-01-09T16:55:22Z,justinfagnani
1883413920,WICG/webcomponents,@nolanlawson   > Maybe a v2 of the scoped registries spec could do this instead of boiling the oce,https://github.com/WICG/webcomponents/issues/1043#issuecomment-1883413920,https://github.com/WICG/webcomponents/issues/1043,[scoped-registries] Consider future expansion to allow using a registry without new API,2024-01-09T16:49:22Z,justinfagnani
1883360193,whatwg/html,> u can fix this scrolling with the following CSS in the global CSS file: body:has(dialog[open]) { o,https://github.com/whatwg/html/issues/7732#issuecomment-1883360193,https://github.com/whatwg/html/issues/7732,Consider preventing page scroll when modal dialog is visible,2024-01-09T16:19:48Z,pepkin88
1883332296,WICG/webcomponents,"In the call, I wondered whether we might find value in adding something like this:  ```js const t",https://github.com/WICG/webcomponents/issues/1043#issuecomment-1883332296,https://github.com/WICG/webcomponents/issues/1043,[scoped-registries] Consider future expansion to allow using a registry without new API,2024-01-09T16:04:11Z,EisenbergEffect
1883315499,WICG/webcomponents,"> This should be verified, but I believe the most common pattern generally used by most web framewor",https://github.com/WICG/webcomponents/issues/1043#issuecomment-1883315499,https://github.com/WICG/webcomponents/issues/1043,[scoped-registries] Consider future expansion to allow using a registry without new API,2024-01-09T15:55:10Z,nolanlawson
1883231202,whatwg/html,"Yes, that's the only testcase where it matters.  (And, yes, it is a normative change, but it's rev",https://github.com/whatwg/html/pull/10005#issuecomment-1883231202,https://github.com/whatwg/html/pull/10005,Fix case where the directionality of a <bdi> could be null.,2024-01-09T15:10:51Z,dbaron
1883223270,whatwg/html,Thanks! Is the only case where this matters the last test which currently fails in all implementatio,https://github.com/whatwg/html/pull/10005#issuecomment-1883223270,https://github.com/whatwg/html/pull/10005,Fix case where the directionality of a <bdi> could be null.,2024-01-09T15:06:35Z,annevk
1883212769,whatwg/html,"@annevk, a tiny edit from a couple of years back… are there objections against it?",https://github.com/whatwg/html/pull/8134#issuecomment-1883212769,https://github.com/whatwg/html/pull/8134,"fix: fix double article, tweak wording",2024-01-09T15:01:19Z,j9t
1883163790,whatwg/html,> I assume we already have test coverage?  It turns out that we didn't (at least I couldn't find a,https://github.com/whatwg/html/pull/10005#issuecomment-1883163790,https://github.com/whatwg/html/pull/10005,Fix case where the directionality of a <bdi> could be null.,2024-01-09T14:35:33Z,dbaron
1883074086,whatwg/html,"u can fix this scrolling with the following CSS in the global CSS file: body:has(dialog[open]) {  ",https://github.com/whatwg/html/issues/7732#issuecomment-1883074086,https://github.com/whatwg/html/issues/7732,Consider preventing page scroll when modal dialog is visible,2024-01-09T13:44:04Z,ciprianmacovei
1883025761,whatwg/dom,@shaseley might know. Given that it's followed by two appends it's not immediately clear at least.,https://github.com/whatwg/dom/pull/1244#issuecomment-1883025761,https://github.com/whatwg/dom/pull/1244,Prevent AbortSignal.any() from causing duplicates in source signals,2024-01-09T13:00:47Z,annevk
1882960916,whatwg/fullscreen,Glad to see Chrome will be shipping soon as well: https://groups.google.com/a/chromium.org/g/blink-d,https://github.com/whatwg/fullscreen/issues/124#issuecomment-1882960916,https://github.com/whatwg/fullscreen/issues/124,Impossible to customize the style of a dialog's ::backdrop residing inside a Shadow DOM.,2024-01-09T12:11:56Z,yisibl
1882952818,whatwg/dom,"My bad, it does. Would it make sense then to remove step 4.2.2.?",https://github.com/whatwg/dom/pull/1244#issuecomment-1882952818,https://github.com/whatwg/dom/pull/1244,Prevent AbortSignal.any() from causing duplicates in source signals,2024-01-09T12:06:15Z,vinhill
1882939208,whatwg/dom,Isn't this what https://infra.spec.whatwg.org/#sets already takes care of?,https://github.com/whatwg/dom/pull/1244#issuecomment-1882939208,https://github.com/whatwg/dom/pull/1244,Prevent AbortSignal.any() from causing duplicates in source signals,2024-01-09T11:57:05Z,annevk
1882931906,whatwg/html,"> The `direction` CSS property isn't meant to change the direction of a progress bar, but to change ",https://github.com/whatwg/html/issues/4177#issuecomment-1882931906,https://github.com/whatwg/html/issues/4177,Rendering <input type=range> vertically,2024-01-09T11:52:12Z,yisibl
1882909538,whatwg/html,"@annevk Considering that input ranges often have a tooltip, I don't want the text direction of the t",https://github.com/whatwg/html/issues/4177#issuecomment-1882909538,https://github.com/whatwg/html/issues/4177,Rendering <input type=range> vertically,2024-01-09T11:36:19Z,yisibl
1882900933,whatwg/html,"In `data:text/html,<select><option%20selected%20disabled>1<option>2</select>` I can select 2 using t",https://github.com/whatwg/html/issues/7168#issuecomment-1882900933,https://github.com/whatwg/html/issues/7168,Behavior of disabled with input type=radio and option is unclear,2024-01-09T11:29:45Z,annevk
1882894254,w3ctag/design-reviews,"@hadleybeeman let me try to provide the latest status, @bradtriebwasser will fill me in as needed. M",https://github.com/w3ctag/design-reviews/issues/840#issuecomment-1882894254,https://github.com/w3ctag/design-reviews/issues/840,Fullscreen Popup Windows,2024-01-09T11:24:58Z,anssiko
1882872812,whatwg/html,A preffed-off implementation in a browser engine would help move this along.,https://github.com/whatwg/html/pull/1936#issuecomment-1882872812,https://github.com/whatwg/html/pull/1936,"Add document.{parsed,contentLoaded,loaded} promises",2024-01-09T11:09:41Z,annevk
1882857296,whatwg/html,https://github.com/whatwg/html/issues/1567#issuecomment-1882843263 has a suggested way to write this,https://github.com/whatwg/html/issues/10032#issuecomment-1882857296,https://github.com/whatwg/html/issues/10032,Change when button has activation behavior,2024-01-09T10:59:17Z,annevk
1882851847,WICG/webcomponents,"out of the box thought, if it would work like a `<form>`  and the inputs inside it. So when you draw",https://github.com/WICG/webcomponents/issues/1043#issuecomment-1882851847,https://github.com/WICG/webcomponents/issues/1043,[scoped-registries] Consider future expansion to allow using a registry without new API,2024-01-09T10:55:38Z,pascalvos
