id,repo,body,url,issue_url,issue_title,created_at,user
1497370559,mozilla/standards-positions,> @smaug---- any update on this? :)  See the discussion in the PR (https://github.com/whatwg/html/,https://github.com/mozilla/standards-positions/issues/543#issuecomment-1497370559,https://github.com/mozilla/standards-positions/issues/543,Navigation API,2023-04-05T12:01:04Z,petervanderbeken
1497349160,mozilla/standards-positions,@smaug---- any update on this? :)  The company I work for is considering using this if firefox pla,https://github.com/mozilla/standards-positions/issues/543#issuecomment-1497349160,https://github.com/mozilla/standards-positions/issues/543,Navigation API,2023-04-05T11:44:38Z,MineDrum
1497235919,whatwg/html,"In order to use the popover API cross-root, you will need to use JS. If the popover API is used enti",https://github.com/whatwg/html/issues/9110#issuecomment-1497235919,https://github.com/whatwg/html/issues/9110,"Support `popovertarget` on custom elements with `role=""button""` ",2023-04-05T10:05:11Z,keithamus
1497216203,whatwg/html,"It looks like the `anchor` attribute wasn't pursued, in favour of using a name reference in CSS. ",https://github.com/whatwg/html/issues/9111#issuecomment-1497216203,https://github.com/whatwg/html/issues/9111,Popover does not know what triggered it,2023-04-05T09:50:03Z,keithamus
1497116637,whatwg/html,> CSS anchoring is a separate spec to popover. Here's an explainer: https://developer.chrome.com/blo,https://github.com/whatwg/html/issues/9111#issuecomment-1497116637,https://github.com/whatwg/html/issues/9111,Popover does not know what triggered it,2023-04-05T08:30:25Z,jpzwarte
1497108428,whatwg/html,> There is mention of an `anchor` attribute in the OpenUI research explainer  CSS anchoring is a s,https://github.com/whatwg/html/issues/9111#issuecomment-1497108428,https://github.com/whatwg/html/issues/9111,Popover does not know what triggered it,2023-04-05T08:23:35Z,keithamus
1497107735,whatwg/html,"@mfreed7 or @josepharhar might want to give this some attention. ",https://github.com/whatwg/html/issues/9111#issuecomment-1497107735,https://github.com/whatwg/html/issues/9111,Popover does not know what triggered it,2023-04-05T08:22:59Z,keithamus
1497107184,whatwg/html,There is mention of an `anchor` attribute in the OpenUI research explainer: https://open-ui.org/comp,https://github.com/whatwg/html/issues/9111#issuecomment-1497107184,https://github.com/whatwg/html/issues/9111,Popover does not know what triggered it,2023-04-05T08:22:30Z,jpzwarte
1497095970,whatwg/html,"I'm just looking at `@oddbird/popover-polyfill` and I'm running into this issue. Afaics there is no ",https://github.com/whatwg/html/issues/9111#issuecomment-1497095970,https://github.com/whatwg/html/issues/9111,Popover does not know what triggered it,2023-04-05T08:13:40Z,jpzwarte
1497019743,whatwg/html,Is there are PR for this? (asking for the WICG Chairs... just wondering about status as we are itchi,https://github.com/whatwg/html/issues/8282#issuecomment-1497019743,https://github.com/whatwg/html/issues/8282,Incorporate scroll-to-text into HTML,2023-04-05T07:07:20Z,marcoscaceres
1497015270,whatwg/html,"The ""another place"" is not a requirement on implementers. It's supposed to be a statement of fact, e",https://github.com/whatwg/html/issues/9114#issuecomment-1497015270,https://github.com/whatwg/html/issues/9114,Should FACE formStateRestoreCallback be called with the new value or state?,2023-04-05T07:03:07Z,annevk
1496946445,WICG/webcomponents,[Functionally complete declarative templating](https://github.com/WICG/webcomponents/issues/997) WIC,https://github.com/WICG/webcomponents/issues/994#issuecomment-1496946445,https://github.com/WICG/webcomponents/issues/994,Templates are currently half a solution to web component HTML,2023-04-05T05:41:17Z,sashafirsov
1496945876,whatwg/html,"Sorry if it's a dumb question, so in order to use popover api in the Declarative shadow dom, we have",https://github.com/whatwg/html/issues/9110#issuecomment-1496945876,https://github.com/whatwg/html/issues/9110,"Support `popovertarget` on custom elements with `role=""button""` ",2023-04-05T05:40:23Z,watsondog
1496916135,whatwg/webidl,"Oh, that's quite right. I missed that the interface between the two specs was phrased in terms of a ",https://github.com/whatwg/webidl/issues/1288#issuecomment-1496916135,https://github.com/whatwg/webidl/issues/1288,"async iteration can produce promises, which the ES spec generally avoids",2023-04-05T04:55:53Z,bakkot
1496909501,whatwg/webidl,"Hmm, I'm not sure if the problem actually exists. Your concern is that `value` at step 8.5.4.4 (aka ",https://github.com/whatwg/webidl/issues/1288#issuecomment-1496909501,https://github.com/whatwg/webidl/issues/1288,"async iteration can produce promises, which the ES spec generally avoids",2023-04-05T04:42:55Z,TimothyGu
1496908143,WICG/webcomponents,The following code seems to work. I forget to add some inner text to my custom <pixel-run> element.,https://github.com/WICG/webcomponents/issues/903#issuecomment-1496908143,https://github.com/WICG/webcomponents/issues/903,"Empty innerHTML/textContent in connectedCallback, but the actual content is rendered",2023-04-05T04:40:25Z,liudonghua123
1496901466,WICG/webcomponents,> I filed https://bugzilla.mozilla.org/show_bug.cgi?id=1673811 on that. Note that `setTimeout` is ab,https://github.com/WICG/webcomponents/issues/903#issuecomment-1496901466,https://github.com/WICG/webcomponents/issues/903,"Empty innerHTML/textContent in connectedCallback, but the actual content is rendered",2023-04-05T04:28:30Z,liudonghua123
1496862013,WICG/webcomponents,@bahrus  > I also wonder if it makes sense to allow the include tags to reference id's of templates,https://github.com/WICG/webcomponents/issues/997#issuecomment-1496862013,https://github.com/WICG/webcomponents/issues/997,Functionally complete declarative templating,2023-04-05T03:10:54Z,sashafirsov
1496861221,WICG/webcomponents,"@bahrus , > Would this proposal be meant as a very useful ""side-effect"" of HTML Modules, or be trea",https://github.com/WICG/webcomponents/issues/997#issuecomment-1496861221,https://github.com/WICG/webcomponents/issues/997,Functionally complete declarative templating,2023-04-05T03:09:09Z,sashafirsov
1496847141,WICG/webcomponents,"@keithamus  > I wonder if  ```html  <template id=""foo"">Content</template> and <template ref=""foo""",https://github.com/WICG/webcomponents/issues/997#issuecomment-1496847141,https://github.com/WICG/webcomponents/issues/997,Functionally complete declarative templating,2023-04-05T02:48:33Z,sashafirsov
1496841096,WICG/webcomponents,"@keithamus , great idea, adding the fallback to proposal.  **loading and fallback**. The ""loaded"" ",https://github.com/WICG/webcomponents/issues/997#issuecomment-1496841096,https://github.com/WICG/webcomponents/issues/997,Functionally complete declarative templating,2023-04-05T02:39:58Z,sashafirsov
1496840075,WICG/webcomponents,"@bahrus , `templ-mount`, as I see it, the all-in-one POC: shadow DOM, loading, custom element, etc. ",https://github.com/WICG/webcomponents/issues/997#issuecomment-1496840075,https://github.com/WICG/webcomponents/issues/997,Functionally complete declarative templating,2023-04-05T02:37:42Z,sashafirsov
1496800903,whatwg/html,"The question here is whether the URL is observable at all, and thus we need to pass it in, or whethe",https://github.com/whatwg/html/issues/9122#issuecomment-1496800903,https://github.com/whatwg/html/issues/9122,"""Loading a document for inline content that doesn't have a DOM"" uses non-existing response",2023-04-05T01:29:09Z,domenic
1496729565,whatwg/html,"As I understand it, this is an open-ended prefix request, but with currently two primary, slightly o",https://github.com/whatwg/html/issues/9084#issuecomment-1496729565,https://github.com/whatwg/html/issues/9084,Accessibility Attribute Request,2023-04-04T23:44:08Z,cookiecrook
1496691098,whatwg/html,"cc @whatwg/a11y ",https://github.com/whatwg/html/issues/9084#issuecomment-1496691098,https://github.com/whatwg/html/issues/9084,Accessibility Attribute Request,2023-04-04T22:44:05Z,zcorpan
1496648702,WICG/webcomponents,"Quite a bit of this overlaps with [similar proposals, of which this is one](https://github.com/bahru",https://github.com/WICG/webcomponents/issues/997#issuecomment-1496648702,https://github.com/WICG/webcomponents/issues/997,Functionally complete declarative templating,2023-04-04T21:51:03Z,bahrus
1496426439,whatwg/html,my apologies then @josepharhar thank you!,https://github.com/whatwg/html/pull/9120#issuecomment-1496426439,https://github.com/whatwg/html/pull/9120,Skip descendant dialogs and popovers for autofocus,2023-04-04T18:36:16Z,scottaohara
1496415441,whatwg/html,@scottaohara I opened another PR for that behavior: https://github.com/whatwg/html/pull/9121,https://github.com/whatwg/html/pull/9120#issuecomment-1496415441,https://github.com/whatwg/html/pull/9120,Skip descendant dialogs and popovers for autofocus,2023-04-04T18:27:41Z,josepharhar
1496379299,whatwg/html,"Thanks Scott, I am working on that bug right now. I believe that this spec PR is about a different ",https://github.com/whatwg/html/pull/9120#issuecomment-1496379299,https://github.com/whatwg/html/pull/9120,Skip descendant dialogs and popovers for autofocus,2023-04-04T17:59:37Z,josepharhar
1496327046,whatwg/html,https://bugs.chromium.org/p/chromium/issues/detail?id=1430405  i've already talked to @mfreed7 abo,https://github.com/whatwg/html/pull/9120#issuecomment-1496327046,https://github.com/whatwg/html/pull/9120,Skip descendant dialogs and popovers for autofocus,2023-04-04T17:14:55Z,scottaohara
1496325990,whatwg/html,@scottaohara Could you send a link to the bug?,https://github.com/whatwg/html/pull/9120#issuecomment-1496325990,https://github.com/whatwg/html/pull/9120,Skip descendant dialogs and popovers for autofocus,2023-04-04T17:14:01Z,josepharhar
1496324710,whatwg/html,@josepharhar i filed a chromium bug so that popover on a dialog would NOT behave this way.,https://github.com/whatwg/html/pull/9120#issuecomment-1496324710,https://github.com/whatwg/html/pull/9120,Skip descendant dialogs and popovers for autofocus,2023-04-04T17:13:00Z,scottaohara
1496296034,whatwg/html,I created a spec PR here: https://github.com/whatwg/html/pull/9120,https://github.com/whatwg/html/issues/9119#issuecomment-1496296034,https://github.com/whatwg/html/issues/9119,popover-focus-child-dialog.html requires spec update,2023-04-04T16:50:15Z,josepharhar
1496213406,WICG/webcomponents,"Reminder that we've got two session for this scheduled for the week after next, see proposed schedul",https://github.com/WICG/webcomponents/issues/978#issuecomment-1496213406,https://github.com/WICG/webcomponents/issues/978,"Spring 2023 ""F2F""",2023-04-04T15:48:48Z,Westbrook
1496137150,webkit/standards-positions,Thank you @marcoscaceres and @hober. I will take a look at these metadata vocabularies. I am not fam,https://github.com/WebKit/standards-positions/issues/138#issuecomment-1496137150,https://github.com/WebKit/standards-positions/issues/138,Document Subtitle,2023-04-04T15:05:20Z,diekus
1496116819,mozilla/standards-positions,Why would origin-partitioning be any harder? And I guess that isn't even the right question. The que,https://github.com/mozilla/standards-positions/issues/628#issuecomment-1496116819,https://github.com/mozilla/standards-positions/issues/628,Anonymous iframe,2023-04-04T14:54:35Z,smaug----
1496068927,mozilla/standards-positions,"> Also, it is unclear how StorageManager works with this. Is there a risk that StorageManager.estima",https://github.com/mozilla/standards-positions/issues/628#issuecomment-1496068927,https://github.com/mozilla/standards-positions/issues/628,Anonymous iframe,2023-04-04T14:25:25Z,ArthurSonzogni
1496068582,mozilla/standards-positions,"> One thing I'm not very keen on in credentialless iframes is that they don't get their own origin.",https://github.com/mozilla/standards-positions/issues/628#issuecomment-1496068582,https://github.com/mozilla/standards-positions/issues/628,Anonymous iframe,2023-04-04T14:25:13Z,ArthurSonzogni
1496010861,webkit/standards-positions,"fwiw, see:  https://github.com/orgs/community/discussions/6838 https://github.com/zentered/issue-",https://github.com/WebKit/standards-positions/issues/27#issuecomment-1496010861,https://github.com/WebKit/standards-positions/issues/27,meta: add some sort of auto-triage,2023-04-04T13:49:54Z,gsnedders
1495890122,webkit/standards-positions,"I propose we label this `position: support` 7 days from now, with the following:  > We are in suppor",https://github.com/WebKit/standards-positions/issues/18#issuecomment-1495890122,https://github.com/WebKit/standards-positions/issues/18,WebTransport,2023-04-04T12:30:06Z,ekinnear
1495758385,whatwg/html,"@josepharhar @mfreed7   Once the specification is synced, WebKit can go ahead with the relevant pa",https://github.com/whatwg/html/issues/9119#issuecomment-1495758385,https://github.com/whatwg/html/issues/9119,popover-focus-child-dialog.html requires spec update,2023-04-04T10:52:36Z,rwlbuis
1495745257,w3ctag/design-reviews,"Ah sorry nope. Our initial intention is to support both POST & GET. But some ongoing discussions in ",https://github.com/w3ctag/design-reviews/issues/776#issuecomment-1495745257,https://github.com/w3ctag/design-reviews/issues/776,Early Design Review: Pending Beacon API,2023-04-04T10:43:46Z,mingyc
1495614594,WICG/webcomponents,"I wonder if `<template id=""foo"">Content</template>` and `<template ref=""foo"">Fallback content</templ",https://github.com/WICG/webcomponents/issues/997#issuecomment-1495614594,https://github.com/WICG/webcomponents/issues/997,Functionally complete declarative templating,2023-04-04T09:07:23Z,keithamus
1495581422,WICG/webcomponents,"Functionally complete declarative templating #997 is WICG proposal and would be part of Declarative ",https://github.com/WICG/webcomponents/issues/978#issuecomment-1495581422,https://github.com/WICG/webcomponents/issues/978,"Spring 2023 ""F2F""",2023-04-04T08:43:44Z,sashafirsov
1495401745,WICG/webcomponents,"@mangelozzi I guess you referring to the current state of templates which is far from the origin of ",https://github.com/WICG/webcomponents/issues/994#issuecomment-1495401745,https://github.com/WICG/webcomponents/issues/994,Templates are currently half a solution to web component HTML,2023-04-04T06:07:15Z,sashafirsov
1495163165,webkit/standards-positions,"Ok, so our revised position is that we ""oppose"" this proposal because we are concerned about duplica",https://github.com/WebKit/standards-positions/issues/138#issuecomment-1495163165,https://github.com/WebKit/standards-positions/issues/138,Document Subtitle,2023-04-04T00:19:14Z,marcoscaceres
1495158868,w3ctag/design-reviews,> > Hi @a-sully – are there versions of the spec and explainer markdowns that can be directly linked,https://github.com/w3ctag/design-reviews/issues/805#issuecomment-1495158868,https://github.com/w3ctag/design-reviews/issues/805,Moving local files with the File System Access API,2023-04-04T00:13:53Z,a-sully
1495143389,webkit/standards-positions,@hober makes a great point. There is already extensive usage of `og:title` throughout the web and th,https://github.com/WebKit/standards-positions/issues/138#issuecomment-1495143389,https://github.com/WebKit/standards-positions/issues/138,Document Subtitle,2023-04-03T23:58:00Z,marcoscaceres
1495118346,webkit/standards-positions,I understand it looks weird. You would reason that you're removing it from ARIA. I noted this in the,https://github.com/WebKit/standards-positions/issues/97#issuecomment-1495118346,https://github.com/WebKit/standards-positions/issues/97,Customized built-in elements,2023-04-03T23:26:49Z,clshortfuse
1495113196,webkit/standards-positions,> @clshortfuse > ```html >  <x-button> >     #shadow-root >       <input type=button aria-labell,https://github.com/WebKit/standards-positions/issues/97#issuecomment-1495113196,https://github.com/WebKit/standards-positions/issues/97,Customized built-in elements,2023-04-03T23:20:13Z,dannymcgee
1495091493,w3ctag/design-reviews,"It's a bit hard to be sure, but after reading https://github.com/WICG/pending-beacon/blob/main/READM",https://github.com/w3ctag/design-reviews/issues/776#issuecomment-1495091493,https://github.com/w3ctag/design-reviews/issues/776,Early Design Review: Pending Beacon API,2023-04-03T22:58:03Z,miketaylr
1495028142,whatwg/html,"From the CSS side: we think `@media (scripting: none)` should align with `<noscript>` handling, and ",https://github.com/whatwg/html/issues/9113#issuecomment-1495028142,https://github.com/whatwg/html/issues/9113,"Consider CSP script-src none directive in the ""Enabled/disabled scripting"" definitions",2023-04-03T21:47:38Z,tabatkins
1494934768,whatwg/webidl,"I was talking to @domfarolino about this topic last week: I concluded that a USVString ""is"" a [scala",https://github.com/whatwg/webidl/issues/335#issuecomment-1494934768,https://github.com/whatwg/webidl/issues/335,"Revamp ByteString, DOMString, and USVString",2023-04-03T20:25:33Z,jyasskin
1494932814,webkit/standards-positions,"PR is up: #162 ",https://github.com/WebKit/standards-positions/pull/161#issuecomment-1494932814,https://github.com/WebKit/standards-positions/pull/161,Use an issue form instead of an old-style issue template,2023-04-03T20:23:34Z,hober
1494921799,whatwg/html,"Diving backwards in blame, that algorithm was added to fullscreen in <https://github.com/whatwg/full",https://github.com/whatwg/html/pull/9093#issuecomment-1494921799,https://github.com/whatwg/html/pull/9093,Use CSS spec for top layer,2023-04-03T20:15:01Z,tabatkins
1494909200,webkit/standards-positions,"Tested on real Mac, Safari 16.4. Same issue.  Filed: https://bugs.webkit.org/show_bug.cgi?id=25493",https://github.com/WebKit/standards-positions/issues/97#issuecomment-1494909200,https://github.com/WebKit/standards-positions/issues/97,Customized built-in elements,2023-04-03T20:05:05Z,clshortfuse
1494870115,webkit/standards-positions,https://github.com/WebKit/standards-positions/issues/26#issue-1295734689 points to the docs. You'd p,https://github.com/WebKit/standards-positions/pull/161#issuecomment-1494870115,https://github.com/WebKit/standards-positions/pull/161,Use an issue form instead of an old-style issue template,2023-04-03T19:37:29Z,nschonni
1494831714,webkit/standards-positions,> It would've been better to move each of the things to be their own field!  Sounds cool! I'll try,https://github.com/WebKit/standards-positions/pull/161#issuecomment-1494831714,https://github.com/WebKit/standards-positions/pull/161,Use an issue form instead of an old-style issue template,2023-04-03T19:06:02Z,hober
1494813734,webkit/standards-positions,"@rniwa My Macbook Pro borked, so I've been using Playwright's WebKit build for Linux. I've tested `E",https://github.com/WebKit/standards-positions/issues/97#issuecomment-1494813734,https://github.com/WebKit/standards-positions/issues/97,Customized built-in elements,2023-04-03T18:52:51Z,clshortfuse
1494790704,webkit/standards-positions,Would it be possible to test Safari version 16.4 (18615.x)? We added the support for ElementInternal,https://github.com/WebKit/standards-positions/issues/97#issuecomment-1494790704,https://github.com/WebKit/standards-positions/issues/97,Customized built-in elements,2023-04-03T18:32:37Z,rniwa
1494784417,webkit/standards-positions,"I decided to sit down and track all the issues with a11y, using native HTMLInputElement with Web Com",https://github.com/WebKit/standards-positions/issues/97#issuecomment-1494784417,https://github.com/WebKit/standards-positions/issues/97,Customized built-in elements,2023-04-03T18:28:51Z,clshortfuse
1494769822,webkit/standards-positions,Why not use fields from one of the popular metadata vocabularies like OpenGraph's [`og:title`](https,https://github.com/WebKit/standards-positions/issues/138#issuecomment-1494769822,https://github.com/WebKit/standards-positions/issues/138,Document Subtitle,2023-04-03T18:16:35Z,hober
1494756158,whatwg/dom,[Closing out issues I've authored that appear to be stagnant.],https://github.com/whatwg/dom/issues/981#issuecomment-1494756158,https://github.com/whatwg/dom/issues/981,Specify that AbortController#abort() be bound to AbortController instance,2023-04-03T18:06:11Z,broofa
1494690950,w3ctag/design-reviews,> One thing we noticed in reviewing the explainer is a lack of user needs.  Our goal is to provide,https://github.com/w3ctag/design-reviews/issues/776#issuecomment-1494690950,https://github.com/w3ctag/design-reviews/issues/776,Early Design Review: Pending Beacon API,2023-04-03T17:12:50Z,mingyc
1494669415,whatwg/html,This is yet again another great reason to native behavior mixins to be surfaced to custom element au,https://github.com/whatwg/html/issues/9110#issuecomment-1494669415,https://github.com/whatwg/html/issues/9110,"Support `popovertarget` on custom elements with `role=""button""` ",2023-04-03T16:58:14Z,Westbrook
1494448377,whatwg/html,Yeah FWIW I'm not suggesting it couldn't (or even wouldn't) be supported but I'm explaining the curr,https://github.com/whatwg/html/issues/9110#issuecomment-1494448377,https://github.com/whatwg/html/issues/9110,"Support `popovertarget` on custom elements with `role=""button""` ",2023-04-03T14:37:30Z,keithamus
1494423012,whatwg/html,"Even though custom elements are a JS API, if I can I would much rather implement things declarativel",https://github.com/whatwg/html/issues/9110#issuecomment-1494423012,https://github.com/whatwg/html/issues/9110,"Support `popovertarget` on custom elements with `role=""button""` ",2023-04-03T14:22:48Z,jpzwarte
1494392998,whatwg/html,Needs label https://github.com/whatwg/html/labels/topic%3A%20popover,https://github.com/whatwg/html/issues/9109#issuecomment-1494392998,https://github.com/whatwg/html/issues/9109,`popovertarget` and shadow DOM,2023-04-03T14:07:55Z,keithamus
1494375884,whatwg/html,"It has been discussed before, but it's been suggested that the two remain separate. See for example ",https://github.com/whatwg/html/issues/3567#issuecomment-1494375884,https://github.com/whatwg/html/issues/3567,Have some way of opening `<dialog>` elements without JavaScript,2023-04-03T14:00:40Z,keithamus
1494370428,whatwg/html,I agree this could be a useful addition. I think extending the `ToggleEvent` to include a `relatedTa,https://github.com/whatwg/html/issues/9111#issuecomment-1494370428,https://github.com/whatwg/html/issues/9111,Popover does not know what triggered it,2023-04-03T13:57:40Z,keithamus
1494353615,whatwg/html,An element like `<sl-button>` could reflect the attribute to a button in the underlying ShadowDOM. A,https://github.com/whatwg/html/issues/9110#issuecomment-1494353615,https://github.com/whatwg/html/issues/9110,"Support `popovertarget` on custom elements with `role=""button""` ",2023-04-03T13:46:25Z,keithamus
1494215295,whatwg/html,"Would it make sense to have dialog's inherit directly from ~~`popover`~~ `popup` meaning we can use ",https://github.com/whatwg/html/issues/3567#issuecomment-1494215295,https://github.com/whatwg/html/issues/3567,Have some way of opening `<dialog>` elements without JavaScript,2023-04-03T12:15:34Z,Link2Twenty
1494196043,whatwg/dom,(Clarification - function parameters are exposed as an array; dictionary members as a dictionary.),https://github.com/whatwg/dom/issues/1183#issuecomment-1494196043,https://github.com/whatwg/dom/issues/1183,Proposal: Allow WebIDL binding to expose parameters' types and enums' values,2023-04-03T12:03:09Z,eladalon1983
1494191524,whatwg/dom,(See #1183. I guess I had two tabs open.),https://github.com/whatwg/dom/issues/1182#issuecomment-1494191524,https://github.com/whatwg/dom/issues/1182,Proposal: Allow WebIDL bindings to expose method parameters' types,2023-04-03T12:00:47Z,eladalon1983
1494190830,whatwg/dom,Oops?,https://github.com/whatwg/dom/issues/1182#issuecomment-1494190830,https://github.com/whatwg/dom/issues/1182,Proposal: Allow WebIDL bindings to expose method parameters' types,2023-04-03T12:00:21Z,eladalon1983
1494161451,whatwg/html,"There does _need_ to be an declarative API, at some point. Would be best to push on this early, and ",https://github.com/whatwg/html/issues/9109#issuecomment-1494161451,https://github.com/whatwg/html/issues/9109,`popovertarget` and shadow DOM,2023-04-03T11:36:42Z,Westbrook
1494103306,webkit/standards-positions,It would've been better to move each of the things to be their own field!,https://github.com/WebKit/standards-positions/pull/161#issuecomment-1494103306,https://github.com/WebKit/standards-positions/pull/161,Use an issue form instead of an old-style issue template,2023-04-03T10:55:11Z,gsnedders
1494078646,whatwg/html,This sucks for design systems using custom elements. For example:  ```html <sl-button popovertarg,https://github.com/whatwg/html/issues/9110#issuecomment-1494078646,https://github.com/whatwg/html/issues/9110,"Support `popovertarget` on custom elements with `role=""button""` ",2023-04-03T10:33:32Z,jpzwarte
1494075322,whatwg/html,Elements with a `role=button` will not work because only `button` & `input` have the mixin.  You c,https://github.com/whatwg/html/issues/9110#issuecomment-1494075322,https://github.com/whatwg/html/issues/9110,"Support `popovertarget` on custom elements with `role=""button""` ",2023-04-03T10:30:31Z,keithamus
1494074642,whatwg/html,Afaict the CSS anchor proposal also doesn't support multiple `popovertarget` invokers: https://githu,https://github.com/whatwg/html/issues/9111#issuecomment-1494074642,https://github.com/whatwg/html/issues/9111,Popover does not know what triggered it,2023-04-03T10:29:56Z,jpzwarte
