id,repo,body,url,issue_url,issue_title,created_at,user
1806856962,WICG/webcomponents,> the proof-of-concept I published to npm  I'm not sure if the usage of your polyfile can represen,https://github.com/WICG/webcomponents/issues/909#issuecomment-1806856962,https://github.com/WICG/webcomponents/issues/909,"""open-stylable"" Shadow Roots",2023-11-11T16:21:24Z,jogibear9988
1806852528,WICG/webcomponents,Two arguments I keep seeing pop up in this thread:  1. This feature is desperately needed. 2. Thi,https://github.com/WICG/webcomponents/issues/909#issuecomment-1806852528,https://github.com/WICG/webcomponents/issues/909,"""open-stylable"" Shadow Roots",2023-11-11T16:03:05Z,nolanlawson
1806827609,webkit/standards-positions,@marcoscaceres could you please add the oppose label? Thanks!,https://github.com/WebKit/standards-positions/issues/267#issuecomment-1806827609,https://github.com/WebKit/standards-positions/issues/267,Vibration API (Second Edition),2023-11-11T14:12:47Z,MrBrain295
1806824653,WICG/webcomponents,"Another potential separate thread out of this conversation, which I have to believe has probably bee",https://github.com/WICG/webcomponents/issues/1035#issuecomment-1806824653,https://github.com/WICG/webcomponents/issues/1035,DOM parts use outside of <template> seems unlikely,2023-11-11T13:59:36Z,bahrus
1806777974,whatwg/html,"Hey, I also really like the server sent events protocol. Using the fetch streaming API works, but t",https://github.com/whatwg/html/issues/2177#issuecomment-1806777974,https://github.com/whatwg/html/issues/2177,Setting headers for EventSource,2023-11-11T10:31:35Z,lukas-reining
1806559643,WICG/webcomponents,"@matthewp   >I would suggest adding ""will non-JS frameworks adopt this?"" as a question to answer. ",https://github.com/WICG/webcomponents/issues/1035#issuecomment-1806559643,https://github.com/WICG/webcomponents/issues/1035,DOM parts use outside of <template> seems unlikely,2023-11-10T23:31:08Z,bahrus
1806525182,WICG/webcomponents,"> I would suggest adding ""will non-JS frameworks adopt this?"" as a question to answer. Key word bein",https://github.com/WICG/webcomponents/issues/1035#issuecomment-1806525182,https://github.com/WICG/webcomponents/issues/1035,DOM parts use outside of <template> seems unlikely,2023-11-10T22:38:26Z,tbondwilkinson
1806520234,WICG/webcomponents,"@bahrus   > Hmm, I'm starting to wonder if you are proposing something more radical than I thought",https://github.com/WICG/webcomponents/issues/1035#issuecomment-1806520234,https://github.com/WICG/webcomponents/issues/1035,DOM parts use outside of <template> seems unlikely,2023-11-10T22:31:43Z,matthewp
1806495619,WICG/webcomponents,"@matthewp,  >Things like loops etc are easy; you get those for free from CSS, since all selectors ",https://github.com/WICG/webcomponents/issues/1035#issuecomment-1806495619,https://github.com/WICG/webcomponents/issues/1035,DOM parts use outside of <template> seems unlikely,2023-11-10T22:03:47Z,bahrus
1806483528,WICG/webcomponents,@tbondwilkinson Thanks for joining the party. 😀  > Code that does not fall into one of those cate,https://github.com/WICG/webcomponents/issues/1035#issuecomment-1806483528,https://github.com/WICG/webcomponents/issues/1035,DOM parts use outside of <template> seems unlikely,2023-11-10T21:52:27Z,matthewp
1806456750,WICG/webcomponents,"@EisenbergEffect   > I could be misunderstanding this, but it seems this would be far more challen",https://github.com/WICG/webcomponents/issues/1035#issuecomment-1806456750,https://github.com/WICG/webcomponents/issues/1035,DOM parts use outside of <template> seems unlikely,2023-11-10T21:28:44Z,matthewp
1806413146,w3c/pointerlock,> A solution here needs to avoid this being usable to move the cursor to an arbitrary position by ra,https://github.com/w3c/pointerlock/issues/61#issuecomment-1806413146,https://github.com/w3c/pointerlock/issues/61,feature request : Allow to set pointer position upon release,2023-11-10T20:50:25Z,sirisian
1806403154,WICG/webcomponents,"@bkardell   > However... I'm having difficulty reconciling: We already have the option to not SSR,",https://github.com/WICG/webcomponents/issues/1035#issuecomment-1806403154,https://github.com/WICG/webcomponents/issues/1035,DOM parts use outside of <template> seems unlikely,2023-11-10T20:39:45Z,matthewp
1806393525,WICG/webcomponents,@bahrus I have written a library that does my CSS idea [here](https://corset.dev/) and the hard part,https://github.com/WICG/webcomponents/issues/1035#issuecomment-1806393525,https://github.com/WICG/webcomponents/issues/1035,DOM parts use outside of <template> seems unlikely,2023-11-10T20:30:55Z,matthewp
1806341343,whatwg/html,How do I convert the output of captureSnapshot to HTML?,https://github.com/whatwg/html/issues/8192#issuecomment-1806341343,https://github.com/whatwg/html/issues/8192,Shadow DOM innerHTML,2023-11-10T19:47:23Z,lucgagan
1806318460,w3c/editcontext,Notes from 2023-11-09 WG meeting:  > [17:59] <whsieh_> dandclark: cE=false with nested cE=true wor,https://github.com/w3c/edit-context/issues/74#issuecomment-1806318460,https://github.com/w3c/edit-context/issues/74,Can EditContext works as normally even in designMode if set to the documentElement and/or body?,2023-11-10T19:25:09Z,dandclark
1806317341,w3c/editcontext,Notes from 2023-11-09 call: > [17:55] <whsieh_> johanneswilm: what connection should there be betwe,https://github.com/w3c/edit-context/issues/71#issuecomment-1806317341,https://github.com/w3c/edit-context/issues/71,"`Document.execCommand`, `Document.queryCommandValue`, `Document.queryCommandState`, `Document.queryCommandEnabled`, `Document.queryCommandSupported`, `Document.queryCommandIndeterm` behavior when an EditContext editing host has focus",2023-11-10T19:24:01Z,dandclark
1806281329,w3c/pointerlock,A solution here needs to avoid this being usable to move the cursor to an arbitrary position by rapi,https://github.com/w3c/pointerlock/issues/61#issuecomment-1806281329,https://github.com/w3c/pointerlock/issues/61,feature request : Allow to set pointer position upon release,2023-11-10T18:58:28Z,reillyeon
1806209256,WICG/webcomponents,"Hey all, thanks for the lively discussion.  I have a few thoughts.  This API has one central goa",https://github.com/WICG/webcomponents/issues/1035#issuecomment-1806209256,https://github.com/WICG/webcomponents/issues/1035,DOM parts use outside of <template> seems unlikely,2023-11-10T18:24:00Z,tbondwilkinson
1806165445,WICG/webcomponents,I just wanted to add a (possibly separate) thread to this conversation.  I may turn this thought int,https://github.com/WICG/webcomponents/issues/1035#issuecomment-1806165445,https://github.com/WICG/webcomponents/issues/1035,DOM parts use outside of <template> seems unlikely,2023-11-10T17:49:46Z,bahrus
1806120587,WICG/webcomponents,"I'm having a little trouble reconciling a few things in my head, and I've been talking to @matthewp ",https://github.com/WICG/webcomponents/issues/1035#issuecomment-1806120587,https://github.com/WICG/webcomponents/issues/1035,DOM parts use outside of <template> seems unlikely,2023-11-10T17:17:42Z,bkardell
1806067280,w3c/pointerevents,Thanks for pointing out the violation of the spec.  Chrome had an old comment to investigate its bou,https://github.com/w3c/pointerevents/issues/477#issuecomment-1806067280,https://github.com/w3c/pointerevents/issues/477,Clarify `pointerleave` and `pointerout` events when first pointer move after removing an element under the pointer,2023-11-10T16:44:32Z,mustaqahmed
1806038926,w3ctag/design-reviews,> Considering there seems to be a [way forward for standardization](https://github.com/WebKit/standa,https://github.com/w3ctag/design-reviews/issues/863#issuecomment-1806038926,https://github.com/w3ctag/design-reviews/issues/863,ServiceWorker static routing API,2023-11-10T16:25:26Z,chrishtr
1805771249,WICG/webcomponents,"> As an aside, I don't know how I come across when I'm writing on a thread like this. I hope you als",https://github.com/WICG/webcomponents/issues/1035#issuecomment-1805771249,https://github.com/WICG/webcomponents/issues/1035,DOM parts use outside of <template> seems unlikely,2023-11-10T13:53:56Z,matthewp
1805525318,whatwg/html,I've raised https://github.com/openui/open-ui/pull/942 which hopefully can be a place where we can d,https://github.com/whatwg/html/issues/9625#issuecomment-1805525318,https://github.com/whatwg/html/issues/9625,[Proposal] Invoker Buttons - allowing popover/dialog and more to be invoked without JS,2023-11-10T11:07:56Z,keithamus
1805353005,webkit/standards-positions,> Mozilla standards-positions issue URL  https://github.com/mozilla/standards-positions/issues/925,https://github.com/WebKit/standards-positions/issues/276#issuecomment-1805353005,https://github.com/WebKit/standards-positions/issues/276,Animating font-palette,2023-11-10T09:10:33Z,drott
1805351209,w3ctag/design-reviews,> * Security and Privacy self-review²: n/a  This incremental improvement to the Fonts spec falls u,https://github.com/w3ctag/design-reviews/issues/915#issuecomment-1805351209,https://github.com/w3ctag/design-reviews/issues/915,Animating font-palette,2023-11-10T09:09:10Z,drott
1805194280,w3c/pointerlock,"I'm running into this same issue currently, and I think an easy way to avoid the click-jacking risk ",https://github.com/w3c/pointerlock/issues/61#issuecomment-1805194280,https://github.com/w3c/pointerlock/issues/61,feature request : Allow to set pointer position upon release,2023-11-10T06:50:27Z,Paril
1805084755,whatwg/html,> thought that the only observable interactions between a DedicatedWorker and its owning Rendering p,https://github.com/whatwg/html/issues/9920#issuecomment-1805084755,https://github.com/whatwg/html/issues/9920,Workers: Unclear how to set fetch client for classic/module worker scripts,2023-11-10T04:52:45Z,domenic
1805070375,whatwg/html,"Looking at the ECMAScript spec for [Agent Clusters](https://tc39.es/ecma262/#sec-agent-clusters)  ",https://github.com/whatwg/html/issues/9920#issuecomment-1805070375,https://github.com/whatwg/html/issues/9920,Workers: Unclear how to set fetch client for classic/module worker scripts,2023-11-10T04:31:41Z,ADKaster
1805060889,whatwg/dom,> I think the problem description still very much assumes a particular solution. Ideally it would no,https://github.com/whatwg/dom/issues/1233#issuecomment-1805060889,https://github.com/whatwg/dom/issues/1233,Selecting Events with Style,2023-11-10T04:16:22Z,AdamSobieski
1805060425,whatwg/html,"> ""environment settings objects"" are not JS objects. You can pass them anywhere.  If this is the c",https://github.com/whatwg/html/issues/9920#issuecomment-1805060425,https://github.com/whatwg/html/issues/9920,Workers: Unclear how to set fetch client for classic/module worker scripts,2023-11-10T04:15:39Z,ADKaster
1804977146,whatwg/html,"> Either way, there is no guarantee that the new agent and the agent that is running the worker shar",https://github.com/whatwg/html/issues/9920#issuecomment-1804977146,https://github.com/whatwg/html/issues/9920,Workers: Unclear how to set fetch client for classic/module worker scripts,2023-11-10T02:24:26Z,domenic
1804920466,whatwg/html,I'll have to delegate to someone else since I'm no longer involved with WebKit.,https://github.com/whatwg/html/issues/8476#issuecomment-1804920466,https://github.com/whatwg/html/issues/8476,Canvas2D layers with filter support,2023-11-10T01:11:06Z,tuankiet65
1804909340,whatwg/html,You can just save the task itself. It's a spec object with identity. We don't need to give it some s,https://github.com/whatwg/html/issues/9919#issuecomment-1804909340,https://github.com/whatwg/html/issues/9919,"A way to detect ""same task""?",2023-11-10T00:56:38Z,domenic
1804875655,whatwg/html,To keep this issue updated the security concerns were discussed within OpenUI see the transcript her,https://github.com/whatwg/html/issues/9625#issuecomment-1804875655,https://github.com/whatwg/html/issues/9625,[Proposal] Invoker Buttons - allowing popover/dialog and more to be invoked without JS,2023-11-10T00:14:50Z,lukewarlow
1804869422,whatwg/html,> Media playback is also already possible without JS using native video elements so I'm not quite su,https://github.com/whatwg/html/issues/9625#issuecomment-1804869422,https://github.com/whatwg/html/issues/9625,[Proposal] Invoker Buttons - allowing popover/dialog and more to be invoked without JS,2023-11-10T00:07:05Z,nt1m
1804868001,whatwg/html,"> I don't quite follow the claim about ""same origin iframes"". In general, x-origin DOM access isn't ",https://github.com/whatwg/html/issues/9625#issuecomment-1804868001,https://github.com/whatwg/html/issues/9625,[Proposal] Invoker Buttons - allowing popover/dialog and more to be invoked without JS,2023-11-10T00:05:34Z,lukewarlow
1804856645,whatwg/html,> Fwiw showPicker only works in same origin iframes. That should help alleviate some security concer,https://github.com/whatwg/html/issues/9625#issuecomment-1804856645,https://github.com/whatwg/html/issues/9625,[Proposal] Invoker Buttons - allowing popover/dialog and more to be invoked without JS,2023-11-09T23:51:22Z,gijsk
1804722538,w3c/pointerevents,While reviewing the [fix](https://chromium-review.googlesource.com/c/chromium/src/+/4955773/) @musta,https://github.com/w3c/pointerevents/issues/477#issuecomment-1804722538,https://github.com/w3c/pointerevents/issues/477,Clarify `pointerleave` and `pointerout` events when first pointer move after removing an element under the pointer,2023-11-09T21:37:34Z,flackr
1804698300,whatwg/html,"If the intention is to unify non-modal dialogs I think the current issue, that's alluded to in your ",https://github.com/whatwg/html/issues/9376#issuecomment-1804698300,https://github.com/whatwg/html/issues/9376,Should we deprecate `dialog.show()`?,2023-11-09T21:17:14Z,lukewarlow
1804610775,WICG/webcomponents,"I think we can close this issue, right?  I  It would be nice if anyone knows where we kept the min",https://github.com/WICG/webcomponents/issues/911#issuecomment-1804610775,https://github.com/WICG/webcomponents/issues/911,Spring 2021 Virtual Meeting,2023-11-09T20:18:28Z,bkardell
1804520216,WICG/webcomponents,"As an aside, I don't know how I come across when I'm writing on a thread like this. I hope you all k",https://github.com/WICG/webcomponents/issues/1035#issuecomment-1804520216,https://github.com/WICG/webcomponents/issues/1035,DOM parts use outside of <template> seems unlikely,2023-11-09T19:41:33Z,EisenbergEffect
1804512372,w3ctag/design-reviews,"Hey TAG, is this floating towards the top of the pile any time soon?",https://github.com/w3ctag/design-reviews/issues/897#issuecomment-1804512372,https://github.com/w3ctag/design-reviews/issues/897,"Tag review request for the ""Dubbing and Audio description Profiles of TTML2""",2023-11-09T19:38:30Z,nigelmegitt
1804469514,WICG/webcomponents,"I could be misunderstanding this, but it seems this would be far more challenging for a server frame",https://github.com/WICG/webcomponents/issues/1035#issuecomment-1804469514,https://github.com/WICG/webcomponents/issues/1035,DOM parts use outside of <template> seems unlikely,2023-11-09T19:21:56Z,EisenbergEffect
1804414581,WICG/webcomponents,@EisenbergEffect: There are many possible DSLs one could imagine. We shouldn't limit ourselves to on,https://github.com/WICG/webcomponents/issues/1035#issuecomment-1804414581,https://github.com/WICG/webcomponents/issues/1035,DOM parts use outside of <template> seems unlikely,2023-11-09T18:59:34Z,matthewp
1804337578,WICG/webcomponents,"I'd love to see a concrete example of how ""binding from a distance"" would work. Let's just take the ",https://github.com/WICG/webcomponents/issues/1035#issuecomment-1804337578,https://github.com/WICG/webcomponents/issues/1035,DOM parts use outside of <template> seems unlikely,2023-11-09T18:25:14Z,EisenbergEffect
1804337293,w3c/editing,EditingWG meeting minutes: [17:34] <whsieh> next up: https://github.com/w3c/editing/issues/439 [17,https://github.com/w3c/editing/issues/439#issuecomment-1804337293,https://github.com/w3c/editing/issues/439,[Delayed Clipboard Rendering] Privacy issue while reading data for web custom types,2023-11-09T18:25:01Z,snianu
1804327171,WICG/webcomponents,"Hey @EisenbergEffect, thanks for taking the time. My issues were not about the specific syntax choic",https://github.com/WICG/webcomponents/issues/1035#issuecomment-1804327171,https://github.com/WICG/webcomponents/issues/1035,DOM parts use outside of <template> seems unlikely,2023-11-09T18:17:26Z,matthewp
1804303784,w3c/clipboard-apis,"RESOLUTION: Keep the exception during `write()`, but return empty `ClipboardItem` during `read()` if",https://github.com/w3c/clipboard-apis/issues/179#issuecomment-1804303784,https://github.com/w3c/clipboard-apis/issues/179,Should reading the clipboard throw DataError or empty clipboard items?,2023-11-09T18:01:02Z,snianu
1804301860,w3c/clipboard-apis,Abandoning this PR as per the resolution in the EditingWG meeting. [17:25] <whsieh> next up: https:,https://github.com/w3c/clipboard-apis/pull/198#issuecomment-1804301860,https://github.com/w3c/clipboard-apis/pull/198,Allow empty ClipboardItem.,2023-11-09T17:59:40Z,snianu
1804206347,whatwg/html,"@annevk Very well, forms may have multiple submit buttons – but that was just a side node.  > And ",https://github.com/whatwg/html/issues/9848#issuecomment-1804206347,https://github.com/whatwg/html/issues/9848,"For the button element, make 'button' the default value for the type attribute (instead of 'submit')",2023-11-09T16:58:25Z,dariok
1804191633,WICG/webcomponents,"Apologies for the wall of text that follows, but I want to make sure we're all on the same page rega",https://github.com/WICG/webcomponents/issues/1035#issuecomment-1804191633,https://github.com/WICG/webcomponents/issues/1035,DOM parts use outside of <template> seems unlikely,2023-11-09T16:49:26Z,EisenbergEffect
1804180246,whatwg/html,"Hi all,  I have finalized the Canvas 2D layer specification (https://github.com/whatwg/html/pull/9",https://github.com/whatwg/html/issues/8476#issuecomment-1804180246,https://github.com/whatwg/html/issues/8476,Canvas2D layers with filter support,2023-11-09T16:42:31Z,graveljp
1804099673,whatwg/html,"> ""just add a switch"" is often a lazy idea, but maybe that's the solution here - some way to tell th",https://github.com/whatwg/html/issues/2272#issuecomment-1804099673,https://github.com/whatwg/html/issues/2272,Disallow interactive content in <summary>,2023-11-09T15:56:42Z,dev-nicolaos
1804097046,whatwg/html,"> The initial about:blank inherits the origin from its creator, and its creator might be same-origin",https://github.com/whatwg/html/issues/9760#issuecomment-1804097046,https://github.com/whatwg/html/issues/9760,Expose information about last activation/cross-document navigation,2023-11-09T15:55:21Z,khushalsagar
1804079379,w3c/editcontext,"> Setting `document.documentElement.editContext` won't work because `<html>` ...  Nit, documentEle",https://github.com/w3c/edit-context/issues/74#issuecomment-1804079379,https://github.com/w3c/edit-context/issues/74,Can EditContext works as normally even in designMode if set to the documentElement and/or body?,2023-11-09T15:45:35Z,smaug----
1804055891,WICG/webcomponents,"@bahrus I really like the phrase ""binding from a distance"" because it both captures the idea and als",https://github.com/WICG/webcomponents/issues/1035#issuecomment-1804055891,https://github.com/WICG/webcomponents/issues/1035,DOM parts use outside of <template> seems unlikely,2023-11-09T15:32:35Z,matthewp
1803976885,WICG/webcomponents,"Also, I think the latest iteration may be a bit different from what you have, but nevertheless, yes,",https://github.com/WICG/webcomponents/issues/1035#issuecomment-1803976885,https://github.com/WICG/webcomponents/issues/1035,DOM parts use outside of <template> seems unlikely,2023-11-09T14:50:34Z,bahrus
1803940800,WICG/webcomponents,"Just my hot-take, from the department of faulty analogies:  For styling, we support both inline an",https://github.com/WICG/webcomponents/issues/1035#issuecomment-1803940800,https://github.com/WICG/webcomponents/issues/1035,DOM parts use outside of <template> seems unlikely,2023-11-09T14:30:39Z,bahrus
1803874990,WICG/webcomponents,"@otabek-git Thanks for your input, this is exactly why I raise the issue. The goal of having a decla",https://github.com/WICG/webcomponents/issues/1035#issuecomment-1803874990,https://github.com/WICG/webcomponents/issues/1035,DOM parts use outside of <template> seems unlikely,2023-11-09T13:53:51Z,matthewp
1803812323,whatwg/html,"> But in the general case, it is error-prone and likely to lead to expensive restyling, relayout, an",https://github.com/whatwg/html/issues/1605#issuecomment-1803812323,https://github.com/whatwg/html/issues/1605,style tag should be allowed in body,2023-11-09T13:15:29Z,dieulot
1803683873,whatwg/html,Fwiw showPicker only works in same origin iframes. That should help alleviate some security concerns,https://github.com/whatwg/html/issues/9625#issuecomment-1803683873,https://github.com/whatwg/html/issues/9625,[Proposal] Invoker Buttons - allowing popover/dialog and more to be invoked without JS,2023-11-09T11:49:31Z,lukewarlow
1803671234,mozilla/standards-positions,Chromium Intent to Ship: https://groups.google.com/a/chromium.org/g/blink-dev/c/bq8u5SREiYE/m/BMOnhI,https://github.com/mozilla/standards-positions/issues/905#issuecomment-1803671234,https://github.com/mozilla/standards-positions/issues/905,View Transitions: list of types,2023-11-09T11:40:05Z,zcorpan
1803626678,WICG/webcomponents,"Not a dumb question at all, @otabek-git.  I think it fair to say people are trying to look at ssr ca",https://github.com/WICG/webcomponents/issues/1035#issuecomment-1803626678,https://github.com/WICG/webcomponents/issues/1035,DOM parts use outside of <template> seems unlikely,2023-11-09T11:08:30Z,bahrus
1803596822,whatwg/html,"Looking at some examples from https://github.com/whatwg/html/issues/2272#issuecomment-1576352017 : ",https://github.com/whatwg/html/issues/2272#issuecomment-1803596822,https://github.com/whatwg/html/issues/2272,Disallow interactive content in <summary>,2023-11-09T10:48:42Z,zcorpan
1803565499,whatwg/html,"agreed. there are compelling uses cases for a `matchSelector` type API, but it feels like squeezing ",https://github.com/whatwg/html/issues/7039#issuecomment-1803565499,https://github.com/whatwg/html/issues/7039,Proposal for Element.currentLang and Element.currentDir,2023-11-09T10:28:10Z,WickyNilliams
1803553705,whatwg/html,"I don't think my ""option 2"" is viable due to style calculation timing. Language changes in response ",https://github.com/whatwg/html/issues/7039#issuecomment-1803553705,https://github.com/whatwg/html/issues/7039,Proposal for Element.currentLang and Element.currentDir,2023-11-09T10:20:25Z,jakearchibald
1803544233,w3ctag/design-reviews,"While you are in the area could you please also review VideoEncoderConfig.contentHint by @Djuffin? ",https://github.com/w3ctag/design-reviews/issues/912#issuecomment-1803544233,https://github.com/w3ctag/design-reviews/issues/912,WebCodecs support for AV1 screen content coding tools,2023-11-09T10:14:21Z,fippo
1803527687,whatwg/html,"FWIW, CSP was mentioned also during the discussions at TPAC.",https://github.com/whatwg/html/issues/9625#issuecomment-1803527687,https://github.com/whatwg/html/issues/9625,[Proposal] Invoker Buttons - allowing popover/dialog and more to be invoked without JS,2023-11-09T10:03:52Z,smaug----
1803488458,whatwg/dom,"I think the problem description still very much assumes a particular solution. Ideally it would not ",https://github.com/whatwg/dom/issues/1233#issuecomment-1803488458,https://github.com/whatwg/dom/issues/1233,Selecting Events with Style,2023-11-09T09:43:49Z,annevk
1803486439,w3ctag/design-reviews,"Apologies for my delay here, I was implementing some changes related to this feedback to test their ",https://github.com/w3ctag/design-reviews/issues/879#issuecomment-1803486439,https://github.com/w3ctag/design-reviews/issues/879,Soft Navigations,2023-11-09T09:42:31Z,yoavweiss
1803480709,whatwg/html,@rajsite Direction relates to layout and language does not. If you're interested in pushing for lang,https://github.com/whatwg/html/issues/7039#issuecomment-1803480709,https://github.com/whatwg/html/issues/7039,Proposal for Element.currentLang and Element.currentDir,2023-11-09T09:38:55Z,jakearchibald
1803477221,whatwg/dom,"@annevk, thank you. I enhanced the problem description. What do you think?",https://github.com/whatwg/dom/issues/1233#issuecomment-1803477221,https://github.com/whatwg/dom/issues/1233,Selecting Events with Style,2023-11-09T09:36:38Z,AdamSobieski
1803390386,WICG/webcomponents,Sorry if it is a dumb question but why dom parts (templating) proposal is only intended for client o,https://github.com/WICG/webcomponents/issues/1035#issuecomment-1803390386,https://github.com/WICG/webcomponents/issues/1035,DOM parts use outside of <template> seems unlikely,2023-11-09T08:47:23Z,otabek-git
1803318930,whatwg/html,I actually agree with the concerns raised by @GijsK regarding CSP at: https://groups.google.com/a/mo,https://github.com/whatwg/html/issues/9625#issuecomment-1803318930,https://github.com/whatwg/html/issues/9625,[Proposal] Invoker Buttons - allowing popover/dialog and more to be invoked without JS,2023-11-09T07:53:46Z,nt1m
1802932567,whatwg/webidl,"> Does this mean adding data properties to `TypeError` instances created by `fetch()`?  Yep, that'",https://github.com/whatwg/webidl/issues/1374#issuecomment-1802932567,https://github.com/whatwg/webidl/issues/1374,Allowing throwing an exception with a specific message,2023-11-08T23:58:09Z,domenic
