id,repo,body,url,issue_url,issue_title,created_at,user
2405880728,w3c/pointerevents,"Oops, this is the wrong repo :-)",https://github.com/w3c/pointerevents/issues/523#issuecomment-2405880728,https://github.com/w3c/pointerevents/issues/523,[css-env-1] Maximum safe area inset values to allow sliding bottom bar,2024-10-10T19:28:46Z,flackr
2405872931,mozilla/standards-positions,"Does the recent change of Element Capture, to only work on ""restrictable"" tracks provided by getView",https://github.com/mozilla/standards-positions/issues/857#issuecomment-2405872931,https://github.com/mozilla/standards-positions/issues/857,Element Capture,2024-10-10T19:23:30Z,eladalon1983
2405850964,w3c/pointerevents,"> It doesn't seem fine. Since one can't detect whether handwriting is supported or not, part of the ",https://github.com/w3c/pointerevents/issues/516#issuecomment-2405850964,https://github.com/w3c/pointerevents/issues/516,[touch actions] handwriting manipulation type to distinguish panning,2024-10-10T19:10:39Z,flackr
2405838038,w3c/pointerevents,"It doesn't seem fine. Since one can't detect whether handwriting is supported or not, part of the pa",https://github.com/w3c/pointerevents/issues/516#issuecomment-2405838038,https://github.com/w3c/pointerevents/issues/516,[touch actions] handwriting manipulation type to distinguish panning,2024-10-10T19:02:47Z,smaug----
2405831372,w3c/pointerevents,Dropping this here for interest/context https://www.youtube.com/watch?v=5nELac-Wgo0,https://github.com/w3c/pointerevents/issues/516#issuecomment-2405831372,https://github.com/w3c/pointerevents/issues/516,[touch actions] handwriting manipulation type to distinguish panning,2024-10-10T18:58:36Z,patrickhlauke
2405502296,whatwg/html,"FWIW, during TPAC the [Screen Capture Community Group](https://www.w3.org/groups/cg/sccg/) also expl",https://github.com/whatwg/html/issues/10519#issuecomment-2405502296,https://github.com/whatwg/html/issues/10519,Proposal: Element 'sensitive' attribute,2024-10-10T15:58:01Z,xhwang-chromium
2405189188,whatwg/html,WebKit (Gnome Web 46) behaves differently for - https://web.mit.edu/bzbarsky/www/testcases/security,https://github.com/whatwg/html/issues/4651#issuecomment-2405189188,https://github.com/whatwg/html/issues/4651,CSP integration for javascript: URLs seems to be broken,2024-10-10T14:04:19Z,mbrodesser-Igalia
2405163377,whatwg/html,https://searchfox.org/mozilla-central/search?q=&path=%2Fhtml%2Fbrowsers%2Fbrowsing-the-web%2Fnavigat,https://github.com/whatwg/html/issues/4651#issuecomment-2405163377,https://github.com/whatwg/html/issues/4651,CSP integration for javascript: URLs seems to be broken,2024-10-10T13:54:08Z,mbrodesser-Igalia
2404991346,whatwg/html,> This requires checking WebKit/Safari's current behavior though {see [4](#user-content-fn-4-9a9b4e3,https://github.com/whatwg/html/issues/4651#issuecomment-2404991346,https://github.com/whatwg/html/issues/4651,CSP integration for javascript: URLs seems to be broken,2024-10-10T12:45:15Z,mbrodesser-Igalia
2404952292,webkit/standards-positions,I just used these events to create a swipeable calendar: https://fosstodon.org/@jpzwarte/11328310404,https://github.com/WebKit/standards-positions/issues/333#issuecomment-2404952292,https://github.com/WebKit/standards-positions/issues/333,Snap Events,2024-10-10T12:26:28Z,jpzwarte
2404931837,whatwg/html,> So one plausible path to interop and greater security here is: >  >     1. Navigations should sn,https://github.com/whatwg/html/issues/4651#issuecomment-2404931837,https://github.com/whatwg/html/issues/4651,CSP integration for javascript: URLs seems to be broken,2024-10-10T12:16:16Z,mbrodesser-Igalia
2404927488,w3ctag/design-reviews,FYI https://github.com/WICG/shared-storage/pull/176 is our latest change to `selectURL`. It allows f,https://github.com/w3ctag/design-reviews/issues/747#issuecomment-2404927488,https://github.com/w3ctag/design-reviews/issues/747,Shared Storage API,2024-10-10T12:14:12Z,jkarlin
2404873244,whatwg/html,Is one possibility to ship :open and not :closed initially? Making :closed match things that can nev,https://github.com/whatwg/html/pull/10126#issuecomment-2404873244,https://github.com/whatwg/html/pull/10126,Add the :open and :closed pseudo-selectors,2024-10-10T11:46:50Z,lukewarlow
2404847557,mozilla/standards-positions,Per https://github.com/whatwg/html/issues/10310#issuecomment-2189178702 the web compat situation nee,https://github.com/mozilla/standards-positions/issues/1086#issuecomment-2404847557,https://github.com/mozilla/standards-positions/issues/1086,Relax `<select>` parser,2024-10-10T11:33:43Z,zcorpan
2404509672,whatwg/html,I think it's worth investigating if it's possible to change this so that standard properties on `doc,https://github.com/whatwg/html/issues/10687#issuecomment-2404509672,https://github.com/whatwg/html/issues/10687,Prevent currentScript from being overridden on document via name='',2024-10-10T08:58:15Z,zcorpan
2404231379,w3ctag/design-reviews,Thank you for resolving this review.  If an implementation wants to deactivate sticky activation t,https://github.com/w3ctag/design-reviews/issues/971#issuecomment-2404231379,https://github.com/w3ctag/design-reviews/issues/971,Vibration API,2024-10-10T07:09:05Z,anssiko
2403707448,whatwg/html,This standard does not cover the navigator.share() API. I think you want https://github.com/w3c/web-,https://github.com/whatwg/html/issues/10690#issuecomment-2403707448,https://github.com/whatwg/html/issues/10690,Add EPUB file type support to Web Share API aka navigator.share(),2024-10-10T01:17:11Z,domenic
2403705270,whatwg/html,Thanks all. I think that's explicit support from 2/3 implementations and some level of implicit agre,https://github.com/whatwg/html/issues/10659#issuecomment-2403705270,https://github.com/whatwg/html/issues/10659,Consider throwing for showModal() and showPopover() in non-fully-active documents,2024-10-10T01:16:16Z,domenic
2403636375,whatwg/html,"Tagged, thanks.",https://github.com/whatwg/html/issues/10666#issuecomment-2403636375,https://github.com/whatwg/html/issues/10666,Upcoming WHATNOT meeting on 2024-10-10,2024-10-09T23:54:51Z,past
2403608819,webkit/standards-positions,"> @lgarron it has been added to WebKit, but hasn't made it to Safari yet. >  > [WebKit/WebKit#3440",https://github.com/WebKit/standards-positions/issues/373#issuecomment-2403608819,https://github.com/WebKit/standards-positions/issues/373,WebAuthn JSON serialization,2024-10-09T23:20:45Z,lgarron
2403549065,w3ctag/design-reviews,"Hello.  > Why do you see rel=opener as the right approach, rather than by keying on target=<anythi",https://github.com/w3ctag/design-reviews/issues/979#issuecomment-2403549065,https://github.com/w3ctag/design-reviews/issues/979,Early design review: Future browsing context group dependency hint,2024-10-09T22:41:25Z,kjmcnee
2403473059,w3ctag/design-reviews,"Hi @DavMila - just a quick question: you've indicated ""CSS working group"" as where this work is bein",https://github.com/w3ctag/design-reviews/issues/994#issuecomment-2403473059,https://github.com/w3ctag/design-reviews/issues/994,Spec review for Animation.progress,2024-10-09T21:37:18Z,torgo
2403466577,w3ctag/design-reviews,We feel as this is a core competency for the working group and with our brief review we don't see an,https://github.com/w3ctag/design-reviews/issues/993#issuecomment-2403466577,https://github.com/w3ctag/design-reviews/issues/993,TAG Review for CSS Values & Units Level 5,2024-10-09T21:32:20Z,torgo
2403446447,w3ctag/design-reviews,"That use cases suggests that maybe there is a state that exists between sticky and transient.  That ",https://github.com/w3ctag/design-reviews/issues/971#issuecomment-2403446447,https://github.com/w3ctag/design-reviews/issues/971,Vibration API,2024-10-09T21:18:23Z,martinthomson
2403426353,webkit/standards-positions,"@lgarron it has been added to WebKit, but hasn't made it to Safari yet.  https://github.com/WebKit",https://github.com/WebKit/standards-positions/issues/373#issuecomment-2403426353,https://github.com/WebKit/standards-positions/issues/373,WebAuthn JSON serialization,2024-10-09T21:04:14Z,timcappalli
2403393227,whatwg/dom,"I ran into a performance issue today where I have 100 cards in a grid, and each card mounts a webcom",https://github.com/whatwg/dom/issues/910#issuecomment-2403393227,https://github.com/whatwg/dom/issues/910,Should there be a declarative version of adoptedStyleSheets?,2024-10-09T20:42:54Z,patrick-mcdougle
2403372362,whatwg/html,"Very good example. To put in other terms, it sounds like the   ...\<q>\<RLI>...\</q>...\<span>...\",https://github.com/whatwg/html/issues/10251#issuecomment-2403372362,https://github.com/whatwg/html/issues/10251,Improve handling of malformed unicode bidi control characters,2024-10-09T20:29:17Z,macchiati
2403342075,webkit/standards-positions,"> I don't think this needs a standards position... it's already in the spec, which theoretically mea",https://github.com/WebKit/standards-positions/issues/373#issuecomment-2403342075,https://github.com/WebKit/standards-positions/issues/373,WebAuthn JSON serialization,2024-10-09T20:10:24Z,lgarron
2403312877,w3c/pointerevents,If a developer specifies `touch-action: handwriting;` they have specified (through omission) that pa,https://github.com/w3c/pointerevents/issues/516#issuecomment-2403312877,https://github.com/w3c/pointerevents/issues/516,[touch actions] handwriting manipulation type to distinguish panning,2024-10-09T19:52:06Z,flackr
2403303987,w3c/pointerevents,I think I'm not fine addressing those issues later. At least we need to consider what all issues the,https://github.com/w3c/pointerevents/issues/516#issuecomment-2403303987,https://github.com/w3c/pointerevents/issues/516,[touch actions] handwriting manipulation type to distinguish panning,2024-10-09T19:46:24Z,smaug----
2403266428,w3c/pointerevents,> For this proposal the goal would be to enable developers to specify whether scrolling and/or handw,https://github.com/w3c/pointerevents/issues/516#issuecomment-2403266428,https://github.com/w3c/pointerevents/issues/516,[touch actions] handwriting manipulation type to distinguish panning,2024-10-09T19:22:53Z,mustaqahmed
2403261974,whatwg/html,"Interestingly, I ran into this problem this morning. I'm working on a presentation about bidi.   M",https://github.com/whatwg/html/issues/10251#issuecomment-2403261974,https://github.com/whatwg/html/issues/10251,Improve handling of malformed unicode bidi control characters,2024-10-09T19:20:14Z,aphillips
2402834889,whatwg/html,"This sounds reasonable, and likely to be web compatible, at least to me. It seems very corner-case t",https://github.com/whatwg/html/issues/10659#issuecomment-2402834889,https://github.com/whatwg/html/issues/10659,Consider throwing for showModal() and showPopover() in non-fully-active documents,2024-10-09T16:53:34Z,mfreed7
2402716618,whatwg/html,> The name of this method is a little bit confusing: >  > ``` > unsigned long caretPositionFromPo,https://github.com/whatwg/html/issues/10677#issuecomment-2402716618,https://github.com/whatwg/html/issues/10677,Canvas TextMetrics additions for editing and text styling,2024-10-09T15:54:55Z,schenney-chromium
2402711098,w3c/pointerevents,"I think we should special case click in the spec. We can't change the behavior. And worth to add a ",https://github.com/w3c/pointerevents/issues/513#issuecomment-2402711098,https://github.com/w3c/pointerevents/issues/513,Ambiguity of the value of the `button` property for the `click` event,2024-10-09T15:52:23Z,smaug----
2402673011,whatwg/html,"To back up @karlt and @zcorpan, not firing an `""error""` event on `HTMLMediaElement` is intentional; ",https://github.com/whatwg/html/issues/8757#issuecomment-2402673011,https://github.com/whatwg/html/issues/8757,MediaError not acccessible for a video element if using it with source elements,2024-10-09T15:35:13Z,jernoble
2402631188,w3c/pointerevents,https://w3c.github.io/uievents/#handle-native-mouse-move-id has some of this defined in an algorithm,https://github.com/w3c/pointerevents/issues/519#issuecomment-2402631188,https://github.com/w3c/pointerevents/issues/519,[PointerEvent algorithms] Order of boundary events,2024-10-09T15:17:11Z,smaug----
2402589427,w3c/pointerevents,Both Chrome and Firefox show zeroes for `click.button` and `click.buttons`.,https://github.com/w3c/pointerevents/issues/513#issuecomment-2402589427,https://github.com/w3c/pointerevents/issues/513,Ambiguity of the value of the `button` property for the `click` event,2024-10-09T15:00:51Z,mustaqahmed
2402572037,w3c/pointerevents,"Thanks for the catch!  The ""since last event"" part was added way before `click` was a PointerEvent!!",https://github.com/w3c/pointerevents/issues/513#issuecomment-2402572037,https://github.com/w3c/pointerevents/issues/513,Ambiguity of the value of the `button` property for the `click` event,2024-10-09T14:54:10Z,mustaqahmed
2402434680,whatwg/html,"> Blocklisting only currentScript name would help with this one particular case.  Yes, that is rig",https://github.com/whatwg/html/issues/10687#issuecomment-2402434680,https://github.com/whatwg/html/issues/10687,Prevent currentScript from being overridden on document via name='',2024-10-09T14:00:32Z,juj
2402374809,whatwg/dom,Looks like the algorithms in DOM could almost handle this. Need to be careful with MutationRecords.,https://github.com/whatwg/dom/issues/1313#issuecomment-2402374809,https://github.com/whatwg/dom/issues/1313,Methods on ChildNode and ParentNode that take `(Node or DOMString)... nodes` should not use an intermediate DocumentFragment,2024-10-09T13:37:20Z,smaug----
2402346423,whatwg/html,"Blocklisting only currentScript name would help with this one particular case. But if sites let one ",https://github.com/whatwg/html/issues/10687#issuecomment-2402346423,https://github.com/whatwg/html/issues/10687,Prevent currentScript from being overridden on document via name='',2024-10-09T13:26:00Z,smaug----
2402012910,whatwg/html,Thanks @juj for taking this on! The named getter algorithm for `Document` objects is defined here (`,https://github.com/whatwg/html/issues/10687#issuecomment-2402012910,https://github.com/whatwg/html/issues/10687,Prevent currentScript from being overridden on document via name='',2024-10-09T11:04:56Z,annevk
2401867400,whatwg/webidl,@domenic: I think a difference with [CrossOriginIsolated] is that conceptually only two APIs fall in,https://github.com/whatwg/webidl/issues/1440#issuecomment-2401867400,https://github.com/whatwg/webidl/issues/1440,Consider adding an `[InjectionMitigated]` extended attribute.,2024-10-09T09:54:39Z,camillelamy
2401861066,whatwg/html,@karlt is correct.  An `error` attribute on `HTMLSourceElement` would be more consistent. Though `,https://github.com/whatwg/html/issues/8757#issuecomment-2401861066,https://github.com/whatwg/html/issues/8757,MediaError not acccessible for a video element if using it with source elements,2024-10-09T09:51:38Z,zcorpan
2401852791,whatwg/html,Filed implementation bugs at - Chrome: https://issues.chromium.org/issues/372269621 - Firefox: htt,https://github.com/whatwg/html/issues/10687#issuecomment-2401852791,https://github.com/whatwg/html/issues/10687,Prevent currentScript from being overridden on document via name='',2024-10-09T09:47:41Z,juj
2401796851,whatwg/html,If information about the source load failure were exposed on the media element then information woul,https://github.com/whatwg/html/issues/8757#issuecomment-2401796851,https://github.com/whatwg/html/issues/8757,MediaError not acccessible for a video element if using it with source elements,2024-10-09T09:21:31Z,karlt
2401790737,whatwg/html,I tried to search where in the HTML spec the connection of DOM element `name='foo'` -> `document.foo,https://github.com/whatwg/html/issues/10687#issuecomment-2401790737,https://github.com/whatwg/html/issues/10687,Prevent currentScript from being overridden on document via name='',2024-10-09T09:18:47Z,juj
2401787906,whatwg/html,"Happy to continue TPAC discussion on whatwg/dom#1255, specifically around focusin/focusout/selection",https://github.com/whatwg/html/issues/10666#issuecomment-2401787906,https://github.com/whatwg/html/issues/10666,Upcoming WHATNOT meeting on 2024-10-10,2024-10-09T09:17:29Z,noamr
2401777696,whatwg/html,"I have a little bit of experience for creating WPT tests from the interaction we had before. To get ",https://github.com/whatwg/html/issues/10687#issuecomment-2401777696,https://github.com/whatwg/html/issues/10687,Prevent currentScript from being overridden on document via name='',2024-10-09T09:13:14Z,juj
2401648429,whatwg/html,cc @whatwg/media,https://github.com/whatwg/html/issues/8757#issuecomment-2401648429,https://github.com/whatwg/html/issues/8757,MediaError not acccessible for a video element if using it with source elements,2024-10-09T08:14:36Z,annevk
2401642585,whatwg/html,Browsers are correctly following the spec AFAICS if they do not set the `error` attribute for `MEDIA,https://github.com/whatwg/html/issues/8757#issuecomment-2401642585,https://github.com/whatwg/html/issues/8757,MediaError not acccessible for a video element if using it with source elements,2024-10-09T08:11:52Z,karlt
2401615775,w3ctag/design-reviews,Thanks for your careful review of this API! To quickly answer the question while you're breakout-tin,https://github.com/w3ctag/design-reviews/issues/971#issuecomment-2401615775,https://github.com/w3ctag/design-reviews/issues/971,Vibration API,2024-10-09T07:59:33Z,anssiko
2401578625,w3ctag/design-reviews,"Hi @anssiko, thanks for being so proactive about engagement here.  The TAG looked at this in break",https://github.com/w3ctag/design-reviews/issues/971#issuecomment-2401578625,https://github.com/w3ctag/design-reviews/issues/971,Vibration API,2024-10-09T07:43:24Z,martinthomson
2401527323,w3ctag/design-reviews,"Hi @eladalon1983, we discussed this review in our call today - just checking if you have any feedbac",https://github.com/w3ctag/design-reviews/issues/954#issuecomment-2401527323,https://github.com/w3ctag/design-reviews/issues/954,Element Capture,2024-10-09T07:18:04Z,matatk
2401074134,whatwg/html,Sorry for not pointing that out. It's https://wicg.github.io/document-picture-in-picture/#close-any-,https://github.com/whatwg/html/pull/10682#issuecomment-2401074134,https://github.com/whatwg/html/pull/10682,Fix window.close() always doing nothing,2024-10-09T01:06:49Z,domenic
2401008308,whatwg/html,"What does `TextCluster` really represent? Is `TextMetrics` the right place to clusterize the text? ",https://github.com/whatwg/html/issues/10677#issuecomment-2401008308,https://github.com/whatwg/html/issues/10677,Canvas TextMetrics additions for editing and text styling,2024-10-08T23:55:19Z,shallawa
2400948937,mozilla/standards-positions,I don't doubt the utility of this-I use it myself. I'm just saying this needs spec work/discussion.,https://github.com/mozilla/standards-positions/issues/777#issuecomment-2400948937,https://github.com/mozilla/standards-positions/issues/777,The `overlay` CSS property,2024-10-08T22:47:48Z,birtles
2400943661,w3ctag/design-reviews,"Hi @kjmcnee, we were discussing this and we're not following the reasoning.  Why do you see rel=op",https://github.com/w3ctag/design-reviews/issues/979#issuecomment-2400943661,https://github.com/w3ctag/design-reviews/issues/979,Early design review: Future browsing context group dependency hint,2024-10-08T22:42:26Z,martinthomson
2400930490,webkit/standards-positions,"Thanks for your feedback, Keith!  We'll think about how adding a version number might work.  I d",https://github.com/WebKit/standards-positions/issues/172#issuecomment-2400930490,https://github.com/WebKit/standards-positions/issues/172,Explicit compile hints,2024-10-08T22:30:03Z,marjakh
2400913693,whatwg/html,"> I suppose that essentially argues for making `:closed` match all elements, or at least all element",https://github.com/whatwg/html/pull/10126#issuecomment-2400913693,https://github.com/whatwg/html/pull/10126,Add the :open and :closed pseudo-selectors,2024-10-08T22:15:02Z,josepharhar
2400838373,whatwg/html,"> I fail to see how this could work. As per your previous point, authors would also need to define a",https://github.com/whatwg/html/issues/10677#issuecomment-2400838373,https://github.com/whatwg/html/issues/10677,Canvas TextMetrics additions for editing and text styling,2024-10-08T21:18:13Z,AndresRPerez12
2400754843,whatwg/html,"The changes look good to me, and I also hope that testing on other implementations works out as the ",https://github.com/whatwg/html/pull/10683#issuecomment-2400754843,https://github.com/whatwg/html/pull/10683,Change URL parsing sequence for window open steps,2024-10-08T20:24:32Z,shannonbooth
2400410665,whatwg/webidl,> @shhnjk: I think this is what the proposal in [w3c/webappsec-csp#665](https://github.com/w3c/webap,https://github.com/whatwg/webidl/issues/1440#issuecomment-2400410665,https://github.com/whatwg/webidl/issues/1440,Consider adding an `[InjectionMitigated]` extended attribute.,2024-10-08T17:12:42Z,shhnjk
2400376138,whatwg/html,"> I would be interested in attending to discuss and seek feedback on #10617.  Thanks, I added it t",https://github.com/whatwg/html/issues/10666#issuecomment-2400376138,https://github.com/whatwg/html/issues/10666,Upcoming WHATNOT meeting on 2024-10-10,2024-10-08T16:53:24Z,past
2400357654,whatwg/html,> If there is someone willing to take this on I suppose we could label this issue agenda+ to gauge i,https://github.com/whatwg/html/issues/10687#issuecomment-2400357654,https://github.com/whatwg/html/issues/10687,Prevent currentScript from being overridden on document via name='',2024-10-08T16:43:40Z,WebReflection
2400230473,whatwg/html,@domenic or @annevk - it seems to me that the we're making progress on the questions about exposure;,https://github.com/whatwg/html/pull/9893#issuecomment-2400230473,https://github.com/whatwg/html/pull/9893,"JavaScript ShadowRealm proposal integration ",2024-10-08T15:54:55Z,Ms2ger
2400229629,mozilla/standards-positions,"> For what it's worth, I think it's weird that this can only be set by transitions and not animation",https://github.com/mozilla/standards-positions/issues/777#issuecomment-2400229629,https://github.com/mozilla/standards-positions/issues/777,The `overlay` CSS property,2024-10-08T15:54:33Z,itpropro
2400219004,mozilla/standards-positions,"Hey @smaug---- I might be misinterpretting your feedback, apologies if so.  Let me try one more ti",https://github.com/mozilla/standards-positions/issues/1069#issuecomment-2400219004,https://github.com/mozilla/standards-positions/issues/1069,PerformanceEventTiming.interactionId,2024-10-08T15:49:48Z,mmocny
2400150069,whatwg/html,I'm not opposed to someone driving this. https://whatwg.org/working-mode#changes describes the rough,https://github.com/whatwg/html/issues/10687#issuecomment-2400150069,https://github.com/whatwg/html/issues/10687,Prevent currentScript from being overridden on document via name='',2024-10-08T15:20:25Z,annevk
2400008988,whatwg/html,> it's not really an API that universal scripts ought to be using anyway  Looking at [MDN: documen,https://github.com/whatwg/html/issues/10687#issuecomment-2400008988,https://github.com/whatwg/html/issues/10687,Prevent currentScript from being overridden on document via name='',2024-10-08T14:26:12Z,juj
2400007511,whatwg/html,> It seems this intends to cover some of the same use cases as #10650. >  > cc @whatwg/canvas @khu,https://github.com/whatwg/html/issues/10677#issuecomment-2400007511,https://github.com/whatwg/html/issues/10677,Canvas TextMetrics additions for editing and text styling,2024-10-08T14:25:40Z,schenney-chromium
2399971814,whatwg/html,"on a side note, we also run WASM in workers where `document` makes no sense (we provide it) and `cur",https://github.com/whatwg/html/issues/10687#issuecomment-2399971814,https://github.com/whatwg/html/issues/10687,Prevent currentScript from being overridden on document via name='',2024-10-08T14:11:51Z,WebReflection
2399959583,whatwg/html,> it's not really an API that universal scripts ought to be using anyway  we use it a lot in PyScr,https://github.com/whatwg/html/issues/10687#issuecomment-2399959583,https://github.com/whatwg/html/issues/10687,Prevent currentScript from being overridden on document via name='',2024-10-08T14:07:05Z,WebReflection
2399757658,whatwg/html,`document.currentScript` presents in the outputs of widely used bundle tools like: [webpack](https:/,https://github.com/whatwg/html/issues/10687#issuecomment-2399757658,https://github.com/whatwg/html/issues/10687,Prevent currentScript from being overridden on document via name='',2024-10-08T12:49:30Z,Sec-ant
2399746515,whatwg/html,Thanks! I verified these changes work over on Ladybird,https://github.com/whatwg/html/pull/10682#issuecomment-2399746515,https://github.com/whatwg/html/pull/10682,Fix window.close() always doing nothing,2024-10-08T12:44:48Z,trflynn89
2399698732,whatwg/html,Thanks @yoavweiss for all your hard work on this COOP improvement!,https://github.com/whatwg/html/pull/10394#issuecomment-2399698732,https://github.com/whatwg/html/pull/10394,Add a `noopener-allow-popups` value to COOP,2024-10-08T12:23:38Z,annevk
2399662446,whatwg/html,"`currentScript` currently only works for classic scripts (i.e., not for module scripts) and only as ",https://github.com/whatwg/html/issues/10687#issuecomment-2399662446,https://github.com/whatwg/html/issues/10687,Prevent currentScript from being overridden on document via name='',2024-10-08T12:06:34Z,annevk
2399601220,whatwg/html,"Given that this ticket #2212 discusses an opt-out, a general solution and is in the process of gathe",https://github.com/whatwg/html/issues/2212#issuecomment-2399601220,https://github.com/whatwg/html/issues/2212,Provide an opt-out for inputs overriding form DOM API,2024-10-08T11:36:20Z,juj
