id,repo,body,url,issue_url,issue_title,created_at,user
2443305606,whatwg/html,"Looks right to me, thanks!",https://github.com/whatwg/html/pull/10729#issuecomment-2443305606,https://github.com/whatwg/html/pull/10729,Fix final step of insertAdjacentHTML(),2024-10-29T06:16:59Z,nielsdos
2442913611,w3ctag/design-reviews,i don’t really have a strong preference for either api as long as something moves forward that helps,https://github.com/w3ctag/design-reviews/issues/961#issuecomment-2442913611,https://github.com/w3ctag/design-reviews/issues/961,Reference Target,2024-10-29T00:18:36Z,michaelwarren1106
2442895230,whatwg/html,I put up a spec PR containing the proposal detailed above: https://github.com/whatwg/html/pull/10728,https://github.com/whatwg/html/issues/10675#issuecomment-2442895230,https://github.com/whatwg/html/issues/10675,The declarative popover invoker feature needs to automatically establish an implicit anchor element,2024-10-29T00:01:01Z,mfreed7
2442895188,whatwg/html,I put up a spec PR containing the proposal detailed above:  https://github.com/whatwg/html/pull/1072,https://github.com/whatwg/html/issues/10442#issuecomment-2442895188,https://github.com/whatwg/html/issues/10442,Add an imperative way to set popover invoker relationships,2024-10-29T00:00:58Z,mfreed7
2442886932,whatwg/html,Meeting notes are published [here](https://lists.w3.org/Archives/Public/www-style/2024Oct/0012.html),https://github.com/whatwg/html/issues/10702#issuecomment-2442886932,https://github.com/whatwg/html/issues/10702,Meeting 9 for joint OpenUI-WHATWG/HTML-CSSWG task force on styleable form controls,2024-10-28T23:52:28Z,past
2442776484,mozilla/standards-positions,"> > 1. How is a video conferencing website expected to use PEPC? >  > re: 1. I agree, there are a ",https://github.com/mozilla/standards-positions/issues/908#issuecomment-2442776484,https://github.com/mozilla/standards-positions/issues/908,Page Embedded Permission Control,2024-10-28T22:15:59Z,jan-ivar
2442590348,whatwg/dom,I want to parse an HTML string in a service worker to multiple [editable and syncable JSON documents,https://github.com/whatwg/dom/issues/1217#issuecomment-2442590348,https://github.com/whatwg/dom/issues/1217,Proposal: DOM APIs in web workers?,2024-10-28T20:43:36Z,thesmartwon
2442576951,whatwg/html,"@domenic @bakkot I created PRs for [Web IDL](https://github.com/whatwg/webidl/pull/1447), [Streams](",https://github.com/whatwg/html/pull/10635#issuecomment-2442576951,https://github.com/whatwg/html/pull/10635,Editorial: replace uses of the Type macro with is-a tests,2024-10-28T20:37:37Z,michaelficarra
2442508526,whatwg/html,"We discussed this in openui and resolved on not observing/responding to mutations within the option ",https://github.com/whatwg/html/issues/10520#issuecomment-2442508526,https://github.com/whatwg/html/issues/10520,Timing of cloning for the `<selectedoption>` element,2024-10-28T20:02:06Z,josepharhar
2442495312,whatwg/html,> Disallowing custom elements inside `<select>` is a limiting case in point.  Custom elements seem,https://github.com/whatwg/html/issues/10317#issuecomment-2442495312,https://github.com/whatwg/html/issues/10317,Content model and 'what' to render for stylable `<select>` elements,2024-10-28T19:54:58Z,josepharhar
2442312817,w3ctag/design-reviews,"We looked at this again today in a breakout. While we recognize that the use case is prevalent, we s",https://github.com/w3ctag/design-reviews/issues/938#issuecomment-2442312817,https://github.com/w3ctag/design-reviews/issues/938,View Transition Classes,2024-10-28T18:21:51Z,LeaVerou
2442152753,whatwg/html,"For same url navigation from address bar, Safari seems to behave differently from Firefox.  Safari",https://github.com/whatwg/html/issues/10597#issuecomment-2442152753,https://github.com/whatwg/html/issues/10597,Adjust Scroll Restoration Behavior for Reloads,2024-10-28T17:05:36Z,LiangTheDev
2442129238,whatwg/html,"Q2: Yes, if we are to align with the behavior of clicking an `<a href=...>`,  then if there is no fr",https://github.com/whatwg/html/issues/10597#issuecomment-2442129238,https://github.com/whatwg/html/issues/10597,Adjust Scroll Restoration Behavior for Reloads,2024-10-28T16:55:16Z,skobes-chromium
2441991427,whatwg/html,"A work-around, if you're able to re-jigger your use-case to use Streams instead of MessagePort  ``",https://github.com/whatwg/html/issues/1766#issuecomment-2441991427,https://github.com/whatwg/html/issues/1766,Add onclose event to MessagePort,2024-10-28T15:59:07Z,James-E-A
2441646292,whatwg/html,The navigation to `javascript:` URLs is presumably covered by https://html.spec.whatwg.org/#the-java,https://github.com/whatwg/html/issues/10727#issuecomment-2441646292,https://github.com/whatwg/html/issues/10727,Trusted Types: `HTMLHyperlinkElementUtils`'s `href` should contain `TrustedScriptURL`,2024-10-28T13:49:50Z,mbrodesser-Igalia
2441317294,whatwg/html,For the anchor element (`<a>`) there are tests at [^1]. Tests for the `<area>` element need to be ad,https://github.com/whatwg/html/issues/10727#issuecomment-2441317294,https://github.com/whatwg/html/issues/10727,Trusted Types: `HTMLHyperlinkElementUtils`'s `href` should contain `TrustedScriptURL`,2024-10-28T11:25:36Z,mbrodesser-Igalia
2441150674,mozilla/standards-positions,> > to prevent sneaky domains returning customized lists to get around the size limits. >  > Not s,https://github.com/mozilla/standards-positions/issues/1052#issuecomment-2441150674,https://github.com/mozilla/standards-positions/issues/1052,WebAuthn related origins,2024-10-28T10:13:43Z,emlun
2440791874,whatwg/html,> That's the type for writing HTML documents which isn't really relevant to user agents.  Which ty,https://github.com/whatwg/html/issues/10719#issuecomment-2440791874,https://github.com/whatwg/html/issues/10719,Should `<object data=...>` support `javascript:` URLs?,2024-10-28T07:54:51Z,mbrodesser-Igalia
2440590675,whatwg/html,Yeah some of these do appear to have been switched around inadvertently.,https://github.com/whatwg/html/issues/10725#issuecomment-2440590675,https://github.com/whatwg/html/issues/10725,Insert position from insertAdjacentHTML seems wrong,2024-10-28T05:33:09Z,lukewarlow
2440500569,whatwg/html,@lukewarlow would you be able to take a look at this?,https://github.com/whatwg/html/issues/10725#issuecomment-2440500569,https://github.com/whatwg/html/issues/10725,Insert position from insertAdjacentHTML seems wrong,2024-10-28T03:59:21Z,domenic
2440496620,whatwg/html,"This is just a proposed change to conformance requirements, as I understand it, so I'll re-tag a bit",https://github.com/whatwg/html/issues/10722#issuecomment-2440496620,https://github.com/whatwg/html/issues/10722,Allow any element to be the child of a custom element (parser weirdness permitting),2024-10-28T03:54:20Z,domenic
2440356539,whatwg/html,@annevk I gave writing tests a go [here](https://github.com/web-platform-tests/wpt/pull/48833) pleas,https://github.com/whatwg/html/pull/10705#issuecomment-2440356539,https://github.com/whatwg/html/pull/10705,Guard showModal() and showPopover() with fully active checks,2024-10-28T02:04:10Z,maraisr
2439996561,whatwg/html,There is a note in [show the picker](https://html.spec.whatwg.org/multipage/input.html#show-the-pick,https://github.com/whatwg/html/issues/10724#issuecomment-2439996561,https://github.com/whatwg/html/issues/10724,Should `<input type=file>` fire a change event when the user chooses the same file twice?,2024-10-27T12:29:15Z,Kaiido
2439740807,whatwg/webidl,Also reproduced with a local bikeshed install from pip.  ``` (vevn) andrew@Andrew-Workstation:~/w,https://github.com/whatwg/webidl/issues/1444#issuecomment-2439740807,https://github.com/whatwg/webidl/issues/1444,`make` fails due to missing ECMAScript references,2024-10-26T21:24:40Z,ADKaster
2439416370,mozilla/standards-positions,Is there currently any simple way how can I provide the password manager via web API?  Expected be,https://github.com/mozilla/standards-positions/issues/842#issuecomment-2439416370,https://github.com/mozilla/standards-positions/issues/842,Credential Management API - PasswordCredential,2024-10-26T07:34:32Z,mvorisek
2439070319,whatwg/html,@domenic I've added links. I'm not sure if you want undefined/null linked. I linked things in the wa,https://github.com/whatwg/html/pull/10635#issuecomment-2439070319,https://github.com/whatwg/html/pull/10635,Editorial: replace uses of the Type macro with is-a tests,2024-10-26T00:14:26Z,michaelficarra
2438998101,w3ctag/design-reviews,I have updated the explainer; PTAL.,https://github.com/w3ctag/design-reviews/issues/954#issuecomment-2438998101,https://github.com/w3ctag/design-reviews/issues/954,Element Capture,2024-10-25T22:53:14Z,eladalon1983
2438746628,whatwg/dom,Chrome/Edge can keep the id stable after it moves in the DOM. This is a new thing that we do.,https://github.com/whatwg/dom/issues/1255#issuecomment-2438746628,https://github.com/whatwg/dom/issues/1255,Atomic move operation for element reparenting & reordering,2024-10-25T20:34:17Z,aleventhal
2438705796,whatwg/dom,"Bikeshedding and Implementation details aside, the specifics of how `moveBefore()` gets implemented ",https://github.com/whatwg/dom/issues/1255#issuecomment-2438705796,https://github.com/whatwg/dom/issues/1255,Atomic move operation for element reparenting & reordering,2024-10-25T20:08:33Z,cookiecrook
2438609821,whatwg/html,"I'm in support of @skobes-chromium's proposal as well, and I'm reviewing the change for it at https:",https://github.com/whatwg/html/issues/10597#issuecomment-2438609821,https://github.com/whatwg/html/issues/10597,Adjust Scroll Restoration Behavior for Reloads,2024-10-25T19:04:56Z,csreis
2438605247,w3ctag/design-reviews,I've updated the [explainer](https://github.com/DavMila/explainer-animation.progress) to address som,https://github.com/w3ctag/design-reviews/issues/994#issuecomment-2438605247,https://github.com/w3ctag/design-reviews/issues/994,Spec review for Animation.progress,2024-10-25T19:01:45Z,DavMila
2438417124,w3ctag/design-reviews,I'm not sure I see a practical difference between the two contexts that you're referencing @LeaVerou,https://github.com/w3ctag/design-reviews/issues/961#issuecomment-2438417124,https://github.com/w3ctag/design-reviews/issues/961,Reference Target,2024-10-25T17:34:51Z,Westbrook
2438338881,w3ctag/design-reviews,"@Westbrook As a meta comment, I think we may have run into the classic big WC use case bifurcation, ",https://github.com/w3ctag/design-reviews/issues/961#issuecomment-2438338881,https://github.com/w3ctag/design-reviews/issues/961,Reference Target,2024-10-25T16:57:16Z,LeaVerou
2438285929,mozilla/standards-positions,"Thanks for marking this positive!  > There is some great progress with regard to figuring out the ",https://github.com/mozilla/standards-positions/issues/965#issuecomment-2438285929,https://github.com/mozilla/standards-positions/issues/965,popover=hint,2024-10-25T16:37:28Z,mfreed7
2438277791,w3ctag/design-reviews,@jyasskin @dandclark  > @LeaVerou Check out how `aria-labelledby` and `aria-describedby` can say th,https://github.com/w3ctag/design-reviews/issues/961#issuecomment-2438277791,https://github.com/w3ctag/design-reviews/issues/961,Reference Target,2024-10-25T16:33:44Z,LeaVerou
2438199293,whatwg/html,"Nice, and yes.",https://github.com/whatwg/html/pull/10705#issuecomment-2438199293,https://github.com/whatwg/html/pull/10705,Guard showModal() and showPopover() with fully active checks,2024-10-25T15:58:08Z,annevk
2437991692,w3ctag/design-reviews,"## As for DX  In that the current DX for associating things accessibly is ID references: ```html",https://github.com/w3ctag/design-reviews/issues/961#issuecomment-2437991692,https://github.com/w3ctag/design-reviews/issues/961,Reference Target,2024-10-25T14:35:57Z,Westbrook
2437982246,w3ctag/design-reviews,"@LeaVerou Check out how `aria-labelledby` and `aria-describedby` can say that an element is labeled ",https://github.com/w3ctag/design-reviews/issues/961#issuecomment-2437982246,https://github.com/w3ctag/design-reviews/issues/961,Reference Target,2024-10-25T14:32:00Z,jyasskin
2437866916,whatwg/html,> Why can't you use the `click` event on the submit button? >  > Someone claimed this does not wor,https://github.com/whatwg/html/issues/10694#issuecomment-2437866916,https://github.com/whatwg/html/issues/10694,Add an event for when a user attempts to submit,2024-10-25T14:02:29Z,KonnorRogers
2437847192,whatwg/html,It doesn't work when calling `.submit()` or `.requestSubmit()`.,https://github.com/whatwg/html/issues/10694#issuecomment-2437847192,https://github.com/whatwg/html/issues/10694,Add an event for when a user attempts to submit,2024-10-25T13:54:58Z,keithamus
2437820350,whatwg/html,"Here some code to hide the browser scrollbar, it was taken from [Bootstrap](https://github.com/twbs/",https://github.com/whatwg/html/issues/7732#issuecomment-2437820350,https://github.com/whatwg/html/issues/7732,Consider preventing page scroll when modal dialog is visible,2024-10-25T13:43:23Z,tkrotoff
2437815148,w3ctag/design-reviews,"What @jyasskin said, except I was envisioning the common pattern of using a boolean attribute for th",https://github.com/w3ctag/design-reviews/issues/961#issuecomment-2437815148,https://github.com/w3ctag/design-reviews/issues/961,Reference Target,2024-10-25T13:41:10Z,LeaVerou
2437810890,mozilla/standards-positions,"So #390 set the position to ""worth prototyping"", #660 set it to ""defer"", and #680 renamed ""worth pro",https://github.com/mozilla/standards-positions/issues/23#issuecomment-2437810890,https://github.com/mozilla/standards-positions/issues/23,Payment Handler API,2024-10-25T13:39:22Z,zcorpan
2437688046,whatwg/html,"I've never done that before, but I can try. On wpt yeah?",https://github.com/whatwg/html/pull/10705#issuecomment-2437688046,https://github.com/whatwg/html/pull/10705,Guard showModal() and showPopover() with fully active checks,2024-10-25T12:47:17Z,maraisr
2437633298,whatwg/notifications,"Now I'm confused, I was assuming that the new intention is to reuse the existing tabs, and the full ",https://github.com/whatwg/notifications/pull/213#issuecomment-2437633298,https://github.com/whatwg/notifications/pull/213,Allow notifications and actions to specify a navigable URL,2024-10-25T12:18:27Z,saschanaz
2437542970,whatwg/html,"Not sure if this is useful information, but to add our usecase:  We have an extension ([yomitan](h",https://github.com/whatwg/html/pull/10172#issuecomment-2437542970,https://github.com/whatwg/html/pull/10172,Remove SVG Blob support from createImageBitmap,2024-10-25T11:28:36Z,djahandarie
2437527973,whatwg/html,Why can't you use the `click` event on the submit button?  Someone claimed this does not work duri,https://github.com/whatwg/html/issues/10694#issuecomment-2437527973,https://github.com/whatwg/html/issues/10694,Add an event for when a user attempts to submit,2024-10-25T11:19:56Z,annevk
2437512854,whatwg/dom,"1. ",https://github.com/whatwg/dom/issues/58#issuecomment-2437512854,https://github.com/whatwg/dom/issues/58,Document.defaultCharset,2024-10-25T11:11:27Z,Srabonchowdhury383
2437512186,whatwg/dom,82173. ![IMG_20241009_020856_202](https://github.com/user-attachments/assets/3612a46b-3a57-4f80-89b,https://github.com/whatwg/dom/issues/58#issuecomment-2437512186,https://github.com/whatwg/dom/issues/58,Document.defaultCharset,2024-10-25T11:11:03Z,Srabonchowdhury383
2437474850,whatwg/html,Please and thank you! 😊 Perhaps you're also interested in writing the tests?,https://github.com/whatwg/html/pull/10705#issuecomment-2437474850,https://github.com/whatwg/html/pull/10705,Guard showModal() and showPopover() with fully active checks,2024-10-25T10:49:46Z,annevk
2437467940,whatwg/html,Safari and Chrome accomplish 2 when `p` is an actual promise and I don't think they have custom bind,https://github.com/whatwg/html/issues/10721#issuecomment-2437467940,https://github.com/whatwg/html/issues/10721,Promises: Clarify the type of the objects in HostPromiseRejectionTracker and associated sets,2024-10-25T10:46:15Z,annevk
2437441368,whatwg/html,@annevk Can I take a stab at the WebKit change for this?,https://github.com/whatwg/html/pull/10705#issuecomment-2437441368,https://github.com/whatwg/html/pull/10705,Guard showModal() and showPopover() with fully active checks,2024-10-25T10:31:02Z,maraisr
2437276336,whatwg/html,@RubenAhlhaus your solution works great for me! The only change I'd make is `window.scrollTo({ left:,https://github.com/whatwg/html/issues/7732#issuecomment-2437276336,https://github.com/whatwg/html/issues/7732,Consider preventing page scroll when modal dialog is visible,2024-10-25T09:06:20Z,stefanfisk
2437070086,w3ctag/design-reviews,"Yes I’d be happy to also work on `<details>`. ",https://github.com/w3ctag/design-reviews/issues/1005#issuecomment-2437070086,https://github.com/w3ctag/design-reviews/issues/1005,Dispatching Toggle Events for Dialog open/close,2024-10-25T07:16:45Z,keithamus
2437022169,whatwg/html,"> It's maintained, but nobody is actively working on new functionality. I suspect a couple dedicated",https://github.com/whatwg/html/issues/2177#issuecomment-2437022169,https://github.com/whatwg/html/issues/2177,Setting headers for EventSource,2024-10-25T06:53:45Z,sagarpanchal
2435559576,webkit/standards-positions,Friendly ping! :),https://github.com/WebKit/standards-positions/issues/381#issuecomment-2435559576,https://github.com/WebKit/standards-positions/issues/381,Multiple Import Maps,2024-10-24T15:07:15Z,yoavweiss
2432523372,whatwg/html,"@mtrootyy then even more reason the spec needs to be updated to mention this, and that work be done ",https://github.com/whatwg/html/pull/10586#issuecomment-2432523372,https://github.com/whatwg/html/pull/10586,Update content model for customizable select,2024-10-23T14:58:30Z,scottaohara
2430021512,whatwg/html,"> WebKit is opposed to this. I don't think this should land.  Thanks for the feedback, @annevk. Wi",https://github.com/whatwg/html/pull/9778#issuecomment-2430021512,https://github.com/whatwg/html/pull/9778,Add popover=hint,2024-10-22T18:58:08Z,mfreed7
2429483359,w3ctag/design-reviews,> We think this seems like a generally useful feature  That's great to hear!  > The explainer sh,https://github.com/w3ctag/design-reviews/issues/962#issuecomment-2429483359,https://github.com/w3ctag/design-reviews/issues/962,Captured Surface Control,2024-10-22T14:42:31Z,eladalon1983
2303281920,webkit/standards-positions,"@cdumez, who might be good to look at this? ",https://github.com/WebKit/standards-positions/issues/381#issuecomment-2303281920,https://github.com/WebKit/standards-positions/issues/381,Multiple Import Maps,2024-08-21T23:19:51Z,marcoscaceres