id,repo,body,url,issue_url,issue_title,created_at,user
1397743103,whatwg/html,"@annevk, any objections to the recent event changes? I've incorporated all of the points in Domenic'",https://github.com/whatwg/html/pull/8717#issuecomment-1397743103,https://github.com/whatwg/html/pull/8717,"Reland ""Add popover attribute""",2023-01-19T23:32:08Z,josepharhar
1397739112,whatwg/html,Let's have the discussion about `DOMParser` on this issue: https://github.com/whatwg/html/issues/875,https://github.com/whatwg/html/pull/5465#issuecomment-1397739112,https://github.com/whatwg/html/pull/5465,Add declarative Shadow DOM features,2023-01-19T23:25:45Z,mfreed7
1397688683,webkit/standards-positions,"@clshortfuse thanks for sharing ... and all I can think about your story, is that if anything change",https://github.com/WebKit/standards-positions/issues/97#issuecomment-1397688683,https://github.com/WebKit/standards-positions/issues/97,Customized built-in elements,2023-01-19T22:19:56Z,WebReflection
1397502491,webkit/standards-positions,I started on working on a Web Components based rewrite of a UI framework. It's accessibility-focused,https://github.com/WebKit/standards-positions/issues/97#issuecomment-1397502491,https://github.com/WebKit/standards-positions/issues/97,Customized built-in elements,2023-01-19T19:36:16Z,clshortfuse
1397474782,whatwg/html,"Oh, btw `file.download()` would not make so much since in server side. think it would be better with",https://github.com/whatwg/html/issues/4148#issuecomment-1397474782,https://github.com/whatwg/html/issues/4148,Download API,2023-01-19T19:09:33Z,jimmywarting
1397423778,whatwg/html,> My rationale for excluding it is: > * `DOMParser` is not an API we plan to extend. It has been ke,https://github.com/whatwg/html/pull/5465#issuecomment-1397423778,https://github.com/whatwg/html/pull/5465,Add declarative Shadow DOM features,2023-01-19T18:25:04Z,mfreed7
1397359561,whatwg/html,"Hi,  I would like to gather feedback on some API design decisions. This proposal is currently sugg",https://github.com/whatwg/html/issues/8476#issuecomment-1397359561,https://github.com/whatwg/html/issues/8476,Canvas2D layers with filter support,2023-01-19T17:36:42Z,graveljp
1397350427,whatwg/html,"Before I ship this in chromium, I just want to make certain I have the right behavior. The desired ",https://github.com/whatwg/html/issues/2988#issuecomment-1397350427,https://github.com/whatwg/html/issues/2988,What's the status of <option label> in cross-browser age?,2023-01-19T17:29:52Z,josepharhar
1397322185,whatwg/html,Such an API would absolutely need to have a way to download streams or download files in pieces. Cur,https://github.com/whatwg/html/issues/4148#issuecomment-1397322185,https://github.com/whatwg/html/issues/4148,Download API,2023-01-19T17:10:00Z,Zipdox2
1397307852,mozilla/standards-positions,"Agree with worth-prototyping, put into bugzilla",https://github.com/mozilla/standards-positions/issues/665#issuecomment-1397307852,https://github.com/mozilla/standards-positions/issues/665,Request for position : HTTP response status code in Resource Timing,2023-01-19T17:00:27Z,bdekoz
1397303792,mozilla/standards-positions,"this seems worth prototyping, I've added a Moz tracker bug here: https://bugzilla.mozilla.org/show_b",https://github.com/mozilla/standards-positions/issues/722#issuecomment-1397303792,https://github.com/mozilla/standards-positions/issues/722,Request for position: Interim response timings in resource timing,2023-01-19T16:57:55Z,bdekoz
1397282468,webkit/standards-positions,@annevk - Thanks for reviewing the updated proposal. We have some clarifications:  -   Regarding s,https://github.com/WebKit/standards-positions/issues/93#issuecomment-1397282468,https://github.com/WebKit/standards-positions/issues/93,Request for position: First-Party Sets,2023-01-19T16:42:33Z,krgovind
1397033173,mozilla/standards-positions,"@fippo I understand what you are trying to achieve, but I believe the ecosystem effects of allowing ",https://github.com/mozilla/standards-positions/issues/728#issuecomment-1397033173,https://github.com/mozilla/standards-positions/issues/728,Request for Position: programatically disabling hardware encoding/decoding in WebRTC,2023-01-19T14:06:02Z,ekr
1396875585,whatwg/html,"> However, they say ""Don't check precise timing while we wait for more concrete spec edits."" Gentle ",https://github.com/whatwg/html/pull/8392#issuecomment-1396875585,https://github.com/whatwg/html/pull/8392,Make the focus fixup rule more explicit,2023-01-19T12:07:34Z,emilio
1396823103,whatwg/html,lol look at me filing things in the wrong repo,https://github.com/whatwg/html/issues/8749#issuecomment-1396823103,https://github.com/whatwg/html/issues/8749,[css-view-transitions-1] Interaction with Safari's back/forward previews,2023-01-19T11:21:45Z,jakearchibald
1396709872,whatwg/html,I'd love to see this re-open if possible. There are quite some use cases where this can be useful: s,https://github.com/whatwg/html/issues/5488#issuecomment-1396709872,https://github.com/whatwg/html/issues/5488,"<input type=""time""> : Time vs. duration",2023-01-19T09:57:22Z,muan
1396686627,whatwg/html,> Webref needs to recognize HTML's unusual pattern of having id-less <dfn>s inside of id-having <hN>,https://github.com/whatwg/html/issues/8743#issuecomment-1396686627,https://github.com/whatwg/html/issues/8743,Meta: should dfns in headings be viewed as exported definitions?,2023-01-19T09:36:32Z,tidoust
1396650337,whatwg/html,"Well, one year later @ultimaweapon.  I stumble over the same problem with OIDC. It would be a simp",https://github.com/whatwg/html/issues/2177#issuecomment-1396650337,https://github.com/whatwg/html/issues/2177,Setting headers for EventSource,2023-01-19T09:07:26Z,tomuench
1396618174,whatwg/dom,I don't really understand the objection to making it bi-state. Just modifying https://html.spec.what,https://github.com/whatwg/dom/pull/892#issuecomment-1396618174,https://github.com/whatwg/dom/pull/892,Add declarative Shadow DOM features,2023-01-19T08:38:30Z,domenic
1396606865,whatwg/html,My rationale for excluding it is:  * `DOMParser` is not an API we plan to extend. It has been kept,https://github.com/whatwg/html/pull/5465#issuecomment-1396606865,https://github.com/whatwg/html/pull/5465,Add declarative Shadow DOM features,2023-01-19T08:28:05Z,annevk
1396606286,whatwg/html,"Got it. So the issue is that although the initial response's response tainting mode is ""basic"", step",https://github.com/whatwg/html/issues/8740#issuecomment-1396606286,https://github.com/whatwg/html/issues/8740,Navigation algorithm consults filtered header list,2023-01-19T08:27:28Z,domenic
1396590651,whatwg/dom,"Looking at the Preview version the ""domintro"" for `attachShadow()` also needs updating.",https://github.com/whatwg/dom/pull/892#issuecomment-1396590651,https://github.com/whatwg/dom/pull/892,Add declarative Shadow DOM features,2023-01-19T08:12:51Z,annevk
1396582114,whatwg/dom,"But that is essentially a blocklist approach, which is not sound. It's fine for implementations to c",https://github.com/whatwg/dom/pull/892#issuecomment-1396582114,https://github.com/whatwg/dom/pull/892,Add declarative Shadow DOM features,2023-01-19T08:05:12Z,annevk
1396575252,whatwg/html,"No, if we change Fetch to return a basic filtered response for navigations HTML doesn't need any cha",https://github.com/whatwg/html/issues/8740#issuecomment-1396575252,https://github.com/whatwg/html/issues/8740,Navigation algorithm consults filtered header list,2023-01-19T07:59:42Z,annevk
1396569014,whatwg/html,"@mfreed7 interesting, depending on folks obfuscating invocation it might not be easier to grep, but ",https://github.com/whatwg/html/issues/8627#issuecomment-1396569014,https://github.com/whatwg/html/issues/8627,setHTML() and declarative shadow roots,2023-01-19T07:54:16Z,annevk
1396558074,mozilla/standards-positions,"@nils-ohlmeier this is a static method so not per-sender (mostly in order not to create another bit ",https://github.com/mozilla/standards-positions/issues/728#issuecomment-1396558074,https://github.com/mozilla/standards-positions/issues/728,Request for Position: programatically disabling hardware encoding/decoding in WebRTC,2023-01-19T07:42:10Z,fippo
1396477603,WICG/webcomponents,"@justinfagnani , why to limit the `adopted-styles` concept to the CSS only? It is a ""library"" conce",https://github.com/WICG/webcomponents/issues/939#issuecomment-1396477603,https://github.com/WICG/webcomponents/issues/939,Declarative CSS Module Scripts,2023-01-19T06:00:52Z,sashafirsov
1396476342,mozilla/standards-positions,"@sefeng211 @valenting  pinging for any updates or comments  ",https://github.com/mozilla/standards-positions/issues/703#issuecomment-1396476342,https://github.com/mozilla/standards-positions/issues/703,PendingBeacon API,2023-01-19T05:58:37Z,mingyc
1396476027,webkit/standards-positions,@othermaciej pinging for any updates or comments,https://github.com/WebKit/standards-positions/issues/85#issuecomment-1396476027,https://github.com/WebKit/standards-positions/issues/85,PendingBeacon API,2023-01-19T05:58:01Z,mingyc
1396434420,whatwg/html,"> I have tests already reviewed in https://phabricator.services.mozilla.com/D156219  However, they",https://github.com/whatwg/html/pull/8392#issuecomment-1396434420,https://github.com/whatwg/html/pull/8392,Make the focus fixup rule more explicit,2023-01-19T04:45:13Z,domenic
1396428939,whatwg/html,"I'll assign myself for now, and try my best to look at it this week and see what I think.",https://github.com/whatwg/html/issues/8725#issuecomment-1396428939,https://github.com/whatwg/html/issues/8725,document state's history policy container does not seem to be correctly updated,2023-01-19T04:36:13Z,domfarolino
1396424347,mozilla/standards-positions,Thanks @a-sully for asking and @jesup for the response.,https://github.com/mozilla/standards-positions/issues/732#issuecomment-1396424347,https://github.com/mozilla/standards-positions/issues/732,Request for Position: FileSystemFileHandle.move() for local files,2023-01-19T04:26:57Z,martinthomson
1396391008,mozilla/standards-positions,"While we're supportive of move() for files (and directories) in OPFS, we're negative on manipulation",https://github.com/mozilla/standards-positions/issues/732#issuecomment-1396391008,https://github.com/mozilla/standards-positions/issues/732,Request for Position: FileSystemFileHandle.move() for local files,2023-01-19T03:22:53Z,jesup
1396380574,whatwg/html,"> You're free to keep insisting that but the likely outcome of that will be that this PR will never ",https://github.com/whatwg/html/pull/5465#issuecomment-1396380574,https://github.com/whatwg/html/pull/5465,Add declarative Shadow DOM features,2023-01-19T03:03:20Z,mfreed7
1396352059,WICG/webcomponents,Unfortunately I found a case where my approach doesn't work...  It uses a constructor that re-ente,https://github.com/WICG/webcomponents/issues/969#issuecomment-1396352059,https://github.com/WICG/webcomponents/issues/969,[scoped-registries] Interaction with HTML element's overridden constructor steps,2023-01-19T02:10:25Z,xiaochengh
1396336726,whatwg/html,"> > > Either way, there is no consensus to add a new option to `parseFromString`. As such, it shoul",https://github.com/whatwg/html/pull/5465#issuecomment-1396336726,https://github.com/whatwg/html/pull/5465,Add declarative Shadow DOM features,2023-01-19T01:47:50Z,rniwa
1396327637,whatwg/html,"> Sorry, that's OP. I should have said first reply.  Ahh ok. Sorry.  > * We need an opt-in for d",https://github.com/whatwg/html/issues/8627#issuecomment-1396327637,https://github.com/whatwg/html/issues/8627,setHTML() and declarative shadow roots,2023-01-19T01:32:34Z,mfreed7
1396295796,whatwg/html,> > > @mfreed7 can you please remove the `parseFromString()` changes from this PR so we can get this,https://github.com/whatwg/html/pull/5465#issuecomment-1396295796,https://github.com/whatwg/html/pull/5465,Add declarative Shadow DOM features,2023-01-19T00:45:11Z,mfreed7
1396281006,whatwg/dom,> I put your build fixes in #1143 and rebased this. I also pushed a fixup commit to correct a number,https://github.com/whatwg/dom/pull/892#issuecomment-1396281006,https://github.com/whatwg/dom/pull/892,Add declarative Shadow DOM features,2023-01-19T00:28:27Z,mfreed7
1396207478,whatwg/html,"It's such a small workaround though, that it doesn't really feel like I'm doing something wrong. Not",https://github.com/whatwg/html/issues/8743#issuecomment-1396207478,https://github.com/whatwg/html/issues/8743,Meta: should dfns in headings be viewed as exported definitions?,2023-01-18T23:02:14Z,kainino0x
1396136712,whatwg/html,"It's always an option to work around (e.g., using manual `<a>`) instead of improve the spec ecosyste",https://github.com/whatwg/html/issues/8743#issuecomment-1396136712,https://github.com/whatwg/html/issues/8743,Meta: should dfns in headings be viewed as exported definitions?,2023-01-18T21:53:15Z,domenic
1396125101,whatwg/html,"The spec source: ```html   <h4><dfn>Serializable objects</dfn></h4> ```  is getting translated ",https://github.com/whatwg/html/issues/8743#issuecomment-1396125101,https://github.com/whatwg/html/issues/8743,Meta: should dfns in headings be viewed as exported definitions?,2023-01-18T21:41:44Z,kainino0x
1396121899,whatwg/html,"> > ""get in touch and ask for a data-export attribute if you think you need to reference one of thes",https://github.com/whatwg/html/issues/8743#issuecomment-1396121899,https://github.com/whatwg/html/issues/8743,Meta: should dfns in headings be viewed as exported definitions?,2023-01-18T21:38:42Z,kainino0x
1396056886,whatwg/html,"So is that the ""audit and reach in"" option from my list?",https://github.com/whatwg/html/issues/8740#issuecomment-1396056886,https://github.com/whatwg/html/issues/8740,Navigation algorithm consults filtered header list,2023-01-18T20:39:30Z,domenic
1387674596,webkit/standards-positions,"To reiterate from the WebKit issue, as someone making a library ([instant.page](https://instant.page",https://github.com/WebKit/standards-positions/issues/114#issuecomment-1387674596,https://github.com/WebKit/standards-positions/issues/114,Request for position: aligning on <link rel=prefetch>,2023-01-18T19:44:56Z,dieulot
1387666541,w3ctag/design-reviews,cc @cfredric @helenyc,https://github.com/w3ctag/design-reviews/issues/807#issuecomment-1387666541,https://github.com/w3ctag/design-reviews/issues/807,Spec review for Storage Access API,2023-01-18T19:40:27Z,johannhof
1387514643,whatwg/html,"Ok, I just pushed a patch for the following: 1. rename PopoverToggleEvent to ToggleEvent 2. stores",https://github.com/whatwg/html/pull/8717#issuecomment-1387514643,https://github.com/whatwg/html/pull/8717,"Reland ""Add popover attribute""",2023-01-18T18:22:00Z,josepharhar
1387487220,whatwg/html,> > @mfreed7 can you please remove the `parseFromString()` changes from this PR so we can get this s,https://github.com/whatwg/html/pull/5465#issuecomment-1387487220,https://github.com/whatwg/html/pull/5465,Add declarative Shadow DOM features,2023-01-18T18:00:23Z,rniwa
1387483788,mozilla/standards-positions,It has not been resolved.,https://github.com/mozilla/standards-positions/issues/472#issuecomment-1387483788,https://github.com/mozilla/standards-positions/issues/472,CSS @scope,2023-01-18T17:57:10Z,mirisuzanne
1387480981,whatwg/html,> @mfreed7 can you please remove the `parseFromString()` changes from this PR so we can get this sta,https://github.com/whatwg/html/pull/5465#issuecomment-1387480981,https://github.com/whatwg/html/pull/5465,Add declarative Shadow DOM features,2023-01-18T17:54:32Z,mfreed7
1387466529,whatwg/html,"OK, I think it is plumbed through the iFrame case now and I don't think I missed any of the linkages",https://github.com/whatwg/html/pull/8470#issuecomment-1387466529,https://github.com/whatwg/html/pull/8470,Add the Priority Hints changes to the html spec,2023-01-18T17:41:43Z,pmeenan
1387441635,mozilla/standards-positions,"> Reviewing a bit the spec, I'm confused about the second monkey-patch [here](https://drafts.csswg.o",https://github.com/mozilla/standards-positions/issues/677#issuecomment-1387441635,https://github.com/mozilla/standards-positions/issues/677,Request for Position: View Transitions API,2023-01-18T17:20:10Z,khushalsagar
1387368425,whatwg/html,"I think using a basic filtered response for navigation responses is the way to go.  ---  Assume ",https://github.com/whatwg/html/issues/8740#issuecomment-1387368425,https://github.com/whatwg/html/issues/8740,Navigation algorithm consults filtered header list,2023-01-18T16:41:29Z,annevk
1387351728,whatwg/html,"Whoa, I commented on this thread five years ago. Let see those cheat sheets.",https://github.com/whatwg/html/issues/3296#issuecomment-1387351728,https://github.com/whatwg/html/issues/3296,"@whatwg, can you produce a html cheetsheet?",2023-01-18T16:29:13Z,512jay
1387323983,whatwg/html,Youenn reminded me there's a good reason to standardize this. It ends up changing the request's cach,https://github.com/whatwg/html/issues/5222#issuecomment-1387323983,https://github.com/whatwg/html/issues/5222,"Should ""reload-triggered navigation"" be more strictly defined?",2023-01-18T16:10:24Z,annevk
1387249505,mozilla/standards-positions,"No indication of a conclusion in issue [6790](https://github.com/w3c/csswg-drafts/issues/6790). ",https://github.com/mozilla/standards-positions/issues/472#issuecomment-1387249505,https://github.com/mozilla/standards-positions/issues/472,CSS @scope,2023-01-18T15:24:28Z,lilles
1387146394,mozilla/standards-positions,"The spec only uses the ""list of available images"" if the `img` element has a non-empty `src` *and do",https://github.com/mozilla/standards-positions/issues/650#issuecomment-1387146394,https://github.com/mozilla/standards-positions/issues/650,Auto-sizes for lazy-loaded images in HTML,2023-01-18T14:17:43Z,zcorpan
1387120977,whatwg/html,"Glad that node removal observation will be worked on but I still think it's pretty weird that there ",https://github.com/whatwg/html/pull/8392#issuecomment-1387120977,https://github.com/whatwg/html/pull/8392,Make the focus fixup rule more explicit,2023-01-18T14:01:21Z,devongovett
1386930312,mozilla/standards-positions,"@mirisuzanne / @lilles / @andruud: Did the weak vs. strong proximity argument reach a conclusion in ",https://github.com/mozilla/standards-positions/issues/472#issuecomment-1386930312,https://github.com/mozilla/standards-positions/issues/472,CSS @scope,2023-01-18T11:51:50Z,emilio
1386926626,mozilla/standards-positions,"Yeah, I'm ok with the CSSWG resolution regarding syntax.  Reviewing a bit the spec, I'm confused a",https://github.com/mozilla/standards-positions/issues/677#issuecomment-1386926626,https://github.com/mozilla/standards-positions/issues/677,Request for Position: View Transitions API,2023-01-18T11:48:30Z,emilio
1386919077,mozilla/standards-positions,My main concern with this proposal is the behavior for lazy images that might or might not be in the,https://github.com/mozilla/standards-positions/issues/650#issuecomment-1386919077,https://github.com/mozilla/standards-positions/issues/650,Auto-sizes for lazy-loaded images in HTML,2023-01-18T11:41:57Z,emilio
1386894734,whatwg/html,I have tests already reviewed in https://phabricator.services.mozilla.com/D156219,https://github.com/whatwg/html/pull/8392#issuecomment-1386894734,https://github.com/whatwg/html/pull/8392,Make the focus fixup rule more explicit,2023-01-18T11:21:04Z,emilio
1386633948,whatwg/html,"> ""get in touch and ask for a data-export attribute if you think you need to reference one of these ",https://github.com/whatwg/html/issues/8743#issuecomment-1386633948,https://github.com/whatwg/html/issues/8743,Meta: should dfns in headings be viewed as exported definitions?,2023-01-18T08:00:12Z,domenic
1386590537,whatwg/html,"In the triage meeting at https://github.com/whatwg/html/issues/8446, we had agreement to move forwar",https://github.com/whatwg/html/pull/8392#issuecomment-1386590537,https://github.com/whatwg/html/pull/8392,Make the focus fixup rule more explicit,2023-01-18T07:12:30Z,domenic
1386525407,whatwg/html,"> @noamr, do you think there's anything left for this? Maybe only things that are tracked in other i",https://github.com/whatwg/html/issues/4224#issuecomment-1386525407,https://github.com/whatwg/html/issues/4224,`Link` header processing not defined,2023-01-18T05:50:40Z,noamr
1386518542,whatwg/html,"@noamr, do you think there's anything left for this? Maybe only things that are tracked in other iss",https://github.com/whatwg/html/issues/4224#issuecomment-1386518542,https://github.com/whatwg/html/issues/4224,`Link` header processing not defined,2023-01-18T05:40:41Z,domenic
1386518300,whatwg/html,Done in https://github.com/whatwg/html/commit/281f4365b7558e0b1e5e2877345501d75b7a910c.,https://github.com/whatwg/html/issues/7985#issuecomment-1386518300,https://github.com/whatwg/html/issues/7985,"Editorial: link ""Assert"" in all cases where it's used",2023-01-18T05:40:21Z,domenic
1386474607,whatwg/html,Riiiiight I understand now. In that case this is a bug in Edge for NOT firing beforeunload when mail,https://github.com/whatwg/html/issues/8724#issuecomment-1386474607,https://github.com/whatwg/html/issues/8724,Seeking clarity regarding potential mis-implemented behaviour in Chromium,2023-01-18T04:34:50Z,texonidas
1386415449,whatwg/html,"You're misunderstanding. When you are viewing a document with a `<a href=""tel:..."">` link, that is t",https://github.com/whatwg/html/issues/8724#issuecomment-1386415449,https://github.com/whatwg/html/issues/8724,Seeking clarity regarding potential mis-implemented behaviour in Chromium,2023-01-18T03:08:44Z,domenic
1386393880,whatwg/html,``` A navigable presents a [Document](https://html.spec.whatwg.org/#document) to the user via its [,https://github.com/whatwg/html/issues/8724#issuecomment-1386393880,https://github.com/whatwg/html/issues/8724,Seeking clarity regarding potential mis-implemented behaviour in Chromium,2023-01-18T02:42:36Z,texonidas
1386344947,whatwg/html,Filed https://github.com/whatwg/html/issues/8740 for the larger issue. I'll merge this now since it',https://github.com/whatwg/html/pull/8686#issuecomment-1386344947,https://github.com/whatwg/html/pull/8686,Fix COOP enforcement in redirects,2023-01-18T01:42:51Z,domenic
1386310975,whatwg/html,See https://html.spec.whatwg.org/#navigable for the definition of navigable; I don't think you're us,https://github.com/whatwg/html/issues/8724#issuecomment-1386310975,https://github.com/whatwg/html/issues/8724,Seeking clarity regarding potential mis-implemented behaviour in Chromium,2023-01-18T01:03:01Z,domenic
1386247834,whatwg/html,"Sorry to reopen this, but I'm unclear from that spec why a tel or mailto link would be classed as a ",https://github.com/whatwg/html/issues/8724#issuecomment-1386247834,https://github.com/whatwg/html/issues/8724,Seeking clarity regarding potential mis-implemented behaviour in Chromium,2023-01-17T23:45:02Z,texonidas
1386246102,w3ctag/design-reviews,"There is a shorthand, it's called `vertical-align`. I pointed this out in the comment earlier.",https://github.com/w3ctag/design-reviews/issues/801#issuecomment-1386246102,https://github.com/w3ctag/design-reviews/issues/801,baseline-source,2023-01-17T23:42:47Z,fantasai
1386178070,whatwg/html,> To recap a bit on what we discussed in that meeting (and got agreement on from the various attende,https://github.com/whatwg/html/pull/8717#issuecomment-1386178070,https://github.com/whatwg/html/pull/8717,"Reland ""Add popover attribute""",2023-01-17T22:37:40Z,mfreed7
1385995399,whatwg/html,"Yes, this is fundamental change. So if it happens, we should at least move the stage back to stage-2",https://github.com/whatwg/html/issues/7233#issuecomment-1385995399,https://github.com/whatwg/html/issues/7233,CSS and JSON module scripts and CSP,2023-01-17T20:15:00Z,Constellation
1385993336,whatwg/html,"Hey, I have complete Cheat Sheet on HTML . So, could you please replay as soon as possible. ",https://github.com/whatwg/html/issues/3296#issuecomment-1385993336,https://github.com/whatwg/html/issues/3296,"@whatwg, can you produce a html cheetsheet?",2023-01-17T20:13:01Z,iammanishk
1385934634,whatwg/html,"To chime in another use case here...   The SyncAccessHandle API is a fast, POSIX-like file primiti",https://github.com/whatwg/html/issues/8362#issuecomment-1385934634,https://github.com/whatwg/html/issues/8362,Allow workers & shared workers to be created within a service worker,2023-01-17T19:24:23Z,a-sully
1385869754,whatwg/html,"> There are still a couple of unresolved comment threads. It appears this also needs rebasing.  I ",https://github.com/whatwg/html/pull/8199#issuecomment-1385869754,https://github.com/whatwg/html/pull/8199,Implement dialog initial focus proposal,2023-01-17T18:43:22Z,josepharhar
1385863621,whatwg/html,It also seems to undermine the use case that went to stages 2 and 3 - so the entire feature may need,https://github.com/whatwg/html/issues/7233#issuecomment-1385863621,https://github.com/whatwg/html/issues/7233,CSS and JSON module scripts and CSP,2023-01-17T18:38:01Z,ljharb
1385852355,whatwg/html,I put this on the agenda to discuss more officially requesting TC39 changing the syntax as this chan,https://github.com/whatwg/html/issues/7233#issuecomment-1385852355,https://github.com/whatwg/html/issues/7233,CSS and JSON module scripts and CSP,2023-01-17T18:29:28Z,annevk
1385447603,WICG/webcomponents,"@rniwa Would that `<style>` be resolved synchronously? I just see the word ""module"" and think async,",https://github.com/WICG/webcomponents/issues/939#issuecomment-1385447603,https://github.com/WICG/webcomponents/issues/939,Declarative CSS Module Scripts,2023-01-17T13:46:06Z,matthewp
