id,repo,body,url,issue_url,issue_title,created_at,user
1877812758,w3c/pointerevents,This is ready for review now.,https://github.com/w3c/pointerevents/pull/494#issuecomment-1877812758,https://github.com/w3c/pointerevents/pull/494,Rewrite the dispatch mechanism of click-like events.,2024-01-04T21:55:18Z,mustaqahmed
1877740821,w3c/pointerevents,"Never mind, this is not ready for review: the main PR will rewrite this section.",https://github.com/w3c/pointerevents/pull/494#issuecomment-1877740821,https://github.com/w3c/pointerevents/pull/494,Rewrite the dispatch mechanism of click-like events.,2024-01-04T20:48:30Z,mustaqahmed
1877675480,w3c/clipboard-apis,"@evanstade Can we discuss your concerns in the next EditingWG call(01/11)? Wanted to make sure they ",https://github.com/w3c/clipboard-apis/issues/191#issuecomment-1877675480,https://github.com/w3c/clipboard-apis/issues/191,Read Blob data for the supported formats on-demand during getType.,2024-01-04T19:52:29Z,snianu
1877625074,w3c/pointerevents,ptal: simplifying the text that will be updated for #492.,https://github.com/w3c/pointerevents/pull/494#issuecomment-1877625074,https://github.com/w3c/pointerevents/pull/494,Rewrite the dispatch mechanism of click-like events.,2024-01-04T19:10:51Z,mustaqahmed
1877568150,webkit/standards-positions,"> It allows the sites to obtain camera images that are synchronized with WebXR's XRPoses. If a site ",https://github.com/WebKit/standards-positions/issues/37#issuecomment-1877568150,https://github.com/WebKit/standards-positions/issues/37,WebXR Raw Camera Access API,2024-01-04T18:26:58Z,josephrocca
1877434030,webkit/standards-positions,"I don't mind at all. That would be great for us, thank you!",https://github.com/WebKit/standards-positions/issues/294#issuecomment-1877434030,https://github.com/WebKit/standards-positions/issues/294,WebGPU: Render to slice of 3D texture,2024-01-04T16:49:11Z,mwyrzykowski
1877432635,webkit/standards-positions,Do you mind our referencing this comment instead of opening additional standards-positions in the fu,https://github.com/WebKit/standards-positions/issues/294#issuecomment-1877432635,https://github.com/WebKit/standards-positions/issues/294,WebGPU: Render to slice of 3D texture,2024-01-04T16:48:20Z,Kangz
1877411933,webkit/standards-positions,"I asked our web standards engineers and as long as this is being added to the v1 specification, then",https://github.com/WebKit/standards-positions/issues/294#issuecomment-1877411933,https://github.com/WebKit/standards-positions/issues/294,WebGPU: Render to slice of 3D texture,2024-01-04T16:37:32Z,mwyrzykowski
1876860193,whatwg/webidl,What's the latest status of this change?,https://github.com/whatwg/webidl/pull/841#issuecomment-1876860193,https://github.com/whatwg/webidl/pull/841,Added a definition of {{StringContext}} extended attribute.,2024-01-04T10:28:53Z,lukewarlow
1876854462,w3ctag/design-reviews,"To demonstrate how this doesn't expose new ancillary data, consider the following. You want to know",https://github.com/w3ctag/design-reviews/issues/911#issuecomment-1876854462,https://github.com/w3ctag/design-reviews/issues/911,Long Animation Frame API (LoAF),2024-01-04T10:24:48Z,noamr
1876808299,whatwg/html,"@kizu Thanks for the article, I wrote a Demo along your lines.  https://codepen.io/yisi/pen/jOJWLv",https://github.com/whatwg/html/issues/9776#issuecomment-1876808299,https://github.com/whatwg/html/issues/9776,popover=hint,2024-01-04T09:53:30Z,yisibl
1876693868,whatwg/html,"> Probably a few years late but it worked by turning the field type to text first then turn in back ",https://github.com/whatwg/html/issues/2358#issuecomment-1876693868,https://github.com/whatwg/html/issues/2358,A use case for cursor control for number inputs,2024-01-04T08:25:51Z,Tolluset
1876676041,whatwg/html,"_Right now_, in Chrome Canary, anchor positioning **can** target the range's thumb. I did write a br",https://github.com/whatwg/html/issues/9776#issuecomment-1876676041,https://github.com/whatwg/html/issues/9776,popover=hint,2024-01-04T08:07:39Z,kizu
1876657144,whatwg/html,"One very common scenario is the `<input type=range>` tooltip, where the current popover can only be ",https://github.com/whatwg/html/issues/9776#issuecomment-1876657144,https://github.com/whatwg/html/issues/9776,popover=hint,2024-01-04T07:53:35Z,yisibl
1876027817,whatwg/html,Vertical `<input type=range>` should behave similarly to vertical `<meter>` and `<progress` elements,https://github.com/whatwg/html/issues/4177#issuecomment-1876027817,https://github.com/whatwg/html/issues/4177,Rendering <input type=range> vertically,2024-01-03T22:01:16Z,dizhang168
1876018538,whatwg/html,"An update on the blink implementation (will ship soon): We are following what is suggested above by ",https://github.com/whatwg/html/issues/8413#issuecomment-1876018538,https://github.com/whatwg/html/issues/8413,"Clarify value direction for elements ""progress"" and ""meter"" with vertical writing mode",2024-01-03T21:52:09Z,dizhang168
1875796777,whatwg/html,I'd like to see what the spec says about cookies without an explicit expiration date. Are those cons,https://github.com/whatwg/html/issues/9935#issuecomment-1875796777,https://github.com/whatwg/html/issues/9935,Cookie API,2024-01-03T18:33:55Z,kettanaito
1875704717,whatwg/html,I think the cookie expires property **shouldnt** have a default value I'd leave it undefined. When c,https://github.com/whatwg/html/issues/9935#issuecomment-1875704717,https://github.com/whatwg/html/issues/9935,Cookie API,2024-01-03T17:15:49Z,marco-ippolito
1875691331,whatwg/html,What do you think about the default value of the `expires` property?   I believe that it must be s,https://github.com/whatwg/html/issues/9935#issuecomment-1875691331,https://github.com/whatwg/html/issues/9935,Cookie API,2024-01-03T17:05:52Z,kettanaito
1875689768,whatwg/html,"@marco-ippolito, one thing to consider is that spreading things in JavaScript isn't cheap on large d",https://github.com/whatwg/html/issues/9935#issuecomment-1875689768,https://github.com/whatwg/html/issues/9935,Cookie API,2024-01-03T17:04:45Z,kettanaito
1875504582,WICG/webcomponents,Here's a live document with the agenda: https://docs.google.com/document/d/1NRI_Ns8dw33LA21Fj2F21J-a,https://github.com/WICG/webcomponents/issues/1031#issuecomment-1875504582,https://github.com/WICG/webcomponents/issues/1031,Quarterly Face to Face Scheduling,2024-01-03T14:56:58Z,Westbrook
1875198116,whatwg/html,I think `from` and `serialize` should use spread notation as argoument. On second thought returning,https://github.com/whatwg/html/issues/9935#issuecomment-1875198116,https://github.com/whatwg/html/issues/9935,Cookie API,2024-01-03T11:09:37Z,marco-ippolito
1875182542,whatwg/html,> This seems reasonable to me.  Thanks @zcorpan! Doe https://github.com/mozilla/standards-position,https://github.com/whatwg/html/issues/10034#issuecomment-1875182542,https://github.com/whatwg/html/issues/10034,Render-blocking scripts should also work for inline scripts,2024-01-03T10:57:11Z,noamr
1875163073,whatwg/html,This seems reasonable to me.,https://github.com/whatwg/html/issues/10034#issuecomment-1875163073,https://github.com/whatwg/html/issues/10034,Render-blocking scripts should also work for inline scripts,2024-01-03T10:41:49Z,zcorpan
1875158803,whatwg/html,I also believe that discussing `Cookie.from()` can be more productive if we also take into account t,https://github.com/whatwg/html/issues/9935#issuecomment-1875158803,https://github.com/whatwg/html/issues/9935,Cookie API,2024-01-03T10:38:31Z,kettanaito
1875149347,whatwg/html,"> Hm, I think giving the .from() method a dual signature would make it more ""difficult"" to work with",https://github.com/whatwg/html/issues/9935#issuecomment-1875149347,https://github.com/whatwg/html/issues/9935,Cookie API,2024-01-03T10:31:12Z,kettanaito
1875069897,whatwg/html,"   > Personally, I still feel like editing would be nicer. But fine. I just wanted to see what wa",https://github.com/whatwg/html/issues/3705#issuecomment-1875069897,https://github.com/whatwg/html/issues/3705,Split source file into sections,2024-01-03T09:29:13Z,alejsanc
1875054684,whatwg/html,> > [This issue should be reopened. Controlling changes with a single file is crazy.](https://github,https://github.com/whatwg/html/issues/10030#issuecomment-1875054684,https://github.com/whatwg/html/issues/10030,Is HTML stagnated?,2024-01-03T09:17:21Z,alejsanc
1875000021,mozilla/standards-positions,"cc @codehag ",https://github.com/mozilla/standards-positions/issues/945#issuecomment-1875000021,https://github.com/mozilla/standards-positions/issues/945,Observable,2024-01-03T08:27:12Z,zcorpan
1874950123,whatwg/html,"But not with an ancestor `<a href>`, right?",https://github.com/whatwg/html/issues/1568#issuecomment-1874950123,https://github.com/whatwg/html/issues/1568,'run authentic click activation steps' doesn't deal with the case when activation behavior changes during click event dispatch,2024-01-03T07:30:18Z,zcorpan
1874761588,whatwg/html,> Setting width/height or attempting to read the bitmap of a detached OffscreenCanvas are programmin,https://github.com/whatwg/html/issues/10026#issuecomment-1874761588,https://github.com/whatwg/html/issues/10026,Detached OffscreenCanvas is underspecified,2024-01-03T01:51:14Z,Kaiido
1874757471,whatwg/html,Another reason to add setting headers support is that it seems that for CORS-RFC1918 private network,https://github.com/whatwg/html/issues/2177#issuecomment-1874757471,https://github.com/whatwg/html/issues/2177,Setting headers for EventSource,2024-01-03T01:45:11Z,jschoch
1874695189,WICG/webcomponents,"It would be nice if a solution here also addressed https://github.com/WICG/webcomponents/issues/979",https://github.com/WICG/webcomponents/issues/809#issuecomment-1874695189,https://github.com/WICG/webcomponents/issues/809,Need a callback for when children changed or parser finished parsing children,2024-01-02T23:48:30Z,justinfagnani
1874690616,WICG/webcomponents,@Westbrook does [this comment](https://github.com/WICG/webcomponents/issues/1031#issuecomment-182220,https://github.com/WICG/webcomponents/issues/1031#issuecomment-1874690616,https://github.com/WICG/webcomponents/issues/1031,Quarterly Face to Face Scheduling,2024-01-02T23:41:26Z,justinfagnani
1874650608,w3c/editing,Tagging few people who would be interested in this discussion. @evanstade @inexorabletash  @sanketj,https://github.com/w3c/editing/issues/423#issuecomment-1874650608,https://github.com/w3c/editing/issues/423,Delayed clipboard rendering API shape.,2024-01-02T22:40:18Z,snianu
1874645356,WICG/webcomponents,So we're less than one week away from Jan 9th 3-5pm meeting. What's our agenda?,https://github.com/WICG/webcomponents/issues/1031#issuecomment-1874645356,https://github.com/WICG/webcomponents/issues/1031,Quarterly Face to Face Scheduling,2024-01-02T22:33:01Z,rniwa
1874637854,w3c/editing,"Even if OSes didn't support that, streaming from the content/renderer process to the process which w",https://github.com/w3c/editing/issues/423#issuecomment-1874637854,https://github.com/w3c/editing/issues/423,Delayed clipboard rendering API shape.,2024-01-02T22:24:50Z,smaug----
1874631496,w3ctag/design-reviews,"> #807  Is there some additional context or meaning to this reply.  Sorry if I'm misunderstanding,",https://github.com/w3ctag/design-reviews/issues/919#issuecomment-1874631496,https://github.com/w3ctag/design-reviews/issues/919,TAG spec review of Storage Access Heuristics,2024-01-02T22:16:45Z,wanderview
1874609449,w3c/editing,"> Right, that is why I'm confused if a `ReadableStream` would add any value to this API when it alre",https://github.com/w3c/editing/issues/423#issuecomment-1874609449,https://github.com/w3c/editing/issues/423,Delayed clipboard rendering API shape.,2024-01-02T21:51:09Z,saschanaz
1874607355,w3c/editing,"Using a stream could let implementations to optimize memory usage, as an example.",https://github.com/w3c/editing/issues/423#issuecomment-1874607355,https://github.com/w3c/editing/issues/423,Delayed clipboard rendering API shape.,2024-01-02T21:48:33Z,smaug----
1874601415,w3c/editing,"> One can convert blobs into streams and streams into blobs  Right, that is why I'm confused if a ",https://github.com/w3c/editing/issues/423#issuecomment-1874601415,https://github.com/w3c/editing/issues/423,Delayed clipboard rendering API shape.,2024-01-02T21:41:39Z,snianu
1874577386,whatwg/html,"> @marco-ippolito, I like your idea to make `Cookie.from()` return an Iterable. This can simplify wo",https://github.com/whatwg/html/issues/9935#issuecomment-1874577386,https://github.com/whatwg/html/issues/9935,Cookie API,2024-01-02T21:15:35Z,mkarajohn
1874560690,whatwg/html,"@marco-ippolito, I like your idea to make `Cookie.from()` return an Iterable. This can simplify work",https://github.com/whatwg/html/issues/9935#issuecomment-1874560690,https://github.com/whatwg/html/issues/9935,Cookie API,2024-01-02T21:02:15Z,kettanaito
1874518930,w3c/editing,>Can Blob APIs be used to stream data instead?  One can convert blobs into streams and streams int,https://github.com/w3c/editing/issues/423#issuecomment-1874518930,https://github.com/w3c/editing/issues/423,Delayed clipboard rendering API shape.,2024-01-02T20:35:30Z,saschanaz
1874480052,w3c/editing,"> Hmm, I was not fully understanding this issue back in the meeting, as my focus was on a different ",https://github.com/w3c/editing/issues/423#issuecomment-1874480052,https://github.com/w3c/editing/issues/423,Delayed clipboard rendering API shape.,2024-01-02T19:55:44Z,snianu
1874422343,whatwg/html,We've been discussing a similar issue with the [Alarms API](https://developer.mozilla.org/en-US/docs,https://github.com/whatwg/html/issues/6759#issuecomment-1874422343,https://github.com/whatwg/html/issues/6759,How should timers account for system sleep/suspend?,2024-01-02T18:59:03Z,dotproto
1874396229,whatwg/html,"A note on another use-case for this, being able to opt-out of a transition per navigation in script.",https://github.com/whatwg/html/issues/9702#issuecomment-1874396229,https://github.com/whatwg/html/issues/9702,[View Transition] Event on old Document to set transition state,2024-01-02T18:33:28Z,khushalsagar
1874373525,whatwg/html,"Setting width/height or attempting to read the bitmap of a detached OffscreenCanvas are programming ",https://github.com/whatwg/html/issues/10026#issuecomment-1874373525,https://github.com/whatwg/html/issues/10026,Detached OffscreenCanvas is underspecified,2024-01-02T18:11:43Z,junov
1874325150,whatwg/html,There are two test cases in [/html/semantics/forms/the-button-element.html](https://github.com/web-p,https://github.com/whatwg/html/issues/1568#issuecomment-1874325150,https://github.com/whatwg/html/issues/1568,'run authentic click activation steps' doesn't deal with the case when activation behavior changes during click event dispatch,2024-01-02T17:27:27Z,vinhill
1874264562,whatwg/html,<hr> elements are not typically supported or recommended within <select> elements. Using <hr> tags i,https://github.com/whatwg/html/issues/9960#issuecomment-1874264562,https://github.com/whatwg/html/issues/9960,<hr> in <select> size >1,2024-01-02T16:38:38Z,motari54
1874244195,whatwg/html,It would be good to have a wpt for this case before resolving.,https://github.com/whatwg/html/issues/1568#issuecomment-1874244195,https://github.com/whatwg/html/issues/1568,'run authentic click activation steps' doesn't deal with the case when activation behavior changes during click event dispatch,2024-01-02T16:22:36Z,zcorpan
1874239064,whatwg/html,"Testing with ``` data:text/html,<a href=""javascript:alert('link followed');""><form onsubmit=""alert",https://github.com/whatwg/html/issues/1567#issuecomment-1874239064,https://github.com/whatwg/html/issues/1567,<button> shouldn't have activation behavior when it is not in a form,2024-01-02T16:18:33Z,zcorpan
1874224020,whatwg/html,"Regarding `secure`, `httpOnly` and `partitioned`, if they are not set at creation time, doesn't that",https://github.com/whatwg/html/issues/9935#issuecomment-1874224020,https://github.com/whatwg/html/issues/9935,Cookie API,2024-01-02T16:08:07Z,mkarajohn
1874204931,WICG/webcomponents,> @smaug---- how was XTF resilient against imperative creation of the same elements?  There were b,https://github.com/WICG/webcomponents/issues/809#issuecomment-1874204931,https://github.com/WICG/webcomponents/issues/809,Need a callback for when children changed or parser finished parsing children,2024-01-02T15:53:33Z,smaug----
1874150356,whatwg/html,@kettanaito I think from should be a static function that returns an iterable (map or array tbd). Wh,https://github.com/whatwg/html/issues/9935#issuecomment-1874150356,https://github.com/whatwg/html/issues/9935,Cookie API,2024-01-02T15:11:23Z,marco-ippolito
1874148493,whatwg/html,The specification changed by now and this issue can be resolved.  A [button](https://html.spec.wha,https://github.com/whatwg/html/issues/1568#issuecomment-1874148493,https://github.com/whatwg/html/issues/1568,'run authentic click activation steps' doesn't deal with the case when activation behavior changes during click event dispatch,2024-01-02T15:09:56Z,vinhill
1874050898,WICG/webcomponents,slotchange doesn't use a separate task https://dom.spec.whatwg.org/#notify-mutation-observers,https://github.com/WICG/webcomponents/issues/1042#issuecomment-1874050898,https://github.com/WICG/webcomponents/issues/1042,Observing slotchange mutation records: a `SlotChangeObserver` API similar to `MutationObserver` with `childList:true`,2024-01-02T13:50:55Z,smaug----
1874044245,whatwg/html,> This issue should be reopened. Controlling changes with a single file is crazy.  why is this spa,https://github.com/whatwg/html/issues/3705#issuecomment-1874044245,https://github.com/whatwg/html/issues/3705,Split source file into sections,2024-01-02T13:44:48Z,alejsanc
1874040956,whatwg/html,> [This issue should be reopened. Controlling changes with a single file is crazy.](https://github.c,https://github.com/whatwg/html/issues/10030#issuecomment-1874040956,https://github.com/whatwg/html/issues/10030,Is HTML stagnated?,2024-01-02T13:41:40Z,alejsanc
1873884212,whatwg/html,`sameSite` values should be lowercase (`lax` instead `Lax` etc) to be [consistent with the `CookieSt,https://github.com/whatwg/html/issues/9935#issuecomment-1873884212,https://github.com/whatwg/html/issues/9935,Cookie API,2024-01-02T11:02:36Z,pilcrowOnPaper
1873799131,whatwg/html,"Hi, @keithamus. Could you please guide me regarding the next steps with this proposal? I will try to",https://github.com/whatwg/html/issues/9935#issuecomment-1873799131,https://github.com/whatwg/html/issues/9935,Cookie API,2024-01-02T09:43:31Z,kettanaito
1873391684,whatwg/html,[This issue should be reopened. Controlling changes with a single file is crazy.](https://github.com,https://github.com/whatwg/html/issues/10030#issuecomment-1873391684,https://github.com/whatwg/html/issues/10030,Is HTML stagnated?,2024-01-01T16:31:29Z,alejsanc
1873391219,whatwg/html,This issue should be reopened. Controlling changes with a single file is crazy.,https://github.com/whatwg/html/issues/3705#issuecomment-1873391219,https://github.com/whatwg/html/issues/3705,Split source file into sections,2024-01-01T16:29:57Z,alejsanc
1873263708,whatwg/html,"Having played with this, I am becoming convinced that this should be in the navigation API, as it re",https://github.com/whatwg/html/issues/9702#issuecomment-1873263708,https://github.com/whatwg/html/issues/9702,[View Transition] Event on old Document to set transition state,2024-01-01T10:24:08Z,noamr
1873006034,mozilla/standards-positions,"> If certain capabilities are regarded as too dangerous for regular web pages, then provide proper i",https://github.com/mozilla/standards-positions/pull/193#issuecomment-1873006034,https://github.com/mozilla/standards-positions/pull/193,Add position on WebUSB.,2023-12-31T17:55:44Z,whitequark
1873004429,mozilla/standards-positions,Our use case is reprogramming the USB device by installing GrapheneOS on it. Android can and does pr,https://github.com/mozilla/standards-positions/pull/193#issuecomment-1873004429,https://github.com/mozilla/standards-positions/pull/193,Add position on WebUSB.,2023-12-31T17:46:31Z,thestinger
1872963742,mozilla/standards-positions,@thestinger   > USB devices should be secured against being plugged into malicious hardware. If th,https://github.com/mozilla/standards-positions/pull/193#issuecomment-1872963742,https://github.com/mozilla/standards-positions/pull/193,Add position on WebUSB.,2023-12-31T14:35:44Z,whitequark
1872959149,whatwg/html,> I recommend looking at the commit log and PRs that have successfully merged. And if there's someth,https://github.com/whatwg/html/issues/10030#issuecomment-1872959149,https://github.com/whatwg/html/issues/10030,Is HTML stagnated?,2023-12-31T14:15:00Z,alejsanc
1872940025,whatwg/html,"https://github.com/whatwg/html/pull/10025#issuecomment-1870055140 was indeed a real issue, see https",https://github.com/whatwg/html/pull/10025#issuecomment-1872940025,https://github.com/whatwg/html/pull/10025,Don't clip range/checkbox/radio overflow to border box.,2023-12-31T12:44:03Z,emilio
1872938501,whatwg/html,cc @pxlcoder @smfr,https://github.com/whatwg/html/issues/10031#issuecomment-1872938501,https://github.com/whatwg/html/issues/10031,[forms] <select> element clip is not specified and not interoperable,2023-12-31T12:36:36Z,nt1m
1872924099,WICG/webcomponents,"> How do those dynamic updates occur, though? That's the point of contention here. For JS based fram",https://github.com/WICG/webcomponents/issues/1035#issuecomment-1872924099,https://github.com/WICG/webcomponents/issues/1035,DOM parts use outside of <template> seems unlikely,2023-12-31T11:18:41Z,hawkticehurst
1872908982,webkit/standards-positions,"cc @cdumez @rniwa @Constellation ",https://github.com/WebKit/standards-positions/issues/292#issuecomment-1872908982,https://github.com/WebKit/standards-positions/issues/292,Observable,2023-12-31T09:59:02Z,nt1m
1872847283,whatwg/html,I recommend looking at the commit log and PRs that have successfully merged. And if there's somethin,https://github.com/whatwg/html/issues/10030#issuecomment-1872847283,https://github.com/whatwg/html/issues/10030,Is HTML stagnated?,2023-12-31T08:25:38Z,annevk
1872831212,whatwg/webidl,"CreateMethodProperty(<var>O</var>, <var>P</var>, <var>V</var>) used to just be:  1. Let <var>newDe",https://github.com/whatwg/webidl/issues/1331#issuecomment-1872831212,https://github.com/whatwg/webidl/issues/1331,Suggestion: forbid ECMA-262/402-defined global names for some named constructs,2023-12-31T08:11:45Z,ExE-Boss
1872665318,mozilla/standards-positions,There's very little leverage to get device makers or developers to do something new since Chromium-b,https://github.com/mozilla/standards-positions/pull/193#issuecomment-1872665318,https://github.com/mozilla/standards-positions/pull/193,Add position on WebUSB.,2023-12-31T04:07:57Z,thestinger
1872660766,mozilla/standards-positions,What are those security expectations?  Firefox provides WebGPU without any permission required inc,https://github.com/mozilla/standards-positions/pull/193#issuecomment-1872660766,https://github.com/mozilla/standards-positions/pull/193,Add position on WebUSB.,2023-12-31T03:37:31Z,thestinger
1872656746,mozilla/standards-positions,@thestinger tbh I didn't read all of your comment because you don't address the point I'm making. I',https://github.com/mozilla/standards-positions/pull/193#issuecomment-1872656746,https://github.com/mozilla/standards-positions/pull/193,Add position on WebUSB.,2023-12-31T03:04:45Z,fabricedesre
1872655202,mozilla/standards-positions,> It turns out that WebMIDI is being used as an experiment to determine whether other negative posit,https://github.com/mozilla/standards-positions/pull/193#issuecomment-1872655202,https://github.com/mozilla/standards-positions/pull/193,Add position on WebUSB.,2023-12-31T02:51:44Z,timonsku
1872652329,mozilla/standards-positions,"> How do you address the issue with the server side being compromised, and serving code that can dam",https://github.com/mozilla/standards-positions/pull/193#issuecomment-1872652329,https://github.com/mozilla/standards-positions/pull/193,Add position on WebUSB.,2023-12-31T02:32:58Z,thestinger
1872642681,whatwg/html,> @alejsanc you might want to check out the following blogs: >   I don't see anything important c,https://github.com/whatwg/html/issues/10030#issuecomment-1872642681,https://github.com/whatwg/html/issues/10030,Is HTML stagnated?,2023-12-31T01:27:12Z,alejsanc
1872638793,whatwg/html,"@alejsanc you might want to check out the following blogs:  * web.dev blog, especially ""New to the",https://github.com/whatwg/html/issues/10030#issuecomment-1872638793,https://github.com/whatwg/html/issues/10030,Is HTML stagnated?,2023-12-31T00:54:51Z,myakura
1872616925,whatwg/html,"That is, from my perspective, the most we can get to explain replaced-ish controls like ""(inline-)bl",https://github.com/whatwg/html/pull/10025#issuecomment-1872616925,https://github.com/whatwg/html/pull/10025,Don't clip range/checkbox/radio overflow to border box.,2023-12-30T22:19:02Z,emilio
1872616718,whatwg/html,"@nt1m, can you elaborate on why?  File inputs at least also clip overflow (and can generate overfl",https://github.com/whatwg/html/pull/10025#issuecomment-1872616718,https://github.com/whatwg/html/pull/10025,Don't clip range/checkbox/radio overflow to border box.,2023-12-30T22:17:29Z,emilio
1872613331,mozilla/standards-positions,It turns out that WebMIDI is being used as an experiment to determine whether other negative positio,https://github.com/mozilla/standards-positions/pull/193#issuecomment-1872613331,https://github.com/mozilla/standards-positions/pull/193,Add position on WebUSB.,2023-12-30T21:51:02Z,whitequark
