id,repo,body,url,issue_url,issue_title,created_at,user
1986442458,WICG/webcomponents,"Supporting wildcards like this would be a massive help, but there's still an extremely large styling",https://github.com/WICG/webcomponents/issues/1051#issuecomment-1986442458,https://github.com/WICG/webcomponents/issues/1051,"[exportparts] support exporting via wildcards `exportparts=""*, primary-*""`",2024-03-08T21:26:46Z,sorvell
1986431866,WICG/webcomponents,> I was not able to make the meeting. Was it understood that this feature _must_ work without JavaSc,https://github.com/WICG/webcomponents/issues/909#issuecomment-1986431866,https://github.com/WICG/webcomponents/issues/909,"""open-stylable"" Shadow Roots",2024-03-08T21:17:34Z,mfreed7
1986428500,WICG/webcomponents,I was not able to make the meeting. Was it understood that this feature *must* work without JavaScri,https://github.com/WICG/webcomponents/issues/909#issuecomment-1986428500,https://github.com/WICG/webcomponents/issues/909,"""open-stylable"" Shadow Roots",2024-03-08T21:14:34Z,matthewp
1986402830,WICG/webcomponents,+1 I also heard   - dialing down of shadow crossing selector combinators as perhaps more of an edg,https://github.com/WICG/webcomponents/issues/909#issuecomment-1986402830,https://github.com/WICG/webcomponents/issues/909,"""open-stylable"" Shadow Roots",2024-03-08T20:55:16Z,robglidden
1986333249,whatwg/html,"/cc @noamr @mfreed7 ",https://github.com/whatwg/html/pull/10188#issuecomment-1986333249,https://github.com/whatwg/html/pull/10188,Use DOM's post-insertion steps for `<script>` elements,2024-03-08T19:55:59Z,domfarolino
1986317230,whatwg/html,"> Popover already has the behaviour, kind of. `popover=auto` has the same behaviour as `closedby=any",https://github.com/whatwg/html/issues/9373#issuecomment-1986317230,https://github.com/whatwg/html/issues/9373,Add light dismiss functionality to `<dialog>`,2024-03-08T19:45:59Z,mfreed7
1986286523,WICG/webcomponents,"+1 to that summary - that's what I heard, and I like this approach. In particular, the ""obvious"" des",https://github.com/WICG/webcomponents/issues/909#issuecomment-1986286523,https://github.com/WICG/webcomponents/issues/909,"""open-stylable"" Shadow Roots",2024-03-08T19:30:40Z,mfreed7
1986278674,whatwg/html,"I just added another proposed idea to the first post:  > ### 3. What if we could fix this without ",https://github.com/whatwg/html/issues/10143#issuecomment-1986278674,https://github.com/whatwg/html/issues/10143,Improve DX of element reference attributes by allowing relative references instead of only ids,2024-03-08T19:27:37Z,LeaVerou
1986271280,WICG/webcomponents,"Yeah, I think the TLDR (please correct me if I'm wrong or expand as necessary) is that we ended up d",https://github.com/WICG/webcomponents/issues/909#issuecomment-1986271280,https://github.com/WICG/webcomponents/issues/909,"""open-stylable"" Shadow Roots",2024-03-08T19:23:08Z,emilio
1986245920,WICG/webcomponents,"I'm not sure it's super-useful, because it doesn't contain notes of what was said verbally in the F2",https://github.com/WICG/webcomponents/issues/909#issuecomment-1986245920,https://github.com/WICG/webcomponents/issues/909,"""open-stylable"" Shadow Roots",2024-03-08T19:01:59Z,mfreed7
1986052207,whatwg/html,"Popover already has the behaviour, kind of. `popover=auto` has the same behaviour as `closedby=any`,",https://github.com/whatwg/html/issues/9373#issuecomment-1986052207,https://github.com/whatwg/html/issues/9373,Add light dismiss functionality to `<dialog>`,2024-03-08T16:53:42Z,keithamus
1985984078,whatwg/html,"As I mentioned in Mozilla's s-p, it would be good to think whether the features would apply to other",https://github.com/whatwg/html/issues/9373#issuecomment-1985984078,https://github.com/whatwg/html/issues/9373,Add light dismiss functionality to `<dialog>`,2024-03-08T16:17:50Z,smaug----
1985372161,whatwg/html,The flow goes like this: - author calls `document.startViewTransition` - wait for next frame - Du,https://github.com/whatwg/html/issues/10186#issuecomment-1985372161,https://github.com/whatwg/html/issues/10186,"Document ""rendering suppression for view transitions"" also suppresses ""perform pending transition operations""",2024-03-08T09:43:53Z,noamr
1985328821,whatwg/html,"The ""groups"" concept seems reasonable, and makes behavior similar to e.g. a fragment navigation for ",https://github.com/whatwg/html/pull/10168#issuecomment-1985328821,https://github.com/whatwg/html/pull/10168,Re-do close watcher user activation tracking,2024-03-08T09:14:55Z,zcorpan
1985118393,whatwg/html,"cc @noamr @bokand ",https://github.com/whatwg/html/issues/10186#issuecomment-1985118393,https://github.com/whatwg/html/issues/10186,"Document ""rendering suppression for view transitions"" also suppresses ""perform pending transition operations""",2024-03-08T06:37:10Z,nt1m
1985088083,whatwg/html,> As a follow up from todays whatnot I've raised standards positions for WebKit and Mozilla. I'm ass,https://github.com/whatwg/html/issues/9373#issuecomment-1985088083,https://github.com/whatwg/html/issues/9373,Add light dismiss functionality to `<dialog>`,2024-03-08T06:01:12Z,mfreed7
1985014165,whatwg/html,"As a follow up to today's WHATNOT meeting, here are a few examples of how Javascript datepickers han",https://github.com/whatwg/html/issues/9542#issuecomment-1985014165,https://github.com/whatwg/html/issues/9542,Disabled dates for input type=date,2024-03-08T04:18:05Z,mikeriley131
1984974002,whatwg/dom,"PTAL @annevk! I'll prepare an HTML PR and commit message for this, as well as file the appropriate b",https://github.com/whatwg/dom/pull/1261#issuecomment-1984974002,https://github.com/whatwg/dom/pull/1261,Introduce DOM post-insertion steps,2024-03-08T03:19:52Z,domfarolino
1984922331,whatwg/html,Tangentially related concern from @mattwoodrow :  > Might be worth some more spec clarification th,https://github.com/whatwg/html/issues/10186#issuecomment-1984922331,https://github.com/whatwg/html/issues/10186,"Document ""rendering suppression for view transitions"" also suppresses ""perform pending transition operations""",2024-03-08T02:08:56Z,nt1m
1984899086,whatwg/html,"cc @khushalsagar @vmpstr ",https://github.com/whatwg/html/issues/10186#issuecomment-1984899086,https://github.com/whatwg/html/issues/10186,"Document ""rendering suppression for view transitions"" also suppresses ""perform pending transition operations""",2024-03-08T01:40:51Z,nt1m
1984887872,WICG/webcomponents,"I think the use cases here boil down to 3 main buckets, all of which would be useful to support: 1.",https://github.com/WICG/webcomponents/issues/909#issuecomment-1984887872,https://github.com/WICG/webcomponents/issues/909,"""open-stylable"" Shadow Roots",2024-03-08T01:29:13Z,sorvell
1984799413,whatwg/html,As a follow up from todays whatnot I've raised standards positions for WebKit and Mozilla. I'm assum,https://github.com/whatwg/html/issues/9373#issuecomment-1984799413,https://github.com/whatwg/html/issues/9373,Add light dismiss functionality to `<dialog>`,2024-03-07T23:52:41Z,lukewarlow
1984797640,mozilla/standards-positions,"As I mentioned during the WHATNOT meeting, it would be good to consider also whether the proposed at",https://github.com/mozilla/standards-positions/issues/998#issuecomment-1984797640,https://github.com/mozilla/standards-positions/issues/998,Dialog light dismiss,2024-03-07T23:51:31Z,smaug----
1984796228,webkit/standards-positions,Draft PR to give a rough idea of what this could look like https://github.com/whatwg/html/pull/10157,https://github.com/WebKit/standards-positions/issues/329#issuecomment-1984796228,https://github.com/WebKit/standards-positions/issues/329,Dialog light dismiss,2024-03-07T23:49:57Z,lukewarlow
1984796163,mozilla/standards-positions,Draft PR to give a rough idea of what this could look like https://github.com/whatwg/html/pull/10157,https://github.com/mozilla/standards-positions/issues/998#issuecomment-1984796163,https://github.com/mozilla/standards-positions/issues/998,Dialog light dismiss,2024-03-07T23:49:51Z,lukewarlow
1984766597,WICG/webcomponents,"@justinfagnani Thank you for your clarification.  Adding another clarification, nor does that sent",https://github.com/WICG/webcomponents/issues/909#issuecomment-1984766597,https://github.com/WICG/webcomponents/issues/909,"""open-stylable"" Shadow Roots",2024-03-07T23:19:26Z,robglidden
1984413277,whatwg/html,@lukewarlow you should have an invite in your inbox,https://github.com/whatwg/html/issues/10156#issuecomment-1984413277,https://github.com/whatwg/html/issues/10156,Upcoming WHATNOT meeting on 3/7/2024,2024-03-07T20:47:14Z,cwilso
1984092727,WICG/webcomponents,@robglidden one clarification:  > This issue was originally framed in terms of shadow-boundary-cro,https://github.com/WICG/webcomponents/issues/909#issuecomment-1984092727,https://github.com/WICG/webcomponents/issues/909,"""open-stylable"" Shadow Roots",2024-03-07T17:40:01Z,justinfagnani
1984007950,whatwg/html,"Gentle ping - any chance we could get an initial review of this PR? @annevk @domenic ",https://github.com/whatwg/html/pull/9778#issuecomment-1984007950,https://github.com/whatwg/html/pull/9778,Add popover=hint,2024-03-07T16:59:42Z,mfreed7
1984003434,whatwg/html,"> Changes LGTM, now that we've resolved the thread. I can merge once all the checkboxes in the OP ar",https://github.com/whatwg/html/pull/10116#issuecomment-1984003434,https://github.com/whatwg/html/pull/10116,Allow top layer elements to be nested within popovers,2024-03-07T16:57:27Z,mfreed7
1983859370,whatwg/html,https://bugzilla.mozilla.org/show_bug.cgi?id=1734870 and https://bugzilla.mozilla.org/show_bug.cgi?i,https://github.com/whatwg/html/issues/10185#issuecomment-1983859370,https://github.com/whatwg/html/issues/10185,should search for draggable attribute follow dom tree or flattened tree?,2024-03-07T16:08:15Z,emilio
1983838775,webkit/standards-positions,"FYI: Renamed this to ""Cross-Document View Transitions"" since L2 version of the spec contains a coupl",https://github.com/WebKit/standards-positions/issues/302#issuecomment-1983838775,https://github.com/WebKit/standards-positions/issues/302,Cross-Document View Transitions,2024-03-07T16:02:46Z,bokand
1983769695,whatwg/html,"If I read the code correctly, https://searchfox.org/mozilla-central/rev/6b1e306175c2284958fb185bab38",https://github.com/whatwg/html/issues/10185#issuecomment-1983769695,https://github.com/whatwg/html/issues/10185,should search for draggable attribute follow dom tree or flattened tree?,2024-03-07T15:33:04Z,smaug----
1983765070,webkit/standards-positions,Web-Spec (in Draft) - https://drafts.csswg.org/css-color-hdr/#controlling-dynamic-range  Post - ht,https://github.com/WebKit/standards-positions/issues/312#issuecomment-1983765070,https://github.com/WebKit/standards-positions/issues/312,CSS dynamic-range-limit property,2024-03-07T15:31:07Z,Ahmad-S792
1983744929,whatwg/html,I'm fine with the proposal above.  (I'm just an occasional participant anyway.)  But one other opt,https://github.com/whatwg/html/issues/10163#issuecomment-1983744929,https://github.com/whatwg/html/issues/10163,Making the WHATNOT meeting cadence weekly,2024-03-07T15:22:12Z,dbaron
1983465294,whatwg/html,"Gave it a try at #10184 ",https://github.com/whatwg/html/issues/10180#issuecomment-1983465294,https://github.com/whatwg/html/issues/10180,Nits with link rel=expect,2024-03-07T13:04:29Z,noamr
1983435005,webkit/standards-positions,"I think that very much depends. If you checkout through PayPal you might well have to login. But it ",https://github.com/WebKit/standards-positions/issues/45#issuecomment-1983435005,https://github.com/WebKit/standards-positions/issues/45,Iframe credentialless (was: Anonymous iframe),2024-03-07T12:45:43Z,annevk
1983414862,webkit/standards-positions,"+CC @CamilleLamy & @MikeWest, _as I haven't worked on <iframe credentialless> for years._ Payment d",https://github.com/WebKit/standards-positions/issues/45#issuecomment-1983414862,https://github.com/WebKit/standards-positions/issues/45,Iframe credentialless (was: Anonymous iframe),2024-03-07T12:32:47Z,ArthurSonzogni
1983375640,whatwg/html,I'm interested.,https://github.com/whatwg/html/issues/10156#issuecomment-1983375640,https://github.com/whatwg/html/issues/10156,Upcoming WHATNOT meeting on 3/7/2024,2024-03-07T12:08:08Z,lukewarlow
1983203400,webkit/standards-positions,"It has come to my attention that `<iframe credentialless>` is sometimes used for payment flows, desp",https://github.com/WebKit/standards-positions/issues/45#issuecomment-1983203400,https://github.com/WebKit/standards-positions/issues/45,Iframe credentialless (was: Anonymous iframe),2024-03-07T10:25:13Z,annevk
1983086135,mozilla/standards-positions,Dup of #109,https://github.com/mozilla/standards-positions/issues/672#issuecomment-1983086135,https://github.com/mozilla/standards-positions/issues/672,Request for Position: Delay and trackVisibility propery in Intersection Observer v2,2024-03-07T09:27:55Z,zcorpan
1983081420,mozilla/standards-positions,Occlusion detection is useful for [Page Embedded Permission Controls](https://github.com/mozilla/sta,https://github.com/mozilla/standards-positions/issues/109#issuecomment-1983081420,https://github.com/mozilla/standards-positions/issues/109,IntersectionObserver V2: Detecting occlusion and visual effects,2024-03-07T09:25:07Z,zcorpan
1983043159,mozilla/standards-positions,"The original position was based on some misunderstandings on our part.  Per discussion offline, we",https://github.com/mozilla/standards-positions/issues/908#issuecomment-1983043159,https://github.com/mozilla/standards-positions/issues/908,Page Embedded Permission Control,2024-03-07T09:09:25Z,zcorpan
1983006921,mozilla/standards-positions,Makes sense to have this on the higher level API since it's available in Web Codecs.  `positive`.,https://github.com/mozilla/standards-positions/issues/996#issuecomment-1983006921,https://github.com/mozilla/standards-positions/issues/996,MediaRecorder: Support mp4 container with avc1 and mp4a.40.2 codecs for MediaRecorder,2024-03-07T08:55:41Z,padenot
1982796332,w3ctag/design-reviews,"Though we cannot share the exact feedback from the origin trial due to confidentiality, the feedback",https://github.com/w3ctag/design-reviews/issues/795#issuecomment-1982796332,https://github.com/w3ctag/design-reviews/issues/795,Compute Pressure Specification Review,2024-03-07T07:48:36Z,kenchris
1982328581,whatwg/html,I agree that we should probably reword the introductory text to be a bit more accurate. It's not nor,https://github.com/whatwg/html/issues/10180#issuecomment-1982328581,https://github.com/whatwg/html/issues/10180,Nits with link rel=expect,2024-03-07T04:31:40Z,domenic
1982033346,whatwg/html,"> Since all of the options are (by design) before the next paint, they're all equally blocking in te",https://github.com/whatwg/html/issues/9046#issuecomment-1982033346,https://github.com/whatwg/html/issues/9046,"Timing of `<dialog>` 'close' event, popover 'toggle' event, `<details>` 'toggle' event",2024-03-06T23:31:11Z,chrishtr
1981811076,whatwg/html,"> https://github.com/whatwg/html/issues/10153#issuecomment-1981562423  @kbrosnan, thanks. Indeed, ",https://github.com/whatwg/html/issues/10153#issuecomment-1981811076,https://github.com/whatwg/html/issues/10153,Nested comment tags.,2024-03-06T21:24:25Z,RokeJulianLockhart
1981741386,whatwg/html,Maybe `headinglevelshift=n` would be better than `headinglevelstart=+n`. The name makes the `+`-ness,https://github.com/whatwg/html/issues/5033#issuecomment-1981741386,https://github.com/whatwg/html/issues/5033,Consider adding a headinglevelstart attribute,2024-03-06T20:38:24Z,jimmyfrasche
1981704003,whatwg/html,"Specifically, [this is the example of nested contexts I gave](https://github.com/whatwg/html/issues/",https://github.com/whatwg/html/issues/5033#issuecomment-1981704003,https://github.com/whatwg/html/issues/5033,Consider adding a headinglevelstart attribute,2024-03-06T20:13:37Z,tabatkins
1981579029,whatwg/html,I think we're saying the same thing but in slightly different ways.  Let's start with one `heading,https://github.com/whatwg/html/issues/5033#issuecomment-1981579029,https://github.com/whatwg/html/issues/5033,Consider adding a headinglevelstart attribute,2024-03-06T19:00:02Z,jimmyfrasche
1981562423,whatwg/html,I can see your enthusiasm for this feature. This change would be a breaking change to how HTML is pa,https://github.com/whatwg/html/issues/10153#issuecomment-1981562423,https://github.com/whatwg/html/issues/10153,Nested comment tags.,2024-03-06T18:49:37Z,kbrosnan
1981436305,webkit/standards-positions,"> Hey @mfreed7, we discussed this a bit again and one question we have is whether this is going to b",https://github.com/WebKit/standards-positions/issues/305#issuecomment-1981436305,https://github.com/WebKit/standards-positions/issues/305,popover=hint,2024-03-06T17:38:02Z,mfreed7
1981424082,webkit/standards-positions,"Hey @mfreed7, we discussed this a bit again and one question we have is whether this is going to be ",https://github.com/WebKit/standards-positions/issues/305#issuecomment-1981424082,https://github.com/WebKit/standards-positions/issues/305,popover=hint,2024-03-06T17:33:27Z,annevk
1981416934,webkit/standards-positions,We think this is an useful feature and we have also recently implemented this: https://github.com/We,https://github.com/WebKit/standards-positions/issues/279#issuecomment-1981416934,https://github.com/WebKit/standards-positions/issues/279,[css-cascade-5] Implement supports() for @import,2024-03-06T17:30:46Z,nt1m
1981173695,whatwg/html,"If the picker is inside of another element (ex: overlay), focus should shift automatically to the pi",https://github.com/whatwg/html/issues/9757#issuecomment-1981173695,https://github.com/whatwg/html/issues/9757,Can showPicker() focus a control?,2024-03-06T15:45:06Z,newtonsgroove
1981167797,whatwg/html,"Eh, maybe get a second opinion on whether it's better to copy the other links or not.",https://github.com/whatwg/html/issues/10180#issuecomment-1981167797,https://github.com/whatwg/html/issues/10180,Nits with link rel=expect,2024-03-06T15:42:33Z,jakearchibald
1981164533,whatwg/html,"I can see future in which  ```html <picture>   <source container=""(width > 500px)"" srcset=""a""> ",https://github.com/whatwg/html/issues/10182#issuecomment-1981164533,https://github.com/whatwg/html/issues/10182,Allow `<source>` elements to query container sizes,2024-03-06T15:41:03Z,eeeps
1981143319,whatwg/html,> ### What is the issue with the HTML Standard? > https://html.spec.whatwg.org/multipage/links.html,https://github.com/whatwg/html/issues/10180#issuecomment-1981143319,https://github.com/whatwg/html/issues/10180,Nits with link rel=expect,2024-03-06T15:32:33Z,noamr
1981107397,whatwg/html,Similar discussion happening here: https://github.com/w3c/csswg-drafts/issues/5889,https://github.com/whatwg/html/issues/10182#issuecomment-1981107397,https://github.com/whatwg/html/issues/10182,Allow `<source>` elements to query container sizes,2024-03-06T15:17:51Z,andy-blum
1981058174,whatwg/html,"It would, but that's not a problem for lazy-loaded images or other images that are farther down the ",https://github.com/whatwg/html/issues/10182#issuecomment-1981058174,https://github.com/whatwg/html/issues/10182,Allow `<source>` elements to query container sizes,2024-03-06T14:58:48Z,andy-blum
1981029892,whatwg/html,Wouldn't this make the image wait on the page for layout?,https://github.com/whatwg/html/issues/10182#issuecomment-1981029892,https://github.com/whatwg/html/issues/10182,Allow `<source>` elements to query container sizes,2024-03-06T14:45:20Z,myakura
1980862933,whatwg/html,https://bugzilla.mozilla.org/show_bug.cgi?id=1883896,https://github.com/whatwg/html/issues/7867#issuecomment-1980862933,https://github.com/whatwg/html/issues/7867,Remove UA style for h1-h6 in section (et. al.) and hgroup,2024-03-06T13:21:44Z,zcorpan
1980646156,mozilla/standards-positions,"Glad to hear Gecko is positive, thank you.  > On the other hand, I'm not sure whether [text-autosp",https://github.com/mozilla/standards-positions/issues/903#issuecomment-1980646156,https://github.com/mozilla/standards-positions/issues/903,CSS Text Level 4: the `text-spacing` property and its longhands,2024-03-06T11:19:00Z,kojiishi
1980578255,webkit/standards-positions,"I suggest we mark this as ""position: support"" one week from now, barring any objections. This is pre",https://github.com/WebKit/standards-positions/issues/319#issuecomment-1980578255,https://github.com/WebKit/standards-positions/issues/319,ReadableStream async iteration,2024-03-06T10:42:40Z,annevk
1980514386,WICG/webcomponents,"For anyone interested in maybe playing around with this in a real world project, I built a quick-and",https://github.com/WICG/webcomponents/issues/909#issuecomment-1980514386,https://github.com/WICG/webcomponents/issues/909,"""open-stylable"" Shadow Roots",2024-03-06T10:08:45Z,DarkWiiPlayer
1980316430,whatwg/html,> ```html > <h1>aria-level=1</h1> > <div headinglevelstart=2> >   <h1>aria-level=2</h1> >   <h2>,https://github.com/whatwg/html/issues/5033#issuecomment-1980316430,https://github.com/whatwg/html/issues/5033,Consider adding a headinglevelstart attribute,2024-03-06T08:21:52Z,jakearchibald
1980129645,whatwg/encoding,whatwg:main branch is broken: `LINK ERROR: Ambiguous for-less link for 'name'`,https://github.com/whatwg/encoding/pull/326#issuecomment-1980129645,https://github.com/whatwg/encoding/pull/326,Clarify insertion order when prepending multiple bytes at once to ioQueue,2024-03-06T05:46:14Z,stasoid
1980107412,whatwg/encoding,I [signed up](https://github.com/whatwg/participant-data/commit/428a8a16e3ac318c7cdd671acd8c60d31fb7,https://github.com/whatwg/encoding/pull/326#issuecomment-1980107412,https://github.com/whatwg/encoding/pull/326,Clarify insertion order when prepending multiple bytes at once to ioQueue,2024-03-06T05:18:46Z,stasoid
1979986783,webkit/standards-positions,WebKit Bug - https://bugs.webkit.org/show_bug.cgi?id=270555,https://github.com/WebKit/standards-positions/issues/318#issuecomment-1979986783,https://github.com/WebKit/standards-positions/issues/318,Notification requireInteraction feature,2024-03-06T02:55:14Z,Ahmad-S792
1979883228,WICG/webcomponents,"Yes, in this limited case I'm only interested in getting the reference to a mandatory child element.",https://github.com/WICG/webcomponents/issues/809#issuecomment-1979883228,https://github.com/WICG/webcomponents/issues/809,Need a callback for when children changed or parser finished parsing children,2024-03-06T00:52:10Z,silverwind
1979877851,WICG/webcomponents,"Just to clarify @silverwind it looks like your code is only for change events, and even then, only o",https://github.com/WICG/webcomponents/issues/809#issuecomment-1979877851,https://github.com/WICG/webcomponents/issues/809,Need a callback for when children changed or parser finished parsing children,2024-03-06T00:45:33Z,patricknelson
1979868644,WICG/webcomponents,"To me it seems to reliably access children in `connectedCallback`, one has to check for both existin",https://github.com/WICG/webcomponents/issues/809#issuecomment-1979868644,https://github.com/WICG/webcomponents/issues/809,Need a callback for when children changed or parser finished parsing children,2024-03-06T00:34:32Z,silverwind
1979742799,w3c/pointerevents,Made changes to introduce deviceProperties rather than having deviceId on PointerEvent. Rough draft-,https://github.com/w3c/pointerevents/pull/495#issuecomment-1979742799,https://github.com/w3c/pointerevents/pull/495,Add deviceProperties.uniqueId to PointerEvent spec,2024-03-05T22:27:43Z,sahirv
1979741207,whatwg/html,Ah. Per @tabatkins argument above that should just be automatic so:  ```html <h1>aria-level=1</h1,https://github.com/whatwg/html/issues/5033#issuecomment-1979741207,https://github.com/whatwg/html/issues/5033,Consider adding a headinglevelstart attribute,2024-03-05T22:26:26Z,jimmyfrasche
1979715912,whatwg/html,"No, I think ""current heading level"" is far too complicated, and I suspect is why the previous outlin",https://github.com/whatwg/html/issues/5033#issuecomment-1979715912,https://github.com/whatwg/html/issues/5033,Consider adding a headinglevelstart attribute,2024-03-05T22:05:46Z,jakearchibald
1979630610,WICG/webcomponents,"Remainder: F2F meeting for this issue is happening this [Friday, March 8th, 9am through 11am PST (Ma",https://github.com/WICG/webcomponents/issues/909#issuecomment-1979630610,https://github.com/WICG/webcomponents/issues/909,"""open-stylable"" Shadow Roots",2024-03-05T21:02:44Z,rniwa
1979620568,whatwg/html,"We're imagining different semantics then. I assumed +0/+1 is relative to the current heading level. ",https://github.com/whatwg/html/issues/5033#issuecomment-1979620568,https://github.com/whatwg/html/issues/5033,Consider adding a headinglevelstart attribute,2024-03-05T20:55:12Z,jimmyfrasche
1979617069,whatwg/html,> * I'm not sure there's a valid use for anything other than `+0` and `+1`.  There's one in your p,https://github.com/whatwg/html/issues/5033#issuecomment-1979617069,https://github.com/whatwg/html/issues/5033,Consider adding a headinglevelstart attribute,2024-03-05T20:52:40Z,jakearchibald
1979518780,whatwg/html,The nice thing about `headinglevelstart` is that you can add wrappers so sub-templates don't have to,https://github.com/whatwg/html/issues/5033#issuecomment-1979518780,https://github.com/whatwg/html/issues/5033,Consider adding a headinglevelstart attribute,2024-03-05T19:50:37Z,jimmyfrasche
1979354145,WICG/webcomponents," @sorvell Runtime created components that don't create their Shadow DOM declaratively would benefit",https://github.com/WICG/webcomponents/issues/909#issuecomment-1979354145,https://github.com/WICG/webcomponents/issues/909,"""open-stylable"" Shadow Roots",2024-03-05T18:10:37Z,robglidden
