id,repo,body,url,issue_url,issue_title,created_at,user
1802932326,whatwg/html,"> I assumed a navigation from about:blank would be considered cross-origin.  Not necessarily. The ",https://github.com/whatwg/html/issues/9760#issuecomment-1802932326,https://github.com/whatwg/html/issues/9760,Expose information about last activation/cross-document navigation,2023-11-08T23:57:50Z,domenic
1802885150,WICG/webcomponents,"@matthewp Welp, I'm already doing that (creating web components for buttons and server-rendering the",https://github.com/WICG/webcomponents/issues/909#issuecomment-1802885150,https://github.com/WICG/webcomponents/issues/909,"""open-stylable"" Shadow Roots",2023-11-08T23:21:18Z,jaredcwhite
1802867712,WICG/webcomponents,"@jaredcwhite I disagree, all of my buttons should look the same regardless of what shadow they happe",https://github.com/WICG/webcomponents/issues/909#issuecomment-1802867712,https://github.com/WICG/webcomponents/issues/909,"""open-stylable"" Shadow Roots",2023-11-08T23:11:24Z,matthewp
1802830162,WICG/webcomponents,"@cstavaru That _is_ how they work. Shoelace is a popular web component library and you can ""skin"" mo",https://github.com/WICG/webcomponents/issues/909#issuecomment-1802830162,https://github.com/WICG/webcomponents/issues/909,"""open-stylable"" Shadow Roots",2023-11-08T22:53:51Z,jaredcwhite
1802672270,WICG/webcomponents,Imagine a car manufacturer building a new car.   It has a myriad of 3rd party suppliers: headlight,https://github.com/WICG/webcomponents/issues/909#issuecomment-1802672270,https://github.com/WICG/webcomponents/issues/909,"""open-stylable"" Shadow Roots",2023-11-08T21:05:08Z,cstavaru
1802591504,WICG/webcomponents,"@justinfagnani Very well reasoned response, and regarding ""We must recognize that real-world develop",https://github.com/WICG/webcomponents/issues/909#issuecomment-1802591504,https://github.com/WICG/webcomponents/issues/909,"""open-stylable"" Shadow Roots",2023-11-08T20:19:42Z,jaredcwhite
1802549099,WICG/webcomponents,"It *may* lead to faster updates, if the browser is able to batch part updates via deeper integration",https://github.com/WICG/webcomponents/issues/1035#issuecomment-1802549099,https://github.com/WICG/webcomponents/issues/1035,DOM parts use outside of <template> seems unlikely,2023-11-08T19:50:10Z,EisenbergEffect
1802540689,WICG/webcomponents,"> If it isn't, and there are some missing API's that could make the browser update the fragments fas",https://github.com/WICG/webcomponents/issues/1035#issuecomment-1802540689,https://github.com/WICG/webcomponents/issues/1035,DOM parts use outside of <template> seems unlikely,2023-11-08T19:43:48Z,matthewp
1802536837,whatwg/webidl,> You can add properties to the TypeError. That seems better?  Does this mean adding data properti,https://github.com/whatwg/webidl/issues/1374#issuecomment-1802536837,https://github.com/whatwg/webidl/issues/1374,Allowing throwing an exception with a specific message,2023-11-08T19:41:08Z,syg
1802514117,WICG/webcomponents,"@jaredcwhite I appreciate the sentiment and basically agree for greenfield projects, but I think we ",https://github.com/WICG/webcomponents/issues/909#issuecomment-1802514117,https://github.com/WICG/webcomponents/issues/909,"""open-stylable"" Shadow Roots",2023-11-08T19:26:33Z,justinfagnani
1802503575,w3c/clipboard-apis,"hi, @garykac (and other contributors, I don't know who it would be more correct to call) what do yo",https://github.com/w3c/clipboard-apis/issues/199#issuecomment-1802503575,https://github.com/w3c/clipboard-apis/issues/199,Add method `match` (`clipboard.match(regex)`) to check clipboard for pattern matching before reading - as it is done in iOS,2023-11-08T19:18:16Z,ErmachenkoBoris
1802497428,whatwg/html,I assumed a navigation from about:blank would be considered cross-origin. Is that not how the naviga,https://github.com/whatwg/html/issues/9760#issuecomment-1802497428,https://github.com/whatwg/html/issues/9760,Expose information about last activation/cross-document navigation,2023-11-08T19:13:38Z,khushalsagar
1802474361,whatwg/html,Maybe language / locale could be made a CSS property (if it makes sense for direction then why not?),https://github.com/whatwg/html/issues/7039#issuecomment-1802474361,https://github.com/whatwg/html/issues/7039,Proposal for Element.currentLang and Element.currentDir,2023-11-08T18:57:31Z,rajsite
1802451874,whatwg/html,I brought up the idea of observing a selector in whatwg/dom recently (which i guess has less visibil,https://github.com/whatwg/html/issues/7039#issuecomment-1802451874,https://github.com/whatwg/html/issues/7039,Proposal for Element.currentLang and Element.currentDir,2023-11-08T18:44:19Z,matthewp
1802409878,whatwg/html,A complete solution using a hypothetical matchesSelector  ```ts let result = element.matchSelecto,https://github.com/whatwg/html/issues/7039#issuecomment-1802409878,https://github.com/whatwg/html/issues/7039,Proposal for Element.currentLang and Element.currentDir,2023-11-08T18:13:58Z,WickyNilliams
1802359529,WICG/webcomponents,Clearly there's enough demand for this feature that it should be considered seriously. But I am pers,https://github.com/WICG/webcomponents/issues/909#issuecomment-1802359529,https://github.com/WICG/webcomponents/issues/909,"""open-stylable"" Shadow Roots",2023-11-08T17:39:45Z,jaredcwhite
1802352784,whatwg/dom,"Hey, please give https://whatwg.org/faq#adding-new-features a read and improve the problem descripti",https://github.com/whatwg/dom/issues/1233#issuecomment-1802352784,https://github.com/whatwg/dom/issues/1233,Selecting Events with Style,2023-11-08T17:35:07Z,annevk
1802336149,w3c/clipboard-apis,I'm not sure if this change is actually required as the existing algorithm in `read()` already handl,https://github.com/w3c/clipboard-apis/pull/198#issuecomment-1802336149,https://github.com/w3c/clipboard-apis/pull/198,Allow empty ClipboardItem.,2023-11-08T17:24:11Z,snianu
1802212790,whatwg/html,"As the OP, I want to point out that I think @jakearchibald's [proposal for `matchSelector()`](https:",https://github.com/whatwg/html/issues/7039#issuecomment-1802212790,https://github.com/whatwg/html/issues/7039,Proposal for Element.currentLang and Element.currentDir,2023-11-08T16:12:54Z,claviska
1802204560,w3c/pointerevents,Does this need a WPT?,https://github.com/w3c/pointerevents/pull/490#issuecomment-1802204560,https://github.com/w3c/pointerevents/pull/490,Handle pointer capture node removal asynchronously,2023-11-08T16:08:20Z,patrickhlauke
1801726303,whatwg/html,"> Hmm, browsers don't seem to [respect the element's language](https://html.spec.whatwg.org/multipag",https://github.com/whatwg/html/issues/7039#issuecomment-1801726303,https://github.com/whatwg/html/issues/7039,Proposal for Element.currentLang and Element.currentDir,2023-11-08T11:46:09Z,rajsite
1801653693,WICG/webcomponents,"As I understand it, currently, the primary purpose of DOM parts is not to make building templating s",https://github.com/WICG/webcomponents/issues/1035#issuecomment-1801653693,https://github.com/WICG/webcomponents/issues/1035,DOM parts use outside of <template> seems unlikely,2023-11-08T11:02:45Z,bahrus
1801605529,whatwg/html,"Thanks for the analysis! I agree that given the data it seems ambitious to get rid of `<object>`. I ",https://github.com/whatwg/html/issues/7327#issuecomment-1801605529,https://github.com/whatwg/html/issues/7327,<object> element can tell whether child document loaded or not,2023-11-08T10:43:36Z,antosart
1801594482,whatwg/html,> might the timing issues cause any temporary inconsistent states? e.g. i'm thinking of a case where,https://github.com/whatwg/html/issues/7039#issuecomment-1801594482,https://github.com/whatwg/html/issues/7039,Proposal for Element.currentLang and Element.currentDir,2023-11-08T10:39:12Z,jakearchibald
1801575412,whatwg/webidl,"Yeah maybe. @littledan @syg thoughts from a JS perspective?  Having said, I think that eventually ",https://github.com/whatwg/webidl/issues/1374#issuecomment-1801575412,https://github.com/whatwg/webidl/issues/1374,Allowing throwing an exception with a specific message,2023-11-08T10:32:02Z,annevk
1801553777,whatwg/html,"> It's only concerned with subtrees if you opt into that, otherwise it's just concerned with the ele",https://github.com/whatwg/html/issues/7039#issuecomment-1801553777,https://github.com/whatwg/html/issues/7039,Proposal for Element.currentLang and Element.currentDir,2023-11-08T10:24:12Z,WickyNilliams
1801550232,whatwg/html,"Hmm, browsers don't seem to [respect the element's language](https://html.spec.whatwg.org/multipage/",https://github.com/whatwg/html/issues/7039#issuecomment-1801550232,https://github.com/whatwg/html/issues/7039,Proposal for Element.currentLang and Element.currentDir,2023-11-08T10:22:49Z,jakearchibald
1801545885,whatwg/webidl,You can add properties to the TypeError. That seems better?  (It's not currently possible in Web I,https://github.com/whatwg/webidl/issues/1374#issuecomment-1801545885,https://github.com/whatwg/webidl/issues/1374,Allowing throwing an exception with a specific message,2023-11-08T10:21:09Z,domenic
1801504299,whatwg/html,"> Yeah, we should not expose the autofilled text size for a security reason. How about applying the ",https://github.com/whatwg/html/pull/9903#issuecomment-1801504299,https://github.com/whatwg/html/pull/9903,Rendering: field-sizing support for some elements,2023-11-08T10:08:26Z,emilio
1801491791,whatwg/html,"@WickyNilliams   > extending mutation observer seems off to me, since MO is concerned with sub-tre",https://github.com/whatwg/html/issues/7039#issuecomment-1801491791,https://github.com/whatwg/html/issues/7039,Proposal for Element.currentLang and Element.currentDir,2023-11-08T10:03:22Z,jakearchibald
1801461920,whatwg/html,We could also split the difference between `LangObserver`/`matchSelector` and look at something like,https://github.com/whatwg/html/issues/7039#issuecomment-1801461920,https://github.com/whatwg/html/issues/7039,Proposal for Element.currentLang and Element.currentDir,2023-11-08T09:52:54Z,keithamus
1801456162,whatwg/html,"interesting ideas.  extending mutation observer seems off to me, since MO is concerned with sub-tr",https://github.com/whatwg/html/issues/7039#issuecomment-1801456162,https://github.com/whatwg/html/issues/7039,Proposal for Element.currentLang and Element.currentDir,2023-11-08T09:50:36Z,WickyNilliams
1801429011,whatwg/html,"I think observability is a must - that's the trickiest part of this, and it's something browsers alr",https://github.com/whatwg/html/issues/7039#issuecomment-1801429011,https://github.com/whatwg/html/issues/7039,Proposal for Element.currentLang and Element.currentDir,2023-11-08T09:40:18Z,jakearchibald
1801412374,whatwg/html,"Dupe of https://github.com/whatwg/html/issues/7039 and #7994, although the problem statement here is",https://github.com/whatwg/html/issues/9918#issuecomment-1801412374,https://github.com/whatwg/html/issues/9918,Observe the language of a node,2023-11-08T09:32:19Z,domenic
1801403144,whatwg/html,"cc @whatwg/css @rniwa @dbaron ",https://github.com/whatwg/html/issues/9918#issuecomment-1801403144,https://github.com/whatwg/html/issues/9918,Observe the language of a node,2023-11-08T09:27:48Z,annevk
1801400024,whatwg/html,(Note that on iOS a select box dropdown is not fullscreen either. It used to be displayed in the key,https://github.com/whatwg/html/pull/9754#issuecomment-1801400024,https://github.com/whatwg/html/pull/9754,Add showPicker to <select> elements,2023-11-08T09:25:48Z,annevk
1801249893,whatwg/html,The data here shows about 0.8% usage: https://chromestatus.com/metrics/feature/timeline/popularity/4,https://github.com/whatwg/html/issues/7327#issuecomment-1801249893,https://github.com/whatwg/html/issues/7327,<object> element can tell whether child document loaded or not,2023-11-08T07:42:55Z,domenic
1800899700,whatwg/html,> * How does this interact with autofill? I don't think we want to expose the autofilled text length,https://github.com/whatwg/html/pull/9903#issuecomment-1800899700,https://github.com/whatwg/html/pull/9903,Rendering: field-sizing support for some elements,2023-11-08T02:17:52Z,tkent-google
1800850543,whatwg/html,> @domenic thoughts?  I continue to think that a major use case for these will be showing the mobi,https://github.com/whatwg/html/pull/9754#issuecomment-1800850543,https://github.com/whatwg/html/pull/9754,Add showPicker to <select> elements,2023-11-08T01:20:34Z,domenic
1800419347,w3c/clipboard-apis,"@evanstade Please let me know if you have any concern with this change, thanks!",https://github.com/w3c/clipboard-apis/pull/198#issuecomment-1800419347,https://github.com/w3c/clipboard-apis/pull/198,Allow empty ClipboardItem.,2023-11-07T23:33:11Z,snianu
1800002909,WICG/webcomponents,Yes I have.,https://github.com/WICG/webcomponents/issues/1035#issuecomment-1800002909,https://github.com/WICG/webcomponents/issues/1035,DOM parts use outside of <template> seems unlikely,2023-11-07T20:36:36Z,matthewp
1799650132,WICG/webcomponents,"I don't think templating libraries will need two implementations.  Once there's a standard, there ",https://github.com/WICG/webcomponents/issues/1035#issuecomment-1799650132,https://github.com/WICG/webcomponents/issues/1035,DOM parts use outside of <template> seems unlikely,2023-11-07T19:12:56Z,EisenbergEffect
1799562893,webkit/standards-positions,Discussed this issue with privacy folks internally. Removing the support for web custom formats in d,https://github.com/WebKit/standards-positions/issues/144#issuecomment-1799562893,https://github.com/WebKit/standards-positions/issues/144,Delayed clipboard rendering,2023-11-07T18:54:12Z,snianu
1799540232,w3c/editing,Discussed this issue with privacy folks internally. Removing the support for web custom formats in d,https://github.com/w3c/editing/issues/439#issuecomment-1799540232,https://github.com/w3c/editing/issues/439,[Delayed Clipboard Rendering] Privacy issue while reading data for web custom types,2023-11-07T18:52:02Z,snianu
1799537944,w3c/pointerevents,Thanks @masayuki-nakano for filing this issue.  Wondering what UI Event spec says (or implies) about,https://github.com/w3c/pointerevents/issues/492#issuecomment-1799537944,https://github.com/w3c/pointerevents/issues/492,Clarify `mousedown` event target if the preceding `pointerdown` event listener removes the target,2023-11-07T18:50:30Z,mustaqahmed
1798776093,whatwg/html,"> I suggested NotSupportedError, but maybe NotAllowedError is also appropriate.  Apologies I misse",https://github.com/whatwg/html/pull/9754#issuecomment-1798776093,https://github.com/whatwg/html/pull/9754,Add showPicker to <select> elements,2023-11-07T14:57:31Z,lukewarlow
1798768370,whatwg/html,OK. It seems the picker is rendered in the top-left corner for hidden non-file input types in chromi,https://github.com/whatwg/html/pull/9754#issuecomment-1798768370,https://github.com/whatwg/html/pull/9754,Add showPicker to <select> elements,2023-11-07T14:54:19Z,zcorpan
1798541502,whatwg/html,Are there features for other browser-like applications defined in the spec?,https://github.com/whatwg/html/issues/9884#issuecomment-1798541502,https://github.com/whatwg/html/issues/9884,autocomplete tokens for EID and IMEI,2023-11-07T13:40:11Z,smaug----
1798533044,whatwg/html,That seems reasonable to me. @domenic thoughts?,https://github.com/whatwg/html/pull/9754#issuecomment-1798533044,https://github.com/whatwg/html/pull/9754,Add showPicker to <select> elements,2023-11-07T13:34:26Z,annevk
1798471415,whatwg/html,"See also https://github.com/openui/open-ui/issues/922 ",https://github.com/whatwg/html/issues/8335#issuecomment-1798471415,https://github.com/whatwg/html/issues/8335,Date picker access in contenteditable elements,2023-11-07T13:07:56Z,lukewarlow
1798461379,whatwg/html,"I've added that line but only with reference to select due to the comment above. @annevk would that ",https://github.com/whatwg/html/pull/9754#issuecomment-1798461379,https://github.com/whatwg/html/pull/9754,Add showPicker to <select> elements,2023-11-07T13:02:55Z,lukewarlow
1798155490,w3c/pointerevents,@smaug---- @mustaqahmed thoughts on this PR?,https://github.com/w3c/pointerevents/pull/491#issuecomment-1798155490,https://github.com/w3c/pointerevents/pull/491,Explain how a removed DOM node should be handled for boundary events.,2023-11-07T09:48:30Z,patrickhlauke
1798092252,whatwg/html,"This might be what `showPicker()` can offer at some point in the future, but it would need some more",https://github.com/whatwg/html/issues/8335#issuecomment-1798092252,https://github.com/whatwg/html/issues/8335,Date picker access in contenteditable elements,2023-11-07T09:10:40Z,annevk
1797973217,whatwg/html,+1,https://github.com/whatwg/html/issues/8335#issuecomment-1797973217,https://github.com/whatwg/html/issues/8335,Date picker access in contenteditable elements,2023-11-07T07:45:05Z,AndriusCTR
1797870212,whatwg/html,In prototyping an interesting case came up. After the replace navigation from the initial about:blan,https://github.com/whatwg/html/issues/9760#issuecomment-1797870212,https://github.com/whatwg/html/issues/9760,Expose information about last activation/cross-document navigation,2023-11-07T05:58:24Z,domenic
1797087974,w3c/clipboard-apis,@evanstade FYI..,https://github.com/w3c/clipboard-apis/issues/179#issuecomment-1797087974,https://github.com/w3c/clipboard-apis/issues/179,Should reading the clipboard throw DataError or empty clipboard items?,2023-11-07T00:39:13Z,snianu
1797005567,w3c/pointerlock,Thanks for sharing this feature request and your use cases. It definitely helps to understand the pr,https://github.com/w3c/pointerlock/issues/61#issuecomment-1797005567,https://github.com/w3c/pointerlock/issues/61,feature request : Allow to set pointer position upon release,2023-11-06T23:07:29Z,hvanops
1796757516,w3c/editcontext,"Yep, looks good to me now.",https://github.com/w3c/edit-context/issues/79#issuecomment-1796757516,https://github.com/w3c/edit-context/issues/79,Fix the Status section,2023-11-06T21:57:36Z,jyasskin
1796695970,w3c/editcontext,Seems like this might have been a Respec issue that got fixed. No changes have been made to the spec,https://github.com/w3c/edit-context/issues/79#issuecomment-1796695970,https://github.com/w3c/edit-context/issues/79,Fix the Status section,2023-11-06T21:52:23Z,dandclark
1796659281,whatwg/html,> It seems to me block-size for textarea is the most common use case. How much demand is there for t,https://github.com/whatwg/html/issues/6807#issuecomment-1796659281,https://github.com/whatwg/html/issues/6807,Allow <textarea> to size to its contents like <div contenteditable>,2023-11-06T21:49:32Z,bfgeek
1796508647,whatwg/html,Chromium currently supports showing picker for more than the file type (when not rendered). Should I,https://github.com/whatwg/html/pull/9754#issuecomment-1796508647,https://github.com/whatwg/html/pull/9754,Add showPicker to <select> elements,2023-11-06T21:20:31Z,lukewarlow
1796448745,whatwg/html,It seems to me block-size for `textarea` is the most common use case. How much demand is there for t,https://github.com/whatwg/html/issues/6807#issuecomment-1796448745,https://github.com/whatwg/html/issues/6807,Allow <textarea> to size to its contents like <div contenteditable>,2023-11-06T21:06:01Z,zcorpan
1796419437,whatwg/html,"In the `showPicker()` steps, just before calling ""Show the picker, if applicable"":  > If *this*  i",https://github.com/whatwg/html/pull/9754#issuecomment-1796419437,https://github.com/whatwg/html/pull/9754,Add showPicker to <select> elements,2023-11-06T20:55:30Z,zcorpan
1795903457,whatwg/html,"Just curious, which eSIM providers require IMEI? Airalo didn't require such info, is it common for p",https://github.com/whatwg/html/issues/9884#issuecomment-1795903457,https://github.com/whatwg/html/issues/9884,autocomplete tokens for EID and IMEI,2023-11-06T18:40:39Z,saschanaz
1795338473,whatwg/html,There's quite a few `<meta>` and `<link>` features for search engines and the like.,https://github.com/whatwg/html/issues/9884#issuecomment-1795338473,https://github.com/whatwg/html/issues/9884,autocomplete tokens for EID and IMEI,2023-11-06T16:21:23Z,annevk
1795312165,whatwg/html,"Sure, used by non-generic websites, and the feature could be fully used only when one browses them u",https://github.com/whatwg/html/issues/9884#issuecomment-1795312165,https://github.com/whatwg/html/issues/9884,autocomplete tokens for EID and IMEI,2023-11-06T16:11:23Z,smaug----
1795290363,whatwg/html,"> something (""characters"" a bad term here).  Gecko uses East Asian Width and General Category as f",https://github.com/whatwg/html/issues/9896#issuecomment-1795290363,https://github.com/whatwg/html/issues/9896,"""textarea wrapping transformation"" should reflect implementations",2023-11-06T16:07:03Z,hsivonen
1795214253,whatwg/html,These identifiers are expected to be used by a variety of non-Apple websites. Similar to those websi,https://github.com/whatwg/html/issues/9884#issuecomment-1795214253,https://github.com/whatwg/html/issues/9884,autocomplete tokens for EID and IMEI,2023-11-06T16:01:28Z,annevk
1795207147,whatwg/html,@zcorpan do you envisage any wording changes to the spec?,https://github.com/whatwg/html/pull/9754#issuecomment-1795207147,https://github.com/whatwg/html/pull/9754,Add showPicker to <select> elements,2023-11-06T15:57:45Z,lukewarlow
1795199036,whatwg/html,Is `wrap=hard` needed for web compat or would it be possible to remove it?,https://github.com/whatwg/html/issues/9896#issuecomment-1795199036,https://github.com/whatwg/html/issues/9896,"""textarea wrapping transformation"" should reflect implementations",2023-11-06T15:53:34Z,zcorpan
1795195645,whatwg/html,I don't think we should add these kinds of non-web features to the HTML spec. Sounds like they would,https://github.com/whatwg/html/issues/9884#issuecomment-1795195645,https://github.com/whatwg/html/issues/9884,autocomplete tokens for EID and IMEI,2023-11-06T15:51:58Z,smaug----
1795103926,whatwg/html,"I think it makes sense to require that the `select` element be rendered for `showPicker()` to work. ",https://github.com/whatwg/html/pull/9754#issuecomment-1795103926,https://github.com/whatwg/html/pull/9754,Add showPicker to <select> elements,2023-11-06T15:30:40Z,zcorpan
1795013695,whatwg/html,"`tags` was removed from Gecko in 2008 (Firefox 3), Chromium in 2014 and WebKit in 2017. It was remov",https://github.com/whatwg/html/pull/9908#issuecomment-1795013695,https://github.com/whatwg/html/pull/9908,HTMLAllCollection: add tags() method,2023-11-06T14:53:48Z,zcorpan
1794899314,w3ctag/design-reviews,"I see that https://github.com/w3ctag/design-reviews/issues/584 covered some aspects of this, the ::s",https://github.com/w3ctag/design-reviews/issues/913#issuecomment-1794899314,https://github.com/w3ctag/design-reviews/issues/913,CSS Spelling and Grammar Customization,2023-11-06T14:06:27Z,schenney-chromium
1794483431,whatwg/html,HTML Standard change is at https://github.com/whatwg/html/pull/9913 and basic test coverage at https,https://github.com/whatwg/html/issues/9884#issuecomment-1794483431,https://github.com/whatwg/html/issues/9884,autocomplete tokens for EID and IMEI,2023-11-06T10:10:35Z,annevk
1794401330,whatwg/fullscreen,Right of course good point.,https://github.com/whatwg/fullscreen/issues/124#issuecomment-1794401330,https://github.com/whatwg/fullscreen/issues/124,Impossible to customize the style of a dialog's ::backdrop residing inside a Shadow DOM.,2023-11-06T09:27:34Z,keithamus
1794309260,whatwg/html,"Done and done. Thanks for your input, @domenic!",https://github.com/whatwg/html/pull/9860#issuecomment-1794309260,https://github.com/whatwg/html/pull/9860,Define the `privacy-policy` link type.,2023-11-06T08:32:45Z,mikewest
1794277712,whatwg/html,"@dariok Yes there are definitely options available to mitigate the effects of a widespread breaking ",https://github.com/whatwg/html/issues/9848#issuecomment-1794277712,https://github.com/whatwg/html/issues/9848,"For the button element, make 'button' the default value for the type attribute (instead of 'submit')",2023-11-06T08:11:03Z,ni11c
1794258385,whatwg/fullscreen,@keithamus from that PR it seems like the only coverage for this is [`html/semantics/interactive-ele,https://github.com/whatwg/fullscreen/issues/124#issuecomment-1794258385,https://github.com/whatwg/fullscreen/issues/124,Impossible to customize the style of a dialog's ::backdrop residing inside a Shadow DOM.,2023-11-06T07:57:59Z,annevk
1794255443,whatwg/html,"I think this is ready to merge, but only because I've been following the discussion closely and spot",https://github.com/whatwg/html/pull/9860#issuecomment-1794255443,https://github.com/whatwg/html/pull/9860,Define the `privacy-policy` link type.,2023-11-06T07:55:43Z,domenic
1794237425,whatwg/html,"Hey folks, what are the next steps here? Can we merge it and #9877 (modulo any necessary cleanup), o",https://github.com/whatwg/html/pull/9860#issuecomment-1794237425,https://github.com/whatwg/html/pull/9860,Define the `privacy-policy` link type.,2023-11-06T07:40:45Z,mikewest
1794044624,whatwg/html,"Hello everyone, This discussion is very intriguing. I have one question.  I recall that since HTM",https://github.com/whatwg/html/pull/9546#issuecomment-1794044624,https://github.com/whatwg/html/pull/9546,Add switch attribute to the input element to allow for a two-state switch control.,2023-11-06T03:54:29Z,hiroya-uga
1793855596,whatwg/fullscreen,https://bugs.webkit.org/show_bug.cgi?id=263834 is now resolved.   Is it worth closing this issue o,https://github.com/whatwg/fullscreen/issues/124#issuecomment-1793855596,https://github.com/whatwg/fullscreen/issues/124,Impossible to customize the style of a dialog's ::backdrop residing inside a Shadow DOM.,2023-11-05T21:48:28Z,keithamus
