id,repo,body,url,issue_url,issue_title,created_at,user
1632855830,mozilla/standards-positions,"This is `positive`, for the reasons outlined in my post to the [main issues](https://github.com/w3c/",https://github.com/mozilla/standards-positions/issues/845#issuecomment-1632855830,https://github.com/mozilla/standards-positions/issues/845,"ManagedMediaSource API ",2023-07-12T16:29:44Z,padenot
1632776336,whatwg/html,"oh, but the 'inner settings object' is got from  https://html.spec.whatwg.org/multipage/workers.htm",https://github.com/whatwg/html/issues/9499#issuecomment-1632776336,https://github.com/whatwg/html/issues/9499,fetch client settings object isn't used in `fetch the descendants of and link a module script`,2023-07-12T15:41:04Z,allstarschh
1632728206,whatwg/html,"Yes I think the intention is to fetch a worker's descendant module scripts with the ""inner settings ",https://github.com/whatwg/html/issues/9499#issuecomment-1632728206,https://github.com/whatwg/html/issues/9499,fetch client settings object isn't used in `fetch the descendants of and link a module script`,2023-07-12T15:12:51Z,domfarolino
1632654696,w3ctag/design-reviews,"> can you clarify what do you mean by ""distinguish""  We now have the ability to say ""this `FileSys",https://github.com/w3ctag/design-reviews/issues/805#issuecomment-1632654696,https://github.com/w3ctag/design-reviews/issues/805,Moving local files with the File System Access API,2023-07-12T14:40:28Z,a-sully
1632642470,whatwg/html,"Thanks. OK I think this should be good to go, depending on what our policy for writing WPTs for `<ob",https://github.com/whatwg/html/pull/9464#issuecomment-1632642470,https://github.com/whatwg/html/pull/9464,Snapshot fallback base URL for about:-schemed Documents,2023-07-12T14:33:15Z,domfarolino
1632623471,whatwg/html,"I've checked the spec again, I am not sure if removing the 'fetch client settings object' is correct",https://github.com/whatwg/html/issues/9499#issuecomment-1632623471,https://github.com/whatwg/html/issues/9499,fetch client settings object isn't used in `fetch the descendants of and link a module script`,2023-07-12T14:22:25Z,allstarschh
1632583569,whatwg/html,"The question should not be ""will servers recognize that `application/*+json` matches `application/xy",https://github.com/whatwg/html/pull/9486#issuecomment-1632583569,https://github.com/whatwg/html/pull/9486,Use appropriate fetch destination for JSON&CSS modules,2023-07-12T13:59:00Z,nicolo-ribaudo
1632558155,whatwg/html,"@whatwg/triage there are no tagged issues for triage yet. If none are raised by the time we meet, I ",https://github.com/whatwg/html/issues/9474#issuecomment-1632558155,https://github.com/whatwg/html/issues/9474,Upcoming HTML standard issue triage meeting on 7/13/2023,2023-07-12T13:44:12Z,past
1632549867,whatwg/html,"That's embarrassing! Yep, I uploaded https://github.com/whatwg/html/pull/9510 to finish this off.",https://github.com/whatwg/html/issues/9499#issuecomment-1632549867,https://github.com/whatwg/html/issues/9499,fetch client settings object isn't used in `fetch the descendants of and link a module script`,2023-07-12T13:39:22Z,domfarolino
1632477644,whatwg/html,"The algorithm still has the 'a fetch client settings object' argument,  https://html.spec.whatwg.or",https://github.com/whatwg/html/issues/9499#issuecomment-1632477644,https://github.com/whatwg/html/issues/9499,fetch client settings object isn't used in `fetch the descendants of and link a module script`,2023-07-12T12:54:03Z,allstarschh
1632361995,whatwg/html,"@stevefaulkner so -1 meaning ""the phrasing in the spec should be reworded to give more nuance"", i as",https://github.com/whatwg/html/issues/8650#issuecomment-1632361995,https://github.com/whatwg/html/issues/8650,Do `<td>` elements inside a `<thead>` get automagically promoted to act like `<th>`,2023-07-12T11:30:11Z,patrickhlauke
1632353843,whatwg/html,"-1 from me, it is not uncommon the have a `<td>` element in a `<thead>` that does indeed represent a",https://github.com/whatwg/html/issues/8650#issuecomment-1632353843,https://github.com/whatwg/html/issues/8650,Do `<td>` elements inside a `<thead>` get automagically promoted to act like `<th>`,2023-07-12T11:24:05Z,stevefaulkner
1632163847,whatwg/html,Returning to this dangling thread ... I believe the situation touched on in https://github.com/w3c/h,https://github.com/whatwg/html/issues/8650#issuecomment-1632163847,https://github.com/whatwg/html/issues/8650,Do `<td>` elements inside a `<thead>` get automagically promoted to act like `<th>`,2023-07-12T09:26:32Z,patrickhlauke
1631920091,whatwg/html,"From a spectator's point of view this all sounds very complicated to be honest. `dialogmodaltarget` ",https://github.com/whatwg/html/pull/9456#issuecomment-1631920091,https://github.com/whatwg/html/pull/9456,add dialogmodaltarget attribute,2023-07-12T06:23:51Z,jpzwarte
1631885555,whatwg/html,"> * navigate step 19 sets initiator origin, and _sometimes_ sets origin.  This is probably OK. Ori",https://github.com/whatwg/html/issues/9460#issuecomment-1631885555,https://github.com/whatwg/html/issues/9460,Should we assign #document-state-origin on new child navigable creation?,2023-07-12T05:44:04Z,domenic
1631877548,whatwg/html,"@annevk knows more about Fetch than me, but here's my initial stab at some answers:  I think a des",https://github.com/whatwg/html/pull/9486#issuecomment-1631877548,https://github.com/whatwg/html/pull/9486,Use appropriate fetch destination for JSON&CSS modules,2023-07-12T05:35:14Z,domenic
1631862193,whatwg/html,"I'm actually pretty confused now. Looking at all the places that create a ""new document state"":  -",https://github.com/whatwg/html/issues/9460#issuecomment-1631862193,https://github.com/whatwg/html/issues/9460,Should we assign #document-state-origin on new child navigable creation?,2023-07-12T05:14:01Z,domenic
1631849130,whatwg/html,"I guess it also applies to style? That doesn't seem to be specified, as far as I can tell...  This",https://github.com/whatwg/html/issues/9505#issuecomment-1631849130,https://github.com/whatwg/html/issues/9505,Add nonce as a Content attribute for <link>,2023-07-12T04:58:45Z,domenic
1631842605,whatwg/html,`nonce` is actually a global content attribute: https://html.spec.whatwg.org/#global-attributes:attr,https://github.com/whatwg/html/issues/9505#issuecomment-1631842605,https://github.com/whatwg/html/issues/9505,Add nonce as a Content attribute for <link>,2023-07-12T04:50:12Z,domenic
1631668255,webkit/standards-positions," > I don't think mutation events are the reason reparenting iframe without reloading is hard.  I ",https://github.com/WebKit/standards-positions/issues/192#issuecomment-1631668255,https://github.com/WebKit/standards-positions/issues/192,Deprecation / Removal of Mutation Events,2023-07-12T00:13:50Z,mfreed7
1631541175,whatwg/html,"> Can you say more?  It's easier for users to reason at a glance, or for downstream tooling (e.g. ",https://github.com/whatwg/html/pull/9456#issuecomment-1631541175,https://github.com/whatwg/html/pull/9456,add dialogmodaltarget attribute,2023-07-11T21:34:05Z,keithamus
1631516060,whatwg/html,"Thanks for filing this. I think this is a result of https://github.com/whatwg/html/pull/8253. Prior ",https://github.com/whatwg/html/issues/9499#issuecomment-1631516060,https://github.com/whatwg/html/issues/9499,fetch client settings object isn't used in `fetch the descendants of and link a module script`,2023-07-11T21:12:23Z,domfarolino
1631495569,whatwg/html,@smaug---- bump. Does the comment above address your questions?,https://github.com/whatwg/html/issues/8782#issuecomment-1631495569,https://github.com/whatwg/html/issues/8782,Detect UA transitions on same-document navigations,2023-07-11T20:54:16Z,khushalsagar
1631493095,whatwg/html,> The benefit of having something like `hoveraction=` (although I'd really like to avoid `hover`) is,https://github.com/whatwg/html/pull/9456#issuecomment-1631493095,https://github.com/whatwg/html/pull/9456,add dialogmodaltarget attribute,2023-07-11T20:52:03Z,mfreed7
1631468187,w3ctag/design-reviews,Following up here to check if there are any other concerns or questions from TAG regarding this feat,https://github.com/w3ctag/design-reviews/issues/853#issuecomment-1631468187,https://github.com/w3ctag/design-reviews/issues/853,HTTPS Upgrades,2023-07-11T20:29:47Z,christhompson
1631321281,whatwg/html,@a-sully @Bodhizafa i extensive use opfs on my awesome os project the right way to do it is to creat,https://github.com/whatwg/html/issues/8362#issuecomment-1631321281,https://github.com/whatwg/html/issues/8362,Allow workers & shared workers to be created within a service worker,2023-07-11T18:39:32Z,frank-dspeed
1631246579,whatwg/html,"Ok, I added parameters to check popover validity and hide popover in order to make removeAttribute('",https://github.com/whatwg/html/pull/9457#issuecomment-1631246579,https://github.com/whatwg/html/pull/9457,Ignore DOM state when hiding popovers if needed,2023-07-11T17:51:37Z,josepharhar
1631082357,w3c/pointerevents,"Using the dblclick event would not work, since Mathlive is doing ""double click to select text"".  T",https://github.com/w3c/pointerevents/issues/98#issuecomment-1631082357,https://github.com/w3c/pointerevents/issues/98,What should be the 'detail' property of pointer events?,2023-07-11T15:55:29Z,stefnotch
1630947298,w3c/pointerevents,> Does that mean there's no good and cross-platform way of detecting a doubleclick?  If a site use,https://github.com/w3c/pointerevents/issues/98#issuecomment-1630947298,https://github.com/w3c/pointerevents/issues/98,What should be the 'detail' property of pointer events?,2023-07-11T14:34:15Z,mustaqahmed
1630871217,w3ctag/design-reviews,"@schwering and @stephenmcgruer, although you have likely already received input from some stakeholde",https://github.com/w3ctag/design-reviews/issues/831#issuecomment-1630871217,https://github.com/w3ctag/design-reviews/issues/831,Eligibility for autofill,2023-07-11T13:49:30Z,ianbjacobs
1630809916,whatwg/html,"@annevk zcorpan is out of office. Can you address the nit and I'll file the implementation bugs, MDN",https://github.com/whatwg/html/pull/9490#issuecomment-1630809916,https://github.com/whatwg/html/pull/9490,Make dirname apply to hidden/tel/url/email inputs,2023-07-11T13:14:10Z,vinhill
1630790895,whatwg/html,The benefit of having something like `hoveraction=` (although I'd really like to avoid `hover`) is t,https://github.com/whatwg/html/pull/9456#issuecomment-1630790895,https://github.com/whatwg/html/pull/9456,add dialogmodaltarget attribute,2023-07-11T13:03:06Z,keithamus
1630777290,whatwg/html,"> Can you make your membership in the Intel GitHub organization public, to appease the IPR bots?  ",https://github.com/whatwg/html/pull/9498#issuecomment-1630777290,https://github.com/whatwg/html/pull/9498,"Editorial: Use the right ""active document"" definition in a focus algorithm",2023-07-11T12:54:48Z,rakuco
1630628104,whatwg/html,I'm not sure if I should open a new issue but I'd like to ask a similar question. What is the differ,https://github.com/whatwg/html/issues/3780#issuecomment-1630628104,https://github.com/whatwg/html/issues/3780,"Clarify what is `change` event in input[type=file]? ",2023-07-11T11:09:55Z,imageck
1630537386,whatwg/html,"> I don't really have a strong opinion here, but I guess the most simple solutions would be: >  > ",https://github.com/whatwg/html/issues/9487#issuecomment-1630537386,https://github.com/whatwg/html/issues/9487,"Showing only a child popover causes ""beforetoggle"" and ""toggle"" events but popover is invisble",2023-07-11T10:03:46Z,mbrodesser-Igalia
1630501712,whatwg/html,"I don't really have a strong opinion here, but I guess the most simple solutions would be: * throw ",https://github.com/whatwg/html/issues/9487#issuecomment-1630501712,https://github.com/whatwg/html/issues/9487,"Showing only a child popover causes ""beforetoggle"" and ""toggle"" events but popover is invisble",2023-07-11T09:42:53Z,nt1m
1630493868,whatwg/html,"> I'm tempted to say we don't really need to address this, it's like the case you're putting a popov",https://github.com/whatwg/html/issues/9487#issuecomment-1630493868,https://github.com/whatwg/html/issues/9487,"Showing only a child popover causes ""beforetoggle"" and ""toggle"" events but popover is invisble",2023-07-11T09:39:33Z,mbrodesser-Igalia
1630487890,whatwg/html,> In order to resolve this we could add a step to check popover validity which looks for the closest,https://github.com/whatwg/html/issues/9487#issuecomment-1630487890,https://github.com/whatwg/html/issues/9487,"Showing only a child popover causes ""beforetoggle"" and ""toggle"" events but popover is invisble",2023-07-11T09:35:46Z,mbrodesser-Igalia
1630466911,whatwg/html,"> > However, that doesn't cover the case when a popover is transitioning from ""showing"" to ""hidden"".",https://github.com/whatwg/html/issues/9459#issuecomment-1630466911,https://github.com/whatwg/html/issues/9459,"When atrribute value changes, do we run hiding popover algorithm regardless?",2023-07-11T09:20:46Z,mbrodesser-Igalia
1630321724,w3ctag/design-reviews,"Hi @a-sully - can you clarify what do you mean by ""distinguish""? Do you mean that the spec itself wo",https://github.com/w3ctag/design-reviews/issues/805#issuecomment-1630321724,https://github.com/w3ctag/design-reviews/issues/805,Moving local files with the File System Access API,2023-07-11T07:46:57Z,torgo
1630309208,mozilla/standards-positions,"Firefox is the only browser that doesn't have this by default, why? You have to manually turn it on ",https://github.com/mozilla/standards-positions/issues/528#issuecomment-1630309208,https://github.com/mozilla/standards-positions/issues/528,Request for Mozilla Position on :has pseudo class,2023-07-11T07:38:00Z,coolCucumber-cat
1630283533,w3ctag/design-reviews,"> The fenced frames proposal does not depend on Shared Storage, no.  Thanks @domfarolino. I think ",https://github.com/w3ctag/design-reviews/issues/838#issuecomment-1630283533,https://github.com/w3ctag/design-reviews/issues/838,Specification review for fenced frames,2023-07-11T07:19:38Z,torgo
1630277503,whatwg/html,> This seems like a normative change which normally has a PR template. How can be sure implementatio,https://github.com/whatwg/html/pull/9481#issuecomment-1630277503,https://github.com/whatwg/html/pull/9481,"Set popover invoker immediately after changing popover's visibility state to ""showing""",2023-07-11T07:15:14Z,mbrodesser-Igalia
1630215214,w3ctag/design-reviews,> I was really hopeful that https://github.com/WICG/fenced-frame/blob/master/explainer/README.md wou,https://github.com/w3ctag/design-reviews/issues/838#issuecomment-1630215214,https://github.com/w3ctag/design-reviews/issues/838,Specification review for fenced frames,2023-07-11T06:22:45Z,rhiaro
1630167414,w3c/pointerevents,That'd be a shame. Does that mean there's no good and cross-platform way of detecting a doubleclick?,https://github.com/w3c/pointerevents/issues/98#issuecomment-1630167414,https://github.com/w3c/pointerevents/issues/98,What should be the 'detail' property of pointer events?,2023-07-11T05:35:40Z,stefnotch
1629916947,mozilla/standards-positions,> I'm a bit confused about this... I guess the idea would be that anchor would be looked up after tr,https://github.com/mozilla/standards-positions/issues/836#issuecomment-1629916947,https://github.com/mozilla/standards-positions/issues/836,HTML anchor attribute,2023-07-11T00:29:28Z,josepharhar
1629896806,whatwg/html,"I'm tempted to say we don't really need to address this, it's like the case you're putting a popover",https://github.com/whatwg/html/issues/9487#issuecomment-1629896806,https://github.com/whatwg/html/issues/9487,"Showing only a child popover causes ""beforetoggle"" and ""toggle"" events but popover is invisble",2023-07-11T00:03:20Z,nt1m
1629877628,whatwg/html,In order to resolve this we could add a step to check popover validity which looks for the closest p,https://github.com/whatwg/html/issues/9487#issuecomment-1629877628,https://github.com/whatwg/html/issues/9487,"Showing only a child popover causes ""beforetoggle"" and ""toggle"" events but popover is invisble",2023-07-10T23:41:02Z,josepharhar
1629869236,whatwg/html,"> I guess there's already a test which contradicts the current specification?  Yes, the current as",https://github.com/whatwg/html/pull/9481#issuecomment-1629869236,https://github.com/whatwg/html/pull/9481,"Set popover invoker immediately after changing popover's visibility state to ""showing""",2023-07-10T23:30:27Z,josepharhar
1629858463,whatwg/html,"> Just like event listeners, we could do `hoveraction=""..."" hoveractiontarget=""""`  Yeah, I suppose",https://github.com/whatwg/html/pull/9456#issuecomment-1629858463,https://github.com/whatwg/html/pull/9456,add dialogmodaltarget attribute,2023-07-10T23:18:23Z,mfreed7
1629792179,whatwg/html,"> However, that doesn't cover the case when a popover is transitioning from ""showing"" to ""hidden"". S",https://github.com/whatwg/html/issues/9459#issuecomment-1629792179,https://github.com/whatwg/html/issues/9459,"When atrribute value changes, do we run hiding popover algorithm regardless?",2023-07-10T22:02:56Z,josepharhar
1629737759,whatwg/html,"> I think it'd also be nice to define action=""auto"" and have that be the default, so that the action",https://github.com/whatwg/html/pull/9456#issuecomment-1629737759,https://github.com/whatwg/html/pull/9456,add dialogmodaltarget attribute,2023-07-10T21:10:54Z,nt1m
1629723990,whatwg/html,"> ...but before we get too much into the details of this, I want to check-in if Chrome folks are OK ",https://github.com/whatwg/html/pull/9456#issuecomment-1629723990,https://github.com/whatwg/html/pull/9456,add dialogmodaltarget attribute,2023-07-10T20:59:33Z,mfreed7
1629714649,w3ctag/design-reviews,I've filed https://github.com/WICG/shared-storage/issues/98 to note that any shared storage-specific,https://github.com/w3ctag/design-reviews/issues/838#issuecomment-1629714649,https://github.com/w3ctag/design-reviews/issues/838,Specification review for fenced frames,2023-07-10T20:52:07Z,domfarolino
1629712447,w3c/pointerevents,"the point seems to be that `details` is an old, legacy, and unreliable property. so despite comments",https://github.com/w3c/pointerevents/issues/98#issuecomment-1629712447,https://github.com/w3c/pointerevents/issues/98,What should be the 'detail' property of pointer events?,2023-07-10T20:50:16Z,patrickhlauke
1629675502,w3c/pointerevents,That's a good point. I suppose Mathlive's code usually ends up using the manual option for detecting,https://github.com/w3c/pointerevents/issues/98#issuecomment-1629675502,https://github.com/w3c/pointerevents/issues/98,What should be the 'detail' property of pointer events?,2023-07-10T20:20:32Z,stefnotch
1629669969,mozilla/standards-positions,"In the case of `""cache""`, it is subject to whatever cache partitioning scheme the UA uses (e.g., if ",https://github.com/mozilla/standards-positions/issues/824#issuecomment-1629669969,https://github.com/mozilla/standards-positions/issues/824,ResourceTiming - deliveryType,2023-07-10T20:16:22Z,jeremyroman
1629663241,whatwg/html,> One way to alleviate this issue is making showModal the default  I agree that making showModal t,https://github.com/whatwg/html/pull/9456#issuecomment-1629663241,https://github.com/whatwg/html/pull/9456,add dialogmodaltarget attribute,2023-07-10T20:11:25Z,josepharhar
1629661793,whatwg/html,"> I want to check-in if Chrome folks are OK with such a late stage rename, because this does imply u",https://github.com/whatwg/html/pull/9456#issuecomment-1629661793,https://github.com/whatwg/html/pull/9456,add dialogmodaltarget attribute,2023-07-10T20:10:28Z,josepharhar
1629654754,mozilla/standards-positions,"How is this not revealing something new about user's browsing behavior, in other words, why is this ",https://github.com/mozilla/standards-positions/issues/824#issuecomment-1629654754,https://github.com/mozilla/standards-positions/issues/824,ResourceTiming - deliveryType,2023-07-10T20:04:50Z,smaug----
1629650334,mozilla/standards-positions,"As explained in the spec issue, we think some more generic approach would be better for this use cas",https://github.com/mozilla/standards-positions/issues/834#issuecomment-1629650334,https://github.com/mozilla/standards-positions/issues/834,`dialogmodaltarget` attribute,2023-07-10T20:01:20Z,smaug----
1629606582,w3ctag/design-reviews,I'm not aware of interest from other browsers for Shared Storage. There is certainly web developer i,https://github.com/w3ctag/design-reviews/issues/747#issuecomment-1629606582,https://github.com/w3ctag/design-reviews/issues/747,Shared Storage API,2023-07-10T19:33:28Z,jkarlin
1629600263,w3c/pointerevents,The `event.detail` field is currently well-defined in the specs: it gives the click-count for [`clic,https://github.com/w3c/pointerevents/issues/98#issuecomment-1629600263,https://github.com/w3c/pointerevents/issues/98,What should be the 'detail' property of pointer events?,2023-07-10T19:29:16Z,mustaqahmed
1629577542,w3ctag/design-reviews,"The fenced frames proposal does not depend on Shared Storage, no. Shared Storage in some part depend",https://github.com/w3ctag/design-reviews/issues/838#issuecomment-1629577542,https://github.com/w3ctag/design-reviews/issues/838,Specification review for fenced frames,2023-07-10T19:17:43Z,domfarolino
1629533922,w3ctag/design-reviews,It was brought to my attention today that my comment above could be clearer. To clarify: we pay atte,https://github.com/w3ctag/design-reviews/issues/747#issuecomment-1629533922,https://github.com/w3ctag/design-reviews/issues/747,Shared Storage API,2023-07-10T18:56:18Z,torgo
1629441796,w3c/pointerevents,Is there an issue that I can follow regarding the `clickCount`? I know of one library that has to do,https://github.com/w3c/pointerevents/issues/98#issuecomment-1629441796,https://github.com/w3c/pointerevents/issues/98,What should be the 'detail' property of pointer events?,2023-07-10T17:55:16Z,stefnotch
1629390734,mozilla/standards-positions,I'm a bit confused about this... I guess the idea would be that `anchor` would be looked up after tr,https://github.com/mozilla/standards-positions/issues/836#issuecomment-1629390734,https://github.com/mozilla/standards-positions/issues/836,HTML anchor attribute,2023-07-10T17:18:39Z,emilio
1629384878,w3ctag/design-reviews,Hi there. Just to reiterate @torgo's last point - I've found it challenging to review this across an,https://github.com/w3ctag/design-reviews/issues/838#issuecomment-1629384878,https://github.com/w3ctag/design-reviews/issues/838,Specification review for fenced frames,2023-07-10T17:14:27Z,rhiaro
1629372135,w3ctag/design-reviews,"> Hi there @natechapin, @domenic, a quick request for clarification: >  > > * Security and Privacy",https://github.com/w3ctag/design-reviews/issues/867#issuecomment-1629372135,https://github.com/w3ctag/design-reviews/issues/867,navigateEvent.sourceElement,2023-07-10T17:06:24Z,natechapin
1629360709,w3ctag/design-reviews,Hi @domfarolino - Some notes from our TAG breakout today:  We're noting that we had previously revie,https://github.com/w3ctag/design-reviews/issues/838#issuecomment-1629360709,https://github.com/w3ctag/design-reviews/issues/838,Specification review for fenced frames,2023-07-10T16:58:58Z,torgo
1629223383,whatwg/html,This seems like a normative change which normally has a PR template. How can be sure implementations,https://github.com/whatwg/html/pull/9481#issuecomment-1629223383,https://github.com/whatwg/html/pull/9481,"Set popover invoker immediately after changing popover's visibility state to ""showing""",2023-07-10T15:44:21Z,annevk
1629164895,whatwg/html,Nope I don't think so.,https://github.com/whatwg/html/pull/9464#issuecomment-1629164895,https://github.com/whatwg/html/pull/9464,Snapshot fallback base URL for about:-schemed Documents,2023-07-10T15:10:23Z,domfarolino
1629135420,whatwg/html,Are there document.open() + about:srcdoc scenarios we need to test in addition to [document-base-url,https://github.com/whatwg/html/pull/9464#issuecomment-1629135420,https://github.com/whatwg/html/pull/9464,Snapshot fallback base URL for about:-schemed Documents,2023-07-10T14:53:37Z,wjmaclean
1629000691,whatwg/html,The current behavior across browsers can be viewed at https://ccameron-chromium.github.io/webgl-exa,https://github.com/whatwg/html/issues/9112#issuecomment-1629000691,https://github.com/whatwg/html/issues/9112,Standardize rendering of PQ and HLG HDR image content,2023-07-10T13:44:25Z,ccameron-chromium
1628946062,mozilla/standards-positions,"This is very odd, very very odd. We don't have anything like this elsewhere in the platform.",https://github.com/mozilla/standards-positions/issues/744#issuecomment-1628946062,https://github.com/mozilla/standards-positions/issues/744,Skip service worker no-op fetch handler,2023-07-10T13:20:37Z,smaug----
1628938829,whatwg/html,> I suppose it would make sense to disallow this for popover=auto elements where the hierarchy means,https://github.com/whatwg/html/issues/9487#issuecomment-1628938829,https://github.com/whatwg/html/issues/9487,"Showing only a child popover causes ""beforetoggle"" and ""toggle"" events but popover is invisble",2023-07-10T13:16:17Z,mbrodesser-Igalia
1628922457,whatwg/html,"Oh, maybe content attributes are those that should be exposed to JS? In that case we could close thi",https://github.com/whatwg/html/issues/9505#issuecomment-1628922457,https://github.com/whatwg/html/issues/9505,Add nonce as a Content attribute for <link>,2023-07-10T13:05:53Z,evilpie
