id,repo,body,url,issue_url,issue_title,created_at,user
1882843263,whatwg/html,"I would suggest we fix this as follows:  - Make ""activation behavior"" and its legacy counterparts ",https://github.com/whatwg/html/issues/1567#issuecomment-1882843263,https://github.com/whatwg/html/issues/1567,<button> shouldn't have activation behavior when it is not in a form,2024-01-09T10:50:20Z,annevk
1882837726,whatwg/html,It also happens to be the case that a negation is the easiest (only?) way to target text inputs with,https://github.com/whatwg/html/pull/10025#issuecomment-1882837726,https://github.com/whatwg/html/pull/10025,Don't clip range/checkbox/radio overflow to border box.,2024-01-09T10:46:53Z,emilio
1882834062,whatwg/html,"> If we do this as-is and thus agree clipping is preferred, #9546 (switch) will need to add `, input",https://github.com/whatwg/html/pull/10025#issuecomment-1882834062,https://github.com/whatwg/html/pull/10025,Don't clip range/checkbox/radio overflow to border box.,2024-01-09T10:44:39Z,emilio
1882826612,whatwg/html,"You mean for listbox or non-listbox select? For non-listbox, you're seeing the border / padding in t",https://github.com/whatwg/html/issues/10031#issuecomment-1882826612,https://github.com/whatwg/html/issues/10031,[forms] <select> element clip is not specified and not interoperable,2024-01-09T10:40:16Z,emilio
1882824914,whatwg/html,"If we do this as-is and thus agree clipping is preferred, #9546 (switch) will need to add `, input[t",https://github.com/whatwg/html/pull/10025#issuecomment-1882824914,https://github.com/whatwg/html/pull/10025,Don't clip range/checkbox/radio overflow to border box.,2024-01-09T10:39:12Z,annevk
1882820105,whatwg/html,If you set width and height to something like 5px I don't see clipping but some kind of minimum size,https://github.com/whatwg/html/issues/10031#issuecomment-1882820105,https://github.com/whatwg/html/issues/10031,[forms] <select> element clip is not specified and not interoperable,2024-01-09T10:36:23Z,annevk
1882818400,whatwg/html,"Tests in https://phabricator.services.mozilla.com/D197457 cover all input types, fwiw. Other than th",https://github.com/whatwg/html/pull/10025#issuecomment-1882818400,https://github.com/whatwg/html/pull/10025,Don't clip range/checkbox/radio overflow to border box.,2024-01-09T10:35:26Z,emilio
1882812391,whatwg/html,I think what I'd like is that as part of this change we add test coverage for all types and get agre,https://github.com/whatwg/html/pull/10025#issuecomment-1882812391,https://github.com/whatwg/html/pull/10025,Don't clip range/checkbox/radio overflow to border box.,2024-01-09T10:31:38Z,annevk
1882787811,whatwg/html,"Yeah, I think I mis-tested Webkit, thanks for pointing that out. However I think this is still a pro",https://github.com/whatwg/html/pull/10025#issuecomment-1882787811,https://github.com/whatwg/html/pull/10025,Don't clip range/checkbox/radio overflow to border box.,2024-01-09T10:17:25Z,emilio
1882778794,whatwg/html,"I think with respect to #9994 that's true, but the claim above about it happening across browsers is",https://github.com/whatwg/html/pull/10025#issuecomment-1882778794,https://github.com/whatwg/html/pull/10025,Don't clip range/checkbox/radio overflow to border box.,2024-01-09T10:12:07Z,annevk
1882758944,whatwg/html,"> @emilio `data:text/html,<input%20type=file%20style=width:10px;height:10px>` does not clip for me i",https://github.com/whatwg/html/pull/10025#issuecomment-1882758944,https://github.com/whatwg/html/pull/10025,Don't clip range/checkbox/radio overflow to border box.,2024-01-09T10:00:29Z,emilio
1882744832,whatwg/html,"cc @pxlcoder ",https://github.com/whatwg/html/pull/10025#issuecomment-1882744832,https://github.com/whatwg/html/pull/10025,Don't clip range/checkbox/radio overflow to border box.,2024-01-09T09:52:03Z,annevk
1882741825,whatwg/html,"@Emilio `data:text/html,<input%20type=file%20style=width:10px;height:10px>` does not clip for me in ",https://github.com/whatwg/html/pull/10025#issuecomment-1882741825,https://github.com/whatwg/html/pull/10025,Don't clip range/checkbox/radio overflow to border box.,2024-01-09T09:50:11Z,annevk
1882703604,whatwg/html,@yisibl can't you override individual controls using `writing-mode` directly on them?,https://github.com/whatwg/html/issues/4177#issuecomment-1882703604,https://github.com/whatwg/html/issues/4177,Rendering <input type=range> vertically,2024-01-09T09:30:51Z,annevk
1882703047,w3ctag/design-reviews,We would really appreciate if you could do some additional review about unintended privacy / securit,https://github.com/w3ctag/design-reviews/issues/909#issuecomment-1882703047,https://github.com/w3ctag/design-reviews/issues/909,Permissions Policy Reporting and Report-Only mode,2024-01-09T09:30:32Z,torgo
1882694838,w3ctag/design-reviews,> Hi @noamr - thanks for sending this our way. >  > A couple of initial questions we had after rev,https://github.com/w3ctag/design-reviews/issues/921#issuecomment-1882694838,https://github.com/w3ctag/design-reviews/issues/921,Navigation Activation Info,2024-01-09T09:25:28Z,noamr
1882664982,w3ctag/design-reviews,Hi @archiv thanks again for sending this our way.  We're happy with the way this is proceeding. We'r,https://github.com/w3ctag/design-reviews/issues/906#issuecomment-1882664982,https://github.com/w3ctag/design-reviews/issues/906,Extending Storage Access API (SAA) to non-cookie storage,2024-01-09T09:07:20Z,torgo
1882642431,w3ctag/design-reviews,Hi @noamr - thanks for sending this our way.     A couple of initial questions we had after review,https://github.com/w3ctag/design-reviews/issues/921#issuecomment-1882642431,https://github.com/w3ctag/design-reviews/issues/921,Navigation Activation Info,2024-01-09T08:52:57Z,torgo
1882493684,whatwg/html,@domenic  Sorry for being late. I added the description which specifies that ports get disentangled,https://github.com/whatwg/html/pull/9933#issuecomment-1882493684,https://github.com/whatwg/html/pull/9933,MessagePort API:add a close event,2024-01-09T06:41:44Z,nononokam
1882405628,w3ctag/design-reviews,"Thank you for the suggestion.  > Can you please add alternatives considered, and reasons why those",https://github.com/w3ctag/design-reviews/issues/890#issuecomment-1882405628,https://github.com/w3ctag/design-reviews/issues/890,`field-sizing` CSS property,2024-01-09T04:45:08Z,tkent-google
1882383830,whatwg/html,"Yes, this looks like a typo! A PR to fix it would be welcome.",https://github.com/whatwg/html/issues/10028#issuecomment-1882383830,https://github.com/whatwg/html/issues/10028,Minor error in import map example?,2024-01-09T04:10:22Z,domenic
1882367251,w3ctag/design-reviews,> (what is singleton-per-top-level-traversable-nature?).  There is only one document PiP window al,https://github.com/w3ctag/design-reviews/issues/798#issuecomment-1882367251,https://github.com/w3ctag/design-reviews/issues/798,Early design review: Document Picture-in-Picture,2024-01-09T03:45:08Z,domenic
1882296587,whatwg/html,> Vertical `<input type=range>` should behave similarly to vertical `<meter>` and `<progress` elemen,https://github.com/whatwg/html/issues/4177#issuecomment-1882296587,https://github.com/whatwg/html/issues/4177,Rendering <input type=range> vertically,2024-01-09T03:09:32Z,yisibl
1882113917,mozilla/standards-positions,Great to hear this is an option!  It would be nice to see https://mozilla.github.io/standards-positi,https://github.com/mozilla/standards-positions/issues/687#issuecomment-1882113917,https://github.com/mozilla/standards-positions/issues/687,Re-request for postion on Web Serial/Serial API,2024-01-09T01:14:33Z,scheib
1882036561,WICG/webcomponents,I don't see how this is possible without new API that frameworks use. Ideally frameworks would be fl,https://github.com/WICG/webcomponents/issues/1043#issuecomment-1882036561,https://github.com/WICG/webcomponents/issues/1043,[scoped-registries] Consider future expansion to allow using a registry without new API,2024-01-09T00:21:00Z,justinfagnani
1882003402,WICG/webcomponents,"as a web component library author, i think a big part of this scoping use case is how to design/impl",https://github.com/WICG/webcomponents/issues/1043#issuecomment-1882003402,https://github.com/WICG/webcomponents/issues/1043,[scoped-registries] Consider future expansion to allow using a registry without new API,2024-01-08T23:55:20Z,michaelwarren1106
1881963210,whatwg/html,"(WebKit uses a custom RenderListBox that inherits from ScrollableArea, which I think Blink has refac",https://github.com/whatwg/html/issues/10031#issuecomment-1881963210,https://github.com/whatwg/html/issues/10031,[forms] <select> element clip is not specified and not interoperable,2024-01-08T23:08:45Z,nt1m
1881962796,WICG/webcomponents,"Oh shoot, sorry, I miscalculated my timezone and missed today's meeting :(",https://github.com/WICG/webcomponents/issues/1031#issuecomment-1881962796,https://github.com/WICG/webcomponents/issues/1031,Quarterly Face to Face Scheduling,2024-01-08T23:08:18Z,rniwa
1881961804,whatwg/html,"> It is clipped internally. Confusingly, it's [explicitly set](https://source.chromium.org/chromium/",https://github.com/whatwg/html/issues/10031#issuecomment-1881961804,https://github.com/whatwg/html/issues/10031,[forms] <select> element clip is not specified and not interoperable,2024-01-08T23:07:12Z,emilio
1881938613,WICG/webcomponents,I think a better solution will be to have `createElement` function on a custom element registry itse,https://github.com/WICG/webcomponents/issues/1043#issuecomment-1881938613,https://github.com/WICG/webcomponents/issues/1043,[scoped-registries] Consider future expansion to allow using a registry without new API,2024-01-08T22:43:57Z,rniwa
1881924232,whatwg/html,> WebKit and Blink probably do the same (clipping internally?).  It is clipped internally. Confusi,https://github.com/whatwg/html/issues/10031#issuecomment-1881924232,https://github.com/whatwg/html/issues/10031,[forms] <select> element clip is not specified and not interoperable,2024-01-08T22:31:14Z,mfreed7
1881879586,whatwg/html,"> I'm playing with Declarative shadow dom and found that, if a stylesheet is loaded inside a declara",https://github.com/whatwg/html/issues/9232#issuecomment-1881879586,https://github.com/whatwg/html/issues/9232,Clarification for <link> behavior in Declarative Shadow DOM,2024-01-08T21:52:31Z,mfreed7
1881794171,w3c/clipboard-apis,"Yes, happy to discuss there.",https://github.com/w3c/clipboard-apis/issues/191#issuecomment-1881794171,https://github.com/w3c/clipboard-apis/issues/191,Read Blob data for the supported formats on-demand during getType.,2024-01-08T20:45:41Z,evanstade
1881786193,whatwg/html,Related: https://github.com/whatwg/html/issues/10013#issuecomment-1878996462,https://github.com/whatwg/html/issues/10011#issuecomment-1881786193,https://github.com/whatwg/html/issues/10011,Textarea user interacted flag doesn't seem to be set to true unless by form submission.,2024-01-08T20:39:16Z,josepharhar
1881746085,WICG/webcomponents,"For any last-minute joiner, the first half of today's session with use [this video link](http://meet",https://github.com/WICG/webcomponents/issues/1031#issuecomment-1881746085,https://github.com/WICG/webcomponents/issues/1031,Quarterly Face to Face Scheduling,2024-01-08T20:07:20Z,Westbrook
1881679544,whatwg/html,"> Yes, as far as I know, there is a whitelist of which properties are allowed for pseudo-elements in",https://github.com/whatwg/html/issues/9776#issuecomment-1881679544,https://github.com/whatwg/html/issues/9776,popover=hint,2024-01-08T19:15:20Z,mfreed7
1881570936,w3ctag/design-reviews,Thanks for bearing with us - we realize this response is late.   There's no way to quantify what i,https://github.com/w3ctag/design-reviews/issues/864#issuecomment-1881570936,https://github.com/w3ctag/design-reviews/issues/864,text-wrap: pretty,2024-01-08T17:58:20Z,LeaVerou
1881548518,w3ctag/design-reviews,Hi @steimelchrome thank you for bearing with us.  We're picking this back up today and trying to get,https://github.com/w3ctag/design-reviews/issues/798#issuecomment-1881548518,https://github.com/w3ctag/design-reviews/issues/798,Early design review: Document Picture-in-Picture,2024-01-08T17:42:59Z,LeaVerou
1881537534,w3ctag/design-reviews,"Hi @bradtriebwasser. We're just checking in on this. Where did you end up, in your quest for working",https://github.com/w3ctag/design-reviews/issues/840#issuecomment-1881537534,https://github.com/w3ctag/design-reviews/issues/840,Fullscreen Popup Windows,2024-01-08T17:35:34Z,hadleybeeman
1881498295,w3ctag/design-reviews,"Sorry it took a long time to close this, but as hinted above, we don't have any issue with this.",https://github.com/w3ctag/design-reviews/issues/858#issuecomment-1881498295,https://github.com/w3ctag/design-reviews/issues/858,deliveryType (Resource Timing),2024-01-08T17:11:54Z,ylafon
1881497723,whatwg/html,lgtm,https://github.com/whatwg/html/pull/9804#issuecomment-1881497723,https://github.com/whatwg/html/pull/9804,Update mathml-related references to use MathML-Core instead of Full…,2024-01-08T17:11:32Z,bfgeek
1881482104,whatwg/html,"I think we prefer to keep this as-is given that a, area, and form can also use the values in this ta",https://github.com/whatwg/html/issues/9959#issuecomment-1881482104,https://github.com/whatwg/html/issues/9959,Move `4.6.7 Link types`  `<link rel>` table into `4.2.4 The link element`,2024-01-08T17:02:39Z,annevk
1881470273,whatwg/html,"@annevk asked  > Also, it would be great if someone from Chromium or Gecko could chime in whether ",https://github.com/whatwg/html/pull/9804#issuecomment-1881470273,https://github.com/whatwg/html/pull/9804,Update mathml-related references to use MathML-Core instead of Full…,2024-01-08T16:56:21Z,bkardell
1881469879,whatwg/html,I don't think there's a problem here.,https://github.com/whatwg/html/pull/9958#issuecomment-1881469879,https://github.com/whatwg/html/pull/9958,typo,2024-01-08T16:56:09Z,annevk
1881430481,mozilla/standards-positions,No need for a dashboard entry IMO since https://mozilla.github.io/standards-positions/#navigation-ap,https://github.com/mozilla/standards-positions/issues/928#issuecomment-1881430481,https://github.com/mozilla/standards-positions/issues/928,`navigation.activation`,2024-01-08T16:35:08Z,zcorpan
1881426087,mozilla/standards-positions,"Intending to amend the current spec for render-blocking scripts to also include inline scripts, see ",https://github.com/mozilla/standards-positions/issues/608#issuecomment-1881426087,https://github.com/mozilla/standards-positions/issues/608,"Request for position: blocking=""render"" attribute on <link>, <script> and <style>",2024-01-08T16:33:04Z,noamr
1881423778,whatwg/html,@noamr the same s-p issue seems fine. Can you comment there and link to this issue? Thanks.,https://github.com/whatwg/html/issues/10034#issuecomment-1881423778,https://github.com/whatwg/html/issues/10034,Render-blocking scripts should also work for inline scripts,2024-01-08T16:31:51Z,zcorpan
1881322322,mozilla/standards-positions,"Thanks for contributing! For TC39 proposals, there's no need to use Mozilla standards-positions, see",https://github.com/mozilla/standards-positions/pull/917#issuecomment-1881322322,https://github.com/mozilla/standards-positions/pull/917,Submit Ecma TC39 proposal-decimal,2024-01-08T15:52:23Z,zcorpan
1881231340,WICG/webcomponents,"> * String reflection (e.g. ariaLabel, role), which is currently implemented in Chromium and Webkit ",https://github.com/WICG/webcomponents/issues/1031#issuecomment-1881231340,https://github.com/WICG/webcomponents/issues/1031,Quarterly Face to Face Scheduling,2024-01-08T15:29:13Z,zcorpan
1881072389,whatwg/html,In general pointing to MathML core sounds good to me.,https://github.com/whatwg/html/pull/9804#issuecomment-1881072389,https://github.com/whatwg/html/pull/9804,Update mathml-related references to use MathML-Core instead of Full…,2024-01-08T14:03:09Z,emilio
1881038577,mozilla/standards-positions,Marking `positive` per @emilio 's comment.,https://github.com/mozilla/standards-positions/issues/772#issuecomment-1881038577,https://github.com/mozilla/standards-positions/issues/772,Focusability of elements with display:contents,2024-01-08T13:46:10Z,zcorpan
1880700881,whatwg/html,Added. We should be able to make that work time-wise I think.,https://github.com/whatwg/html/issues/9993#issuecomment-1880700881,https://github.com/whatwg/html/issues/9993,Upcoming WHATNOT meeting on 1/11/2024,2024-01-08T10:06:56Z,annevk
1880554487,w3ctag/design-reviews,"Sorry for the lack of context @wanderview - that was more intended as a note-to-self as part of the ",https://github.com/w3ctag/design-reviews/issues/919#issuecomment-1880554487,https://github.com/w3ctag/design-reviews/issues/919,TAG spec review of Storage Access Heuristics,2024-01-08T08:23:00Z,torgo
1880253983,mozilla/standards-positions,"Google deployed the Privacy Pass protocols on the Web under the name “Private State Tokens”, which h",https://github.com/mozilla/standards-positions/issues/262#issuecomment-1880253983,https://github.com/mozilla/standards-positions/issues/262,Private State Token API,2024-01-08T00:48:40Z,martinthomson
1880252624,mozilla/standards-positions,"Apple deployed the Privacy Pass protocols on the Web under the name “Private Access Tokens”, but thi",https://github.com/mozilla/standards-positions/issues/954#issuecomment-1880252624,https://github.com/mozilla/standards-positions/issues/954,Private Access Tokens,2024-01-08T00:45:22Z,martinthomson
1880252108,whatwg/html,"Is it possible to add https://github.com/whatwg/html/issues/10039 to the agenda? I can't attend the ",https://github.com/whatwg/html/issues/9993#issuecomment-1880252108,https://github.com/whatwg/html/issues/9993,Upcoming WHATNOT meeting on 1/11/2024,2024-01-08T00:44:05Z,zcbenz
1880251277,mozilla/standards-positions,"It has taken us a long time to reach this point, but we have completed [our assessment of this techn",https://github.com/mozilla/standards-positions/issues/261#issuecomment-1880251277,https://github.com/mozilla/standards-positions/issues/261,Privacy Pass protocol,2024-01-08T00:42:01Z,martinthomson
1880136820,whatwg/html,"> **1B** Allow DOMString? reflection for attributes starting with aria-* only, as a legacy exception",https://github.com/whatwg/html/issues/10037#issuecomment-1880136820,https://github.com/whatwg/html/issues/10037,ARIA attribute reflection uses DOMString? but they are not enumerated attributes,2024-01-07T18:34:34Z,nolanlawson
1880034650,whatwg/html,"It was a clarification, no worries thanks!",https://github.com/whatwg/html/issues/10038#issuecomment-1880034650,https://github.com/whatwg/html/issues/10038,Should past user activations be kept after refresh?,2024-01-07T11:44:29Z,CanadaHonk
1880030227,whatwg/html,"No, because it's a new `Window` object.  (Edit: maybe I misunderstood; was this a clarification qu",https://github.com/whatwg/html/issues/10038#issuecomment-1880030227,https://github.com/whatwg/html/issues/10038,Should past user activations be kept after refresh?,2024-01-07T11:25:24Z,domenic
1879891926,whatwg/html,"Yes, maybe `fetch()` is more powerful. But even the polyfill from Microsoft/Azure that supposedly im",https://github.com/whatwg/html/issues/2177#issuecomment-1879891926,https://github.com/whatwg/html/issues/2177,Setting headers for EventSource,2024-01-07T00:25:15Z,ThiefMaster
1879888292,WICG/webcomponents,Definitely in agreement that we need more power in this area: https://github.com/WICG/webcomponents/,https://github.com/WICG/webcomponents/issues/1042#issuecomment-1879888292,https://github.com/WICG/webcomponents/issues/1042,Observing slotchange mutation records: a `SlotChangeObserver` API similar to `MutationObserver` with `childList:true`,2024-01-07T00:14:41Z,Westbrook
1879470456,WICG/webcomponents,Amazing! Thanks everyone for you flexibility. I've swapped the 1pm ET hour on Wednesday with the 4pm,https://github.com/WICG/webcomponents/issues/1031#issuecomment-1879470456,https://github.com/WICG/webcomponents/issues/1031,Quarterly Face to Face Scheduling,2024-01-06T00:57:07Z,Westbrook
1879466281,WICG/webcomponents,Yes I'll be able to make the Monday session. Sounds like that'll work better schedule-wise for every,https://github.com/WICG/webcomponents/issues/1031#issuecomment-1879466281,https://github.com/WICG/webcomponents/issues/1031,Quarterly Face to Face Scheduling,2024-01-06T00:48:32Z,behowell
1879450363,w3ctag/design-reviews,> こんにちはTAG! >  > I'm requesting a TAG review of: >  > * Name: Mixed Content Level 2 > * Specifi,https://github.com/w3ctag/design-reviews/issues/420#issuecomment-1879450363,https://github.com/w3ctag/design-reviews/issues/420,Mixed content level 2,2024-01-06T00:19:39Z,kleinkk76
1879384430,WICG/webcomponents,"3pm ET is 7am here (and 6am in Brisbane where @jcsteh is); that's manageable with enough coffee :) ",https://github.com/WICG/webcomponents/issues/1031#issuecomment-1879384430,https://github.com/WICG/webcomponents/issues/1031,Quarterly Face to Face Scheduling,2024-01-05T23:41:53Z,alice
1879316576,w3ctag/design-reviews,There is a recent update to the spec for a new feature:  Allow Cross-Origin Subframes to Send Auto,https://github.com/w3ctag/design-reviews/issues/838#issuecomment-1879316576,https://github.com/w3ctag/design-reviews/issues/838,Specification review for fenced frames,2024-01-05T22:12:35Z,blu25
1879182364,WICG/webcomponents,"@behowell is leading the cross-root presentation, but he did mention that he had availability on Mon",https://github.com/WICG/webcomponents/issues/1031#issuecomment-1879182364,https://github.com/WICG/webcomponents/issues/1031,Quarterly Face to Face Scheduling,2024-01-05T19:49:39Z,Westbrook
1879162046,WICG/webcomponents,Hm... I have a conflict on Jan 19th 7pm to 8pm now. I guess we should do another round of when2meet.,https://github.com/WICG/webcomponents/issues/1027#issuecomment-1879162046,https://github.com/WICG/webcomponents/issues/1027,DOM Parts Quarterly Meeting,2024-01-05T19:29:25Z,rniwa
1879160383,mozilla/standards-positions,At this point I think we're open to shipping WebSerial using the same add-on-gating mechanism as Web,https://github.com/mozilla/standards-positions/issues/687#issuecomment-1879160383,https://github.com/mozilla/standards-positions/issues/687,Re-request for postion on Web Serial/Serial API,2024-01-05T19:27:39Z,bholley
1879155779,WICG/webcomponents,Can we swap the agenda for 8th and 10th and schedule ARIA related topics at 4pm so that @alice and o,https://github.com/WICG/webcomponents/issues/1031#issuecomment-1879155779,https://github.com/WICG/webcomponents/issues/1031,Quarterly Face to Face Scheduling,2024-01-05T19:23:09Z,rniwa
1879101798,whatwg/html,"just tough it could be nice if you could apply the same sandboxing possibilities that you can do to ",https://github.com/whatwg/html/issues/7485#issuecomment-1879101798,https://github.com/whatwg/html/issues/7485,Modernized version of window.open() API,2024-01-05T18:34:30Z,jimmywarting
1878996462,whatwg/html,Yeah I wrote that test and implemented the change in chromium here: https://chromium-review.googleso,https://github.com/whatwg/html/issues/10013#issuecomment-1878996462,https://github.com/whatwg/html/issues/10013,"User interacted flag gets set when change events are set, but tests disagree",2024-01-05T17:08:44Z,josepharhar
1878865951,WICG/webcomponents,I've broken the [agenda for the two days](https://docs.google.com/document/d/1NRI_Ns8dw33LA21Fj2F21J,https://github.com/WICG/webcomponents/issues/1031#issuecomment-1878865951,https://github.com/WICG/webcomponents/issues/1031,Quarterly Face to Face Scheduling,2024-01-05T15:39:20Z,Westbrook
1878842223,WICG/webcomponents,"@rniwa I'm happy to get Jan 19th, 7pm to 8pm UTC on the WCCG calendar if you want to organize this t",https://github.com/WICG/webcomponents/issues/1027#issuecomment-1878842223,https://github.com/WICG/webcomponents/issues/1027,DOM Parts Quarterly Meeting,2024-01-05T15:22:12Z,Westbrook
1878822510,whatwg/html,Hmm... i wanted my iframe to be sandboxed and having javascript disabled.  however i would still li,https://github.com/whatwg/html/issues/3230#issuecomment-1878822510,https://github.com/whatwg/html/issues/3230,"Should ""script-src 'none'"" CSP in HTTP headers count as scripting being disabled?",2024-01-05T15:08:07Z,jimmywarting
1878699746,WICG/webcomponents,Is there a decision yet on the time of the call? The #1031 calls are now scheduled for Jan 8 & Jan 1,https://github.com/WICG/webcomponents/issues/1027#issuecomment-1878699746,https://github.com/WICG/webcomponents/issues/1027,DOM Parts Quarterly Meeting,2024-01-05T13:54:10Z,eemeli
1878106329,whatwg/html,Somewhat related (but not blocking): https://github.com/w3c/csswg-drafts/issues/6942,https://github.com/whatwg/html/issues/10029#issuecomment-1878106329,https://github.com/whatwg/html/issues/10029,Should `:target` match after elements are removed and reattached to the document?,2024-01-05T04:27:07Z,domenic
1878072165,w3c/clipboard-apis,I'm updating the MDN Clipboard API docs to reflect the current state of play. The situation is confu,https://github.com/w3c/clipboard-apis/issues/163#issuecomment-1878072165,https://github.com/w3c/clipboard-apis/issues/163,Should clipboard-write permission be removed too?,2024-01-05T03:25:36Z,hamishwillee
1877974859,mozilla/standards-positions,"Seeing how many years it's been, I'd say so, yes",https://github.com/mozilla/standards-positions/issues/94#issuecomment-1877974859,https://github.com/mozilla/standards-positions/issues/94,Cookie-Store API,2024-01-05T01:08:42Z,Atulin
1877962462,whatwg/html,"Thanks, I'm going to try shipping the change in chrome then. Here is a WPT: https://github.com/web-p",https://github.com/whatwg/html/issues/10029#issuecomment-1877962462,https://github.com/whatwg/html/issues/10029,Should `:target` match after elements are removed and reattached to the document?,2024-01-05T00:48:35Z,josepharhar
