id,repo,body,url,issue_url,issue_title,created_at,user
1570316674,whatwg/html,> urlForState is not what [pushState/replaceState call](https://github.com/WebKit/WebKit/blob/e8c125,https://github.com/whatwg/html/issues/9343#issuecomment-1570316674,https://github.com/whatwg/html/issues/9343,"pushState/replaceState have special handling for the empty string, which is not in the spec",2023-05-31T14:11:17Z,bathos
1570185515,whatwg/dom,That the DOM Standard handles them in its own algorithms without providing hooks. (Technically not t,https://github.com/whatwg/dom/pull/1185#issuecomment-1570185515,https://github.com/whatwg/dom/pull/1185,Add before removing steps,2023-05-31T12:57:18Z,annevk
1570182791,whatwg/dom,"> Except for popover we handle all of those in DOM directly.  @annevk: what does ""in DOM directly""",https://github.com/whatwg/dom/pull/1185#issuecomment-1570182791,https://github.com/whatwg/dom/pull/1185,Add before removing steps,2023-05-31T12:55:45Z,mbrodesser-Igalia
1570151750,whatwg/dom,"> Things chromium does before removal  Except for popover we handle all of those in DOM directly. ",https://github.com/whatwg/dom/pull/1185#issuecomment-1570151750,https://github.com/whatwg/dom/pull/1185,Add before removing steps,2023-05-31T12:33:56Z,annevk
1570102259,whatwg/html,(There might be a larger issue here. As part of some refactoring in WebKit I noticed many URL-consum,https://github.com/whatwg/html/issues/9343#issuecomment-1570102259,https://github.com/whatwg/html/issues/9343,"pushState/replaceState have special handling for the empty string, which is not in the spec",2023-05-31T12:12:39Z,annevk
1570097569,whatwg/html,urlForState is not what [pushState/replaceState call](https://github.com/WebKit/WebKit/blob/e8c12535,https://github.com/whatwg/html/issues/9343#issuecomment-1570097569,https://github.com/whatwg/html/issues/9343,"pushState/replaceState have special handling for the empty string, which is not in the spec",2023-05-31T12:10:49Z,annevk
1569983373,whatwg/html,Thank you @domenic! I've addressed your comments.,https://github.com/whatwg/html/pull/8008#issuecomment-1569983373,https://github.com/whatwg/html/pull/8008,Add sizes=auto to lazy-loaded <img>,2023-05-31T11:05:16Z,zcorpan
1569960939,whatwg/html,"Since Chromium's implementation seems to have been the main inspiration for the spec, it seems worth",https://github.com/whatwg/html/issues/9367#issuecomment-1569960939,https://github.com/whatwg/html/issues/9367,"When the popover attribute is removed, the hide popover algorithm will return too early",2023-05-31T10:50:09Z,mbrodesser-Igalia
1569956413,whatwg/html,Validity requirements don't affect user agents. Just conformance checkers.,https://github.com/whatwg/html/pull/9309#issuecomment-1569956413,https://github.com/whatwg/html/pull/9309,Ignore dangling markup in target name,2023-05-31T10:46:52Z,annevk
1569952386,whatwg/html,Modified title to reflect feedback.,https://github.com/whatwg/html/issues/9294#issuecomment-1569952386,https://github.com/whatwg/html/issues/9294,Proposal:  measurement or number semantic HTML tag,2023-05-31T10:43:52Z,bahrus
1569793690,mozilla/standards-positions,FYI: [Some google apps still use DOM mutation event listeners if running in Firefox](https://bugzill,https://github.com/mozilla/standards-positions/issues/807#issuecomment-1569793690,https://github.com/mozilla/standards-positions/issues/807,Deprecation / Removal of Mutation Events,2023-05-31T09:05:08Z,masayuki-nakano
1569789104,whatwg/html,"> You said ""The event should be somewhat equivalent to addEventListener('pageshow', () => requestAni",https://github.com/whatwg/html/issues/9315#issuecomment-1569789104,https://github.com/whatwg/html/issues/9315,Proposal: fire an event before the first rendering opportunity after activation,2023-05-31T09:02:16Z,noamr
1569782602,whatwg/html,"You said ""The event should be somewhat equivalent to addEventListener('pageshow', () => requestAnim",https://github.com/whatwg/html/issues/9315#issuecomment-1569782602,https://github.com/whatwg/html/issues/9315,Proposal: fire an event before the first rendering opportunity after activation,2023-05-31T08:58:37Z,smaug----
1569781032,whatwg/html,"> So if pageshow listener does slow things, like if often may do, rendering might be postponed signi",https://github.com/whatwg/html/issues/9315#issuecomment-1569781032,https://github.com/whatwg/html/issues/9315,Proposal: fire an event before the first rendering opportunity after activation,2023-05-31T08:57:37Z,noamr
1569763023,whatwg/html,"So if pageshow listener does slow things, like if often may do, rendering might be postponed signifi",https://github.com/whatwg/html/issues/9315#issuecomment-1569763023,https://github.com/whatwg/html/issues/9315,Proposal: fire an event before the first rendering opportunity after activation,2023-05-31T08:46:00Z,smaug----
1569736467,mozilla/standards-positions,It's not entirely clear to me what's being discussed here: Feedback before a spec exists or feedback,https://github.com/mozilla/standards-positions/issues/808#issuecomment-1569736467,https://github.com/mozilla/standards-positions/issues/808,Expectations for standards-positions with only an explainer (pre-spec),2023-05-31T08:30:23Z,johannhof
1569670415,mozilla/standards-positions,"Hey Dan, that's a fair point. We're aiming to pick this up as a WG Note for WebAppSec and would appr",https://github.com/mozilla/standards-positions/issues/806#issuecomment-1569670415,https://github.com/mozilla/standards-positions/issues/806,Standardizing Security Semantics for Cross-Site Cookies,2023-05-31T07:48:03Z,johannhof
1569658806,webkit/standards-positions,"beside the irrelevant reply for one post from last year, you should've read further:  > race condi",https://github.com/WebKit/standards-positions/issues/97#issuecomment-1569658806,https://github.com/WebKit/standards-positions/issues/97,Customized built-in elements,2023-05-31T07:39:42Z,WebReflection
1569630128,whatwg/html,"> That said, [people are already implementing this proposal in both websites and password managers](",https://github.com/whatwg/html/issues/3518#issuecomment-1569630128,https://github.com/whatwg/html/issues/3518,Proposal: HTML passwordrules attribute,2023-05-31T07:17:43Z,tomayac
1569477373,whatwg/html,"I’d suggest that if this were to exist, `<number>` (or something similar) might be better aligned wi",https://github.com/whatwg/html/issues/9294#issuecomment-1569477373,https://github.com/whatwg/html/issues/9294,Proposal:  measurement or number semantic HTML tag,2023-05-31T04:26:36Z,bathos
1569406141,whatwg/html,"cc @cathiechen @emilio ",https://github.com/whatwg/html/issues/9366#issuecomment-1569406141,https://github.com/whatwg/html/issues/9366,auto popover list definition isn't quite correct,2023-05-31T02:29:06Z,nt1m
1569372457,w3ctag/design-reviews,For the TAG's information -- there was a fair amount of negative feedback from HTTP folks on this sp,https://github.com/w3ctag/design-reviews/issues/849#issuecomment-1569372457,https://github.com/w3ctag/design-reviews/issues/849,Incremental Font Transfer: Patch Subset,2023-05-31T01:51:35Z,mnot
1569370897,webkit/standards-positions,>   Race conditions do not exist in js because it runs on a single thread?  Race conditions are n,https://github.com/WebKit/standards-positions/issues/97#issuecomment-1569370897,https://github.com/WebKit/standards-positions/issues/97,Customized built-in elements,2023-05-31T01:48:50Z,raegen
1569296266,whatwg/html,@annevk @rwlbuis Do you have a preference here?,https://github.com/whatwg/html/pull/9344#issuecomment-1569296266,https://github.com/whatwg/html/pull/9344,Check dialog is modal flag instead of open attribute in 'check popover validity' algorithm,2023-05-30T23:59:18Z,nt1m
1569228227,w3c/editcontext,This is superseded with https://github.com/w3c/edit-context/pull/47.,https://github.com/w3c/edit-context/pull/31#issuecomment-1569228227,https://github.com/w3c/edit-context/pull/31,Add event interfaces to 'fire an event' phrases,2023-05-30T22:44:40Z,dandclark
1569213320,whatwg/html,"As a follow up to my last comment, the idea of supporting img features such as lazy loading for vide",https://github.com/whatwg/html/issues/6363#issuecomment-1569213320,https://github.com/whatwg/html/issues/6363,HTML Video Element: Proposal For Reintroduction of Media in Source Elements,2023-05-30T22:30:40Z,dangayle
1569206863,whatwg/html,"> I don't know of many examples that use this currently, but I would think the use case applies for ",https://github.com/whatwg/html/issues/6363#issuecomment-1569206863,https://github.com/whatwg/html/issues/6363,HTML Video Element: Proposal For Reintroduction of Media in Source Elements,2023-05-30T22:24:35Z,dangayle
1569157040,whatwg/html,"> > > I'm hoping to write more whenever I have time. > >  > >  > > Hello, just checking in on thi",https://github.com/whatwg/html/pull/9047#issuecomment-1569157040,https://github.com/whatwg/html/pull/9047,Spec :user-invalid & :user-valid,2023-05-30T21:53:36Z,mfreed7
1569141190,whatwg/html," > Hmm, yeah, it does throw in that situation. I guess symmetry with `show()` does make sense. The ",https://github.com/whatwg/html/pull/9344#issuecomment-1569141190,https://github.com/whatwg/html/pull/9344,Check dialog is modal flag instead of open attribute in 'check popover validity' algorithm,2023-05-30T21:40:03Z,mfreed7
1569136574,whatwg/html,"> > Thinking more, this is tricky, because if you have the sequence: > > ``` > > dialog.show(); >",https://github.com/whatwg/html/pull/9344#issuecomment-1569136574,https://github.com/whatwg/html/pull/9344,Check dialog is modal flag instead of open attribute in 'check popover validity' algorithm,2023-05-30T21:35:14Z,nt1m
1569128191,whatwg/html,"> Thinking more, this is tricky, because if you have the sequence: >  > ``` > dialog.show(); > d",https://github.com/whatwg/html/pull/9344#issuecomment-1569128191,https://github.com/whatwg/html/pull/9344,Check dialog is modal flag instead of open attribute in 'check popover validity' algorithm,2023-05-30T21:29:04Z,mfreed7
1568971117,whatwg/html,> > The alternative fix would be throwing an exception if you're trying to close a `<dialog popover>,https://github.com/whatwg/html/pull/9344#issuecomment-1568971117,https://github.com/whatwg/html/pull/9344,Check dialog is modal flag instead of open attribute in 'check popover validity' algorithm,2023-05-30T19:31:14Z,nt1m
1568919559,whatwg/html,"> You also forgot about the `formtarget` attribute. We probably want to restructure ""get an element'",https://github.com/whatwg/html/pull/9309#issuecomment-1568919559,https://github.com/whatwg/html/pull/9309,Ignore dangling markup in target name,2023-05-30T18:54:00Z,shhnjk
1568852403,whatwg/html,"An alternative list of units, used by [Intl.NumberFormat](https://developer.mozilla.org/en-US/docs/W",https://github.com/whatwg/html/issues/9294#issuecomment-1568852403,https://github.com/whatwg/html/issues/9294,Proposal:  measurement or number semantic HTML tag,2023-05-30T18:02:50Z,bahrus
1568833577,whatwg/html,"FWIW, I think the currently proposed approach is nicer as it doesn't bake more of popover into the `",https://github.com/whatwg/html/pull/9344#issuecomment-1568833577,https://github.com/whatwg/html/pull/9344,Check dialog is modal flag instead of open attribute in 'check popover validity' algorithm,2023-05-30T17:48:24Z,annevk
1568776506,whatwg/html,"> The alternative fix would be throwing an exception if you're trying to close a `<dialog popover>` ",https://github.com/whatwg/html/pull/9344#issuecomment-1568776506,https://github.com/whatwg/html/pull/9344,Check dialog is modal flag instead of open attribute in 'check popover validity' algorithm,2023-05-30T17:03:29Z,mfreed7
1568761620,mozilla/standards-positions,"> very strong positive position  Awesome, thanks! I need to figure out the process for this, and s",https://github.com/mozilla/standards-positions/issues/807#issuecomment-1568761620,https://github.com/mozilla/standards-positions/issues/807,Deprecation / Removal of Mutation Events,2023-05-30T16:51:40Z,mfreed7
1568740482,w3ctag/design-reviews,@atanassov @LeaVerou FYI.,https://github.com/w3ctag/design-reviews/issues/851#issuecomment-1568740482,https://github.com/w3ctag/design-reviews/issues/851,Cross-document View Transitions API,2023-05-30T16:34:29Z,khushalsagar
1568376165,whatwg/html,> Yea we should use `unsafe response` in all those cases. @trflynn89 were you going to post a PR for,https://github.com/whatwg/html/issues/9355#issuecomment-1568376165,https://github.com/whatwg/html/issues/9355,"Fetches for element resources should use the response's ""unsafe response"" for network status and response bodies",2023-05-30T12:48:18Z,trflynn89
1568309610,WICG/webcomponents,"Cross linking to #1014, which was brought up earlier as a potential quick-fix, but hasn't seen much ",https://github.com/WICG/webcomponents/issues/1005#issuecomment-1568309610,https://github.com/WICG/webcomponents/issues/1005,Spring 2023 Cross-Root ARIA F2F,2023-05-30T12:00:10Z,bennypowers
1568308993,WICG/webcomponents,"As discussed in #1005 ",https://github.com/WICG/webcomponents/issues/1014#issuecomment-1568308993,https://github.com/WICG/webcomponents/issues/1014,[a11y]: permit aria-hidden=true on focusable shadow elements in FACE,2023-05-30T11:59:40Z,bennypowers
1568307064,whatwg/dom,Thanks: #1204.,https://github.com/whatwg/dom/issues/1203#issuecomment-1568307064,https://github.com/whatwg/dom/issues/1203,"Undefined variable in the ""add an event listener"" algorithm",2023-05-30T11:58:16Z,annevk
1568296762,w3c/editcontext,"Queue a global task takes more arguments, but something like that could be a reasonable first step. ",https://github.com/w3c/edit-context/issues/41#issuecomment-1568296762,https://github.com/w3c/edit-context/issues/41,"""text state"" updated from in parallel but also API accessible",2023-05-30T11:50:04Z,annevk
1568285053,whatwg/html,Yea we should use `unsafe response` in all those cases. @trflynn89 were you going to post a PR for t,https://github.com/whatwg/html/issues/9355#issuecomment-1568285053,https://github.com/whatwg/html/issues/9355,"Fetches for element resources should use the response's ""unsafe response"" for network status and response bodies",2023-05-30T11:40:40Z,noamr
1568279508,whatwg/html,"cc @noamr ",https://github.com/whatwg/html/issues/9355#issuecomment-1568279508,https://github.com/whatwg/html/issues/9355,"Fetches for element resources should use the response's ""unsafe response"" for network status and response bodies",2023-05-30T11:37:07Z,annevk
1568259783,whatwg/html,> We don't want to let the page to postpone showing the page to the user.  ... In situations where,https://github.com/whatwg/html/issues/9315#issuecomment-1568259783,https://github.com/whatwg/html/issues/9315,Proposal: fire an event before the first rendering opportunity after activation,2023-05-30T11:22:59Z,noamr
1568202363,whatwg/dom,"> Yes, implementations run steps after as well. > Things chromium does before removal: >  >     H",https://github.com/whatwg/dom/pull/1185#issuecomment-1568202363,https://github.com/whatwg/dom/pull/1185,Add before removing steps,2023-05-30T10:38:58Z,mbrodesser-Igalia
1568181025,whatwg/html,\o/,https://github.com/whatwg/html/pull/9297#issuecomment-1568181025,https://github.com/whatwg/html/pull/9297,Meta: load some scripts with defer to make their DOMContentLoaded listener reliable,2023-05-30T10:21:27Z,annevk
1568174193,whatwg/html,No worries! One draft PR seems fine.,https://github.com/whatwg/html/pull/9360#issuecomment-1568174193,https://github.com/whatwg/html/pull/9360,Add back/forward cache NotRestoredReasons,2023-05-30T10:16:54Z,domenic
1568169384,whatwg/html,"`<datalist>` appears to be an alternative to `<select>`, not `<select multiple>`.  and if it were ",https://github.com/whatwg/html/issues/9357#issuecomment-1568169384,https://github.com/whatwg/html/issues/9357,Deprecate `<select multiple>`,2023-05-30T10:13:17Z,SoniEx2
1568149520,whatwg/html,"Changed my orgs memberships to public, let's see if the bot picks that up.",https://github.com/whatwg/html/pull/9297#issuecomment-1568149520,https://github.com/whatwg/html/pull/9297,Meta: load some scripts with defer to make their DOMContentLoaded listener reliable,2023-05-30T09:59:51Z,jsnajdr
1568135361,whatwg/html,"@jsnajdr thank you! You need to make your membership of that organization public so the bot can see ",https://github.com/whatwg/html/pull/9297#issuecomment-1568135361,https://github.com/whatwg/html/pull/9297,Meta: load some scripts with defer to make their DOMContentLoaded listener reliable,2023-05-30T09:50:02Z,annevk
1568118159,whatwg/html,"`<datalist>` already exists. And `<select multiple>` UI could be improved still, e.g., with checkbox",https://github.com/whatwg/html/issues/9357#issuecomment-1568118159,https://github.com/whatwg/html/issues/9357,Deprecate `<select multiple>`,2023-05-30T09:38:25Z,annevk
1568097243,whatwg/html,"Sorry @domenic, I was the one that suggested her to open a draft PR, to get the auto-generated HTML ",https://github.com/whatwg/html/pull/9360#issuecomment-1568097243,https://github.com/whatwg/html/pull/9360,Add back/forward cache NotRestoredReasons,2023-05-30T09:25:05Z,rakina
1568034271,whatwg/html,Hi @annevk :wave: the contributor agreement has been signed on behalf of the entire Automattic organ,https://github.com/whatwg/html/pull/9297#issuecomment-1568034271,https://github.com/whatwg/html/pull/9297,Meta: load some scripts with defer to make their DOMContentLoaded listener reliable,2023-05-30T08:53:25Z,jsnajdr
1567988287,mozilla/standards-positions,This one is sufficient IMO.,https://github.com/mozilla/standards-positions/issues/677#issuecomment-1567988287,https://github.com/mozilla/standards-positions/issues/677,Request for Position: View Transitions API,2023-05-30T08:23:49Z,zcorpan
1567983245,mozilla/standards-positions,@zcorpan is this RFP enough for cross-document transitions or should we file a new one? See new [TA,https://github.com/mozilla/standards-positions/issues/677#issuecomment-1567983245,https://github.com/mozilla/standards-positions/issues/677,Request for Position: View Transitions API,2023-05-30T08:20:23Z,noamr
1567909784,whatwg/html,"You can create diffs using either the Git command line tools, or the GitHub web UI. For an example o",https://github.com/whatwg/html/pull/9360#issuecomment-1567909784,https://github.com/whatwg/html/pull/9360,Add back/forward cache NotRestoredReasons,2023-05-30T07:29:01Z,domenic
1567843364,whatwg/html,"Hi Domenic, thanks for pointing this out! I created the draft PRs just to generate HTML diff files s",https://github.com/whatwg/html/pull/9360#issuecomment-1567843364,https://github.com/whatwg/html/pull/9360,Add back/forward cache NotRestoredReasons,2023-05-30T06:29:36Z,rubberyuzu
1567752766,whatwg/html,"Hi @rubberyuzu,  You seem to have opened [4 separate draft pull requests](https://github.com/whatw",https://github.com/whatwg/html/pull/9360#issuecomment-1567752766,https://github.com/whatwg/html/pull/9360,Add back/forward cache NotRestoredReasons,2023-05-30T04:55:00Z,domenic
1567711225,whatwg/html,"@smaug----,  I agree that we don't want this policy in general. Chrome has similar behaviour, if you",https://github.com/whatwg/html/issues/9315#issuecomment-1567711225,https://github.com/whatwg/html/issues/9315,Proposal: fire an event before the first rendering opportunity after activation,2023-05-30T03:30:25Z,khushalsagar
1567660903,whatwg/html,"I’m unsure if maybe this was intended as satirical, but if not: HTML is neither platform-specific no",https://github.com/whatwg/html/issues/9358#issuecomment-1567660903,https://github.com/whatwg/html/issues/9358,"Make HTML 5.4 or 5.5 exclusive to 64-bit x86 and ARM processors, once either gets announced.",2023-05-30T01:53:59Z,bathos
1567577387,whatwg/html,"@josepharhar @mfreed7 One side effect of this PR is that you can now run `showPopover()` on dialogs ",https://github.com/whatwg/html/pull/9344#issuecomment-1567577387,https://github.com/whatwg/html/pull/9344,Check dialog is modal flag instead of open attribute in 'check popover validity' algorithm,2023-05-29T22:56:19Z,nt1m
1567573961,mozilla/standards-positions,I agree with Dan. It is perfectly fine to ask for input on just about anything here. But we might de,https://github.com/mozilla/standards-positions/issues/808#issuecomment-1567573961,https://github.com/mozilla/standards-positions/issues/808,Expectations for standards-positions with only an explainer (pre-spec),2023-05-29T22:47:31Z,martinthomson
1567519104,mozilla/standards-positions,"There's nothing wrong with private feedback on a new proposal, but our standards position process do",https://github.com/mozilla/standards-positions/issues/808#issuecomment-1567519104,https://github.com/mozilla/standards-positions/issues/808,Expectations for standards-positions with only an explainer (pre-spec),2023-05-29T21:08:32Z,dveditz
1567407722,whatwg/html,Sectioning root was removed in #7829,https://github.com/whatwg/html/issues/2447#issuecomment-1567407722,https://github.com/whatwg/html/issues/2447,`details` Element Should Not Be a Sectioning Root for Outline Algorithm,2023-05-29T18:22:45Z,zcorpan
1567398062,whatwg/html,"A new attribute to control restoration SGTM, with the default being to restore (regardless of `autoc",https://github.com/whatwg/html/issues/9019#issuecomment-1567398062,https://github.com/whatwg/html/issues/9019,Resetting forms on document reactivation,2023-05-29T18:08:09Z,zcorpan
1567307840,mozilla/standards-positions,"> I'm not sure our standards position process is intended for discussions that are in that stage. ",https://github.com/mozilla/standards-positions/issues/806#issuecomment-1567307840,https://github.com/mozilla/standards-positions/issues/806,Standardizing Security Semantics for Cross-Site Cookies,2023-05-29T16:03:26Z,zcorpan
1567247223,w3c/pointerevents,That sounds reasonable.,https://github.com/w3c/pointerevents/issues/472#issuecomment-1567247223,https://github.com/w3c/pointerevents/issues/472,consider to change the behavior of getCoalescedEvents on non-SecureContext,2023-05-29T15:01:34Z,smaug----
1567245074,w3c/pointerevents,Thanks for noting this unfortunate situation.  I agree that the compat risk could be non-trivial.  W,https://github.com/w3c/pointerevents/issues/472#issuecomment-1567245074,https://github.com/w3c/pointerevents/issues/472,consider to change the behavior of getCoalescedEvents on non-SecureContext,2023-05-29T15:00:04Z,mustaqahmed
1567202489,whatwg/html,@dalecurtis the same applies for `type`. We don't currently have a way to indicate why a resource wa,https://github.com/whatwg/html/pull/9341#issuecomment-1567202489,https://github.com/whatwg/html/pull/9341,Re-add <source media> for media elements,2023-05-29T14:19:47Z,zcorpan
1567198488,whatwg/dom,"> We don't typically start with proposals, unless there's already agreement that the problem is wort",https://github.com/whatwg/dom/issues/1183#issuecomment-1567198488,https://github.com/whatwg/dom/issues/1183,Proposal: Allow WebIDL binding to expose parameters' types and enums' values,2023-05-29T14:16:22Z,eladalon1983
1567159640,mozilla/standards-positions,Sure,https://github.com/mozilla/standards-positions/issues/807#issuecomment-1567159640,https://github.com/mozilla/standards-positions/issues/807,Deprecation / Removal of Mutation Events,2023-05-29T13:46:49Z,zcorpan
1566968149,whatwg/html,"Coming from https://github.com/whatwg/html/issues/9340, it would seem that such a Promise based `pos",https://github.com/whatwg/html/issues/3458#issuecomment-1566968149,https://github.com/whatwg/html/issues/3458,postMessage should return a promise,2023-05-29T10:57:34Z,Kaiido
1566830223,whatwg/html,> Looks like browsers behave differently. Firefox on linux works reasonable well when using alt+mous,https://github.com/whatwg/html/issues/9354#issuecomment-1566830223,https://github.com/whatwg/html/issues/9354,Is there any proposal to optimize the user experience issue where it's difficult to select a specific word within the text of a hyperlink?,2023-05-29T09:21:26Z,lovetingyuan
1566791548,whatwg/html,Looks like browsers behave differently. Firefox on linux works reasonable well when using alt+mouse.,https://github.com/whatwg/html/issues/9354#issuecomment-1566791548,https://github.com/whatwg/html/issues/9354,Is there any proposal to optimize the user experience issue where it's difficult to select a specific word within the text of a hyperlink?,2023-05-29T09:00:29Z,smaug----
1566153124,webkit/standards-positions,Any further thoughts on this specific media query?,https://github.com/WebKit/standards-positions/issues/145#issuecomment-1566153124,https://github.com/WebKit/standards-positions/issues/145,prefers-reduced-transparency,2023-05-28T14:10:58Z,lukewarlow
1565553323,whatwg/html,"It appears ancient — predates Blink, was present when WebKit first landed History in 2009:  ![line",https://github.com/whatwg/html/issues/9343#issuecomment-1565553323,https://github.com/whatwg/html/issues/9343,"pushState/replaceState have special handling for the empty string, which is not in the spec",2023-05-27T16:03:30Z,bathos
1565290094,whatwg/html,"@mfreed7 FWIW, a side-effect of my PR is that we can call `showPopover()` on top of `show()` or any ",https://github.com/whatwg/html/issues/9335#issuecomment-1565290094,https://github.com/whatwg/html/issues/9335,"""check popover algorithm"" check for open dialogs is weak",2023-05-27T09:01:28Z,nt1m
1565265296,whatwg/html,I created https://github.com/whatwg/html/pull/9344,https://github.com/whatwg/html/issues/9335#issuecomment-1565265296,https://github.com/whatwg/html/issues/9335,"""check popover algorithm"" check for open dialogs is weak",2023-05-27T08:14:39Z,nt1m
