id,repo,body,url,issue_url,issue_title,created_at,user
1964175480,whatwg/html,"cc @whatwg/components ",https://github.com/whatwg/html/issues/10155#issuecomment-1964175480,https://github.com/whatwg/html/issues/10155,It's not clear how constraint validation works for FACE if the 'validation anchor' is null,2024-02-26T13:41:18Z,annevk
1963882161,whatwg/dom,@mbrodesser-Igalia that was for an editorial PR to trusted types (which has been merged) rather than,https://github.com/whatwg/dom/pull/1258#issuecomment-1963882161,https://github.com/whatwg/dom/pull/1258,Integration with trusted types inside of node conversion,2024-02-26T11:11:11Z,lukewarlow
1963814265,w3ctag/design-reviews,"We (@torgo @ylafon @maxpassion and I) discussed this again today and we don't have anything further ",https://github.com/w3ctag/design-reviews/issues/922#issuecomment-1963814265,https://github.com/w3ctag/design-reviews/issues/922,BBS Cryptosuite v2023 Securing Verifiable Credentials with Selective Disclosure using BBS Signatures,2024-02-26T10:40:48Z,rhiaro
1963718390,whatwg/webidl,"Can the PR preview please be fixed?  CC @koto ",https://github.com/whatwg/webidl/pull/841#issuecomment-1963718390,https://github.com/whatwg/webidl/pull/841,Added a definition of {{StringContext}} extended attribute.,2024-02-26T09:53:14Z,mbrodesser-Igalia
1963666798,whatwg/dom,@lukewarlow you mentioned somewhere you'd appreciate a review in order to simplify the change. Since,https://github.com/whatwg/dom/pull/1258#issuecomment-1963666798,https://github.com/whatwg/dom/pull/1258,Integration with trusted types inside of node conversion,2024-02-26T09:27:10Z,mbrodesser-Igalia
1963656028,whatwg/dom,"@koto can the PR preview please be fixed? The changes themselves are sufficiently complicated, so le",https://github.com/whatwg/dom/pull/1247#issuecomment-1963656028,https://github.com/whatwg/dom/pull/1247,"Draft integration with Trusted Types, take 2.",2024-02-26T09:21:57Z,mbrodesser-Igalia
1963520207,whatwg/html,I have a work in progress Chromium CL. [This version](https://chromium-review.googlesource.com/c/chr,https://github.com/whatwg/html/pull/10048#issuecomment-1963520207,https://github.com/whatwg/html/pull/10048,Don't always consume user activation for close watchers,2024-02-26T08:00:35Z,domenic
1963095323,whatwg/html,I'm not sure to understand. `<noscript>` is already valid as a child of `<body>` in an HTML document,https://github.com/whatwg/html/issues/10159#issuecomment-1963095323,https://github.com/whatwg/html/issues/10159,Clarify context of 4.12.2 the `<noscript>` element,2024-02-25T23:12:34Z,Kaiido
1963043534,w3ctag/design-reviews,"We've indicated to horizontal groups we'd like to get feedback by 2024-02-29. Making good progress, ",https://github.com/w3ctag/design-reviews/issues/928#issuecomment-1963043534,https://github.com/w3ctag/design-reviews/issues/928,DeviceOrientation Event Specification,2024-02-25T19:54:49Z,anssiko
1963039781,webkit/standards-positions,Where can we see implementation status?,https://github.com/WebKit/standards-positions/issues/76#issuecomment-1963039781,https://github.com/WebKit/standards-positions/issues/76,ECMAScript Decorators,2024-02-25T19:38:36Z,trusktr
1963021797,whatwg/html,Just want to check in on the status here. Is this expected to move forward? Is there anything someon,https://github.com/whatwg/html/pull/5749#issuecomment-1963021797,https://github.com/whatwg/html/pull/5749,Expand JS error serialization,2024-02-25T18:27:16Z,jasnell
1962918159,webkit/standards-positions,"Il giorno dom 25 feb 2024 alle 04:09:39 -08:00:00, Anne van Kesteren  ***@***.***> ha scritto: > S",https://github.com/WebKit/standards-positions/issues/174#issuecomment-1962918159,https://github.com/WebKit/standards-positions/issues/174,Accelerated Shape Detection in Images,2024-02-25T12:18:48Z,Tachi107
1962914973,webkit/standards-positions,"Seems like you missed this part:  > This is a DRAFT POSITION and does not represent the consensus ",https://github.com/WebKit/standards-positions/issues/174#issuecomment-1962914973,https://github.com/WebKit/standards-positions/issues/174,Accelerated Shape Detection in Images,2024-02-25T12:09:28Z,annevk
1962894671,webkit/standards-positions,"Hi all, according to <https://github.com/WebKit/standards-positions/issues/174#issuecomment-15394158",https://github.com/WebKit/standards-positions/issues/174#issuecomment-1962894671,https://github.com/WebKit/standards-positions/issues/174,Accelerated Shape Detection in Images,2024-02-25T11:01:22Z,Tachi107
1962851728,whatwg/html,"Since all of the options are (by design) before the next paint, they're all equally blocking in term",https://github.com/whatwg/html/issues/9046#issuecomment-1962851728,https://github.com/whatwg/html/issues/9046,"Timing of `<dialog>` 'close' event, popover 'toggle' event, `<details>` 'toggle' event",2024-02-25T08:12:35Z,jakearchibald
1962311427,whatwg/html,@mattatobin What projects and technologies I am otherwise involved in is completely irrelevant to th,https://github.com/whatwg/html/issues/4508#issuecomment-1962311427,https://github.com/whatwg/html/issues/4508,Reinstate <style scoped>,2024-02-24T09:35:48Z,wolfbeast
1962232045,whatwg/html,"@wolfbeast I do not believe you will win arguments or prove your point by calling web components ""ov",https://github.com/whatwg/html/issues/4508#issuecomment-1962232045,https://github.com/whatwg/html/issues/4508,Reinstate <style scoped>,2024-02-24T03:14:20Z,mattatobin
1962207879,whatwg/html,Not sure why but the diff link is outdated,https://github.com/whatwg/html/pull/10157#issuecomment-1962207879,https://github.com/whatwg/html/pull/10157,WIP dialog closedby attribute spec,2024-02-24T01:44:32Z,lukewarlow
1952054895,WICG/webcomponents,It seems like this conversation is going in a bit of a zig-zag with someone proposing a solution whe,https://github.com/WICG/webcomponents/issues/909#issuecomment-1952054895,https://github.com/WICG/webcomponents/issues/909,"""open-stylable"" Shadow Roots",2024-02-19T09:38:29Z,DarkWiiPlayer
1944421018,whatwg/dom,,https://github.com/whatwg/dom/issues/1255#issuecomment-1944421018,https://github.com/whatwg/dom/issues/1255,Atomic move operation for element reparenting & reordering,2024-02-14T19:00:54Z,jarhar