id,repo,body,url,issue_url,issue_title,created_at,user
1979262702,whatwg/html,> Are we moving towards only adjusting levels if the attribute(s) are present?  I think anything e,https://github.com/whatwg/html/issues/5033#issuecomment-1979262702,https://github.com/whatwg/html/issues/5033,Consider adding a headinglevelstart attribute,2024-03-05T17:17:47Z,jakearchibald
1979256279,whatwg/html,I'm learning so much here! @muan is your polyfill intended to support VirtualDOM libraries like Reac,https://github.com/whatwg/html/issues/5033#issuecomment-1979256279,https://github.com/whatwg/html/issues/5033,Consider adding a headinglevelstart attribute,2024-03-05T17:14:18Z,jpdevries
1979148125,whatwg/html,I guess one thing that isn't specified right now is what precision we parse and store the colors in.,https://github.com/whatwg/html/issues/8917#issuecomment-1979148125,https://github.com/whatwg/html/issues/8917,Canvas 2D context color serialization,2024-03-05T16:19:40Z,annevk
1979131651,whatwg/html,"@annevk I agree with your 1 and 2, for the existing 8-bit Canvas 2D which has just `sRGB` and `displ",https://github.com/whatwg/html/issues/8917#issuecomment-1979131651,https://github.com/whatwg/html/issues/8917,Canvas 2D context color serialization,2024-03-05T16:12:14Z,svgeesus
1978930600,whatwg/html,"> https://github.com/whatwg/html/issues/10153#issuecomment-1976432980  @annevk, I know solely that",https://github.com/whatwg/html/issues/10153#issuecomment-1978930600,https://github.com/whatwg/html/issues/10153,Nested comment tags.,2024-03-05T14:43:22Z,RokeJulianLockhart
1978919471,whatwg/html,"cc @rniwa @nt1m @mfreed7 ",https://github.com/whatwg/html/issues/10032#issuecomment-1978919471,https://github.com/whatwg/html/issues/10032,Change when button has activation behavior,2024-03-05T14:38:05Z,annevk
1978903836,WICG/webcomponents,Edited later: I misspoke [here](https://github.com/WICG/webcomponents/issues/909#issuecomment-197748,https://github.com/WICG/webcomponents/issues/909#issuecomment-1978903836,https://github.com/WICG/webcomponents/issues/909,"""open-stylable"" Shadow Roots",2024-03-05T14:30:21Z,sorvell
1978793258,whatwg/html,"I know spec owner interest in the ""auto"" feature is low at this point, but what might work better is",https://github.com/whatwg/html/issues/5033#issuecomment-1978793258,https://github.com/whatwg/html/issues/5033,Consider adding a headinglevelstart attribute,2024-03-05T13:36:49Z,jakearchibald
1978720889,whatwg/html,"Both of my proposed solutions are probably not a good idea. - Idea 1, introduce a has activation be",https://github.com/whatwg/html/issues/10032#issuecomment-1978720889,https://github.com/whatwg/html/issues/10032,Change when button has activation behavior,2024-03-05T12:56:46Z,vinhill
1978697230,whatwg/html,"I think a phantom watcher could work, the reason I avoided it initially was because I think you can ",https://github.com/whatwg/html/issues/9373#issuecomment-1978697230,https://github.com/whatwg/html/issues/9373,Add light dismiss functionality to `<dialog>`,2024-03-05T12:43:33Z,lukewarlow
1978660328,whatwg/html,"> such as a popover component wanting to make sure it's topmost, and if not, closing and re-showing ",https://github.com/whatwg/html/issues/9075#issuecomment-1978660328,https://github.com/whatwg/html/issues/9075,"API to get top layer elements ",2024-03-05T12:26:12Z,Link2Twenty
1978602687,whatwg/html,"We have textareas where the server-side will look for common spam patterns, such as URLs, and drop t",https://github.com/whatwg/html/issues/9102#issuecomment-1978602687,https://github.com/whatwg/html/issues/9102,<textarea> should support the [pattern] attribute like the <input> element,2024-03-05T12:01:17Z,sandstrom
1978516622,whatwg/html,`comp-dict` maybe?,https://github.com/whatwg/html/issues/10162#issuecomment-1978516622,https://github.com/whatwg/html/issues/10162,Provide a mechanism to trigger the fetch of compression dictionaries,2024-03-05T11:10:30Z,mnot
1978397400,whatwg/html,"@Kaiido I meant to reply before closing this. It seems worthwhile updating those getter/setters, yes",https://github.com/whatwg/html/pull/10175#issuecomment-1978397400,https://github.com/whatwg/html/pull/10175,Let CSS Color handle CSS <color> value parsing,2024-03-05T10:07:55Z,annevk
1978387298,whatwg/dom,"Yeah, don't write ""resolve"" followed by a link to an issue in your commit message if they don't actu",https://github.com/whatwg/dom/issues/808#issuecomment-1978387298,https://github.com/whatwg/dom/issues/808,"Side effects due to tree insertion or removal (script, iframe)",2024-03-05T10:02:45Z,annevk
1978253590,whatwg/html,> I don't think I suggested that the `div` element in that example should be false? Just that `<inpu,https://github.com/whatwg/html/pull/10018#issuecomment-1978253590,https://github.com/whatwg/html/pull/10018,Add a new attribute called `writingsuggestions` to control UA-provided writing assistance,2024-03-05T08:56:37Z,domenic
1978235678,whatwg/html,"I don't think I suggested that the `div` element in that example should be false? Just that `<input ",https://github.com/whatwg/html/pull/10018#issuecomment-1978235678,https://github.com/whatwg/html/pull/10018,Add a new attribute called `writingsuggestions` to control UA-provided writing assistance,2024-03-05T08:46:09Z,annevk
1978204317,whatwg/html,"Oh, I see what you mean.  I still think the simplified-spellcheck model (i.e., without true/false ",https://github.com/whatwg/html/pull/10018#issuecomment-1978204317,https://github.com/whatwg/html/pull/10018,Add a new attribute called `writingsuggestions` to control UA-provided writing assistance,2024-03-05T08:27:08Z,domenic
1978191213,w3c/pointerevents,"It would be inappropriate to try and address this at the Pointer Events specification level, in my v",https://github.com/w3c/pointerevents/issues/499#issuecomment-1978191213,https://github.com/w3c/pointerevents/issues/499,improve drop down menu handling,2024-03-05T08:19:01Z,patrickhlauke
1978180945,whatwg/html,"No we can't test that. I suggested testing that it's false for disabled form controls for instance, ",https://github.com/whatwg/html/pull/10018#issuecomment-1978180945,https://github.com/whatwg/html/pull/10018,Add a new attribute called `writingsuggestions` to control UA-provided writing assistance,2024-03-05T08:12:42Z,annevk
1978023473,whatwg/html,"Ooh, this is tricky.  I think going back and inserting things into the close watcher stack after c",https://github.com/whatwg/html/issues/9373#issuecomment-1978023473,https://github.com/whatwg/html/issues/9373,Add light dismiss functionality to `<dialog>`,2024-03-05T06:00:49Z,domenic
1977868420,whatwg/html,"I'd rather keep consistency with `spellcheck=""""`'s exclusion criteria. In general I find the `spellc",https://github.com/whatwg/html/pull/10018#issuecomment-1977868420,https://github.com/whatwg/html/pull/10018,Add a new attribute called `writingsuggestions` to control UA-provided writing assistance,2024-03-05T03:00:50Z,domenic
1977761176,whatwg/notifications,"Also I should note that https://github.com/w3c/ServiceWorker/issues/1512 would potentially decouple ",https://github.com/whatwg/notifications/issues/205#issuecomment-1977761176,https://github.com/whatwg/notifications/issues/205,Should persistent notifications be associated with service worker registration or the scope?,2024-03-05T01:09:36Z,asutherland
1977758246,whatwg/notifications,I think registration is correct.  Arguably the current use of registration allows the spec to hand-w,https://github.com/whatwg/notifications/issues/205#issuecomment-1977758246,https://github.com/whatwg/notifications/issues/205,Should persistent notifications be associated with service worker registration or the scope?,2024-03-05T01:06:16Z,asutherland
1977721748,WICG/webcomponents,"@knowler When I say ""I just see pull ..."" I don't mean I am proposing pull over push, rather that ""p",https://github.com/WICG/webcomponents/issues/909#issuecomment-1977721748,https://github.com/WICG/webcomponents/issues/909,"""open-stylable"" Shadow Roots",2024-03-05T00:23:46Z,robglidden
1977706818,WICG/webcomponents,"@sorvell Indeed, nested declarative shadow trees is I where I am finding particular benefit to ""inhe",https://github.com/WICG/webcomponents/issues/909#issuecomment-1977706818,https://github.com/WICG/webcomponents/issues/909,"""open-stylable"" Shadow Roots",2024-03-05T00:09:50Z,robglidden
1977692370,whatwg/html,I notice that [shadowColor](https://whatpr.org/html/10175/canvas.html#dom-context-2d-shadowcolor) us,https://github.com/whatwg/html/pull/10175#issuecomment-1977692370,https://github.com/whatwg/html/pull/10175,Let CSS Color handle CSS <color> value parsing,2024-03-04T23:56:19Z,Kaiido
1977647444,whatwg/html,I've analyzed the first 30 URLs from top sites listed in https://chromestatus.com/metrics/feature/ti,https://github.com/whatwg/html/issues/7867#issuecomment-1977647444,https://github.com/whatwg/html/issues/7867,Remove UA style for h1-h6 in section (et. al.) and hgroup,2024-03-04T23:28:42Z,zcorpan
1977594108,whatwg/html,"Ok, the red it's using is reasonable for both light and darkmode, so I've just pulled it out to a va",https://github.com/whatwg/html/pull/10176#issuecomment-1977594108,https://github.com/whatwg/html/pull/10176,More darkmode coloring. Fixes #10141,2024-03-04T22:40:54Z,tabatkins
1977574874,whatwg/html,"Wait, the `.glyph.control` style *is* used, it's just not in `source`. One sec while I fix it.",https://github.com/whatwg/html/pull/10176#issuecomment-1977574874,https://github.com/whatwg/html/pull/10176,More darkmode coloring. Fixes #10141,2024-03-04T22:25:42Z,tabatkins
1977561057,WICG/webcomponents,Reply to: https://github.com/WICG/webcomponents/issues/909#issuecomment-1977302028 > I just see pul,https://github.com/WICG/webcomponents/issues/909#issuecomment-1977561057,https://github.com/WICG/webcomponents/issues/909,"""open-stylable"" Shadow Roots",2024-03-04T22:14:53Z,knowler
1977490373,whatwg/html,"> I would still expect more test coverage though, in particular that `XMLHttpRequest`, `EventSource`",https://github.com/whatwg/html/pull/10022#issuecomment-1977490373,https://github.com/whatwg/html/pull/10022,Implement dangling markup injection mitigation,2024-03-04T21:28:43Z,shhnjk
1977487651,WICG/webcomponents,@robglidden   > I am working on a project with declarative shadow DOM and cascade layers and it ha,https://github.com/WICG/webcomponents/issues/909#issuecomment-1977487651,https://github.com/WICG/webcomponents/issues/909,"""open-stylable"" Shadow Roots",2024-03-04T21:27:06Z,sorvell
1977417588,whatwg/html,Webkit bug: https://bugs.webkit.org/show_bug.cgi?id=269928,https://github.com/whatwg/html/pull/10116#issuecomment-1977417588,https://github.com/whatwg/html/pull/10116,Allow top layer elements to be nested within popovers,2024-03-04T20:41:13Z,keithamus
1977399411,whatwg/dom,Seems this was prematurely closed?,https://github.com/whatwg/dom/issues/808#issuecomment-1977399411,https://github.com/whatwg/dom/issues/808,"Side effects due to tree insertion or removal (script, iframe)",2024-03-04T20:28:54Z,domfarolino
1977325466,whatwg/html,"Is anything missing from this PR? I'd like to ship this in Chrome 124, but that branches in a few we",https://github.com/whatwg/html/pull/10116#issuecomment-1977325466,https://github.com/whatwg/html/pull/10116,Allow top layer elements to be nested within popovers,2024-03-04T19:39:11Z,mfreed7
1977302028,WICG/webcomponents,@bkardell Thank you for your longer description.  Please also forgive the wordy response.  Short a,https://github.com/WICG/webcomponents/issues/909#issuecomment-1977302028,https://github.com/WICG/webcomponents/issues/909,"""open-stylable"" Shadow Roots",2024-03-04T19:26:14Z,robglidden
1977238305,w3ctag/design-reviews,Chrome (M123) is just about to enter origin trial for this feature.,https://github.com/w3ctag/design-reviews/issues/809#issuecomment-1977238305,https://github.com/w3ctag/design-reviews/issues/809,WebAssembly JavaScript Promise Integration API,2024-03-04T18:49:03Z,fgmccabe
1976925577,WICG/webcomponents,"fwiw, @bkardell  I think what you've outlined is exactly what folks are asking for. I think just the",https://github.com/WICG/webcomponents/issues/909#issuecomment-1976925577,https://github.com/WICG/webcomponents/issues/909,"""open-stylable"" Shadow Roots",2024-03-04T16:05:02Z,michaelwarren1106
1976821310,whatwg/html,Thank you! @domenic any objection to treating this as an obvious bug fix?,https://github.com/whatwg/html/pull/10175#issuecomment-1976821310,https://github.com/whatwg/html/pull/10175,Let CSS Color handle CSS <color> value parsing,2024-03-04T15:17:40Z,annevk
1976818917,whatwg/html,"There might well be a shorter token that's also reasonable, although looking at the draft specificat",https://github.com/whatwg/html/issues/10162#issuecomment-1976818917,https://github.com/whatwg/html/issues/10162,Provide a mechanism to trigger the fetch of compression dictionaries,2024-03-04T15:16:36Z,annevk
1976805495,WICG/webcomponents,"@robglidden This didn't answer my question, or if it did I didn't understand.  Sorry if this is word",https://github.com/WICG/webcomponents/issues/909#issuecomment-1976805495,https://github.com/WICG/webcomponents/issues/909,"""open-stylable"" Shadow Roots",2024-03-04T15:10:33Z,bkardell
1976795601,whatwg/html,"Sounds good to me. I wasn't entirely comfortable with `dictionary` in a document scope referring to ",https://github.com/whatwg/html/issues/10162#issuecomment-1976795601,https://github.com/whatwg/html/issues/10162,Provide a mechanism to trigger the fetch of compression dictionaries,2024-03-04T15:05:59Z,pmeenan
1976769179,whatwg/html,"There is https://github.com/web-platform-tests/wpt/commit/cf3bea46ac040b52697f4de61d3b870335d6d269, ",https://github.com/whatwg/html/pull/10175#issuecomment-1976769179,https://github.com/whatwg/html/pull/10175,Let CSS Color handle CSS <color> value parsing,2024-03-04T14:55:51Z,Loirooriol
1976722305,webkit/standards-positions,For developer interest: - The Deno runtime has implemented the [`WebSocketStream`](https://deno.lan,https://github.com/WebKit/standards-positions/issues/315#issuecomment-1976722305,https://github.com/WebKit/standards-positions/issues/315,WebSocketStream: Stream-based backpressure-supporting API for the WebSocket protocol,2024-03-04T14:35:46Z,tomayac
1976610046,whatwg/html,@svgeesus here is what I think we want:  1. For non-sRGB just do as CSS already does. 2. For sRGB,https://github.com/whatwg/html/issues/8917#issuecomment-1976610046,https://github.com/whatwg/html/issues/8917,Canvas 2D context color serialization,2024-03-04T13:42:33Z,annevk
1976585783,whatwg/html,Thanks everyone. I put up #10175.,https://github.com/whatwg/html/issues/9940#issuecomment-1976585783,https://github.com/whatwg/html/issues/9940,"""parse a CSS <color> value"" should take into account that currentColor can be nested in color-mix() ",2024-03-04T13:29:44Z,annevk
1976584753,whatwg/html,@Loirooriol do you know if this is tested? Is any browser non-compliant?,https://github.com/whatwg/html/pull/10175#issuecomment-1976584753,https://github.com/whatwg/html/pull/10175,Let CSS Color handle CSS <color> value parsing,2024-03-04T13:29:13Z,annevk
1976576034,webkit/standards-positions,Thanks! I should have specifically asked for web developer interest as we're curious what adoption m,https://github.com/WebKit/standards-positions/issues/315#issuecomment-1976576034,https://github.com/WebKit/standards-positions/issues/315,WebSocketStream: Stream-based backpressure-supporting API for the WebSocket protocol,2024-03-04T13:24:43Z,annevk
1976545366,whatwg/html,"Also, you shouldn't have merged any tests without `.tentative` in the name. This is not agreed upon ",https://github.com/whatwg/html/pull/10022#issuecomment-1976545366,https://github.com/whatwg/html/pull/10022,Implement dangling markup injection mitigation,2024-03-04T13:07:49Z,annevk
1976519653,whatwg/html,"Spellchecking also has the concept of ""true-by-default"", but it's not clear that's actually implemen",https://github.com/whatwg/html/pull/10018#issuecomment-1976519653,https://github.com/whatwg/html/pull/10018,Add a new attribute called `writingsuggestions` to control UA-provided writing assistance,2024-03-04T12:53:40Z,annevk
1976504498,whatwg/dom,> This looks complicated. Any reason we cannot convert to Text nodes first and then potentially thro,https://github.com/whatwg/dom/pull/1258#issuecomment-1976504498,https://github.com/whatwg/dom/pull/1258,Integration with trusted types inside of node conversion,2024-03-04T12:45:00Z,lukewarlow
1976468842,webkit/standards-positions,Chrome sees WebSockets used on 10% of page loads: https://chromestatus.com/metrics/feature/timeline/,https://github.com/WebKit/standards-positions/issues/315#issuecomment-1976468842,https://github.com/WebKit/standards-positions/issues/315,WebSocketStream: Stream-based backpressure-supporting API for the WebSocket protocol,2024-03-04T12:24:35Z,ricea
1976439232,whatwg/html,I think `rel=dictionary` is not specific enough. If I were to come across that I would expect that t,https://github.com/whatwg/html/issues/10162#issuecomment-1976439232,https://github.com/whatwg/html/issues/10162,Provide a mechanism to trigger the fetch of compression dictionaries,2024-03-04T12:09:08Z,annevk
1976436575,whatwg/html,"> https://github.com/whatwg/html/issues/10153#issuecomment-1976432980  Thank you, @annevk. I'm awa",https://github.com/whatwg/html/issues/10153#issuecomment-1976436575,https://github.com/whatwg/html/issues/10153,Nested comment tags.,2024-03-04T12:07:43Z,RokeJulianLockhart
1976432980,whatwg/html,"https://whatwg.org/working-mode#changes describes the process, but in this specific case I know that",https://github.com/whatwg/html/issues/10153#issuecomment-1976432980,https://github.com/whatwg/html/issues/10153,Nested comment tags.,2024-03-04T12:05:40Z,annevk
1976428404,whatwg/html,"> https://github.com/whatwg/html/issues/10153#issuecomment-1976419737  @annevk, what is the proced",https://github.com/whatwg/html/issues/10153#issuecomment-1976428404,https://github.com/whatwg/html/issues/10153,Nested comment tags.,2024-03-04T12:03:04Z,RokeJulianLockhart
1976428267,whatwg/html,"Nice find. Yeah, I suppose we need to eagerly create the `Storage` holders.",https://github.com/whatwg/html/issues/10135#issuecomment-1976428267,https://github.com/whatwg/html/issues/10135,Storage event should probably fire on Document that didn't call localStorage getter,2024-03-04T12:02:59Z,annevk
1976419737,whatwg/html,We cannot make a breaking change like this to how HTML is parsed. Especially with so little justific,https://github.com/whatwg/html/issues/10153#issuecomment-1976419737,https://github.com/whatwg/html/issues/10153,Nested comment tags.,2024-03-04T11:58:33Z,annevk
1976412190,whatwg/html,"I suppose that essentially argues for making `:closed` match all elements, or at least all elements ",https://github.com/whatwg/html/pull/10126#issuecomment-1976412190,https://github.com/whatwg/html/pull/10126,Add the :open and :closed pseudo-selectors,2024-03-04T11:54:01Z,annevk
1976405996,whatwg/html,Related: https://github.com/whatwg/html/issues/5033#issuecomment-1733292070,https://github.com/whatwg/html/issues/7390#issuecomment-1976405996,https://github.com/whatwg/html/issues/7390,"Element request: `<h>` to reconcile heading levels, outlines, and components",2024-03-04T11:50:16Z,jakearchibald
1976395154,whatwg/html,We should just make `<h1>` work this way.,https://github.com/whatwg/html/issues/7390#issuecomment-1976395154,https://github.com/whatwg/html/issues/7390,"Element request: `<h>` to reconcile heading levels, outlines, and components",2024-03-04T11:43:48Z,jakearchibald
1976378991,whatwg/html,@dbaron what do you think? Seems worth trying to tackle now that we've done most of the other direct,https://github.com/whatwg/html/issues/4903#issuecomment-1976378991,https://github.com/whatwg/html/issues/4903,"input field placeholders should respect the dir attribute when set to ""auto""",2024-03-04T11:34:05Z,annevk
1976000851,whatwg/html,I think throwing on the SVG type is probably what we want though. That's a small change that would a,https://github.com/whatwg/html/pull/10172#issuecomment-1976000851,https://github.com/whatwg/html/pull/10172,Remove SVG Blob support from createImageBitmap,2024-03-04T08:31:53Z,annevk
1975983276,whatwg/html,"Oh, very good point...    There is actually already [a test](https://wpt.fyi/results/html/canvas/e",https://github.com/whatwg/html/pull/10172#issuecomment-1975983276,https://github.com/whatwg/html/pull/10172,Remove SVG Blob support from createImageBitmap,2024-03-04T08:23:50Z,Kaiido
1975956756,whatwg/html,"cc @padenot @hoch ",https://github.com/whatwg/html/issues/10169#issuecomment-1975956756,https://github.com/whatwg/html/issues/10169,Worklet termination,2024-03-04T08:12:23Z,annevk
1975956182,whatwg/html,Somewhat related: #10136.,https://github.com/whatwg/html/issues/10169#issuecomment-1975956182,https://github.com/whatwg/html/issues/10169,Worklet termination,2024-03-04T08:11:59Z,annevk
1975945212,whatwg/html,Here's an interesting test:  `type` is set to `image/svg+xml` but the blob decodes as a PNG. I str,https://github.com/whatwg/html/pull/10172#issuecomment-1975945212,https://github.com/whatwg/html/pull/10172,Remove SVG Blob support from createImageBitmap,2024-03-04T08:06:53Z,annevk
1975938047,whatwg/html,"That ""The transformations must be performed in reverse order."" almost sounds like a note rather than",https://github.com/whatwg/html/issues/2848#issuecomment-1975938047,https://github.com/whatwg/html/issues/2848,Small clarity improvements to canvas transform methods,2024-03-04T08:02:21Z,Kaiido
1975886074,whatwg/html,"> Another thing that would be really nice here if we could inline the ""The transformations must be p",https://github.com/whatwg/html/issues/2848#issuecomment-1975886074,https://github.com/whatwg/html/issues/2848,Small clarity improvements to canvas transform methods,2024-03-04T07:25:16Z,tawandamoyo
1975870999,whatwg/html,"Finally was able to dig into the tests issue here, and I found the problem. Tests will be exported f",https://github.com/whatwg/html/pull/10043#issuecomment-1975870999,https://github.com/whatwg/html/pull/10043,Fix key event used for close requests,2024-03-04T07:12:39Z,domenic
1975774567,webkit/standards-positions,"You need to use the command line flag `--enable-blink-features=StandardizedBrowserZoom` in order to ",https://github.com/WebKit/standards-positions/issues/311#issuecomment-1975774567,https://github.com/WebKit/standards-positions/issues/311,Standardized CSS zoom,2024-03-04T05:43:52Z,yoavweiss
1975744382,whatwg/html,"Yes, that's exactly right!",https://github.com/whatwg/html/issues/2848#issuecomment-1975744382,https://github.com/whatwg/html/issues/2848,Small clarity improvements to canvas transform methods,2024-03-04T05:10:39Z,domenic
1975691031,whatwg/html,"Hmm, I forgot that my plan was to fire `cancel` anyway. I think we can add that on top of #10168 tho",https://github.com/whatwg/html/issues/10047#issuecomment-1975691031,https://github.com/whatwg/html/issues/10047,Close watchers: detecting close requests vs. other closes,2024-03-04T04:44:02Z,domenic
1975689421,whatwg/html,Thanks so much for your review @lukewarlow!  > Just to clarify this doesn't increase the total num,https://github.com/whatwg/html/pull/10168#issuecomment-1975689421,https://github.com/whatwg/html/pull/10168,Re-do close watcher user activation tracking,2024-03-04T04:43:32Z,domenic
1975567814,webkit/standards-positions,"from the tests on  * STP 188,  * Firefox Nightly 125.0a1 (2024-02-21) (64-bit)  * Chrome Canary V",https://github.com/WebKit/standards-positions/issues/311#issuecomment-1975567814,https://github.com/WebKit/standards-positions/issues/311,Standardized CSS zoom,2024-03-04T03:00:00Z,karlcow
1975509683,whatwg/html," > although it seems surprising it wouldn't be supported anywhere. This is not too different from u",https://github.com/whatwg/html/pull/10172#issuecomment-1975509683,https://github.com/whatwg/html/pull/10172,Remove SVG Blob support from createImageBitmap,2024-03-04T01:45:24Z,Kaiido
1975122712,whatwg/html,I've filed a bug now.,https://github.com/whatwg/html/issues/9181#issuecomment-1975122712,https://github.com/whatwg/html/issues/9181,Make <img> src attribute optional if srcset is present,2024-03-03T11:02:39Z,foolip
1975122209,whatwg/html,"This seems fine to me, although it seems surprising it wouldn't be supported anywhere. This is not t",https://github.com/whatwg/html/pull/10172#issuecomment-1975122209,https://github.com/whatwg/html/pull/10172,Remove SVG Blob support from createImageBitmap,2024-03-03T11:00:44Z,annevk
1975119811,whatwg/html,I think the problem now is that there are certain JS APIs that assume there's an event loop (as defi,https://github.com/whatwg/html/issues/10136#issuecomment-1975119811,https://github.com/whatwg/html/issues/10136,Worklet agents and the event loop,2024-03-03T10:50:18Z,annevk
1975090712,webkit/standards-positions,It seems like there are some [compatibility issues](https://issues.chromium.org/issues/327837303) re,https://github.com/WebKit/standards-positions/issues/311#issuecomment-1975090712,https://github.com/WebKit/standards-positions/issues/311,Standardized CSS zoom,2024-03-03T08:52:33Z,yoavweiss
1975083169,whatwg/encoding,"I see now, thank you.",https://github.com/whatwg/encoding/issues/325#issuecomment-1975083169,https://github.com/whatwg/encoding/issues/325,Ambiguous wording in GB18030 decoder,2024-03-03T08:18:30Z,stasoid
1975081000,whatwg/encoding,"Yeah, it's meant to ""restore"" _ioQueue_ as if those bytes were not processed after all, allowing the",https://github.com/whatwg/encoding/issues/325#issuecomment-1975081000,https://github.com/whatwg/encoding/issues/325,Ambiguous wording in GB18030 decoder,2024-03-03T08:08:17Z,annevk
