id,repo,body,url,issue_url,issue_title,created_at,user
1577983551,whatwg/html,"Seems like a reasonable assertion to add given ""hide popover"" sets the invoker to null.",https://github.com/whatwg/html/issues/9383#issuecomment-1577983551,https://github.com/whatwg/html/issues/9383,"Should ""show popover"" assert the element's popover invoker is null?",2023-06-06T06:20:42Z,nt1m
1577960150,whatwg/html,@cwilso my concern is that popover landed in the standard with lots of issues that need to be addres,https://github.com/whatwg/html/pull/9144#issuecomment-1577960150,https://github.com/whatwg/html/pull/9144,Add anchor attribute,2023-06-06T05:56:34Z,annevk
1577936091,whatwg/html,@josepharhar @tabatkins My initial thought looking at this is whether we can leverage presentation h,https://github.com/whatwg/html/pull/9144#issuecomment-1577936091,https://github.com/whatwg/html/pull/9144,Add anchor attribute,2023-06-06T05:33:18Z,nt1m
1577923808,whatwg/html,@zcorpan do you need a bug or will the tests suffice?,https://github.com/whatwg/html/pull/9369#issuecomment-1577923808,https://github.com/whatwg/html/pull/9369,Tighten auto popover list definition,2023-06-06T05:18:10Z,annevk
1577914426,whatwg/html,"Thanks! For next time, editorial changes are prefixed with ""Editorial: "".",https://github.com/whatwg/html/pull/9388#issuecomment-1577914426,https://github.com/whatwg/html/pull/9388,[editorial] Fix typo & quoting inconsistency in popover example,2023-06-06T05:08:19Z,annevk
1577790269,whatwg/html,"Yes, that's the primary use case for the JS API for us, and the VT API would likely work well enough",https://github.com/whatwg/html/issues/9332#issuecomment-1577790269,https://github.com/whatwg/html/issues/9332,[View Transitions] Extend render-blocking to support Document,2023-06-06T02:15:03Z,nickcoury
1577731722,whatwg/html,"> Wouldn't it be even more confusing if you have to use document.getElementsByClassName(""foo"") but e",https://github.com/whatwg/html/issues/9379#issuecomment-1577731722,https://github.com/whatwg/html/issues/9379,Add `class` & `for` aliases for `className` and `htmlFor`,2023-06-06T00:39:26Z,bathos
1577689471,whatwg/html,What about functions like [`getElementsByClassName`](https://developer.mozilla.org/en-US/docs/Web/AP,https://github.com/whatwg/html/issues/9379#issuecomment-1577689471,https://github.com/whatwg/html/issues/9379,Add `class` & `for` aliases for `className` and `htmlFor`,2023-06-05T23:37:44Z,Frank-Mayer
1577501107,whatwg/html,"@josepharhar I just noticed a small bug here on the spec, the ""is modal"" check will never be true, s",https://github.com/whatwg/html/pull/9178#issuecomment-1577501107,https://github.com/whatwg/html/pull/9178,Only restore dialog focus if focus is in the dialog,2023-06-05T21:27:27Z,nt1m
1577472627,whatwg/html,"I only noticed this because existing WPT were failing when I implemented the previous definition, so",https://github.com/whatwg/html/pull/9369#issuecomment-1577472627,https://github.com/whatwg/html/pull/9369,Tighten auto popover list definition,2023-06-05T21:04:06Z,nt1m
1577466643,whatwg/html,> Does this need implementation bugs?  I'm not sure if WebKit already implemented this in https://,https://github.com/whatwg/html/pull/9369#issuecomment-1577466643,https://github.com/whatwg/html/pull/9369,Tighten auto popover list definition,2023-06-05T20:59:49Z,josepharhar
1577461929,whatwg/html,> So one way forward could be to check for which callers that method's return value might differ fro,https://github.com/whatwg/html/issues/9367#issuecomment-1577461929,https://github.com/whatwg/html/issues/9367,"When the popover attribute is removed, the hide popover algorithm will return too early",2023-06-05T20:56:41Z,josepharhar
1577401130,webkit/standards-positions,"In my view, we've already paid the cost of mutation events. Since there are other events that fire a",https://github.com/WebKit/standards-positions/issues/192#issuecomment-1577401130,https://github.com/WebKit/standards-positions/issues/192,Deprecation / Removal of Mutation Events,2023-06-05T20:04:27Z,rniwa
1577393786,whatwg/html,"@hinell, please...we all know that. which is the whole point of this issue, adding aliases for match",https://github.com/whatwg/html/issues/9379#issuecomment-1577393786,https://github.com/whatwg/html/issues/9379,Add `class` & `for` aliases for `className` and `htmlFor`,2023-06-05T20:00:18Z,patrickhlauke
1577389319,whatwg/html,"@jakearchibald `class` and `for` are attributes actually. The latter is used in lables. :eyes: ",https://github.com/whatwg/html/issues/9379#issuecomment-1577389319,https://github.com/whatwg/html/issues/9379,Add `class` & `for` aliases for `className` and `htmlFor`,2023-06-05T19:57:41Z,hinell
1577356338,w3c/pointerevents,Started working on a new WPT.,https://github.com/w3c/pointerevents/pull/382#issuecomment-1577356338,https://github.com/w3c/pointerevents/pull/382,Expand the definition/explanation of predicted events timestamps,2023-06-05T19:27:35Z,mustaqahmed
1577285716,whatwg/html,"This makes sense to me, but note that `ElementInternals` would not be able to share the same hypothe",https://github.com/whatwg/html/issues/9385#issuecomment-1577285716,https://github.com/whatwg/html/issues/9385,Constraint Validation IDL is reiterated multiple times,2023-06-05T18:41:54Z,bathos
1577236137,whatwg/html,So I've signed the agreement and I've also figured out the exact line that I need to modify.   Aro,https://github.com/whatwg/html/issues/9347#issuecomment-1577236137,https://github.com/whatwg/html/issues/9347,""" autocomplete cols;"" missing a semicolon",2023-06-05T18:01:31Z,kaf-lamed-beyt
1577199104,whatwg/html,@annevk I'm not sure I understand why this work is blocking on popover.  Although popover is one pla,https://github.com/whatwg/html/pull/9144#issuecomment-1577199104,https://github.com/whatwg/html/pull/9144,Add anchor attribute,2023-06-05T17:32:54Z,cwilso
1577160419,whatwg/dom,"I don't know why XPath keeps being related to XSLT (oh 90's, sometimes I miss you) but anything that",https://github.com/whatwg/dom/issues/1198#issuecomment-1577160419,https://github.com/whatwg/dom/issues/1198,Import HTML's XPath and XSLT monkey patches,2023-06-05T17:04:25Z,WebReflection
1577125079,mozilla/standards-positions,"Is there any chance of an update here? As a developer, I really want this functionalityâ€”and Iâ€™ve see",https://github.com/mozilla/standards-positions/issues/472#issuecomment-1577125079,https://github.com/mozilla/standards-positions/issues/472,CSS @scope,2023-06-05T16:38:28Z,keithjgrant
1577094120,w3ctag/design-reviews,"@mnot wrote:  > there was a fair amount of negative feedback from HTTP folks on this specfication",https://github.com/w3ctag/design-reviews/issues/849#issuecomment-1577094120,https://github.com/w3ctag/design-reviews/issues/849,Incremental Font Transfer: Patch Subset,2023-06-05T16:15:34Z,svgeesus
1577091958,whatwg/html,"agreed.  light dismiss for modal dialogs should be an opt in, not a default,",https://github.com/whatwg/html/issues/9373#issuecomment-1577091958,https://github.com/whatwg/html/issues/9373,Add light dismiss functionality to `<dialog>`,2023-06-05T16:14:04Z,scottaohara
1577090597,whatwg/html,"Thank you @cookiecrook, @domenic, @zcorpan, @annevk and all for your consideration and input (and so",https://github.com/whatwg/html/issues/9084#issuecomment-1577090597,https://github.com/whatwg/html/issues/9084,Accessibility Attribute Request,2023-06-05T16:13:11Z,matatk
1577070305,whatwg/html,"> > Note one nuance, which is different from popover: since there's no concept of ""nested"" dialogs ",https://github.com/whatwg/html/issues/9373#issuecomment-1577070305,https://github.com/whatwg/html/issues/9373,Add light dismiss functionality to `<dialog>`,2023-06-05T16:01:10Z,mfreed7
1577053411,mozilla/standards-positions,Sounds reasonable to me!,https://github.com/mozilla/standards-positions/issues/756#issuecomment-1577053411,https://github.com/mozilla/standards-positions/issues/756,Request for Mozilla Position on RTCRtpReceiver.jitterBufferTarget,2023-06-05T15:50:37Z,zcorpan
1577044321,whatwg/html,@annevk The WebKit export for https://github.com/WebKit/WebKit/pull/14454 should take care of it.,https://github.com/whatwg/html/pull/9344#issuecomment-1577044321,https://github.com/whatwg/html/pull/9344,Check dialog is modal flag instead of open attribute in 'check popover validity' algorithm,2023-06-05T15:44:09Z,nt1m
1577040070,whatwg/html,We generally don't add features without knowing that they're useful for something. See https://whatw,https://github.com/whatwg/html/issues/9102#issuecomment-1577040070,https://github.com/whatwg/html/issues/9102,<textarea> should support the [pattern] attribute like the <input> element,2023-06-05T15:41:16Z,zcorpan
1577007252,w3ctag/design-reviews,Sincere apologies for the delay in getting back to you on this @daniel-montalvo. Considering this is,https://github.com/w3ctag/design-reviews/issues/821#issuecomment-1577007252,https://github.com/w3ctag/design-reviews/issues/821,Review of DPUB-ARIA 1.1 and DPUB-AAM 1.1,2023-06-05T15:20:03Z,rhiaro
1577006940,whatwg/html,"Anything else I can do to move this forward? @nt1m @annevk ",https://github.com/whatwg/html/pull/9093#issuecomment-1577006940,https://github.com/whatwg/html/pull/9093,Use CSS spec for top layer,2023-06-05T15:19:51Z,josepharhar
1576990820,whatwg/html,@zcorpan there is simply no reason for it to be not implemented to be honest. I don't remember my or,https://github.com/whatwg/html/issues/9102#issuecomment-1576990820,https://github.com/whatwg/html/issues/9102,<textarea> should support the [pattern] attribute like the <input> element,2023-06-05T15:12:31Z,soanvig
1576974530,whatwg/webidl,"For integers we have `Clamp` and `EnforceRange` extended attributes to control throwing or changing ",https://github.com/whatwg/webidl/issues/893#issuecomment-1576974530,https://github.com/whatwg/webidl/issues/893,Enums that does not throw?,2023-06-05T15:04:32Z,zcorpan
1576945317,whatwg/html,Can you give concrete examples of where this would be useful?,https://github.com/whatwg/html/issues/9102#issuecomment-1576945317,https://github.com/whatwg/html/issues/9102,<textarea> should support the [pattern] attribute like the <input> element,2023-06-05T14:48:31Z,zcorpan
1576940382,whatwg/html,regarding: >we noticed is that mouse/keyboard users are able to activate interactive content inside,https://github.com/whatwg/html/issues/2272#issuecomment-1576940382,https://github.com/whatwg/html/issues/2272,Disallow interactive content in <summary>,2023-06-05T14:45:28Z,scottaohara
1576940150,whatwg/html,"Supporting light dismiss for `dialog` seems nice. I wonder if we're able to make it work by default,",https://github.com/whatwg/html/issues/9373#issuecomment-1576940150,https://github.com/whatwg/html/issues/9373,Add light dismiss functionality to `<dialog>`,2023-06-05T14:45:19Z,zcorpan
1576926107,whatwg/html,"Given the discussion above, I've closed #9372, but I'm glad it triggered this discussion.  It sounds",https://github.com/whatwg/html/issues/2272#issuecomment-1576926107,https://github.com/whatwg/html/issues/2272,Disallow interactive content in <summary>,2023-06-05T14:36:11Z,dbaron
1576918758,whatwg/html,"Based on the discussion in #2272, sounds like I should retract this PR.",https://github.com/whatwg/html/pull/9372#issuecomment-1576918758,https://github.com/whatwg/html/pull/9372,Disallow interactive content in <summary>.,2023-06-05T14:31:21Z,dbaron
1576907140,whatwg/html,"Ah right, I think it can assert it then, looking at the callers.",https://github.com/whatwg/html/issues/9383#issuecomment-1576907140,https://github.com/whatwg/html/issues/9383,"Should ""show popover"" assert the element's popover invoker is null?",2023-06-05T14:24:23Z,annevk
1576883964,whatwg/html,"@annevk be aware that `showPopover()` (https://html.spec.whatwg.org/#dom-showpopover) invokes ""show ",https://github.com/whatwg/html/issues/9383#issuecomment-1576883964,https://github.com/whatwg/html/issues/9383,"Should ""show popover"" assert the element's popover invoker is null?",2023-06-05T14:10:44Z,mbrodesser-Igalia
1576825877,whatwg/html,"> of those, 46% use `summary` with interactive content (or 105,235 pages or 0.82% of total pages) ",https://github.com/whatwg/html/issues/2272#issuecomment-1576825877,https://github.com/whatwg/html/issues/2272,Disallow interactive content in <summary>,2023-06-05T13:38:21Z,sideshowbarker
1576788621,whatwg/dom,* https://html.spec.whatwg.org/#interactions-with-xpath-and-xslt * https://html.spec.whatwg.org/#sc,https://github.com/whatwg/dom/issues/1198#issuecomment-1576788621,https://github.com/whatwg/dom/issues/1198,Import HTML's XPath and XSLT monkey patches,2023-06-05T13:18:03Z,annevk
1576782923,whatwg/html,<s>I'm not sure how this can be true. There's nothing preventing another invocation of `showPopover(,https://github.com/whatwg/html/issues/9383#issuecomment-1576782923,https://github.com/whatwg/html/issues/9383,"Should ""show popover"" assert the element's popover invoker is null?",2023-06-05T13:14:44Z,annevk
1576631391,w3ctag/design-reviews,"@rhiaro @torgo @plinss Hearing no objections to the above comment, @mattgarrish and I are planning ",https://github.com/w3ctag/design-reviews/issues/821#issuecomment-1576631391,https://github.com/w3ctag/design-reviews/issues/821,Review of DPUB-ARIA 1.1 and DPUB-AAM 1.1,2023-06-05T11:41:41Z,daniel-montalvo
1576625270,whatwg/dom,What monkey patches you're talking about here?,https://github.com/whatwg/dom/issues/1198#issuecomment-1576625270,https://github.com/whatwg/dom/issues/1198,Import HTML's XPath and XSLT monkey patches,2023-06-05T11:36:26Z,smaug----
1576618204,whatwg/dom,Do we have any use counters for the APIs? (Firefox doesn't have),https://github.com/whatwg/dom/issues/1189#issuecomment-1576618204,https://github.com/whatwg/dom/issues/1189,Should TreeWalker be expanded to support shadow roots in support of the selection API?,2023-06-05T11:31:22Z,smaug----
1576605389,w3c/pointerevents,"edited the above table to just highlight (bold, italic, square brackets) the outliers (the click eve",https://github.com/w3c/pointerevents/issues/356#issuecomment-1576605389,https://github.com/w3c/pointerevents/issues/356,Clarify what the target of the click event should be after capturing pointer events,2023-06-05T11:20:10Z,patrickhlauke
1576516979,webkit/standards-positions,"I discussed this with colleagues and this looks good to us. I suggest we label this as ""position: su",https://github.com/WebKit/standards-positions/issues/194#issuecomment-1576516979,https://github.com/WebKit/standards-positions/issues/194,BYOB support for Fetch,2023-06-05T10:13:35Z,annevk
1576515257,whatwg/html,Awesome! I'll sign the agreement now and go over `source` If I get stuck. I'll reach out,https://github.com/whatwg/html/issues/9347#issuecomment-1576515257,https://github.com/whatwg/html/issues/9347,""" autocomplete cols;"" missing a semicolon",2023-06-05T10:12:29Z,kaf-lamed-beyt
1576510182,whatwg/html,Thanks for your interest! In order to fix this you need to change `source` and be comfortable signin,https://github.com/whatwg/html/issues/9347#issuecomment-1576510182,https://github.com/whatwg/html/issues/9347,""" autocomplete cols;"" missing a semicolon",2023-06-05T10:09:14Z,annevk
1576474868,whatwg/html,"@hinell added spec links. Although, I thought it would be obvious since `className` and `htmlFor` ar",https://github.com/whatwg/html/issues/9379#issuecomment-1576474868,https://github.com/whatwg/html/issues/9379,Add `class` & `for` aliases for `className` and `htmlFor`,2023-06-05T09:45:37Z,jakearchibald
1576470586,whatwg/html,You should clarify your post on whether you are talking about HTML Attributes or `Element` propertie,https://github.com/whatwg/html/issues/9379#issuecomment-1576470586,https://github.com/whatwg/html/issues/9379,Add `class` & `for` aliases for `className` and `htmlFor`,2023-06-05T09:42:28Z,hinell
1576469938,whatwg/html,"Doh, sorry, it's right there in the OP and I managed to miss it.",https://github.com/whatwg/html/issues/9379#issuecomment-1576469938,https://github.com/whatwg/html/issues/9379,Add `class` & `for` aliases for `className` and `htmlFor`,2023-06-05T09:41:58Z,patrickhlauke
1576466945,whatwg/html,"The proposal is to add aliases, not rename the properties.",https://github.com/whatwg/html/issues/9379#issuecomment-1576466945,https://github.com/whatwg/html/issues/9379,Add `class` & `for` aliases for `className` and `htmlFor`,2023-06-05T09:39:40Z,jakearchibald
1576452156,whatwg/html,"I'd be in favour of the new shorter consistent properties, but for backwards compat likely need to k",https://github.com/whatwg/html/issues/9379#issuecomment-1576452156,https://github.com/whatwg/html/issues/9379,Add `class` & `for` aliases for `className` and `htmlFor`,2023-06-05T09:28:45Z,patrickhlauke
1576394843,mozilla/standards-positions,@zcorpan do we need more information before we resolve this?,https://github.com/mozilla/standards-positions/issues/484#issuecomment-1576394843,https://github.com/mozilla/standards-positions/issues/484,Clipboard DataTransfer read-only files,2023-06-05T08:53:41Z,hsinyi
1576393779,whatwg/html,> I think this proposal should be considered on its own ignoring what JSX or other libraries are doi,https://github.com/whatwg/html/issues/9379#issuecomment-1576393779,https://github.com/whatwg/html/issues/9379,Add `class` & `for` aliases for `className` and `htmlFor`,2023-06-05T08:52:53Z,jakearchibald
1576371422,whatwg/html,"> Well, Solidjs, as an example, doesn't expose these names in JSX. It simply uses `class`. The fact ",https://github.com/whatwg/html/issues/9379#issuecomment-1576371422,https://github.com/whatwg/html/issues/9379,Add `class` & `for` aliases for `className` and `htmlFor`,2023-06-05T08:39:30Z,Gpx
1576370090,whatwg/html,Also usage of `summary` seems to have grown from [0.9% last year](https://docs.google.com/spreadshee,https://github.com/whatwg/html/issues/2272#issuecomment-1576370090,https://github.com/whatwg/html/issues/2272,Disallow interactive content in <summary>,2023-06-05T08:38:52Z,zcorpan
1576352017,whatwg/html,"I queried httparchive (total pages 12,808,711). Findings:  - 1.77% of pages use `summary` (226,719",https://github.com/whatwg/html/issues/2272#issuecomment-1576352017,https://github.com/whatwg/html/issues/2272,Disallow interactive content in <summary>,2023-06-05T08:30:43Z,zcorpan
1576163490,whatwg/html,"@annevk cases where you want to override previous changes, or setting an initial set of class names.",https://github.com/whatwg/html/issues/9379#issuecomment-1576163490,https://github.com/whatwg/html/issues/9379,Add `class` & `for` aliases for `className` and `htmlFor`,2023-06-05T07:05:02Z,jakearchibald
1576143882,whatwg/webidl,I think we actually want to allow specs to create AggregateErrors. E.g. https://github.com/whatwg/st,https://github.com/whatwg/webidl/issues/1314#issuecomment-1576143882,https://github.com/whatwg/webidl/issues/1314,Simple exceptions â€œapart from...â€ list is incomplete,2023-06-05T06:49:56Z,domenic
1576123855,whatwg/html,"> Well, Solidjs, as an example, doesn't expose these names in JSX. It simply uses `class`. The fact ",https://github.com/whatwg/html/issues/9379#issuecomment-1576123855,https://github.com/whatwg/html/issues/9379,Add `class` & `for` aliases for `className` and `htmlFor`,2023-06-05T06:28:55Z,gioboa
1576108423,whatwg/html,"What's a good use case for `className` that is not better tackled with `classList`? (Also, this part",https://github.com/whatwg/html/issues/9379#issuecomment-1576108423,https://github.com/whatwg/html/issues/9379,Add `class` & `for` aliases for `className` and `htmlFor`,2023-06-05T06:13:29Z,annevk
1575994942,whatwg/html,I updated the PR with @annevk's suggestion applied.,https://github.com/whatwg/html/pull/9344#issuecomment-1575994942,https://github.com/whatwg/html/pull/9344,Check dialog is modal flag instead of open attribute in 'check popover validity' algorithm,2023-06-05T03:46:15Z,nt1m
1575797541,webkit/standards-positions,Support for the `overflow-block` and `overflow-inline` Media Queries shipped in [Safari Technology P,https://github.com/WebKit/standards-positions/issues/146#issuecomment-1575797541,https://github.com/WebKit/standards-positions/issues/146,Update and overflow media features,2023-06-04T23:39:36Z,jensimmons
1575760905,whatwg/html,"Well, Solidjs, as an example, doesn't expose these names in JSX. It simply uses `class`. The fact th",https://github.com/whatwg/html/issues/9379#issuecomment-1575760905,https://github.com/whatwg/html/issues/9379,Add `class` & `for` aliases for `className` and `htmlFor`,2023-06-04T22:46:44Z,aminya
1575655097,whatwg/html,"Hi @annevk,  I'd love to work on this. Can you assign it to me? Although this will be my first tim",https://github.com/whatwg/html/issues/9347#issuecomment-1575655097,https://github.com/whatwg/html/issues/9347,""" autocomplete cols;"" missing a semicolon",2023-06-04T17:49:13Z,kaf-lamed-beyt
1575624464,whatwg/html,"Yeah, pre-ES5 those keywords were reserved unconditionally. But it's been a decade since they were u",https://github.com/whatwg/html/issues/9379#issuecomment-1575624464,https://github.com/whatwg/html/issues/9379,Add `class` & `for` aliases for `className` and `htmlFor`,2023-06-04T16:07:44Z,tabatkins
1575488139,mozilla/standards-positions,"I think generally looks good. The main concern is implementation (this needs to be supported at the ",https://github.com/mozilla/standards-positions/issues/810#issuecomment-1575488139,https://github.com/mozilla/standards-positions/issues/810,CSS Values 4: mix(),2023-06-04T09:31:19Z,emilio
1575361566,whatwg/html,I was talking with @muan about this and one thing we noticed is that mouse/keyboard users are able t,https://github.com/whatwg/html/issues/2272#issuecomment-1575361566,https://github.com/whatwg/html/issues/2272,Disallow interactive content in <summary>,2023-06-04T03:36:46Z,domenic
1575112584,whatwg/html,"i can appreciate that comparison.  I mean, the summary element is defined as a 'summary, caption, le",https://github.com/whatwg/html/issues/2272#issuecomment-1575112584,https://github.com/whatwg/html/issues/2272,Disallow interactive content in <summary>,2023-06-03T18:28:17Z,scottaohara
1574762631,whatwg/html,"@domenic for GitHubâ€™s use case we consider non modal dialogs stuff like the labels, assignees, revie",https://github.com/whatwg/html/issues/9376#issuecomment-1574762631,https://github.com/whatwg/html/issues/9376,Should we deprecate `dialog.show()`?,2023-06-03T07:59:25Z,keithamus
1574726034,whatwg/html,"Domenic pointed out https://participate.whatwg.org/agreement#signature on chat, as a real-world exam",https://github.com/whatwg/html/issues/2272#issuecomment-1574726034,https://github.com/whatwg/html/issues/2272,Disallow interactive content in <summary>,2023-06-03T06:49:47Z,annevk
1574671676,mozilla/standards-positions,CC also @dholbert,https://github.com/mozilla/standards-positions/issues/809#issuecomment-1574671676,https://github.com/mozilla/standards-positions/issues/809,CSS Values 5: random(),2023-06-03T05:32:48Z,CanadaHonk
1574671595,mozilla/standards-positions,CC also @dholbert,https://github.com/mozilla/standards-positions/issues/810#issuecomment-1574671595,https://github.com/mozilla/standards-positions/issues/810,CSS Values 4: mix(),2023-06-03T05:32:32Z,CanadaHonk
1574578060,whatwg/html,"> Note one nuance, which is different from popover: since there's no concept of ""nested"" dialogs  ",https://github.com/whatwg/html/issues/9373#issuecomment-1574578060,https://github.com/whatwg/html/issues/9373,Add light dismiss functionality to `<dialog>`,2023-06-03T02:36:43Z,domenic
1574576530,whatwg/html,I think the biggest question mark here is whether you actually always want non-modal dialog things i,https://github.com/whatwg/html/issues/9376#issuecomment-1574576530,https://github.com/whatwg/html/issues/9376,Should we deprecate `dialog.show()`?,2023-06-03T02:34:17Z,domenic
1574350246,whatwg/html,"I believe since this issue was filed, there now exists `<dialog>` with a `showModal()` API. What be",https://github.com/whatwg/html/issues/5593#issuecomment-1574350246,https://github.com/whatwg/html/issues/5593,Proposal: Window.openModal(url),2023-06-02T21:45:09Z,keithamus
1574349461,mozilla/standards-positions,"Hi folks, updating this thread to note that Chromium is working on adding support for Bluetooth Clas",https://github.com/mozilla/standards-positions/issues/687#issuecomment-1574349461,https://github.com/mozilla/standards-positions/issues/687,Re-request for postion on Web Serial/Serial API,2023-06-02T21:44:07Z,nondebug
1574323238,whatwg/html,It sounds like the use-case for a JS API is primarily for same-document navigations where removing t,https://github.com/whatwg/html/issues/9332#issuecomment-1574323238,https://github.com/whatwg/html/issues/9332,[View Transitions] Extend render-blocking to support Document,2023-06-02T21:14:18Z,khushalsagar
1574291263,whatwg/html,"> If it just works do we need to deprecate `dialog.show()`?  Yes, that just works. And that's why ",https://github.com/whatwg/html/issues/9376#issuecomment-1574291263,https://github.com/whatwg/html/issues/9376,Should we deprecate `dialog.show()`?,2023-06-02T20:41:40Z,mfreed7
1574289071,whatwg/html,"In current implementations what does this do?  ```html <dialog id=""example"" popover>   Content </dia",https://github.com/whatwg/html/issues/9376#issuecomment-1574289071,https://github.com/whatwg/html/issues/9376,Should we deprecate `dialog.show()`?,2023-06-02T20:39:01Z,Link2Twenty
1574225164,whatwg/html,appreciate much of your response @sideshowbarker .  i disagree with implying this is something AT sh,https://github.com/whatwg/html/issues/2272#issuecomment-1574225164,https://github.com/whatwg/html/issues/2272,Disallow interactive content in <summary>,2023-06-02T19:40:26Z,scottaohara
