id,repo,body,url,issue_url,issue_title,created_at,user
1975078991,whatwg/encoding,"Wow, this is very surprising for me, thanks for the answer. So I am assuming in all other places whe",https://github.com/whatwg/encoding/issues/325#issuecomment-1975078991,https://github.com/whatwg/encoding/issues/325,Ambiguous wording in GB18030 decoder,2024-03-03T08:00:47Z,stasoid
1975076022,whatwg/encoding,It means to prepend a sequence. Otherwise you'd reorder which is never done.  Getting rid of seque,https://github.com/whatwg/encoding/issues/325#issuecomment-1975076022,https://github.com/whatwg/encoding/issues/325,Ambiguous wording in GB18030 decoder,2024-03-03T07:45:47Z,annevk
1975075172,whatwg/dom,`fetch()` has some more detailed timer tracking issues for cases like this: https://github.com/whatw,https://github.com/whatwg/dom/issues/1263#issuecomment-1975075172,https://github.com/whatwg/dom/issues/1263,Ability to reset an AbortSignal.timeout,2024-03-03T07:40:47Z,annevk
1975025415,whatwg/dom,"Perhaps, and is how I've addressed this previously, it just feels a bit... awkward. I mean, that sam",https://github.com/whatwg/dom/issues/1263#issuecomment-1975025415,https://github.com/whatwg/dom/issues/1263,Ability to reset an AbortSignal.timeout,2024-03-03T05:14:38Z,jasnell
1974945072,whatwg/dom,Just using setTimeout + AbortController manually for this case seems fine?,https://github.com/whatwg/dom/issues/1263#issuecomment-1974945072,https://github.com/whatwg/dom/issues/1263,Ability to reset an AbortSignal.timeout,2024-03-02T23:51:16Z,domenic
1974846556,whatwg/html,"> Yeah, I'm def down with the concept. Question is just if we think there's a necessity for full art",https://github.com/whatwg/html/issues/4004#issuecomment-1974846556,https://github.com/whatwg/html/issues/4004,The <video> poster attribute should accept multiple sources,2024-03-02T16:39:29Z,prlbr
1974689478,whatwg/html,cc @whatwg/canvas and particularly @yiyix since you did remove the previous tests.,https://github.com/whatwg/html/pull/10172#issuecomment-1974689478,https://github.com/whatwg/html/pull/10172,Remove SVG Blob support from createImageBitmap,2024-03-02T07:55:43Z,Kaiido
1974158785,whatwg/html,@domenic just to ping on this because it seemed like you were planning to merge but didn't.,https://github.com/whatwg/html/pull/10098#issuecomment-1974158785,https://github.com/whatwg/html/pull/10098,Make showPicker consume user activation,2024-03-02T01:17:58Z,lukewarlow
1974148346,whatwg/html,I've given this a read through and it all seems to make sense to me. I can't think of a way this can,https://github.com/whatwg/html/pull/10168#issuecomment-1974148346,https://github.com/whatwg/html/pull/10168,Re-do close watcher user activation tracking,2024-03-02T00:56:11Z,lukewarlow
1974015259,whatwg/html,"created a webkit bug today for some unexpected naming from pseudo content that is redundant at best,",https://github.com/whatwg/html/pull/9546#issuecomment-1974015259,https://github.com/whatwg/html/pull/9546,Add switch attribute to the input element to allow for a two-state switch control.,2024-03-01T22:23:13Z,scottaohara
1974010952,whatwg/html,"### Feedback  @LeaVerou   > Many HTML attributes need to reference one or more HTML elements in ",https://github.com/whatwg/html/issues/10143#issuecomment-1974010952,https://github.com/whatwg/html/issues/10143,Improve DX of element reference attributes by allowing relative references instead of only ids,2024-03-01T22:18:24Z,sorvell
1973994043,WICG/webcomponents,"@bkardell As I alluded to, declarative shadow DOM has changed my approach to web components, and I n",https://github.com/WICG/webcomponents/issues/909#issuecomment-1973994043,https://github.com/WICG/webcomponents/issues/909,"""open-stylable"" Shadow Roots",2024-03-01T22:08:27Z,robglidden
1973804977,WICG/webcomponents,"`document.querySelectorAll('.foo .bar')` and `.foo .bar{...}` need to somehow match the same things ",https://github.com/WICG/webcomponents/issues/909#issuecomment-1973804977,https://github.com/WICG/webcomponents/issues/909,"""open-stylable"" Shadow Roots",2024-03-01T19:39:44Z,bkardell
1973774453,WICG/webcomponents,> > I am hoping that the implementation blocker to https://github.com/WICG/webcomponents/issues/909#,https://github.com/WICG/webcomponents/issues/909#issuecomment-1973774453,https://github.com/WICG/webcomponents/issues/909,"""open-stylable"" Shadow Roots",2024-03-01T19:15:06Z,robglidden
1973744616,whatwg/html,i'm torn on this.  because it'd be a really unexpected change in established behavior that a modal d,https://github.com/whatwg/html/issues/9936#issuecomment-1973744616,https://github.com/whatwg/html/issues/9936,A popover on top of a modal dialog should be interactable,2024-03-01T18:50:12Z,scottaohara
1973215690,w3ctag/design-reviews,"FYI, the event has been renamed `pageswap`: https://github.com/WICG/view-transitions/blob/main/cross",https://github.com/w3ctag/design-reviews/issues/851#issuecomment-1973215690,https://github.com/w3ctag/design-reviews/issues/851,Cross-document View Transitions API,2024-03-01T13:34:17Z,miketaylr
1972883209,whatwg/html,"> While in the area for #2845, I noticed the following small tweaks that we could make to improve [t",https://github.com/whatwg/html/issues/2848#issuecomment-1972883209,https://github.com/whatwg/html/issues/2848,Small clarity improvements to canvas transform methods,2024-03-01T10:02:29Z,tawandamoyo
1972066568,whatwg/html,"A concept of event loop with real-time constraints would be a decent solution to this problem, but I",https://github.com/whatwg/html/issues/10136#issuecomment-1972066568,https://github.com/whatwg/html/issues/10136,Worklet agents and the event loop,2024-02-29T22:18:44Z,hoch
1972062128,whatwg/webidl,"FYI @inexorabletash, Anne says it seems reasonable :).",https://github.com/whatwg/webidl/issues/1388#issuecomment-1972062128,https://github.com/whatwg/webidl/issues/1388,Intent to use BigInt/numeric union in WebNN,2024-02-29T22:15:23Z,fdwr
1972047768,mozilla/standards-positions,"FYI, the event was finally renamed to `pageswap`. See the final spec here: https://html.spec.whatwg.",https://github.com/mozilla/standards-positions/issues/969#issuecomment-1972047768,https://github.com/mozilla/standards-positions/issues/969,The `pageconceal` event (part of cross-document view-transitions),2024-02-29T22:04:47Z,khushalsagar
1971905537,WICG/webcomponents,> I am hoping that the implementation blocker to https://github.com/WICG/webcomponents/issues/909#is,https://github.com/WICG/webcomponents/issues/909#issuecomment-1971905537,https://github.com/WICG/webcomponents/issues/909,"""open-stylable"" Shadow Roots",2024-02-29T20:29:34Z,bkardell
1971878378,WICG/webcomponents,"Echoing @justinfagnani ""[Maybe a layer based system  would work ...""](https://github.com/WICG/webcom",https://github.com/WICG/webcomponents/issues/909#issuecomment-1971878378,https://github.com/WICG/webcomponents/issues/909,"""open-stylable"" Shadow Roots",2024-02-29T20:11:09Z,robglidden
1971838180,whatwg/dom,"Given the discussion in tc39/proposal-shadowrealm#398, let's close this for now.",https://github.com/whatwg/dom/pull/1253#issuecomment-1971838180,https://github.com/whatwg/dom/pull/1253,Expose AbortSignal.timeout on all globals,2024-02-29T19:42:58Z,ptomato
1971631896,whatwg/webidl,"Sorry for being slow, that seems reasonable.",https://github.com/whatwg/webidl/issues/1388#issuecomment-1971631896,https://github.com/whatwg/webidl/issues/1388,Intent to use BigInt/numeric union in WebNN,2024-02-29T17:35:41Z,annevk
1971125419,whatwg/html,"@domenic the latter, have fixed it. Thanks",https://github.com/whatwg/html/pull/10170#issuecomment-1971125419,https://github.com/whatwg/html/pull/10170,Fix (#10053):  typo in CanvasDrawPath.isPointInPath,2024-02-29T13:20:52Z,tawandamoyo
1970885557,whatwg/webidl,> Seems like it should be (long long or BigInt) then.  The WebNN user calls a function to apply an,https://github.com/whatwg/webidl/issues/1388#issuecomment-1970885557,https://github.com/whatwg/webidl/issues/1388,Intent to use BigInt/numeric union in WebNN,2024-02-29T10:56:10Z,fdwr
1970738507,whatwg/webidl,"No, neither `double` nor `long long` would give you int64 precision. It seems really strange to over",https://github.com/whatwg/webidl/issues/1388#issuecomment-1970738507,https://github.com/whatwg/webidl/issues/1388,Intent to use BigInt/numeric union in WebNN,2024-02-29T09:27:13Z,annevk
1970725499,whatwg/html,"Eh, the main thing I was hoping to get was the ability to read the algorithms top to bottom. So movi",https://github.com/whatwg/html/pull/10002#issuecomment-1970725499,https://github.com/whatwg/html/pull/10002,Fire the `pageswap` event when navigating away from a document,2024-02-29T09:19:36Z,domenic
1970708024,whatwg/html,"> LGTM. >  > It occurs to me that maybe it would be cleaner to create separate algorithms instead ",https://github.com/whatwg/html/pull/10002#issuecomment-1970708024,https://github.com/whatwg/html/pull/10002,Fire the `pageswap` event when navigating away from a document,2024-02-29T09:08:53Z,noamr
1970638759,w3ctag/design-reviews,We've issued a [CfC](https://lists.w3.org/Archives/Public/public-webmachinelearning-wg/2024Feb/0006.,https://github.com/w3ctag/design-reviews/issues/933#issuecomment-1970638759,https://github.com/w3ctag/design-reviews/issues/933,Updated review of WebNN API,2024-02-29T08:24:45Z,anssiko
1970597014,whatwg/html,"Thanks for this! It looks good!  You seem to have signed the participant agreement as ""Tawanda"". H",https://github.com/whatwg/html/pull/10170#issuecomment-1970597014,https://github.com/whatwg/html/pull/10170,Fix (#10053):  typo in CanvasDrawPath.isPointInPath,2024-02-29T07:55:53Z,domenic
1970161413,whatwg/webidl,"Howdy Anne. We're looking at a union of `(double and BigInt)`, where `double` (float64) is large eno",https://github.com/whatwg/webidl/issues/1388#issuecomment-1970161413,https://github.com/whatwg/webidl/issues/1388,Intent to use BigInt/numeric union in WebNN,2024-02-29T00:28:06Z,fdwr
1970074147,mozilla/standards-positions,Just to give my understanding of the proposal (please correct me): 1. One part is having a new spec,https://github.com/mozilla/standards-positions/issues/908#issuecomment-1970074147,https://github.com/mozilla/standards-positions/issues/908,Page Embedded Permission Control,2024-02-28T23:13:06Z,simon-friedberger
1970033410,mozilla/standards-positions,"Given that this is an effort that covers a lot of different proposals, we're going to close this wit",https://github.com/mozilla/standards-positions/issues/177#issuecomment-1970033410,https://github.com/mozilla/standards-positions/issues/177,Open UI,2024-02-28T22:33:53Z,martinthomson
1970022549,mozilla/standards-positions,"OpenUI is also researching the switch control, with some research at https://open-ui.org/components/",https://github.com/mozilla/standards-positions/issues/990#issuecomment-1970022549,https://github.com/mozilla/standards-positions/issues/990,[html] <input type=checkbox switch>,2024-02-28T22:24:55Z,jyasskin
1969347712,whatwg/html,"> Those aren't measuring either named access on the document or named access on forms, and they are ",https://github.com/whatwg/html/issues/2212#issuecomment-1969347712,https://github.com/whatwg/html/issues/2212,Provide an opt-out for inputs overriding form DOM API,2024-02-28T16:20:26Z,securityMB
1969259439,webkit/standards-positions,"Overall this looks good. However, do you have some data that supports investing more in WebSocket? N",https://github.com/WebKit/standards-positions/issues/315#issuecomment-1969259439,https://github.com/WebKit/standards-positions/issues/315,WebSocketStream: Stream-based backpressure-supporting API for the WebSocket protocol,2024-02-28T15:41:49Z,annevk
1969148606,whatwg/html,Making `auto` work for eager images when layout is available makes resource selection a race conditi,https://github.com/whatwg/html/issues/10110#issuecomment-1969148606,https://github.com/whatwg/html/issues/10110,"`<img sizes=""auto, 100px"" loading=""eager"">`: `auto` equates to `100wv` but should ideally be ignored",2024-02-28T14:49:24Z,zcorpan
1969136484,whatwg/html,cc @tcaptan-cr @progers,https://github.com/whatwg/html/issues/10110#issuecomment-1969136484,https://github.com/whatwg/html/issues/10110,"`<img sizes=""auto, 100px"" loading=""eager"">`: `auto` equates to `100wv` but should ideally be ignored",2024-02-28T14:43:21Z,zcorpan
1969062328,whatwg/webidl,"Reading those three issues it seems like upgrading to `double` or `long long` would get you most of ",https://github.com/whatwg/webidl/issues/1388#issuecomment-1969062328,https://github.com/whatwg/webidl/issues/1388,Intent to use BigInt/numeric union in WebNN,2024-02-28T14:08:31Z,annevk
1968671124,whatwg/html,@RByers mid-Feb has passed. :) Is there enough data now for anonymized URL collection?,https://github.com/whatwg/html/issues/2390#issuecomment-1968671124,https://github.com/whatwg/html/issues/2390,Standardize YouTube embed rewriting?,2024-02-28T10:22:21Z,zcorpan
1968648764,whatwg/html,"Thinking about this again, I'm not sure it's a good idea to introduce duplication of MQ for `<link>`",https://github.com/whatwg/html/issues/7540#issuecomment-1968648764,https://github.com/whatwg/html/issues/7540,Allow authors to apply new css features (like cascade layers) while linking stylesheets,2024-02-28T10:10:45Z,zcorpan
1968621027,w3ctag/design-reviews,"Putting it on hold for now is reasonable, I think a revised approach might be forthcoming soon.",https://github.com/w3ctag/design-reviews/issues/916#issuecomment-1968621027,https://github.com/w3ctag/design-reviews/issues/916,Early Design Review: Opener Protections,2024-02-28T09:55:55Z,arichiv
1968493737,w3ctag/design-reviews,Hi @arichiv thanks for the response. We're trying to figure out how we can best be helpful here. Wou,https://github.com/w3ctag/design-reviews/issues/916#issuecomment-1968493737,https://github.com/w3ctag/design-reviews/issues/916,Early Design Review: Opener Protections,2024-02-28T08:44:52Z,torgo
1968313200,whatwg/html,Superseded by https://github.com/whatwg/html/pull/10168; any review over there is appreciated!,https://github.com/whatwg/html/pull/10048#issuecomment-1968313200,https://github.com/whatwg/html/pull/10048,Don't always consume user activation for close watchers,2024-02-28T06:23:23Z,domenic
1968269511,w3ctag/design-reviews,"> ""It depends"". When it does, it will most certainly be specified. Specifically for a `popover` it r",https://github.com/w3ctag/design-reviews/issues/920#issuecomment-1968269511,https://github.com/w3ctag/design-reviews/issues/920,Invokers API,2024-02-28T05:36:42Z,mfreed7
1968157085,whatwg/dom,Enjoyed reading this thread. This is a great question:  > what problem are we trying to solve  F,https://github.com/whatwg/dom/issues/1217#issuecomment-1968157085,https://github.com/whatwg/dom/issues/1217,Proposal: DOM APIs in web workers?,2024-02-28T03:38:50Z,patricknelson
1968156854,mozilla/standards-positions,It's shipping in [Chrome 123](https://chromiumdash.appspot.com/commit/a7c9f7f16b8748526a2b82d9099f3f,https://github.com/mozilla/standards-positions/issues/849#issuecomment-1968156854,https://github.com/mozilla/standards-positions/issues/849,css-ui `field-sizing` property,2024-02-28T03:38:35Z,yisibl
1967919675,mozilla/standards-positions,"Another addition we're proposing is a new boolean parameter `allowReturnToOpener`, which defaults to",https://github.com/mozilla/standards-positions/issues/670#issuecomment-1967919675,https://github.com/mozilla/standards-positions/issues/670,Document Picture in Picture API,2024-02-27T23:42:34Z,steimelchrome
1967918830,webkit/standards-positions,"Another addition we're proposing is a new boolean parameter `allowReturnToOpener`, which defaults to",https://github.com/WebKit/standards-positions/issues/41#issuecomment-1967918830,https://github.com/WebKit/standards-positions/issues/41,Document Picture in Picture API,2024-02-27T23:41:39Z,steimelchrome
1967916721,w3ctag/design-reviews,"Another addition we're proposing is a new boolean parameter `allowReturnToOpener`, which defaults to",https://github.com/w3ctag/design-reviews/issues/798#issuecomment-1967916721,https://github.com/w3ctag/design-reviews/issues/798,Early design review: Document Picture-in-Picture,2024-02-27T23:39:27Z,steimelchrome
1967716065,w3ctag/design-reviews,I should clarify that all the CSS Color 4 color spaces are defined over the extended range.,https://github.com/w3ctag/design-reviews/issues/917#issuecomment-1967716065,https://github.com/w3ctag/design-reviews/issues/917,Adding support for High Dynamic Range (HDR) imagery to HTML Canvas,2024-02-27T22:10:10Z,svgeesus
1967712782,w3ctag/design-reviews,@plinss   > I was also wondering why not include the other color spaces supported by CSS. I unders,https://github.com/w3ctag/design-reviews/issues/917#issuecomment-1967712782,https://github.com/w3ctag/design-reviews/issues/917,Adding support for High Dynamic Range (HDR) imagery to HTML Canvas,2024-02-27T22:08:57Z,svgeesus
1967579230,w3ctag/design-reviews,We recognize that there are some substantial changes to the API since our [original review](https://,https://github.com/w3ctag/design-reviews/issues/342#issuecomment-1967579230,https://github.com/w3ctag/design-reviews/issues/342,Related Website Sets (formerly First-Party Sets),2024-02-27T20:59:50Z,plinss
1967557278,w3c/pointerevents,"I don't mind `deviceProperties.id` or `deviceProperties.uniqueId`. `id` works since we already know ",https://github.com/w3c/pointerevents/issues/353#issuecomment-1967557278,https://github.com/w3c/pointerevents/issues/353,Multi-pen support and persistent pointerId,2024-02-27T20:43:49Z,sahirv
1967550437,w3ctag/design-reviews,"To summarize and close this review, we note that there are some disagreements about goals here that ",https://github.com/w3ctag/design-reviews/issues/726#issuecomment-1967550437,https://github.com/w3ctag/design-reviews/issues/726,Early design review for the Topics API,2024-02-27T20:38:40Z,plinss
1967456416,w3ctag/design-reviews,Thank you @plinss and @martinthomson for the discussion last week. I think where we landed in the di,https://github.com/w3ctag/design-reviews/issues/842#issuecomment-1967456416,https://github.com/w3ctag/design-reviews/issues/842,Isolated Web Apps,2024-02-27T19:32:56Z,reillyeon
1967332824,w3c/pointerevents,"One more question, is `deviceProperties.deviceId` a bit redundant? Should it just be something like ",https://github.com/w3c/pointerevents/issues/353#issuecomment-1967332824,https://github.com/w3c/pointerevents/issues/353,Multi-pen support and persistent pointerId,2024-02-27T18:16:28Z,flackr
1966816296,whatwg/html,Both are needed to give a correct aspect ratio.,https://github.com/whatwg/html/issues/10079#issuecomment-1966816296,https://github.com/whatwg/html/issues/10079,"img sizes=""auto"" skewing images using object-fit: contain",2024-02-27T15:28:05Z,zcorpan
1966704868,whatwg/dom,"This should be as simple as replacing ""element"" with ""node"". This also seems to apply to the ""in a d",https://github.com/whatwg/dom/issues/1259#issuecomment-1966704868,https://github.com/whatwg/dom/issues/1259,"""connected"" should be defined for all kinds of nodes",2024-02-27T14:41:57Z,annevk
1966698090,webkit/standards-positions,"My main worry here would be that the lifetime of these objects is not carefully defined and as such ",https://github.com/WebKit/standards-positions/issues/325#issuecomment-1966698090,https://github.com/WebKit/standards-positions/issues/325,Allow CSSImportRule.styleSheet to be null,2024-02-27T14:38:42Z,annevk
1966263501,whatwg/html,Given that  along with the core _highlight the active match and scroll into view_ behavior brow,https://github.com/whatwg/html/issues/3539#issuecomment-1966263501,https://github.com/whatwg/html/issues/3539,Potentially standardize window.find(),2024-02-27T10:40:14Z,sideshowbarker
1965572013,w3ctag/design-reviews,"I was also wondering why not include the other color spaces supported by CSS. I understand that the ",https://github.com/w3ctag/design-reviews/issues/917#issuecomment-1965572013,https://github.com/w3ctag/design-reviews/issues/917,Adding support for High Dynamic Range (HDR) imagery to HTML Canvas,2024-02-27T00:24:51Z,plinss
1965501674,w3ctag/design-reviews,To add to Luke's commentary:  > Is there a way to detect that this feature exists?  `'invokeTargetEl,https://github.com/w3ctag/design-reviews/issues/920#issuecomment-1965501674,https://github.com/w3ctag/design-reviews/issues/920,Invokers API,2024-02-26T23:17:52Z,keithamus
1965496481,whatwg/html,This has come up in a few conversations but primarily from a discussion about adding a 'cancel' (nam,https://github.com/whatwg/html/issues/10164#issuecomment-1965496481,https://github.com/whatwg/html/issues/10164,Add `requestClose()` function to HTMLDialogElement,2024-02-26T23:13:08Z,lukewarlow
1965398946,WICG/webcomponents,"@smaug----, thanks for the info. We want to see as many lovely Mozillians join the convo as possible",https://github.com/WICG/webcomponents/issues/1050#issuecomment-1965398946,https://github.com/WICG/webcomponents/issues/1050,April Face-to-face Scheduling/Agenda,2024-02-26T22:17:24Z,Westbrook
1965355270,w3ctag/design-reviews,To further help in your review of the explainer (though your feedback and input on the extended feat,https://github.com/w3ctag/design-reviews/issues/920#issuecomment-1965355270,https://github.com/w3ctag/design-reviews/issues/920,Invokers API,2024-02-26T21:49:13Z,lukewarlow
1965350988,w3ctag/design-reviews,"> Does invoking alter focus? If something is invoked, does that receive focus?   I Think this ulti",https://github.com/w3ctag/design-reviews/issues/920#issuecomment-1965350988,https://github.com/w3ctag/design-reviews/issues/920,Invokers API,2024-02-26T21:45:35Z,lukewarlow
1965348992,w3ctag/design-reviews," > Is there a way to detect that this feature exists?    Checking if an element has an `invokeTarg",https://github.com/w3ctag/design-reviews/issues/920#issuecomment-1965348992,https://github.com/w3ctag/design-reviews/issues/920,Invokers API,2024-02-26T21:44:09Z,lukewarlow
1965332617,w3ctag/design-reviews,"@plinss and I discussed this briefly and while we think the overall capability looks good, we have s",https://github.com/w3ctag/design-reviews/issues/920#issuecomment-1965332617,https://github.com/w3ctag/design-reviews/issues/920,Invokers API,2024-02-26T21:34:44Z,martinthomson
1965311444,whatwg/html,> interested  Can you please send me an email to pastith @ GMail with your email address to add yo,https://github.com/whatwg/html/issues/10156#issuecomment-1965311444,https://github.com/whatwg/html/issues/10156,Upcoming WHATNOT meeting on 3/7/2024,2024-02-26T21:20:41Z,past
1965287853,w3ctag/design-reviews,"To conclude here, as this is an early review, we're OK with the resolution of the capability-probing",https://github.com/w3ctag/design-reviews/issues/925#issuecomment-1965287853,https://github.com/w3ctag/design-reviews/issues/925,Delayed Clipboard Rendering,2024-02-26T21:11:23Z,martinthomson
1965251329,webkit/standards-positions,"FYI, [this Chrome feature](https://chromestatus.com/feature/5162545698045952) tracks adding `Sec-CH-",https://github.com/WebKit/standards-positions/issues/70#issuecomment-1965251329,https://github.com/WebKit/standards-positions/issues/70,User Agent Client Hints,2024-02-26T20:56:12Z,djmitche
1965231469,whatwg/html,"@annevk, PTAL when you have some time!",https://github.com/whatwg/html/pull/10022#issuecomment-1965231469,https://github.com/whatwg/html/pull/10022,Implement dangling markup injection mitigation,2024-02-26T20:42:33Z,shhnjk
1964832370,w3ctag/design-reviews,"Sorry for late, filed them here: https://github.com/mozilla/standards-positions/issues/993 https:/",https://github.com/w3ctag/design-reviews/issues/864#issuecomment-1964832370,https://github.com/w3ctag/design-reviews/issues/864,text-wrap: pretty,2024-02-26T18:21:46Z,kojiishi
1964765613,w3ctag/design-reviews,"Hi there,  @plinss @ylafon and I looked at this today during a breakout. We had a few thoughts an",https://github.com/w3ctag/design-reviews/issues/917#issuecomment-1964765613,https://github.com/w3ctag/design-reviews/issues/917,Adding support for High Dynamic Range (HDR) imagery to HTML Canvas,2024-02-26T17:54:55Z,LeaVerou
1964670732,w3ctag/design-reviews,Hi @kojiishi any response to Lea's questions above?,https://github.com/w3ctag/design-reviews/issues/864#issuecomment-1964670732,https://github.com/w3ctag/design-reviews/issues/864,text-wrap: pretty,2024-02-26T17:09:45Z,plinss
1964531442,whatwg/dom,"> @koto can the PR preview please be fixed? The changes themselves are sufficiently complicated, so ",https://github.com/whatwg/dom/pull/1247#issuecomment-1964531442,https://github.com/whatwg/dom/pull/1247,"Draft integration with Trusted Types, take 2.",2024-02-26T16:09:03Z,koto
1964453044,whatwg/dom,I might be missing something but this doesn't seem to account for event handler attributes? I know t,https://github.com/whatwg/dom/pull/1247#issuecomment-1964453044,https://github.com/whatwg/dom/pull/1247,"Draft integration with Trusted Types, take 2.",2024-02-26T15:42:37Z,lukewarlow
1964332163,w3c/pointerevents,The WPTs are covered through #356 and #357.,https://github.com/w3c/pointerevents/pull/474#issuecomment-1964332163,https://github.com/w3c/pointerevents/pull/474,"Define target and event-order for click, auxclick and contextmenu events",2024-02-26T14:52:23Z,mustaqahmed
1964326773,w3c/pointerevents,Done with WPT.,https://github.com/w3c/pointerevents/issues/356#issuecomment-1964326773,https://github.com/w3c/pointerevents/issues/356,Clarify what the target of the click event should be after capturing pointer events,2024-02-26T14:50:06Z,mustaqahmed
1964325878,w3c/pointerevents,Done with WPT.,https://github.com/w3c/pointerevents/issues/357#issuecomment-1964325878,https://github.com/w3c/pointerevents/issues/357,Clarify when lostpointercapture should fire,2024-02-26T14:49:41Z,mustaqahmed
