id,repo,body,url,issue_url,issue_title,created_at,user
2414194042,mozilla/standards-positions,"Web Share Target API was already separate, see #176.",https://github.com/mozilla/standards-positions/issues/27#issuecomment-2414194042,https://github.com/mozilla/standards-positions/issues/27,Web Share API,2024-10-15T15:03:32Z,saschanaz
2414186880,mozilla/standards-positions,I have split this into separate issues (see https://github.com/mozilla/standards-positions/issues/10,https://github.com/mozilla/standards-positions/issues/93#issuecomment-2414186880,https://github.com/mozilla/standards-positions/issues/93,CSS Houdini,2024-10-15T15:00:53Z,zcorpan
2414184190,mozilla/standards-positions,I have split this into separate issues (see https://github.com/mozilla/standards-positions/issues/10,https://github.com/mozilla/standards-positions/issues/27#issuecomment-2414184190,https://github.com/mozilla/standards-positions/issues/27,Web Share API,2024-10-15T14:59:59Z,zcorpan
2414181815,mozilla/standards-positions,I have split this into separate issues (see #1087): - #1092 - #1093  - #1094  - #1098,https://github.com/mozilla/standards-positions/issues/60#issuecomment-2414181815,https://github.com/mozilla/standards-positions/issues/60,Web Components,2024-10-15T14:59:05Z,zcorpan
2413939259,mozilla/standards-positions,I propose a `positive` position (disclaimer: I was involved with specifying this). Having apps expre,https://github.com/mozilla/standards-positions/issues/1071#issuecomment-2413939259,https://github.com/mozilla/standards-positions/issues/1071,RTCRtpEncodingParameters.scaleResolutionDownTo,2024-10-15T13:35:23Z,jan-ivar
2413909459,mozilla/standards-positions,We are positive with the API. The parameter changes were talked in TPAC 2024 and it was positive fro,https://github.com/mozilla/standards-positions/issues/1055#issuecomment-2413909459,https://github.com/mozilla/standards-positions/issues/1055,Selection API: getComposedRanges,2024-10-15T13:24:10Z,sefeng211
2413743789,whatwg/html,This has been resolved with Infra a couple of years ago: https://infra.spec.whatwg.org/#algorithm-co,https://github.com/whatwg/html/issues/1582#issuecomment-2413743789,https://github.com/whatwg/html/issues/1582,Should setting HTMLTableElement.caption throw?,2024-10-15T12:12:14Z,annevk
2413622985,mozilla/standards-positions,"I had a chat with Martin about this. Based on his comments in the TAG review, the spec would probab",https://github.com/mozilla/standards-positions/issues/1029#issuecomment-2413622985,https://github.com/mozilla/standards-positions/issues/1029,Local Peer-to-Peer API,2024-10-15T11:25:13Z,valenting
2413524820,mozilla/standards-positions,> However I think it is well defined how it works in terms of animations unless I'm missing somethin,https://github.com/mozilla/standards-positions/issues/777#issuecomment-2413524820,https://github.com/mozilla/standards-positions/issues/777,The `overlay` CSS property,2024-10-15T10:37:26Z,birtles
2413337786,whatwg/dom,mine was just an idea but I like `rect` and `scroll` ... my idea is that you don't want those proper,https://github.com/whatwg/dom/issues/1318#issuecomment-2413337786,https://github.com/whatwg/dom/issues/1318,Proposal: add `computed` attribute for great performance!,2024-10-15T09:14:07Z,WebReflection
2413253632,mozilla/standards-positions,"I think I agree with @birtles, this in general feels very narrowly scope.  However I think it is w",https://github.com/mozilla/standards-positions/issues/777#issuecomment-2413253632,https://github.com/mozilla/standards-positions/issues/777,The `overlay` CSS property,2024-10-15T08:39:42Z,emilio
2413168866,whatwg/html,"I believe we should consider adding error handling for cases where appending a child fails, even if ",https://github.com/whatwg/html/issues/1582#issuecomment-2413168866,https://github.com/whatwg/html/issues/1582,Should setting HTMLTableElement.caption throw?,2024-10-15T08:01:34Z,riyak-783
2413048307,whatwg/dom,"   > I feel like this could be lazy or helped via CSS similar way will-change helps but using will",https://github.com/whatwg/dom/issues/1318#issuecomment-2413048307,https://github.com/whatwg/dom/issues/1318,Proposal: add `computed` attribute for great performance!,2024-10-15T06:56:19Z,anuoua
2412983711,whatwg/dom,I feel like this could be lazy or helped via CSS similar way will-change helps but using will-comput,https://github.com/whatwg/dom/issues/1318#issuecomment-2412983711,https://github.com/whatwg/dom/issues/1318,Proposal: add `computed` attribute for great performance!,2024-10-15T06:13:36Z,WebReflection
2412826654,whatwg/html,"Nice catch, thank you!  It looks like you work for Facebook/Meta, so we'll need to get them to sig",https://github.com/whatwg/html/pull/10696#issuecomment-2412826654,https://github.com/whatwg/html/pull/10696,Correct typo in COOP reporting,2024-10-15T03:34:57Z,domenic
2412826540,w3ctag/design-reviews,"As the author of the two Chrome posts on the subject, I'd be happy to help create a consensus docume",https://github.com/w3ctag/design-reviews/issues/1003#issuecomment-2412826540,https://github.com/w3ctag/design-reviews/issues/1003,CSS Masonry Layout,2024-10-15T03:34:48Z,rachelandrew
2412651339,w3ctag/design-reviews,"When discussing this at length with the AOM Working Group, the WCCG, and implementors, a primary sho",https://github.com/w3ctag/design-reviews/issues/961#issuecomment-2412651339,https://github.com/w3ctag/design-reviews/issues/961,Reference Target,2024-10-15T01:50:52Z,Westbrook
2412631272,w3ctag/design-reviews,That sounds like this considered alternative: https://github.com/WICG/webcomponents/blob/gh-pages/pr,https://github.com/w3ctag/design-reviews/issues/961#issuecomment-2412631272,https://github.com/w3ctag/design-reviews/issues/961,Reference Target,2024-10-15T01:25:04Z,dandclark
2412623188,whatwg/html,> While it _may_ be possible for web-developers to queue tasks in a way so that snapshotting a CSP v,https://github.com/whatwg/html/issues/4651#issuecomment-2412623188,https://github.com/whatwg/html/issues/4651,CSP integration for javascript: URLs seems to be broken,2024-10-15T01:15:12Z,domenic
2412604482,w3c/pointerevents,"+1 for `touch-action: handwriting pan` or similar, combined with UA defined precedence would allow b",https://github.com/w3c/pointerevents/issues/516#issuecomment-2412604482,https://github.com/w3c/pointerevents/issues/516,[touch actions] handwriting manipulation type to distinguish panning,2024-10-15T00:54:48Z,adettenb
2412579580,mozilla/standards-positions,"Does this essentially deprecate `authenticatorAttachment`? I assume this was added, rather than add ",https://github.com/mozilla/standards-positions/issues/1043#issuecomment-2412579580,https://github.com/mozilla/standards-positions/issues/1043,Web Authentication `hints` parameter,2024-10-15T00:25:51Z,dveditz
2412546770,mozilla/standards-positions,"> The spec says relying parties ""MUST choose a common RP ID to use across all ceremonies from relate",https://github.com/mozilla/standards-positions/issues/1052#issuecomment-2412546770,https://github.com/mozilla/standards-positions/issues/1052,WebAuthn related origins,2024-10-14T23:58:48Z,timcappalli
2412529273,whatwg/html,"From the conversation at [issue 10533](https://github.com/whatwg/html/issues/10533), there are some ",https://github.com/whatwg/html/issues/10642#issuecomment-2412529273,https://github.com/whatwg/html/issues/10642,tabindex vs reading-flow property,2024-10-14T23:42:40Z,dizhang168
2412525113,mozilla/standards-positions,"> trusted libraries can be hosted on your own site. Services can be talked to over APIs using fetch ",https://github.com/mozilla/standards-positions/issues/1062#issuecomment-2412525113,https://github.com/mozilla/standards-positions/issues/1062,Realms Initialization Control,2024-10-14T23:38:02Z,dveditz
2412461574,w3ctag/design-reviews,"This comment is just from me, without having consulted the rest of the TAG yet.  I see that we hav",https://github.com/w3ctag/design-reviews/issues/1003#issuecomment-2412461574,https://github.com/w3ctag/design-reviews/issues/1003,CSS Masonry Layout,2024-10-14T22:42:45Z,jyasskin
2412451522,mozilla/standards-positions,"This loses me right off the top. From the ""Use Cases"" section of the explainer > The ability to saf",https://github.com/mozilla/standards-positions/issues/1062#issuecomment-2412451522,https://github.com/mozilla/standards-positions/issues/1062,Realms Initialization Control,2024-10-14T22:34:51Z,dveditz
2412388864,mozilla/standards-positions,"This seems like it would have similar objections to the ""First Party Sets"" proposal. Maybe some or a",https://github.com/mozilla/standards-positions/issues/1052#issuecomment-2412388864,https://github.com/mozilla/standards-positions/issues/1052,WebAuthn related origins,2024-10-14T21:41:58Z,dveditz
2412367166,whatwg/html,https://developer.chrome.com/docs/css-ui/hidden-until-found has been an interesting step forward for,https://github.com/whatwg/html/issues/2858#issuecomment-2412367166,https://github.com/whatwg/html/issues/2858,"Notify page that ""find in page"" is being used",2024-10-14T21:24:05Z,oliviertassinari
2412275191,whatwg/html,Proposed agenda: 1. Update on specs: https://github.com/whatwg/html/issues/9799#issue-1914386972 2,https://github.com/whatwg/html/issues/10702#issuecomment-2412275191,https://github.com/whatwg/html/issues/10702,Meeting 9 for joint OpenUI-WHATWG/HTML-CSSWG task force on styleable form controls,2024-10-14T20:43:27Z,josepharhar
2411916929,mozilla/standards-positions,cc @tomrittervg,https://github.com/mozilla/standards-positions/issues/1014#issuecomment-2411916929,https://github.com/mozilla/standards-positions/issues/1014,Reduce Accept-Language,2024-10-14T18:01:45Z,zcorpan
2411852093,mozilla/standards-positions,So chromium is not following the current spec if it follows only some of the events? Why does it hav,https://github.com/mozilla/standards-positions/issues/1069#issuecomment-2411852093,https://github.com/mozilla/standards-positions/issues/1069,PerformanceEventTiming.interactionId,2024-10-14T17:30:14Z,smaug----
2411841675,w3ctag/design-reviews,"We discussed this in a breakout today and we don't see any architectural concerns with this, so we'r",https://github.com/w3ctag/design-reviews/issues/999#issuecomment-2411841675,https://github.com/w3ctag/design-reviews/issues/999,CSS Scoping; :has-slotted,2024-10-14T17:24:14Z,jyasskin
2411812056,w3ctag/design-reviews,"Have you considered reversing the relationship of the shadow root to the target node? For example, r",https://github.com/w3ctag/design-reviews/issues/961#issuecomment-2411812056,https://github.com/w3ctag/design-reviews/issues/961,Reference Target,2024-10-14T17:09:33Z,plinss
2411679782,whatwg/html,> I removed the logic in a chromium patch and am running all tests on it now to find out  https://,https://github.com/whatwg/html/pull/10235#issuecomment-2411679782,https://github.com/whatwg/html/pull/10235,Add focusin and focusout events,2024-10-14T16:04:52Z,josepharhar
2411292409,whatwg/html,"> Other navigations need it for `navigate-to` checks on redirects, if I read the spec correctly. Plu",https://github.com/whatwg/html/issues/4651#issuecomment-2411292409,https://github.com/whatwg/html/issues/4651,CSP integration for javascript: URLs seems to be broken,2024-10-14T13:34:38Z,mbrodesser-Igalia
2411158439,webkit/standards-positions,As an update on this I'm supportive of the direction in https://github.com/WICG/observable/issues/17,https://github.com/WebKit/standards-positions/issues/292#issuecomment-2411158439,https://github.com/WebKit/standards-positions/issues/292,Observable,2024-10-14T12:56:07Z,esprehn
2410733707,webkit/standards-positions,I am a developer and I am very interested.,https://github.com/WebKit/standards-positions/issues/315#issuecomment-2410733707,https://github.com/WebKit/standards-positions/issues/315,WebSocketStream: Stream-based backpressure-supporting API for the WebSocket protocol,2024-10-14T10:24:44Z,mkurz
2410733277,whatwg/html,"> One weird aspect, though, is that chromium currently performs the client CSP check before queueing",https://github.com/whatwg/html/issues/4651#issuecomment-2410733277,https://github.com/whatwg/html/issues/4651,CSP integration for javascript: URLs seems to be broken,2024-10-14T10:24:34Z,mbrodesser-Igalia
2410686895,WICG/webcomponents,I created a similar proposal in the past: https://github.com/adrianhelvik/anonymous-custom-elements,https://github.com/WICG/webcomponents/issues/1074#issuecomment-2410686895,https://github.com/WICG/webcomponents/issues/1074,Anonymous Custom Elements,2024-10-14T10:09:20Z,adrianhelvikspond
2409279623,WICG/webcomponents,"I can't comment on the broad set of scenarios, but for my own use cases of building a templating eng",https://github.com/WICG/webcomponents/issues/1076#issuecomment-2409279623,https://github.com/WICG/webcomponents/issues/1076,case-sensitive access to HTML attributes (as they were written) would be useful for framework authors,2024-10-13T23:03:15Z,EisenbergEffect
2409198308,WICG/webcomponents,> So any time we access in JS it clones them?  AIUI no. My undersranding: when you access in JS it,https://github.com/WICG/webcomponents/issues/1076#issuecomment-2409198308,https://github.com/WICG/webcomponents/issues/1076,case-sensitive access to HTML attributes (as they were written) would be useful for framework authors,2024-10-13T22:20:49Z,keithamus
2409178157,WICG/webcomponents,> I worry about how tools will handle this. They can assume that attribute and tag names are case-in,https://github.com/WICG/webcomponents/issues/1076#issuecomment-2409178157,https://github.com/WICG/webcomponents/issues/1076,case-sensitive access to HTML attributes (as they were written) would be useful for framework authors,2024-10-13T22:09:31Z,trusktr
2409170495,WICG/webcomponents,"> All browsers do ""[string interning](https://en.wikipedia.org/wiki/String_interning)"" of attribute ",https://github.com/WICG/webcomponents/issues/1076#issuecomment-2409170495,https://github.com/WICG/webcomponents/issues/1076,case-sensitive access to HTML attributes (as they were written) would be useful for framework authors,2024-10-13T22:05:33Z,trusktr
2409155449,WICG/webcomponents,"> Materializing Attr nodes is very slow  How much slower are we talking about? Pota's `html` uses ",https://github.com/WICG/webcomponents/issues/1076#issuecomment-2409155449,https://github.com/WICG/webcomponents/issues/1076,case-sensitive access to HTML attributes (as they were written) would be useful for framework authors,2024-10-13T21:56:53Z,trusktr
2409155136,WICG/webcomponents,Just some field notes on implementation complexity (not an implementer but merely a student of imple,https://github.com/WICG/webcomponents/issues/1076#issuecomment-2409155136,https://github.com/WICG/webcomponents/issues/1076,case-sensitive access to HTML attributes (as they were written) would be useful for framework authors,2024-10-13T21:56:42Z,keithamus
2409145969,WICG/webcomponents,Materializing Attr nodes is very slow. I would want something like `getAttributeNames()` that return,https://github.com/WICG/webcomponents/issues/1076#issuecomment-2409145969,https://github.com/WICG/webcomponents/issues/1076,case-sensitive access to HTML attributes (as they were written) would be useful for framework authors,2024-10-13T21:51:14Z,justinfagnani
2409130535,WICG/webcomponents,I like the idea of adding a new property to the `Attr` type to preserve the pre-normalized casing of,https://github.com/WICG/webcomponents/issues/1076#issuecomment-2409130535,https://github.com/WICG/webcomponents/issues/1076,case-sensitive access to HTML attributes (as they were written) would be useful for framework authors,2024-10-13T21:04:25Z,EisenbergEffect
2409120269,whatwg/html,**Problem 1:** ``` const originalRequestSubmit = HTMLFormElement.prototype.requestSubmit; HTMLFor,https://github.com/whatwg/html/issues/10694#issuecomment-2409120269,https://github.com/whatwg/html/issues/10694,Add an event for when a user attempts to submit,2024-10-13T20:49:48Z,abnahid
2409112797,whatwg/html,@josepharhar it's been done for now. PTL again plz.,https://github.com/whatwg/html/pull/10469#issuecomment-2409112797,https://github.com/whatwg/html/pull/10469,hidePopover with button click not timeout,2024-10-13T20:23:24Z,Jxck
2409085695,w3ctag/design-reviews,"Not that it really matters now that this feature is already well-established, but as a netizen, I am",https://github.com/w3ctag/design-reviews/issues/623#issuecomment-2409085695,https://github.com/w3ctag/design-reviews/issues/623,Cryptographically secure random UUIDs,2024-10-13T18:54:04Z,Sainan
2408655250,WICG/webcomponents,Revisiting this after [feedback](https://dev.to/ryansolid/web-components-are-not-the-future-48bh) fr,https://github.com/WICG/webcomponents/issues/1043#issuecomment-2408655250,https://github.com/WICG/webcomponents/issues/1043,[scoped-registries] Consider future expansion to allow using a registry without new API,2024-10-12T18:37:08Z,nolanlawson
2408382441,WICG/webcomponents,I'm breaking my coment into a few sections to make it easy to reply to whichever part you're interes,https://github.com/WICG/webcomponents/issues/1069#issuecomment-2408382441,https://github.com/WICG/webcomponents/issues/1069,[templates] A declarative JavaScript templating API,2024-10-12T04:42:46Z,trusktr
2408260094,whatwg/html,"Thank you all for attending the meeting yesterday, and special thanks to Chris for the excellent (an",https://github.com/whatwg/html/issues/10666#issuecomment-2408260094,https://github.com/whatwg/html/issues/10666,Upcoming WHATNOT meeting on 2024-10-10,2024-10-12T00:18:10Z,past
2408222359,whatwg/html,I created an html5lib PR to update tests: https://github.com/html5lib/html5lib-tests/pull/178,https://github.com/whatwg/html/pull/10557#issuecomment-2408222359,https://github.com/whatwg/html/pull/10557,Relax `<select>` parser,2024-10-11T23:06:23Z,josepharhar
2407927654,mozilla/standards-positions,How do mozilla users participate in these? i can point to 100+ developers that would like mozilla to,https://github.com/mozilla/standards-positions/issues/1066#issuecomment-2407927654,https://github.com/mozilla/standards-positions/issues/1066,FYI Private State Token API Permissions Policy Default Allowlist Wildcard,2024-10-11T18:26:34Z,maceip
2407716673,whatwg/html,"I don't know what's more sad: that it took 30 years before someone proposed this, or that the propos",https://github.com/whatwg/html/issues/5312#issuecomment-2407716673,https://github.com/whatwg/html/issues/5312,"Form Submission: Fix the ""Double Submit problem"" at the spec level",2024-10-11T16:06:41Z,php4fan
2407481539,whatwg/html,> Is one possibility to ship :open and not :closed initially? Making :closed match things that can n,https://github.com/whatwg/html/pull/10126#issuecomment-2407481539,https://github.com/whatwg/html/pull/10126,Add the :open and :closed pseudo-selectors,2024-10-11T14:01:13Z,bramus
2407327523,whatwg/html,👍,https://github.com/whatwg/html/issues/9799#issuecomment-2407327523,https://github.com/whatwg/html/issues/9799,Customizable `<select>` element,2024-10-11T12:37:44Z,HeyGoAudio
2407316448,w3c/pointerevents,> So it's more of a potential developer footgun in general - once you specify that an area is just g,https://github.com/w3c/pointerevents/issues/516#issuecomment-2407316448,https://github.com/w3c/pointerevents/issues/516,[touch actions] handwriting manipulation type to distinguish panning,2024-10-11T12:31:10Z,flackr
2407297246,w3ctag/design-reviews,"> Hi @DavMila - just a quick question: you've indicated ""CSS working group"" as where this work is be",https://github.com/w3ctag/design-reviews/issues/994#issuecomment-2407297246,https://github.com/w3ctag/design-reviews/issues/994,Spec review for Animation.progress,2024-10-11T12:20:07Z,DavMila
2407170895,whatwg/html,> Only the former would support form resetting well. The latter has some challenges whereby event di,https://github.com/whatwg/html/issues/6578#issuecomment-2407170895,https://github.com/whatwg/html/issues/6578,New `indeterminate` attribute for <input type=checkbox>,2024-10-11T11:02:51Z,jakearchibald
2407064372,whatwg/html,It sounded like this was just to be extra sure about the `head` element.  There’s still the questi,https://github.com/whatwg/html/issues/10691#issuecomment-2407064372,https://github.com/whatwg/html/issues/10691,“a start tag must never be omitted if it has any attributes”,2024-10-11T09:58:06Z,j9t
2406984755,whatwg/html,"Sure, but then we'd have to add that clause for each element whose start tag may be omitted. Instead",https://github.com/whatwg/html/issues/10691#issuecomment-2406984755,https://github.com/whatwg/html/issues/10691,“a start tag must never be omitted if it has any attributes”,2024-10-11T09:13:19Z,annevk
2406981823,whatwg/html,Thanks for sharing more context. I’m still not clear about the value of the sentence in question (wh,https://github.com/whatwg/html/issues/10691#issuecomment-2406981823,https://github.com/whatwg/html/issues/10691,“a start tag must never be omitted if it has any attributes”,2024-10-11T09:11:44Z,j9t
2406961987,whatwg/html,Given this statement:  > A [head](https://html.spec.whatwg.org/multipage/semantics.html#the-head-e,https://github.com/whatwg/html/issues/10691#issuecomment-2406961987,https://github.com/whatwg/html/issues/10691,“a start tag must never be omitted if it has any attributes”,2024-10-11T09:01:49Z,annevk
2406957299,whatwg/html,I had to read that statement a few times and am not sure I understand 🙂  Maybe taking a step back,https://github.com/whatwg/html/issues/10691#issuecomment-2406957299,https://github.com/whatwg/html/issues/10691,“a start tag must never be omitted if it has any attributes”,2024-10-11T08:59:32Z,j9t
2406925998,whatwg/html,One of my favourite patterns (because its very robust) is to do the following:  ```html <script d,https://github.com/whatwg/html/issues/1013#issuecomment-2406925998,https://github.com/whatwg/html/issues/1013,Introduce pointer to <script> element in module scripts,2024-10-11T08:42:55Z,MajPay
2406892106,w3c/pointerevents,"Ah, true. So it's more of a potential developer footgun in general - once you specify that an area i",https://github.com/w3c/pointerevents/issues/516#issuecomment-2406892106,https://github.com/w3c/pointerevents/issues/516,[touch actions] handwriting manipulation type to distinguish panning,2024-10-11T08:24:58Z,patrickhlauke
2406703776,whatwg/html,">     1. Developers are very likely **not to check or understand the a11y tree** at all, and therefo",https://github.com/whatwg/html/issues/10533#issuecomment-2406703776,https://github.com/whatwg/html/issues/10533,Discussing how to focus navigate display: contents elements that are focusable in CSS reading-flow,2024-10-11T07:16:58Z,jcsteh
2406669879,whatwg/html,"I don't think this can be skipped, because the other conditions are not conditional upon the element",https://github.com/whatwg/html/issues/10691#issuecomment-2406669879,https://github.com/whatwg/html/issues/10691,“a start tag must never be omitted if it has any attributes”,2024-10-11T06:52:59Z,annevk
2406663870,webkit/standards-positions,"Overall this seems reasonable and thanks for working on it! However, during review it was suggested ",https://github.com/WebKit/standards-positions/issues/413#issuecomment-2406663870,https://github.com/WebKit/standards-positions/issues/413,:open and :closed pseudo-classes,2024-10-11T06:48:09Z,annevk
2406655043,whatwg/html,As long as there is no way for the end user to ascertain whether the website is holding this attribu,https://github.com/whatwg/html/issues/10519#issuecomment-2406655043,https://github.com/whatwg/html/issues/10519,Proposal: Element 'sensitive' attribute,2024-10-11T06:41:09Z,annevk
2406636862,whatwg/html,Let's duplicate this into the DOM issue. HTML doesn't define Events.,https://github.com/whatwg/html/issues/8513#issuecomment-2406636862,https://github.com/whatwg/html/issues/8513,One-time `await`able event listeners,2024-10-11T06:25:50Z,annevk
2406329408,whatwg/html,@mbrodesser-Igalia it's so awesome that you're investigating this in detail. I can't say I've been f,https://github.com/whatwg/html/issues/4651#issuecomment-2406329408,https://github.com/whatwg/html/issues/4651,CSP integration for javascript: URLs seems to be broken,2024-10-11T01:03:48Z,domenic
2406189209,w3c/pointerevents,"> I'd imagine a long page with lots of text fields, like a long form ... if each of those inputs (po",https://github.com/w3c/pointerevents/issues/516#issuecomment-2406189209,https://github.com/w3c/pointerevents/issues/516,[touch actions] handwriting manipulation type to distinguish panning,2024-10-10T23:04:52Z,ogerchikov
2406184479,w3c/pointerevents,> do you have a use case in mind that would make page unusable?  I'd imagine a long page with lots,https://github.com/w3c/pointerevents/issues/516#issuecomment-2406184479,https://github.com/w3c/pointerevents/issues/516,[touch actions] handwriting manipulation type to distinguish panning,2024-10-10T23:00:15Z,patrickhlauke
2406162543,w3c/pointerevents,I agree with @flackr's argument that the intention of `touch-action: handwriting` is to disable scro,https://github.com/w3c/pointerevents/issues/516#issuecomment-2406162543,https://github.com/w3c/pointerevents/issues/516,[touch actions] handwriting manipulation type to distinguish panning,2024-10-10T22:40:38Z,ogerchikov
2405991653,whatwg/html,"I think the build errors are because FileAPI still defines this type? Or I might be doing something ",https://github.com/whatwg/html/pull/10693#issuecomment-2405991653,https://github.com/whatwg/html/pull/10693,Add FileList interface to HTML.,2024-10-10T20:35:00Z,mkruisselbrink
