id,repo,body,url,issue_url,issue_title,created_at,user
1561783308,mozilla/standards-positions,@bgrins are there any scripts or so that would need updates for this change?,https://github.com/mozilla/standards-positions/pull/793#issuecomment-1561783308,https://github.com/mozilla/standards-positions/pull/793,chore: port GitHub issue form from Webkit,2023-05-24T19:02:22Z,zcorpan
1561775525,mozilla/standards-positions,SGTM,https://github.com/mozilla/standards-positions/issues/797#issuecomment-1561775525,https://github.com/mozilla/standards-positions/issues/797,Request for position: Intervention Reporting (Reporting API),2023-05-24T18:56:17Z,zcorpan
1561684624,w3c/editcontext,"Hmm, I don't think that really works @dandclark. We need to be somewhat clear how state updates are ",https://github.com/w3c/edit-context/issues/41#issuecomment-1561684624,https://github.com/w3c/edit-context/issues/41,"""text state"" updated from in parallel but also API accessible",2023-05-24T17:43:18Z,annevk
1561657991,w3ctag/design-reviews,"There are full implementations in Chrome, Firefox, and the Wasm spec reference interpreter. Safari h",https://github.com/w3ctag/design-reviews/issues/814#issuecomment-1561657991,https://github.com/w3ctag/design-reviews/issues/814,WebAssembly Garbage Collection extensions,2023-05-24T17:23:46Z,ajklein
1561573461,w3ctag/design-reviews,Awesome API! But I have some doubts. I've tried it with various cameras (both new and old) and it on,https://github.com/w3ctag/design-reviews/issues/826#issuecomment-1561573461,https://github.com/w3ctag/design-reviews/issues/826,Background Blur API,2023-05-24T16:45:24Z,matiaslopezd
1561454274,whatwg/html,We've removed our implementation in Firefox in [December 2016](https://bugzilla.mozilla.org/show_bug,https://github.com/whatwg/html/issues/6363#issuecomment-1561454274,https://github.com/whatwg/html/issues/6363,HTML Video Element: Proposal For Reintroduction of Media in Source Elements,2023-05-24T15:57:07Z,padenot
1561400386,w3ctag/design-reviews,Hi! Thanks for the responses above. Can you provide some additional info on multiple implementations,https://github.com/w3ctag/design-reviews/issues/814#issuecomment-1561400386,https://github.com/w3ctag/design-reviews/issues/814,WebAssembly Garbage Collection extensions,2023-05-24T15:40:48Z,torgo
1561386766,w3ctag/design-reviews,"Thanks @johannhof, we'll keep this open for now. For our TAG processes, we are keen to not let issue",https://github.com/w3ctag/design-reviews/issues/808#issuecomment-1561386766,https://github.com/w3ctag/design-reviews/issues/808,requestStorageAccessFor,2023-05-24T15:35:51Z,hadleybeeman
1561363813,w3ctag/design-reviews,Thanks for that @josepharhar. We discussed again in today's TAG plenary call. Regarding multi-stakeh,https://github.com/w3ctag/design-reviews/issues/734#issuecomment-1561363813,https://github.com/w3ctag/design-reviews/issues/734,Element.checkVisibility review,2023-05-24T15:22:58Z,torgo
1561354072,whatwg/html,I think WebKit is the odd-one-out and inheriting isn't necessarily better. I guess it depends on wha,https://github.com/whatwg/html/issues/9310#issuecomment-1561354072,https://github.com/whatwg/html/issues/9310,"""fallback base URL"" algorithm seems wrong for popups?",2023-05-24T15:17:06Z,annevk
1561324685,webkit/standards-positions,Hi! Thanks for filing. Could you move your spec to a group where it’s under W3C’s governance and has,https://github.com/WebKit/standards-positions/issues/191#issuecomment-1561324685,https://github.com/WebKit/standards-positions/issues/191,Standardizing Security Semantics of Cross-Site Cookies,2023-05-24T15:00:30Z,johnwilander
1561272308,whatwg/html,Yeah Chrome doesn't seem to match the spec here I guess. Maybe we should file a Chome bug?,https://github.com/whatwg/html/issues/9310#issuecomment-1561272308,https://github.com/whatwg/html/issues/9310,"""fallback base URL"" algorithm seems wrong for popups?",2023-05-24T14:30:30Z,domfarolino
1560888224,w3c/pointerevents,I'm adding a test for this through mozilla-central. https://bugzilla.mozilla.org/show_bug.cgi?id=18,https://github.com/w3c/pointerevents/pull/465#issuecomment-1560888224,https://github.com/w3c/pointerevents/pull/465,Make note about passive events normative body text,2023-05-24T10:43:55Z,smaug----
1560772779,whatwg/html,Great and useful advice from @bathos  Regarding accessibility of data: Some of the details of the p,https://github.com/whatwg/html/issues/9295#issuecomment-1560772779,https://github.com/whatwg/html/issues/9295,Proposal: Web Charts,2023-05-24T09:29:19Z,brennanyoung
1560638655,whatwg/fullscreen,Closing in favor of https://github.com/whatwg/html/pull/9328.,https://github.com/whatwg/fullscreen/pull/225#issuecomment-1560638655,https://github.com/whatwg/fullscreen/pull/225,Editorial: align @namespace declaration with HTML,2023-05-24T08:03:18Z,foolip
1560625586,whatwg/fullscreen,Will do!,https://github.com/whatwg/fullscreen/pull/225#issuecomment-1560625586,https://github.com/whatwg/fullscreen/pull/225,Editorial: align @namespace declaration with HTML,2023-05-24T07:53:57Z,foolip
1560623144,WICG/webcomponents,https://www.when2meet.com/?20168849-v82m5,https://github.com/WICG/webcomponents/issues/999#issuecomment-1560623144,https://github.com/WICG/webcomponents/issues/999,Spring 2023 DOM Parts F2F,2023-05-24T07:52:02Z,rniwa
1560522183,whatwg/html,"So with my editor hat on, what I'm seeing here is implementer interest from both Mozilla and Chromiu",https://github.com/whatwg/html/issues/9158#issuecomment-1560522183,https://github.com/whatwg/html/issues/9158,Consider a different process for standardizing registerProtocolHandler schemes,2023-05-24T06:24:48Z,domenic
1560520105,whatwg/html,I think at this point Chromium is most interested in https://github.com/whatwg/html/issues/3998 (rec,https://github.com/whatwg/html/pull/7678#issuecomment-1560520105,https://github.com/whatwg/html/pull/7678,Add notes to the safelisted schemes list,2023-05-24T06:22:29Z,domenic
1560515919,whatwg/html,"@bathos thank you so much for jumping in i am not a native speaker and not a good community manager ",https://github.com/whatwg/html/issues/9295#issuecomment-1560515919,https://github.com/whatwg/html/issues/9295,Proposal: Web Charts,2023-05-24T06:17:25Z,lemanschik
1560512963,whatwg/html,"> Perhaps, in particular after versioning the markup examples to include support for (real-time) dat",https://github.com/whatwg/html/issues/9295#issuecomment-1560512963,https://github.com/whatwg/html/issues/9295,Proposal: Web Charts,2023-05-24T06:14:02Z,bathos
1560501510,whatwg/html,@domenic or @zcorpan should prolly drive this.  OP needs to have the PR template restored and fill,https://github.com/whatwg/html/pull/7678#issuecomment-1560501510,https://github.com/whatwg/html/pull/7678,Add notes to the safelisted schemes list,2023-05-24T06:01:30Z,annevk
1560473511,whatwg/html,"i guess you will find no one for that in the w3c world i am in it since more then 35 years and even ",https://github.com/whatwg/html/issues/9295#issuecomment-1560473511,https://github.com/whatwg/html/issues/9295,Proposal: Web Charts,2023-05-24T05:21:27Z,lemanschik
1560387499,WICG/webcomponents,Works for me! Can you put together a whenisgood for those two weeks?,https://github.com/WICG/webcomponents/issues/999#issuecomment-1560387499,https://github.com/WICG/webcomponents/issues/999,Spring 2023 DOM Parts F2F,2023-05-24T02:54:05Z,tbondwilkinson
1560312524,mozilla/standards-positions,The original Microsoft explainer is very old and has a lot of out-of-date details.  Here's a new e,https://github.com/mozilla/standards-positions/issues/794#issuecomment-1560312524,https://github.com/mozilla/standards-positions/issues/794,CSS Anchor Positioning,2023-05-24T01:04:11Z,xiaochengh
1560312013,webkit/standards-positions,The original Microsoft explainer is very old and has a lot of out-of-date details.  Here's a new e,https://github.com/WebKit/standards-positions/issues/167#issuecomment-1560312013,https://github.com/WebKit/standards-positions/issues/167,CSS Anchor Positioning,2023-05-24T01:03:24Z,xiaochengh
1560242098,whatwg/html,Yes Mozilla is interested.,https://github.com/whatwg/html/pull/9217#issuecomment-1560242098,https://github.com/whatwg/html/pull/9217,Clarify WebTransport BFCache interaction,2023-05-23T23:09:46Z,jan-ivar
1560226980,whatwg/html,Thank you @lemanschik for indicating the [Streams API](https://developer.mozilla.org/en-US/docs/Web/,https://github.com/whatwg/html/issues/9295#issuecomment-1560226980,https://github.com/whatwg/html/issues/9295,Proposal: Web Charts,2023-05-23T22:52:00Z,AdamSobieski
1560207657,WICG/webcomponents,"At this point, let's cancel May 25th and do the Igalia one instead.  The Igalia session (https://g",https://github.com/WICG/webcomponents/issues/1005#issuecomment-1560207657,https://github.com/WICG/webcomponents/issues/1005,Spring 2023 Cross-Root ARIA F2F,2023-05-23T22:26:01Z,nolanlawson
1560165488,WICG/webcomponents,Looks like the week of July 17th and July 24th are only weeks in which everyone is available.,https://github.com/WICG/webcomponents/issues/999#issuecomment-1560165488,https://github.com/WICG/webcomponents/issues/999,Spring 2023 DOM Parts F2F,2023-05-23T21:43:54Z,rniwa
1560081673,WICG/webcomponents,Should we decide on a week?,https://github.com/WICG/webcomponents/issues/999#issuecomment-1560081673,https://github.com/WICG/webcomponents/issues/999,Spring 2023 DOM Parts F2F,2023-05-23T20:28:08Z,tbondwilkinson
1559941379,whatwg/html,And the update sync and interactivity api got also shipped generic we call that Streams WriteableSt,https://github.com/whatwg/html/issues/9295#issuecomment-1559941379,https://github.com/whatwg/html/issues/9295,Proposal: Web Charts,2023-05-23T18:26:05Z,lemanschik
1559937309,whatwg/html,@AdamSobieski i added you on linkedin  we could chat there if you like because it looks like you wan,https://github.com/whatwg/html/issues/9295#issuecomment-1559937309,https://github.com/whatwg/html/issues/9295,Proposal: Web Charts,2023-05-23T18:22:46Z,lemanschik
1559931711,whatwg/html,Now that we have discussed some of the accessibility- and internationalization-related topics releva,https://github.com/whatwg/html/issues/9295#issuecomment-1559931711,https://github.com/whatwg/html/issues/9295,Proposal: Web Charts,2023-05-23T18:20:18Z,AdamSobieski
1559915897,whatwg/html,https://jsfiddle.net/jarhar/s5v6tr1q/ In chrome canary it looks like p19 is closed. It is closed by,https://github.com/whatwg/html/issues/9319#issuecomment-1559915897,https://github.com/whatwg/html/issues/9319,Another corner case about nested popovers,2023-05-23T18:09:26Z,josepharhar
1559903026,w3c/editcontext,"I think the ""in parallel"" here can just be dropped. The details of how the `Text Edit Context` is up",https://github.com/w3c/edit-context/issues/41#issuecomment-1559903026,https://github.com/w3c/edit-context/issues/41,"""text state"" updated from in parallel but also API accessible",2023-05-23T17:59:48Z,dandclark
1559880484,whatwg/html,I resolved the merge conflicts,https://github.com/whatwg/html/pull/9058#issuecomment-1559880484,https://github.com/whatwg/html/pull/9058,Throw exception in originalType check,2023-05-23T17:40:27Z,josepharhar
1559830823,w3c/editing,Removing the Agenda+ label. We'll follow-up async with Adobe folks and Webkit.,https://github.com/w3c/editing/issues/425#issuecomment-1559830823,https://github.com/w3c/editing/issues/425,[Delayed Clipboard Rendering] Does macOS support setting the data for the requested pasteboard item asynchronously?,2023-05-23T17:01:42Z,snianu
1559808577,webkit/standards-positions,The property as specified now has no effect when scrollbars are overlay scrollbars; it's primarily a,https://github.com/WebKit/standards-positions/issues/135#issuecomment-1559808577,https://github.com/WebKit/standards-positions/issues/135,scrollbar-gutter CSS Property,2023-05-23T16:44:57Z,smfr
1559605011,whatwg/fullscreen,🎉  Thanks all!,https://github.com/whatwg/fullscreen/pull/223#issuecomment-1559605011,https://github.com/whatwg/fullscreen/pull/223,"Remove top layer definitions, now that CSS Position 4 contains them.",2023-05-23T14:55:46Z,annevk
1559574367,whatwg/html,"SGTM! @vmpstr do you want to send a PR to make the change, or who can do that?",https://github.com/whatwg/html/issues/9300#issuecomment-1559574367,https://github.com/whatwg/html/issues/9300,Update the wording of resize observer steps in update the rendering,2023-05-23T14:44:58Z,foolip
1559522154,whatwg/html,"To elaborate a little bit, what I'm thinking is that the `canvas` element and the `OffscreenCanvas` ",https://github.com/whatwg/html/issues/9320#issuecomment-1559522154,https://github.com/whatwg/html/issues/9320,"States should be worded explicitly in getContext() tables where context mode and contextIDs match ",2023-05-23T14:25:56Z,annevk
1559508598,whatwg/html,OK. That seems reasonable!  `media` was removed because of the lack of reaction to environment cha,https://github.com/whatwg/html/issues/6363#issuecomment-1559508598,https://github.com/whatwg/html/issues/6363,HTML Video Element: Proposal For Reintroduction of Media in Source Elements,2023-05-23T14:21:13Z,zcorpan
1559503856,whatwg/fullscreen,I've filed https://bugzilla.mozilla.org/show_bug.cgi?id=1834542 and https://bugs.webkit.org/show_bug,https://github.com/whatwg/fullscreen/pull/223#issuecomment-1559503856,https://github.com/whatwg/fullscreen/pull/223,"Remove top layer definitions, now that CSS Position 4 contains them.",2023-05-23T14:19:35Z,foolip
1559468941,whatwg/html,> However re-reviewing them I don't see any assertions on `history.length` immediately after opening,https://github.com/whatwg/html/issues/9030#issuecomment-1559468941,https://github.com/whatwg/html/issues/9030,History length/index are not synchronously initialized in new navigables,2023-05-23T14:07:40Z,petervanderbeken
1559449981,whatwg/html,"I think the behavior in Firefox comes from the fact that window.open(); (no arguments) doesn't load ",https://github.com/whatwg/html/issues/9030#issuecomment-1559449981,https://github.com/whatwg/html/issues/9030,History length/index are not synchronously initialized in new navigables,2023-05-23T14:01:19Z,smaug----
1559382695,whatwg/html,"@zcorpan aha, thanks for clarifying ... so indeed  > unless I misunderstand the meaning of step 1",https://github.com/whatwg/html/issues/8439#issuecomment-1559382695,https://github.com/whatwg/html/issues/8439,"After scrolling to the beginning of the document, the sequential focus navigation starting point should be unset.",2023-05-23T13:37:17Z,patrickhlauke
1559370708,whatwg/html,"No, the point is to update the URL, but since there's no matching element there is no scrolling anyw",https://github.com/whatwg/html/issues/8439#issuecomment-1559370708,https://github.com/whatwg/html/issues/8439,"After scrolling to the beginning of the document, the sequential focus navigation starting point should be unset.",2023-05-23T13:32:55Z,zcorpan
1559311959,whatwg/html,"> @zcorpan, I like your proposal to set an ""omit events unless the currentSrc changes"" flag for rele",https://github.com/whatwg/html/pull/8008#issuecomment-1559311959,https://github.com/whatwg/html/pull/8008,Add sizes=auto to lazy-loaded <img>,2023-05-23T13:11:24Z,zcorpan
1559306157,whatwg/html,"> I don't think it should be unset for step 1. Pages might use fragments for client side navigation ",https://github.com/whatwg/html/issues/8439#issuecomment-1559306157,https://github.com/whatwg/html/issues/8439,"After scrolling to the beginning of the document, the sequential focus navigation starting point should be unset.",2023-05-23T13:09:16Z,patrickhlauke
1559111463,whatwg/html,Added a note and rebased to resolve conflicts.,https://github.com/whatwg/html/pull/8175#issuecomment-1559111463,https://github.com/whatwg/html/pull/8175,Rename 'intrinsic dimensions' to 'natural dimensions' to match CSS,2023-05-23T11:32:11Z,zcorpan
1559091025,whatwg/html,I don't think it should be unset for step 1. Pages might use fragments for client side navigation or,https://github.com/whatwg/html/issues/8439#issuecomment-1559091025,https://github.com/whatwg/html/issues/8439,"After scrolling to the beginning of the document, the sequential focus navigation starting point should be unset.",2023-05-23T11:17:21Z,zcorpan
1558872724,whatwg/html,I think (unless I misunderstand the meaning of step 1 https://html.spec.whatwg.org/multipage/browsin,https://github.com/whatwg/html/issues/8439#issuecomment-1558872724,https://github.com/whatwg/html/issues/8439,"After scrolling to the beginning of the document, the sequential focus navigation starting point should be unset.",2023-05-23T09:11:18Z,patrickhlauke
1558697560,whatwg/notifications,"Tests sent at https://github.com/web-platform-tests/wpt/pull/40160 (reviewed upstream) ",https://github.com/whatwg/notifications/pull/194#issuecomment-1558697560,https://github.com/whatwg/notifications/pull/194,Default silent to platform convention,2023-05-23T07:32:32Z,marcoscaceres
1558690836,mozilla/standards-positions,"Ah, that's right. Sorry for the noise.",https://github.com/mozilla/standards-positions/issues/804#issuecomment-1558690836,https://github.com/mozilla/standards-positions/issues/804,Ignore target names which contain both `\n` and `<` characters,2023-05-23T07:27:55Z,valenting
1558688180,mozilla/standards-positions,"@valenting This is about `target` attributes (e.g., target names) and https://github.com/whatwg/html",https://github.com/mozilla/standards-positions/issues/804#issuecomment-1558688180,https://github.com/mozilla/standards-positions/issues/804,Ignore target names which contain both `\n` and `<` characters,2023-05-23T07:25:43Z,mozfreddyb
1558672827,w3ctag/design-reviews,Hi @hemeryar thanks for that - it looks good - and sorry it took so long to get you that answer. A l,https://github.com/w3ctag/design-reviews/issues/760#issuecomment-1558672827,https://github.com/w3ctag/design-reviews/issues/760,COOP: restrict-properties early review,2023-05-23T07:15:14Z,torgo
1558624658,whatwg/html,Can you rebase this then?,https://github.com/whatwg/html/pull/9058#issuecomment-1558624658,https://github.com/whatwg/html/pull/9058,Throw exception in originalType check,2023-05-23T06:39:45Z,annevk
1558523562,whatwg/html,"I think specifying that the media, srcset, and sizes attributes are to be consulted during the [reso",https://github.com/whatwg/html/issues/6363#issuecomment-1558523562,https://github.com/whatwg/html/issues/6363,HTML Video Element: Proposal For Reintroduction of Media in Source Elements,2023-05-23T05:02:13Z,jernoble
1558455238,whatwg/html,"Can i help to solve this issue ",https://github.com/whatwg/html/issues/4715#issuecomment-1558455238,https://github.com/whatwg/html/issues/4715,width and height attributes on <table> should perhaps allow 0 as a value,2023-05-23T03:23:48Z,Kevin-Usadadiya
1558049166,whatwg/html," > So in your scenario both the button and popover would have to have DOM ids so they can point to ",https://github.com/whatwg/html/issues/9111#issuecomment-1558049166,https://github.com/whatwg/html/issues/9111,Popover does not know what triggered it,2023-05-22T21:37:05Z,mfreed7
1558040646,whatwg/html,"@jernoble are you OK with the current implemented behavior of the media query only being considered ",https://github.com/whatwg/html/issues/6363#issuecomment-1558040646,https://github.com/whatwg/html/issues/6363,HTML Video Element: Proposal For Reintroduction of Media in Source Elements,2023-05-22T21:30:37Z,zcorpan
1558015519,whatwg/html,"FWIW, my work on table layout is mostly not recent, and was back when I worked on Gecko.  That sai",https://github.com/whatwg/html/issues/4715#issuecomment-1558015519,https://github.com/whatwg/html/issues/4715,width and height attributes on <table> should perhaps allow 0 as a value,2023-05-22T21:13:39Z,dbaron
1557863204,whatwg/html,> It's possible that we make popovers somehow have an implicit anchor element (eg invoker); that's g,https://github.com/whatwg/html/issues/9311#issuecomment-1557863204,https://github.com/whatwg/html/issues/9311,Interaction between Popover API and CSS Anchor Positioning specs,2023-05-22T19:49:20Z,jpzwarte
1557839938,whatwg/html,"> Thanks, this looks a big improvement. I've a couple nits left. >  > Another thing I noticed that",https://github.com/whatwg/html/pull/9305#issuecomment-1557839938,https://github.com/whatwg/html/pull/9305,Cleaned up the tables for getContext(),2023-05-22T19:40:31Z,trevorspiniolas
1557836186,whatwg/html,"Right now there's no such thing as ""`anchorElement` is implicitly set"". It has to be explicitly set ",https://github.com/whatwg/html/issues/9311#issuecomment-1557836186,https://github.com/whatwg/html/issues/9311,Interaction between Popover API and CSS Anchor Positioning specs,2023-05-22T19:37:04Z,xiaochengh
1557835962,whatwg/html,"[The fix](https://phabricator.services.mozilla.com/D177011) in Gecko, We have only made modification",https://github.com/whatwg/html/pull/9198#issuecomment-1557835962,https://github.com/whatwg/html/pull/9198,Improve popover event handling in nested showing and hiding,2023-05-22T19:36:49Z,cathiechen
1557782102,webkit/standards-positions,Is this blocked on anything in particular or just queued?,https://github.com/WebKit/standards-positions/issues/34#issuecomment-1557782102,https://github.com/WebKit/standards-positions/issues/34,Navigation API,2023-05-22T19:10:43Z,rd3k
1557777366,w3ctag/design-reviews,"I updated the chromestatus, we shipped this in chrome 105.",https://github.com/w3ctag/design-reviews/issues/734#issuecomment-1557777366,https://github.com/w3ctag/design-reviews/issues/734,Element.checkVisibility review,2023-05-22T19:07:55Z,josepharhar
1557733805,whatwg/html,"Yes, this is still relevant. Chromium has this change implemented here: https://source.chromium.org/",https://github.com/whatwg/html/pull/9058#issuecomment-1557733805,https://github.com/whatwg/html/pull/9058,Throw exception in originalType check,2023-05-22T18:52:00Z,josepharhar
1557716513,webkit/standards-positions,"Hey Anne, thanks for the additional feedback! I discussed this with others on the Chrome side.  We",https://github.com/WebKit/standards-positions/issues/50#issuecomment-1557716513,https://github.com/WebKit/standards-positions/issues/50,CHIPS (Cookies Having Independent Partitioned State),2023-05-22T18:41:22Z,johannhof
1557689432,mozilla/standards-positions,Sounds great! Thank you!,https://github.com/mozilla/standards-positions/issues/804#issuecomment-1557689432,https://github.com/mozilla/standards-positions/issues/804,Ignore target names which contain both `\n` and `<` characters,2023-05-22T18:20:51Z,shhnjk
1557687745,whatwg/html,I've moved the logic to only take effect on html attributes (and not JS APIs like`window.open()`). P,https://github.com/whatwg/html/pull/9309#issuecomment-1557687745,https://github.com/whatwg/html/pull/9309,Ignore dangling markup in target name,2023-05-22T18:19:21Z,shhnjk
1557687555,w3ctag/design-reviews,The fully-synchronous interface* is shipped and in active use on all major browsers. Given the usage,https://github.com/w3ctag/design-reviews/issues/772#issuecomment-1557687555,https://github.com/w3ctag/design-reviews/issues/772,Sync Methods for FileSystemSyncAccessHandle in File System Access API,2023-05-22T18:19:11Z,a-sully
1557683912,webkit/standards-positions,"Given @jernoble's remarks, I plan to mark this as `position: support` in a week unless this discussi",https://github.com/WebKit/standards-positions/issues/190#issuecomment-1557683912,https://github.com/WebKit/standards-positions/issues/190,Re-introduction of Media Queries (and srcset/sizes) in Source Elements,2023-05-22T18:16:23Z,hober
1557678455,whatwg/html,"> @emilio or @cathiechen, can you please review this? Mainly interested in two things: >  >     * ",https://github.com/whatwg/html/pull/9198#issuecomment-1557678455,https://github.com/whatwg/html/pull/9198,Improve popover event handling in nested showing and hiding,2023-05-22T18:12:07Z,emilio
1557676719,whatwg/html,I made all of the cases into a jsfiddle here: https://jsfiddle.net/jarhar/301cmbqo/ I tested it usi,https://github.com/whatwg/html/issues/9311#issuecomment-1557676719,https://github.com/whatwg/html/issues/9311,Interaction between Popover API and CSS Anchor Positioning specs,2023-05-22T18:10:46Z,josepharhar
1557652000,webkit/standards-positions,"> we're definitely assuming sites will set as many of these as allowed  There are certainly sites ",https://github.com/WebKit/standards-positions/issues/50#issuecomment-1557652000,https://github.com/WebKit/standards-positions/issues/50,CHIPS (Cookies Having Independent Partitioned State),2023-05-22T17:55:10Z,martinthomson
1557633036,webkit/standards-positions,I actually am talking about it being slower to make requests and requests taking up more packets. Al,https://github.com/WebKit/standards-positions/issues/50#issuecomment-1557633036,https://github.com/WebKit/standards-positions/issues/50,CHIPS (Cookies Having Independent Partitioned State),2023-05-22T17:37:44Z,annevk
1557572108,w3ctag/design-reviews,Hi - Can you please put together an explainer for this so we can start a review? See here https://w3,https://github.com/w3ctag/design-reviews/issues/836#issuecomment-1557572108,https://github.com/w3ctag/design-reviews/issues/836,WebRTC Codec selection API,2023-05-22T16:55:56Z,torgo
1557559477,w3ctag/design-reviews,What's the current state here? Given that the main motivation for this is WASM and the WASM people a,https://github.com/w3ctag/design-reviews/issues/772#issuecomment-1557559477,https://github.com/w3ctag/design-reviews/issues/772,Sync Methods for FileSystemSyncAccessHandle in File System Access API,2023-05-22T16:46:38Z,hober
