id,repo,body,url,issue_url,issue_title,created_at,user
2452740423,WICG/webcomponents,No. Customer elements only upgrade when they're connected.,https://github.com/WICG/webcomponents/issues/1078#issuecomment-2452740423,https://github.com/WICG/webcomponents/issues/1078,[Scoped Registries] Can disconnected elements can retain their shadowroot via dangling treeroot pointer?,2024-11-02T00:08:46Z,rniwa
2452739047,WICG/webcomponents,"If `<x-foo>` defined in the global registry it will upgrade immediately, right?",https://github.com/WICG/webcomponents/issues/1078#issuecomment-2452739047,https://github.com/WICG/webcomponents/issues/1078,[Scoped Registries] Can disconnected elements can retain their shadowroot via dangling treeroot pointer?,2024-11-02T00:06:39Z,justinfagnani
2452732634,WICG/webcomponents,"But the element isn't gonna upgrade until it's connected anyway, and at the time of connection, the ",https://github.com/WICG/webcomponents/issues/1078#issuecomment-2452732634,https://github.com/WICG/webcomponents/issues/1078,[Scoped Registries] Can disconnected elements can retain their shadowroot via dangling treeroot pointer?,2024-11-01T23:55:35Z,rniwa
2452726995,WICG/webcomponents,> Could someone clarify the exact situation in which this will be useful again?  When you create a,https://github.com/WICG/webcomponents/issues/1078#issuecomment-2452726995,https://github.com/WICG/webcomponents/issues/1078,[Scoped Registries] Can disconnected elements can retain their shadowroot via dangling treeroot pointer?,2024-11-01T23:45:06Z,justinfagnani
2452718709,WICG/webcomponents,Could someone clarify the exact situation in which this will be useful again?,https://github.com/WICG/webcomponents/issues/1078#issuecomment-2452718709,https://github.com/WICG/webcomponents/issues/1078,[Scoped Registries] Can disconnected elements can retain their shadowroot via dangling treeroot pointer?,2024-11-01T23:33:25Z,rniwa
2452697131,w3ctag/design-reviews,"Addressing @LeaVerou's comment above:  > I know that, but it seems like as long as each of these i",https://github.com/w3ctag/design-reviews/issues/961#issuecomment-2452697131,https://github.com/w3ctag/design-reviews/issues/961,Reference Target,2024-11-01T23:00:59Z,dandclark
2452554520,mozilla/standards-positions,Thanks for your comments Ben! I just wanted to chime in on a couple points where I think there is so,https://github.com/mozilla/standards-positions/issues/618#issuecomment-2452554520,https://github.com/mozilla/standards-positions/issues/618,FedCM (was WebID),2024-11-01T20:36:53Z,RByers
2452418940,mozilla/standards-positions,@tantek: I've added a comment with some updated analysis in #618. I also updated the URL so it doesn,https://github.com/mozilla/standards-positions/pull/1104#issuecomment-2452418940,https://github.com/mozilla/standards-positions/pull/1104,FedCM Update,2024-11-01T18:53:45Z,bvandersloot-mozilla
2452409835,mozilla/standards-positions,More than two years out: I think this merits an update.   Much of Martin's comment is either still,https://github.com/mozilla/standards-positions/issues/618#issuecomment-2452409835,https://github.com/mozilla/standards-positions/issues/618,FedCM (was WebID),2024-11-01T18:47:15Z,bvandersloot-mozilla
2452191811,whatwg/html,"Thanks to both of you! I revamped (slightly) your PR, and re-opened it as https://github.com/whatwg/",https://github.com/whatwg/html/issues/10592#issuecomment-2452191811,https://github.com/whatwg/html/issues/10592,Support disabling CloseWatcher integration in `<dialog>`,2024-11-01T16:37:08Z,mfreed7
2452140124,mozilla/standards-positions,"This proposal is interesting, and makes a lot of sense for subdocuments in particular.   For Gecko",https://github.com/mozilla/standards-positions/issues/1084#issuecomment-2452140124,https://github.com/mozilla/standards-positions/issues/1084,Storage Access Headers,2024-11-01T16:09:34Z,bvandersloot-mozilla
2452135842,whatwg/html,"> This is exciting! Unfortunately I am going OOO for a week starting ~now, so won't get a chance to ",https://github.com/whatwg/html/pull/10737#issuecomment-2452135842,https://github.com/whatwg/html/pull/10737,Add dialog light dismiss behavior,2024-11-01T16:07:01Z,mfreed7
2451765465,whatwg/html,> Would you mind commenting on what approach you took to the mutability of the closedby attribute? W,https://github.com/whatwg/html/pull/10737#issuecomment-2451765465,https://github.com/whatwg/html/pull/10737,Add dialog light dismiss behavior,2024-11-01T12:03:59Z,keithamus
2451487463,whatwg/html,"This is exciting! Unfortunately I am going OOO for a week starting ~now, so won't get a chance to re",https://github.com/whatwg/html/pull/10737#issuecomment-2451487463,https://github.com/whatwg/html/pull/10737,Add dialog light dismiss behavior,2024-11-01T08:14:59Z,domenic
2451327249,whatwg/html,"I think framing it around roles, rather than element types makes a lot of sense! 💯 ",https://github.com/whatwg/html/issues/10722#issuecomment-2451327249,https://github.com/whatwg/html/issues/10722,Allow any element to be the child of a custom element (parser weirdness permitting),2024-11-01T05:37:58Z,LeaVerou
2451244931,w3ctag/design-reviews,"> The example in the explainer refers to the CSS `@import` rule, while I think you are referring to ",https://github.com/w3ctag/design-reviews/issues/1000#issuecomment-2451244931,https://github.com/w3ctag/design-reviews/issues/1000,Declarative CSS Modules and Declarative Shadow DOM `adoptedstylesheets` attribute,2024-11-01T03:53:58Z,LeaVerou
2451088135,whatwg/dom,"> > Proposal A: >  > I don't understand how this proposal is different than a JavaScript array of ",https://github.com/whatwg/dom/issues/736#issuecomment-2451088135,https://github.com/whatwg/dom/issues/736,Proposal: a DocumentFragment whose nodes do not get removed once inserted,2024-11-01T00:49:57Z,dbaron
2451077898,whatwg/html,"This is the HTML Standard repository, and CSS features are not specified here. You probably want htt",https://github.com/whatwg/html/issues/10736#issuecomment-2451077898,https://github.com/whatwg/html/issues/10736,Image brightness reduction,2024-11-01T00:39:00Z,domenic
2451075071,whatwg/html,"Thanks, refiled as https://github.com/w3c/FileAPI/issues/203",https://github.com/whatwg/html/issues/10735#issuecomment-2451075071,https://github.com/whatwg/html/issues/10735,"Allow `createObjectURL` to retain filename from `File` (and similar) objects ",2024-11-01T00:35:56Z,jsoref
2451065308,whatwg/html,This standard doesn't have any method called `createObjectURL`. I think you want https://w3c.github.,https://github.com/whatwg/html/issues/10735#issuecomment-2451065308,https://github.com/whatwg/html/issues/10735,"Allow `createObjectURL` to retain filename from `File` (and similar) objects ",2024-11-01T00:26:21Z,domenic
2451062300,whatwg/dom,> Proposal A:  I don't understand how this proposal is different than a JavaScript array of nodes.,https://github.com/whatwg/dom/issues/736#issuecomment-2451062300,https://github.com/whatwg/dom/issues/736,Proposal: a DocumentFragment whose nodes do not get removed once inserted,2024-11-01T00:23:43Z,domenic
2451043064,whatwg/html,> Did you mean a CSS property?  yes.,https://github.com/whatwg/html/issues/10736#issuecomment-2451043064,https://github.com/whatwg/html/issues/10736,Image brightness reduction,2024-11-01T00:03:44Z,shallawa
2450956008,whatwg/html,"Did you mean a CSS property? ",https://github.com/whatwg/html/issues/10736#issuecomment-2450956008,https://github.com/whatwg/html/issues/10736,Image brightness reduction,2024-10-31T22:30:52Z,ydaniv
2450741163,w3ctag/design-reviews,"> Btw it's incorrect to say that >  > > Inline `<style>` blocks do not support `@import` rules > ",https://github.com/w3ctag/design-reviews/issues/1000#issuecomment-2450741163,https://github.com/w3ctag/design-reviews/issues/1000,Declarative CSS Modules and Declarative Shadow DOM `adoptedstylesheets` attribute,2024-10-31T20:18:17Z,phumai98
2450423672,whatwg/html,Happy to assist anyone who wants to take over the PR. I think for the exact mechanics of changing th,https://github.com/whatwg/html/issues/10592#issuecomment-2450423672,https://github.com/whatwg/html/issues/10592,Support disabling CloseWatcher integration in `<dialog>`,2024-10-31T17:22:09Z,lukewarlow
2450409575,whatwg/dom,"P.S. nobody might like pre-inserted or appended comments out of the blue, but that's what any hydrat",https://github.com/whatwg/dom/issues/736#issuecomment-2450409575,https://github.com/whatwg/dom/issues/736,Proposal: a DocumentFragment whose nodes do not get removed once inserted,2024-10-31T17:14:51Z,WebReflection
2450402635,whatwg/dom,"All issues solved in a way or another by my libraries ... a persistent fragment pre-inject a pinned ",https://github.com/whatwg/dom/issues/736#issuecomment-2450402635,https://github.com/whatwg/dom/issues/736,Proposal: a DocumentFragment whose nodes do not get removed once inserted,2024-10-31T17:11:09Z,WebReflection
2450402608,whatwg/html,"I’d also be happy to pick this up as it aligns with our goals at GitHub. ",https://github.com/whatwg/html/issues/10592#issuecomment-2450402608,https://github.com/whatwg/html/issues/10592,Support disabling CloseWatcher integration in `<dialog>`,2024-10-31T17:11:08Z,keithamus
2450367727,w3ctag/design-reviews,"We could go back on beforetoggle/toggle and replace them with beforeopen/beforeclose/open/close, but",https://github.com/w3ctag/design-reviews/issues/1005#issuecomment-2450367727,https://github.com/w3ctag/design-reviews/issues/1005,Dispatching Toggle Events for Dialog open/close,2024-10-31T16:54:57Z,josepharhar
2450337321,whatwg/html,Sorry for the delay getting back to this. But yes I'd like to pick https://github.com/whatwg/html/pu,https://github.com/whatwg/html/issues/10592#issuecomment-2450337321,https://github.com/whatwg/html/issues/10592,Support disabling CloseWatcher integration in `<dialog>`,2024-10-31T16:40:18Z,mfreed7
2450312403,whatwg/dom,"Yes, this should only be exposed to isolated worlds of extensions, not the main world for normal pag",https://github.com/whatwg/dom/issues/1321#issuecomment-2450312403,https://github.com/whatwg/dom/issues/1321,Extension only API to query across shadow trees,2024-10-31T16:30:08Z,xeenon
2450304875,whatwg/dom,> That doesn't mean this has to be exposed to all sites - we could still allow the user agent to pre,https://github.com/whatwg/dom/issues/1321#issuecomment-2450304875,https://github.com/whatwg/dom/issues/1321,Extension only API to query across shadow trees,2024-10-31T16:26:21Z,rniwa
2450281458,whatwg/html,"Thank you all for attending the meeting today and a special thank you to Domenic for taking meeting ",https://github.com/whatwg/html/issues/10720#issuecomment-2450281458,https://github.com/whatwg/html/issues/10720,Upcoming WHATNOT meeting on 2024-10-31,2024-10-31T16:14:55Z,past
2450276827,whatwg/html,"+1  Also, now that something like this is coming out for CSS anchor positioning, it might be easie",https://github.com/whatwg/html/issues/9104#issuecomment-2450276827,https://github.com/whatwg/html/issues/9104,Add BoundingClientRectObserver,2024-10-31T16:13:11Z,AlbertMarashi
2450273120,whatwg/dom,"To add some more context here, we recently had some discussions about this in the WebExtensions Comm",https://github.com/whatwg/dom/issues/1321#issuecomment-2450273120,https://github.com/whatwg/dom/issues/1321,Extension only API to query across shadow trees,2024-10-31T16:11:51Z,oliverdunk
2450228044,whatwg/dom,"Reading through this issue, I think (although I might be misreading some of the comments) that diffe",https://github.com/whatwg/dom/issues/736#issuecomment-2450228044,https://github.com/whatwg/dom/issues/736,Proposal: a DocumentFragment whose nodes do not get removed once inserted,2024-10-31T15:52:32Z,dbaron
2450198052,whatwg/html,"For Chromium, this is an artifact of two things:  1. The fact that the decision to lazy load an ima",https://github.com/whatwg/html/issues/10671#issuecomment-2450198052,https://github.com/whatwg/html/issues/10671,[images] Lazy loading and out of band loads.,2024-10-31T15:39:31Z,domfarolino
2449790664,w3ctag/design-reviews,"Would the use of `defaultReferenceTarget` or similar fail when moving from out ""cannonical"" example:",https://github.com/w3ctag/design-reviews/issues/961#issuecomment-2449790664,https://github.com/w3ctag/design-reviews/issues/961,Reference Target,2024-10-31T13:01:46Z,Westbrook
2449282305,whatwg/html,"@domfarolino, back in the day you used to work on lazy-loading images---would you be able to help wi",https://github.com/whatwg/html/issues/10671#issuecomment-2449282305,https://github.com/whatwg/html/issues/10671,[images] Lazy loading and out of band loads.,2024-10-31T08:13:22Z,domenic
2449079332,w3ctag/design-reviews,One potential issue I can see with the non-`id` approach is that it makes changing the active descen,https://github.com/w3ctag/design-reviews/issues/961#issuecomment-2449079332,https://github.com/w3ctag/design-reviews/issues/961,Reference Target,2024-10-31T06:19:04Z,nolanlawson
2449068255,whatwg/html,> AFAICT the html spec doesn't say what to do with the referer when calling out to fetch API for met,https://github.com/whatwg/html/issues/3643#issuecomment-2449068255,https://github.com/whatwg/html/issues/3643,"referer header on <meta http-equiv=""refresh"" content=""0;url="">",2024-10-31T06:07:22Z,zrhoffman
2449063109,w3ctag/design-reviews,I'm happy to work with @rachelandrew on this.,https://github.com/w3ctag/design-reviews/issues/1003#issuecomment-2449063109,https://github.com/w3ctag/design-reviews/issues/1003,CSS Masonry Layout,2024-10-31T06:02:18Z,fantasai
2448890537,whatwg/html,Any idea what the status of this is?,https://github.com/whatwg/html/issues/2142#issuecomment-2448890537,https://github.com/whatwg/html/issues/2142,A way to stream content into an element,2024-10-31T02:23:44Z,dead-claudia
2448355903,webkit/standards-positions,WebKit Bugzilla: https://bugs.webkit.org/show_bug.cgi?id=253143,https://github.com/WebKit/standards-positions/issues/9#issuecomment-2448355903,https://github.com/WebKit/standards-positions/issues/9,Auto-sizes for lazy-loaded images in HTML,2024-10-30T20:52:30Z,styfle
2448207968,w3ctag/design-reviews,"FWIW, I don't think you should duplicate any information into https://github.com/screen-share/captur",https://github.com/w3ctag/design-reviews/issues/962#issuecomment-2448207968,https://github.com/w3ctag/design-reviews/issues/962,Captured Surface Control,2024-10-30T19:43:18Z,jyasskin
2448193603,whatwg/html,This PR removes some important(?) context about option use within / outside of a datalist.  for ins,https://github.com/whatwg/html/pull/10586#issuecomment-2448193603,https://github.com/whatwg/html/pull/10586,Update content model for customizable select,2024-10-30T19:36:56Z,scottaohara
2447933745,whatwg/html,"> allow any element to have a custom element as a parent.  Sounds OK, but the custom parent elemen",https://github.com/whatwg/html/issues/10722#issuecomment-2447933745,https://github.com/whatwg/html/issues/10722,Allow any element to be the child of a custom element (parser weirdness permitting),2024-10-30T17:52:00Z,stevefaulkner
2447905753,w3ctag/design-reviews,> We still feel the explainer needs more information on possible abuse cases and a bit more discussi,https://github.com/w3ctag/design-reviews/issues/962#issuecomment-2447905753,https://github.com/w3ctag/design-reviews/issues/962,Captured Surface Control,2024-10-30T17:38:23Z,eladalon1983
2447787278,whatwg/html,> Editorially LGTM (with one more nit). Let us know when all the boxes are checked.  Thanks! Done.,https://github.com/whatwg/html/pull/10728#issuecomment-2447787278,https://github.com/whatwg/html/pull/10728,"Add imperative access to popover invoker, and connect popover/invoker to implicit anchor element",2024-10-30T16:49:51Z,mfreed7
2447640764,whatwg/html,> @josepharhar you were actioned in the last meeting with the following; were you able to open the i,https://github.com/whatwg/html/issues/10730#issuecomment-2447640764,https://github.com/whatwg/html/issues/10730,Meeting 10 for joint OpenUI-WHATWG/HTML-CSSWG task force on styleable form controls,2024-10-30T16:01:18Z,josepharhar
2447447168,w3ctag/design-reviews,Thank you!,https://github.com/w3ctag/design-reviews/issues/1002#issuecomment-2447447168,https://github.com/w3ctag/design-reviews/issues/1002,"Review for CR transition of WebAssembly specifications for version 2.0 features ",2024-10-30T15:03:56Z,dschuff
2446446802,whatwg/html,> That applies to the iframe element's src attribute too [1](#user-content-fn-1-190d0e50d1a03f2de1a2,https://github.com/whatwg/html/issues/10719#issuecomment-2446446802,https://github.com/whatwg/html/issues/10719,Should `<object data=...>` support `javascript:` URLs?,2024-10-30T10:13:43Z,zcorpan
2446353267,whatwg/html,> > How is it not relevant to user agents? >  > See https://html.spec.whatwg.org/multipage/infrast,https://github.com/whatwg/html/issues/10719#issuecomment-2446353267,https://github.com/whatwg/html/issues/10719,Should `<object data=...>` support `javascript:` URLs?,2024-10-30T09:43:03Z,mbrodesser-Igalia
2446195385,w3ctag/design-reviews,Thank you for your reply and all the info in the Explainer. We discussed this on our breakout today.,https://github.com/w3ctag/design-reviews/issues/962#issuecomment-2446195385,https://github.com/w3ctag/design-reviews/issues/962,Captured Surface Control,2024-10-30T08:40:24Z,matatk
2446189694,w3ctag/design-reviews,"Hi and thank you for your response, @dschuff. We reviewed again today and we agree that making those",https://github.com/w3ctag/design-reviews/issues/1002#issuecomment-2446189694,https://github.com/w3ctag/design-reviews/issues/1002,"Review for CR transition of WebAssembly specifications for version 2.0 features ",2024-10-30T08:37:17Z,torgo
2445925031,whatwg/html,"Thanks @domenic I'll close my wpt pr's then... Though must say, do not appreciate being led on like ",https://github.com/whatwg/html/pull/10705#issuecomment-2445925031,https://github.com/whatwg/html/pull/10705,Guard showModal() and showPopover() with fully active checks,2024-10-30T05:45:58Z,maraisr
2445874795,WICG/webcomponents,"> Using a template or fragment is different. I propose adding a new element to handle this, named `c",https://github.com/WICG/webcomponents/issues/1059#issuecomment-2445874795,https://github.com/WICG/webcomponents/issues/1059,Exploration: HTML Module Imports and Exports,2024-10-30T05:17:28Z,DanielHerr
2445576178,w3ctag/design-reviews,My intuition and experience with using these suggests that opening and closing `<details>` and `<dia,https://github.com/w3ctag/design-reviews/issues/1005#issuecomment-2445576178,https://github.com/w3ctag/design-reviews/issues/1005,Dispatching Toggle Events for Dialog open/close,2024-10-30T00:39:24Z,martinthomson
2445556014,w3ctag/design-reviews,I think it would help to see the common cases where you'd need 2 event listeners with mostly the sam,https://github.com/w3ctag/design-reviews/issues/1005#issuecomment-2445556014,https://github.com/w3ctag/design-reviews/issues/1005,Dispatching Toggle Events for Dialog open/close,2024-10-30T00:19:43Z,jyasskin
2445547369,w3ctag/design-reviews,"Having the separate event would likely lead to setting up 2 event listeners instead of one for some ",https://github.com/w3ctag/design-reviews/issues/1005#issuecomment-2445547369,https://github.com/w3ctag/design-reviews/issues/1005,Dispatching Toggle Events for Dialog open/close,2024-10-30T00:11:12Z,keithamus
2445541018,whatwg/html,Yes I'm not keeping this up to date anymore since I decided to split out the PRs and have slight red,https://github.com/whatwg/html/pull/10548#issuecomment-2445541018,https://github.com/whatwg/html/pull/10548,Complete draft spec for customizable `<select>`,2024-10-30T00:04:59Z,josepharhar
2445525346,whatwg/html,"For @csreis's first question about same url navigation from bookmark, it looks like Chrome and Firef",https://github.com/whatwg/html/issues/10597#issuecomment-2445525346,https://github.com/whatwg/html/issues/10597,Adjust Scroll Restoration Behavior for Reloads,2024-10-29T23:47:32Z,LiangTheDev
2445474271,w3ctag/design-reviews,"We discussed this in a breakout today:  The two types (""before"" and ""on"") of event seem like very ",https://github.com/w3ctag/design-reviews/issues/1005#issuecomment-2445474271,https://github.com/w3ctag/design-reviews/issues/1005,Dispatching Toggle Events for Dialog open/close,2024-10-29T22:56:58Z,jyasskin
2445463104,w3ctag/design-reviews,"Discussed in a breakout.  This seems fine.  There is a web-compat risk ""self"" and ""auto"" were not pr",https://github.com/w3ctag/design-reviews/issues/1001#issuecomment-2445463104,https://github.com/w3ctag/design-reviews/issues/1001,CSS view transition auto name generation,2024-10-29T22:46:37Z,martinthomson
2445460531,whatwg/html,"For anybody not already following along, there is a parallel discussion about this same topic here: ",https://github.com/whatwg/html/issues/10673#issuecomment-2445460531,https://github.com/whatwg/html/issues/10673,Declarative CSS Modules and Declarative Shadow DOM `adoptedstylesheets` attribute,2024-10-29T22:44:21Z,o-t-w
2445451579,w3ctag/design-reviews,"(As you can tell, this is a real team effort :)  We're happy to see this feature progress.  There ",https://github.com/w3ctag/design-reviews/issues/1000#issuecomment-2445451579,https://github.com/w3ctag/design-reviews/issues/1000,Declarative CSS Modules and Declarative Shadow DOM `adoptedstylesheets` attribute,2024-10-29T22:36:07Z,martinthomson
2445449878,w3ctag/design-reviews,A concern about whatever mechanism is used here is that there is an existing behavior of copy-on-wri,https://github.com/w3ctag/design-reviews/issues/1000#issuecomment-2445449878,https://github.com/w3ctag/design-reviews/issues/1000,Declarative CSS Modules and Declarative Shadow DOM `adoptedstylesheets` attribute,2024-10-29T22:34:36Z,plinss
2445445568,w3ctag/design-reviews,"Hi @noamr, I know this is a small thing, but the explainer really needs examples.",https://github.com/w3ctag/design-reviews/issues/1001#issuecomment-2445445568,https://github.com/w3ctag/design-reviews/issues/1001,CSS view transition auto name generation,2024-10-29T22:30:48Z,martinthomson
2445410154,whatwg/html,@josepharhar you were actioned in the last meeting with the following; were you able to open the iss,https://github.com/whatwg/html/issues/10730#issuecomment-2445410154,https://github.com/whatwg/html/issues/10730,Meeting 10 for joint OpenUI-WHATWG/HTML-CSSWG task force on styleable form controls,2024-10-29T22:01:59Z,gregwhitworth
2445174688,w3ctag/design-reviews,"> @michaelwarren1106 This can be mitigated by simply using the first instance of the attribute (for ",https://github.com/w3ctag/design-reviews/issues/961#issuecomment-2445174688,https://github.com/w3ctag/design-reviews/issues/961,Reference Target,2024-10-29T19:38:13Z,michaelwarren1106
2445019398,w3ctag/design-reviews,@michaelwarren1106 This can be mitigated by simply using the first instance of the attribute (for re,https://github.com/w3ctag/design-reviews/issues/961#issuecomment-2445019398,https://github.com/w3ctag/design-reviews/issues/961,Reference Target,2024-10-29T18:17:30Z,LeaVerou
2444919482,WICG/webcomponents,"> We need a way to represent SCERs in SSR, and if SCERs are tied to Shadow Realms rather than Shadow",https://github.com/WICG/webcomponents/issues/1043#issuecomment-2444919482,https://github.com/WICG/webcomponents/issues/1043,[scoped-registries] Consider future expansion to allow using a registry without new API,2024-10-29T17:28:18Z,justinfagnani
2444861270,WICG/webcomponents,Some points that were raised about SCER in the Discord:  - We need a way to represent SCERs in SSR,https://github.com/WICG/webcomponents/issues/1043#issuecomment-2444861270,https://github.com/WICG/webcomponents/issues/1043,[scoped-registries] Consider future expansion to allow using a registry without new API,2024-10-29T17:02:58Z,nolanlawson
2444770611,whatwg/html,"Actually, that's my mistake. Further testing shows that this does *not* actually work to detect a tr",https://github.com/whatwg/html/issues/1766#issuecomment-2444770611,https://github.com/whatwg/html/issues/1766,Add onclose event to MessagePort,2024-10-29T16:25:29Z,James-E-A
2444422914,whatwg/html,https://wpt.fyi/results/domparsing/insert-adjacent.html?label=experimental&label=master&aligned is c,https://github.com/whatwg/html/pull/10729#issuecomment-2444422914,https://github.com/whatwg/html/pull/10729,Fix final step of insertAdjacentHTML(),2024-10-29T14:24:25Z,zcorpan
2444415965,whatwg/html,"@fergald Sure, here's a quick demo: https://webpages.uah.edu/~je0029/tmp/demo_stream_canary/  The ",https://github.com/whatwg/html/issues/1766#issuecomment-2444415965,https://github.com/whatwg/html/issues/1766,Add onclose event to MessagePort,2024-10-29T14:21:46Z,James-E-A
2443904956,whatwg/html,> How is it not relevant to user agents?  See https://html.spec.whatwg.org/multipage/infrastructur,https://github.com/whatwg/html/issues/10719#issuecomment-2443904956,https://github.com/whatwg/html/issues/10719,Should `<object data=...>` support `javascript:` URLs?,2024-10-29T11:03:30Z,zcorpan
2443753748,whatwg/html,@ArthurSonzogni - I now believe that returning the non-null WindowProxy in case of a BCG change is s,https://github.com/whatwg/html/issues/10457#issuecomment-2443753748,https://github.com/whatwg/html/issues/10457,Should COOP-related browsing context switch result in nullification of a popup's WindowProxy's `window`?,2024-10-29T09:57:28Z,yoavweiss
2443652082,whatwg/html,@James-E-A I guess the intention here is that canary's `finally` will be called when `TARGET` is clo,https://github.com/whatwg/html/issues/1766#issuecomment-2443652082,https://github.com/whatwg/html/issues/1766,Add onclose event to MessagePort,2024-10-29T09:13:02Z,fergald
