id,repo,body,url,issue_url,issue_title,created_at,user
1872606016,mozilla/standards-positions,"> How do you address the issue with the server side being compromised, and serving code that can dam",https://github.com/mozilla/standards-positions/pull/193#issuecomment-1872606016,https://github.com/mozilla/standards-positions/pull/193,Add position on WebUSB.,2023-12-30T21:00:07Z,whitequark
1872599785,whatwg/html,THIS IS THE GREAT ISSUE. Only one article in 2023 in [https://blog.whatwg.org/](https://blog.whatwg.,https://github.com/whatwg/html/issues/10030#issuecomment-1872599785,https://github.com/whatwg/html/issues/10030,Is HTML stagnated?,2023-12-30T20:26:50Z,alejsanc
1872598395,whatwg/html,"@emilio I wonder if the styles should be applied on `input:is([type=button i], [type=reset i], [type",https://github.com/whatwg/html/pull/10025#issuecomment-1872598395,https://github.com/whatwg/html/pull/10025,Don't clip range/checkbox/radio overflow to border box.,2023-12-30T20:20:05Z,nt1m
1872597709,whatwg/html,"> I tried reverting the 2008 change in blink and the crash test did not reproduce, so it seems safe ",https://github.com/whatwg/html/issues/10029#issuecomment-1872597709,https://github.com/whatwg/html/issues/10029,Should `:target` match after elements are removed and reattached to the document?,2023-12-30T20:16:26Z,nt1m
1872592448,whatwg/html,"Lots of new features have been included into HTML in recent years, however the html issue tracker is",https://github.com/whatwg/html/issues/10030#issuecomment-1872592448,https://github.com/whatwg/html/issues/10030,Is HTML stagnated?,2023-12-30T19:48:45Z,keithamus
1872520794,whatwg/html,I’m linking the Chromium bug re `overscroll-behavior: contain` not working for dialogs without overf,https://github.com/whatwg/html/issues/7732#issuecomment-1872520794,https://github.com/whatwg/html/issues/7732,Consider preventing page scroll when modal dialog is visible,2023-12-30T12:41:06Z,simevidas
1872453558,whatwg/html,"I tried to build with `<dialog>` for the first time today (in Chrome), then I hit this, and found th",https://github.com/whatwg/html/issues/7732#issuecomment-1872453558,https://github.com/whatwg/html/issues/7732,Consider preventing page scroll when modal dialog is visible,2023-12-30T05:04:41Z,trusktr
1871973833,whatwg/html,Chromium seems interested to implement this as soon as this is spec.,https://github.com/whatwg/html/pull/9017#issuecomment-1871973833,https://github.com/whatwg/html/pull/9017,"Add ""lbry"" scheme to allowlist",2023-12-29T11:32:10Z,ben221199
1871355843,whatwg/html,chrome issue for this: https://bugs.chromium.org/p/chromium/issues/detail?id=1513949  ah nevermind,https://github.com/whatwg/html/issues/9976#issuecomment-1871355843,https://github.com/whatwg/html/issues/9976,[forms] Make <input type=button> magic clip not magic,2023-12-28T17:14:43Z,josepharhar
1816004924,whatwg/html,"I believe when handling a cookie string, it will often contain multiple cookies. With that in mind, ",https://github.com/whatwg/html/issues/9935#issuecomment-1816004924,https://github.com/whatwg/html/issues/9935,Cookie API,2023-11-17T09:13:01Z,kettanaito
1479407951,whatwg/html,That's not bending the rules. Getters returning different things because of state changes is perfect,https://github.com/whatwg/html/issues/8545#issuecomment-1479407951,https://github.com/whatwg/html/issues/8545,GC for cached attr-associated elements?,2023-03-22T11:43:19Z,annevk
791911381,whatwg/html,[I move this proposal to WICG.](https://github.com/WICG/proposals/issues/25),https://github.com/whatwg/html/issues/6436#issuecomment-791911381,https://github.com/whatwg/html/issues/6436,Form submission in the background without Javascript.,2021-03-06T10:52:23Z,alejsanc
791911192,whatwg/html,[I move this proposal to WICG.](https://github.com/WICG/open-ui/issues/279),https://github.com/whatwg/html/issues/6448#issuecomment-791911192,https://github.com/whatwg/html/issues/6448,Form submission does not show progress,2021-03-06T10:50:42Z,alejsanc
791911041,whatwg/html,[I move this proposal to WICG.](https://github.com/WICG/open-ui/issues/280),https://github.com/whatwg/html/issues/6449#issuecomment-791911041,https://github.com/whatwg/html/issues/6449,Form not submitted warning message before unload,2021-03-06T10:49:15Z,alejsanc
791910784,whatwg/html,[I move this proposal to WICG.](https://github.com/WICG/open-ui/issues/281),https://github.com/whatwg/html/issues/6457#issuecomment-791910784,https://github.com/whatwg/html/issues/6457,Form submission confirmation without Javascript,2021-03-06T10:46:54Z,alejsanc
791910642,whatwg/html,"> Yeah, as I have said in a couple of issues, https://wicg.io/ and https://github.com/WICG/open-ui a",https://github.com/whatwg/html/issues/6457#issuecomment-791910642,https://github.com/whatwg/html/issues/6457,Form submission confirmation without Javascript,2021-03-06T10:45:44Z,alejsanc
791713008,whatwg/html,"> So in general, there's not a lot of interest in adding features to browsers which allow you to do ",https://github.com/whatwg/html/issues/6457#issuecomment-791713008,https://github.com/whatwg/html/issues/6457,Form submission confirmation without Javascript,2021-03-05T21:15:13Z,alejsanc
791632656,whatwg/html,"It adds an overview. It is important to see things as a whole, any of these functionalities interfer",https://github.com/whatwg/html/issues/6458#issuecomment-791632656,https://github.com/whatwg/html/issues/6458,Forms lack basic functionality,2021-03-05T19:29:29Z,alejsanc
790889695,whatwg/html,It's a shame. When was it abandoned? Before Javascript and JSON were widely used? Now it is very com,https://github.com/whatwg/html/issues/6442#issuecomment-790889695,https://github.com/whatwg/html/issues/6442,Searchable dynamic datalist with JSON list without Javascript,2021-03-04T19:55:47Z,alejsanc
790881359,whatwg/html,This functionality must be optional. In forms with small size parameters it is not necessary. The br,https://github.com/whatwg/html/issues/6448#issuecomment-790881359,https://github.com/whatwg/html/issues/6448,Form submission does not show progress,2021-03-04T19:44:43Z,alejsanc
789901308,whatwg/dom,Thanks for the info annevk.,https://github.com/whatwg/dom/issues/957#issuecomment-789901308,https://github.com/whatwg/dom/issues/957,Evolution of DOM API to a higher level of abstraction.,2021-03-03T17:16:58Z,alejsanc
789869242,whatwg/dom,Those examples that you put are more complex than my example. That's why people use libraries and no,https://github.com/whatwg/dom/issues/957#issuecomment-789869242,https://github.com/whatwg/dom/issues/957,Evolution of DOM API to a higher level of abstraction.,2021-03-03T16:47:14Z,alejsanc
789369300,whatwg/html,"Thanks andreubotella, I have found it at the same time you wrote your message.",https://github.com/whatwg/html/issues/6432#issuecomment-789369300,https://github.com/whatwg/html/issues/6432,Add content-type attribute to anchors for external applications,2021-03-03T02:06:39Z,alejsanc
789367721,whatwg/html,"And HTML is not only about render web pages. It is also about linking content with ""a"" and ""link"".  ",https://github.com/whatwg/html/issues/6432#issuecomment-789367721,https://github.com/whatwg/html/issues/6432,Add content-type attribute to anchors for external applications,2021-03-03T02:03:17Z,alejsanc
789358630,whatwg/html,But the content-type attribute is in the HTML Spec scope. This is only about this simple attribute.,https://github.com/whatwg/html/issues/6432#issuecomment-789358630,https://github.com/whatwg/html/issues/6432,Add content-type attribute to anchors for external applications,2021-03-03T01:39:09Z,alejsanc
789356753,whatwg/html,We are not talking about theoretical systems that could be used but about something that browsers al,https://github.com/whatwg/html/issues/6432#issuecomment-789356753,https://github.com/whatwg/html/issues/6432,Add content-type attribute to anchors for external applications,2021-03-03T01:33:40Z,alejsanc
789350697,whatwg/html,How does the browser pass a url to an application?  Any application that uses WebDAV like LibreOff,https://github.com/whatwg/html/issues/6432#issuecomment-789350697,https://github.com/whatwg/html/issues/6432,Add content-type attribute to anchors for external applications,2021-03-03T01:19:52Z,alejsanc
789324070,whatwg/html,> Especially since servers have been dealing with the current one for years.  We could also contin,https://github.com/whatwg/html/issues/6431#issuecomment-789324070,https://github.com/whatwg/html/issues/6431,"Add boolean input element with ""true"" and ""false"" values.",2021-03-03T00:28:22Z,alejsanc
789319790,whatwg/html,I think that at least you should not censor me and leave the discussion open to see what other peopl,https://github.com/whatwg/html/issues/6432#issuecomment-789319790,https://github.com/whatwg/html/issues/6432,Add content-type attribute to anchors for external applications,2021-03-03T00:18:40Z,alejsanc
789318788,whatwg/html,"The other applications need the URL, I don't see anything strange about the browser being able to pa",https://github.com/whatwg/html/issues/6432#issuecomment-789318788,https://github.com/whatwg/html/issues/6432,Add content-type attribute to anchors for external applications,2021-03-03T00:16:34Z,alejsanc
789314479,whatwg/html,What browsers currently do is download the file to your hard drive and from there open it with an ap,https://github.com/whatwg/html/issues/6432#issuecomment-789314479,https://github.com/whatwg/html/issues/6432,Add content-type attribute to anchors for external applications,2021-03-03T00:05:47Z,alejsanc