id,repo,body,url,issue_url,issue_title,created_at,user
1581804834,whatwg/html,"> Oh, clever, that's why you wrote it that way. I think there's still a problem though: what if you ",https://github.com/whatwg/html/pull/9387#issuecomment-1581804834,https://github.com/whatwg/html/pull/9387,Fix ::backdrop user-agent rule for popovers,2023-06-08T02:44:17Z,nt1m
1581785909,mozilla/standards-positions,LGTM.  From an rtp/sdp spec perspective the sender is allowed to switch codecs among the agreed on l,https://github.com/mozilla/standards-positions/issues/789#issuecomment-1581785909,https://github.com/mozilla/standards-positions/issues/789,WebRTC Codec selection API,2023-06-08T02:12:05Z,jesup
1581729731,webkit/standards-positions,I'm not sure why adding even more API to Web Serial API would somehow lessen our existing concerns.,https://github.com/WebKit/standards-positions/issues/199#issuecomment-1581729731,https://github.com/WebKit/standards-positions/issues/199,Web Serial API,2023-06-08T00:59:20Z,rniwa
1581691790,w3c/editing,Removing Agenda+ as we're still working through some security issues in the delayed clipboard render,https://github.com/w3c/editing/issues/424#issuecomment-1581691790,https://github.com/w3c/editing/issues/424,[Delayed Clipboard Rendering] What happens to the clipboard data on Tab/Browser Close?,2023-06-08T00:21:06Z,snianu
1581627628,whatwg/html,"> dialog:not([popover])::backdrop,  Oh, clever, that's why you wrote it that way. I think there's ",https://github.com/whatwg/html/pull/9387#issuecomment-1581627628,https://github.com/whatwg/html/pull/9387,Fix ::backdrop user-agent rule for popovers,2023-06-07T23:10:06Z,mfreed7
1581547385,whatwg/html,"Maybe ""skipAttributeCheck"" could be expanded to a ""ignoreDomState"" parameter which would also satisf",https://github.com/whatwg/html/issues/9367#issuecomment-1581547385,https://github.com/whatwg/html/issues/9367,"When the popover attribute is removed, the hide popover algorithm will return too early",2023-06-07T21:40:49Z,josepharhar
1581546146,whatwg/dom,"> An alternative idea: when https://html.spec.whatwg.org/#hide-popover-algorithm is invoked, instead",https://github.com/whatwg/dom/pull/1185#issuecomment-1581546146,https://github.com/whatwg/dom/pull/1185,Add before removing steps,2023-06-07T21:39:25Z,josepharhar
1581540308,whatwg/html,"> Quickly looking at the implementation in Chrome, :modal does not match after close() going through",https://github.com/whatwg/html/pull/9387#issuecomment-1581540308,https://github.com/whatwg/html/pull/9387,Fix ::backdrop user-agent rule for popovers,2023-06-07T21:32:56Z,nt1m
1581534963,whatwg/html,"Quickly looking at the implementation in Chrome, :modal does not match after close() going through t",https://github.com/whatwg/html/pull/9387#issuecomment-1581534963,https://github.com/whatwg/html/pull/9387,Fix ::backdrop user-agent rule for popovers,2023-06-07T21:26:59Z,lilles
1581510488,whatwg/html,"> I think that works. Curious though, can't the `dialog` rules just be this: >  > ``` > dialog:mo",https://github.com/whatwg/html/pull/9387#issuecomment-1581510488,https://github.com/whatwg/html/pull/9387,Fix ::backdrop user-agent rule for popovers,2023-06-07T21:04:45Z,nt1m
1581502220,w3c/pointerevents,So we can close this?,https://github.com/w3c/pointerevents/issues/303#issuecomment-1581502220,https://github.com/w3c/pointerevents/issues/303,touch-action and scrolling directional lock,2023-06-07T20:59:40Z,smaug----
1581492284,w3c/pointerevents,"I have just completed my investigation, and concluded that I misrepresented those WPTs in my two rec",https://github.com/w3c/pointerevents/issues/303#issuecomment-1581492284,https://github.com/w3c/pointerevents/issues/303,touch-action and scrolling directional lock,2023-06-07T20:52:38Z,mustaqahmed
1581484756,whatwg/html,> @josepharhar Can you solve the issue by just re-writing the UA styles to be this? >  > ```css >,https://github.com/whatwg/html/pull/9387#issuecomment-1581484756,https://github.com/whatwg/html/pull/9387,Fix ::backdrop user-agent rule for popovers,2023-06-07T20:47:11Z,mfreed7
1581467288,whatwg/html,"> The implication of this change is that the other ""check popover validity"" checks (dialog, fullscre",https://github.com/whatwg/html/issues/8999#issuecomment-1581467288,https://github.com/whatwg/html/issues/8999,togglePopover() algorithm does not check popover validity when force == false and when the popover visibility state is hidden,2023-06-07T20:31:41Z,josepharhar
1581462858,mozilla/standards-positions,"API is something like: ```js const {codecs} = RTCRtpSender.getCapabilities(""video"");  const h264 ",https://github.com/mozilla/standards-positions/issues/789#issuecomment-1581462858,https://github.com/mozilla/standards-positions/issues/789,WebRTC Codec selection API,2023-06-07T20:27:47Z,jan-ivar
1581456493,whatwg/html,"> What about the concerns @zcorpan raised with regards to minified code?  I think it doesn't make ",https://github.com/whatwg/html/pull/9309#issuecomment-1581456493,https://github.com/whatwg/html/pull/9309,Ignore dangling markup in target name,2023-06-07T20:22:30Z,shhnjk
1581429322,webkit/standards-positions,"WebXR has been in WebKit for over two years, so I assume this issue is more about when/how it's goin",https://github.com/WebKit/standards-positions/issues/155#issuecomment-1581429322,https://github.com/WebKit/standards-positions/issues/155,WebXR Device API,2023-06-07T20:01:23Z,voxpelli
1581369380,whatwg/html,"cc @mfreed7 @lilles ",https://github.com/whatwg/html/pull/9387#issuecomment-1581369380,https://github.com/whatwg/html/pull/9387,Fix ::backdrop user-agent rule for popovers,2023-06-07T19:12:21Z,nt1m
1581064933,w3ctag/design-reviews,Thanks @rhiaro !,https://github.com/w3ctag/design-reviews/issues/821#issuecomment-1581064933,https://github.com/w3ctag/design-reviews/issues/821,Review of DPUB-ARIA 1.1 and DPUB-AAM 1.1,2023-06-07T15:29:53Z,mattgarrish
1581002654,whatwg/dom,"Before removing steps is how it's done in WebKit, but I'm open to different solution too.",https://github.com/whatwg/dom/pull/1185#issuecomment-1581002654,https://github.com/whatwg/dom/pull/1185,Add before removing steps,2023-06-07T14:58:38Z,nt1m
1580999079,whatwg/dom,"An alternative idea: when https://html.spec.whatwg.org/#hide-popover-algorithm is invoked, instead o",https://github.com/whatwg/dom/pull/1185#issuecomment-1580999079,https://github.com/whatwg/dom/pull/1185,Add before removing steps,2023-06-07T14:56:54Z,mbrodesser-Igalia
1580961624,whatwg/html,"I'm sure this has some major gaps because I'm new to doing substantive edits like this to HTML, but ",https://github.com/whatwg/html/pull/9400#issuecomment-1580961624,https://github.com/whatwg/html/pull/9400,Add name attribute for grouping details elements into an exclusive accordion,2023-06-07T14:37:43Z,dbaron
1580949049,w3c/pointerevents,"Here is a more precise observation about existing tests, we need to consolidate our discussion here ",https://github.com/w3c/pointerevents/issues/303#issuecomment-1580949049,https://github.com/w3c/pointerevents/issues/303,touch-action and scrolling directional lock,2023-06-07T14:30:49Z,mustaqahmed
1580938130,w3c/pointerevents,"I just realized that we have the following WPTs to enforce railing behavior already, with the assump",https://github.com/w3c/pointerevents/issues/303#issuecomment-1580938130,https://github.com/w3c/pointerevents/issues/303,touch-action and scrolling directional lock,2023-06-07T14:25:06Z,mustaqahmed
1580923757,w3c/pointerevents,> [pointerevents/pointerevent_touch-action*.html](https://wpt.fyi/results/pointerevents?label=master,https://github.com/w3c/pointerevents/pull/351#issuecomment-1580923757,https://github.com/w3c/pointerevents/pull/351,Add a SHOULD clause about pan gestures and what happens if a gesture â€¦,2023-06-07T14:20:27Z,mustaqahmed
1580841998,whatwg/html,we use form referer to prevent xss.  it'd be nice if we could enable it for the relevant forms and,https://github.com/whatwg/html/issues/4320#issuecomment-1580841998,https://github.com/whatwg/html/issues/4320,Add referrerpolicy to <form>,2023-06-07T13:37:12Z,SoniEx2
1580841761,whatwg/html,"Use case: As a developer, I would like to be able to use the `pattern` option in `textarea` element",https://github.com/whatwg/html/issues/9102#issuecomment-1580841761,https://github.com/whatwg/html/issues/9102,<textarea> should support the [pattern] attribute like the <input> element,2023-06-07T13:37:07Z,RobinWitt
1580825818,WICG/webcomponents,"Thanks for the summary, @bennypowers.  Just to add some nuance, the experiment I ran was:  - In ",https://github.com/WICG/webcomponents/issues/1014#issuecomment-1580825818,https://github.com/WICG/webcomponents/issues/1014,[a11y]: permit aria-hidden=true on focusable shadow elements in FACE,2023-06-07T13:28:11Z,alice
1580790996,WICG/webcomponents,@bennypowers Thanks for the clarification! I'm happy to get together. I don't think I can add much v,https://github.com/WICG/webcomponents/issues/1014#issuecomment-1580790996,https://github.com/WICG/webcomponents/issues/1014,[a11y]: permit aria-hidden=true on focusable shadow elements in FACE,2023-06-07T13:13:30Z,EisenbergEffect
1580783054,whatwg/html,I'm not saying it's not useful. The party proposing a change bears the burden of presenting convinci,https://github.com/whatwg/html/issues/9102#issuecomment-1580783054,https://github.com/whatwg/html/issues/9102,<textarea> should support the [pattern] attribute like the <input> element,2023-06-07T13:09:02Z,zcorpan
1580766311,WICG/webcomponents,"Thanks for asking @EisenbergEffect. I'm hesitant to offer anything in this thread as ""good advice"" f",https://github.com/WICG/webcomponents/issues/1014#issuecomment-1580766311,https://github.com/WICG/webcomponents/issues/1014,[a11y]: permit aria-hidden=true on focusable shadow elements in FACE,2023-06-07T12:58:44Z,bennypowers
1580757780,WICG/webcomponents,"@bennypowers Just to be clear, if I were to implement a custom input, the guidance would be to:  *",https://github.com/WICG/webcomponents/issues/1014#issuecomment-1580757780,https://github.com/WICG/webcomponents/issues/1014,[a11y]: permit aria-hidden=true on focusable shadow elements in FACE,2023-06-07T12:53:47Z,EisenbergEffect
1580691386,whatwg/html,@zcorpan Why is a pattern useful in an input element? Why shouldnt it be useful for the same reasons,https://github.com/whatwg/html/issues/9102#issuecomment-1580691386,https://github.com/whatwg/html/issues/9102,<textarea> should support the [pattern] attribute like the <input> element,2023-06-07T12:17:48Z,RobinWitt
1580687442,whatwg/html,"Thanks! I was misunderstanding that [LegacyOverrideBuiltIns] has priority over own properties. It's ",https://github.com/whatwg/html/issues/9394#issuecomment-1580687442,https://github.com/whatwg/html/issues/9394,Is it expected that Document has [LegacyOverrideBuiltIns]?,2023-06-07T12:14:43Z,yuki3
1580678312,whatwg/html,"@zcorpan this is extremely limiting, plus probably much harder to implement right. Input was always ",https://github.com/whatwg/html/issues/9102#issuecomment-1580678312,https://github.com/whatwg/html/issues/9102,<textarea> should support the [pattern] attribute like the <input> element,2023-06-07T12:09:44Z,soanvig
1580672076,whatwg/html,"Thanks. Can you link to any live sites that are working around the lack of this feature with JS?  ",https://github.com/whatwg/html/issues/9102#issuecomment-1580672076,https://github.com/whatwg/html/issues/9102,<textarea> should support the [pattern] attribute like the <input> element,2023-06-07T12:05:15Z,zcorpan
1580652748,w3ctag/design-reviews,"Sorry for the late response on this, since we decided not to try and push Profiles through in this c",https://github.com/w3ctag/design-reviews/issues/818#issuecomment-1580652748,https://github.com/w3ctag/design-reviews/issues/818,Web of Things (WoT) Profile - Review Requested,2023-06-07T11:55:53Z,mmccool
1580559643,whatwg/dom,"That sounds pretty good to me, thanks for investigating! @rwlbuis @nt1m?",https://github.com/whatwg/dom/pull/1185#issuecomment-1580559643,https://github.com/whatwg/dom/pull/1185,Add before removing steps,2023-06-07T11:12:46Z,annevk
1580516107,WICG/webcomponents,I'm grateful to @alice for her time over element chat while she participates in the Igalia WebEngine,https://github.com/WICG/webcomponents/issues/1014#issuecomment-1580516107,https://github.com/WICG/webcomponents/issues/1014,[a11y]: permit aria-hidden=true on focusable shadow elements in FACE,2023-06-07T10:53:14Z,bennypowers
1580493163,whatwg/html,"cc @zcorpan ",https://github.com/whatwg/html/issues/9398#issuecomment-1580493163,https://github.com/whatwg/html/issues/9398,"""Update the image data"" can dereference null ""pending request"" in multiple places",2023-06-07T10:45:07Z,annevk
1580468191,whatwg/html,This was introduced in https://github.com/whatwg/html/commit/f355f4a44cb833de93a52ce37eed8cc2d5f9c8c,https://github.com/whatwg/html/issues/9394#issuecomment-1580468191,https://github.com/whatwg/html/issues/9394,Is it expected that Document has [LegacyOverrideBuiltIns]?,2023-06-07T10:33:53Z,annevk
1580420560,whatwg/html,(I've ignored the PR template as this appeared to be a straightforward bug fix.),https://github.com/whatwg/html/pull/9391#issuecomment-1580420560,https://github.com/whatwg/html/pull/9391,Fix modal check in dialog closing algorithm,2023-06-07T10:19:12Z,annevk
1580330769,w3c/clipboard-apis,Make Shure to fine eliminate feature algorithm on /#pasting-html,https://github.com/w3c/clipboard-apis/issues/140#issuecomment-1580330769,https://github.com/w3c/clipboard-apis/issues/140,make pasting/sanitizing section normative?,2023-06-07T09:49:49Z,ShahriarNasseri
1580237551,whatwg/html,I can. You need to make your membership of https://github.com/Igalia public. I can add you to the tr,https://github.com/whatwg/html/pull/9397#issuecomment-1580237551,https://github.com/whatwg/html/pull/9397,"Add asserting element's popover invoker is null in the ""show popover"" algorithm",2023-06-07T08:57:00Z,annevk
1580120809,whatwg/html,"@annevk: can you please review this? Since this is my first PR, I am not entitled to add a reviewer ",https://github.com/whatwg/html/pull/9397#issuecomment-1580120809,https://github.com/whatwg/html/pull/9397,"Add asserting element's popover invoker is null in the ""show popover"" algorithm",2023-06-07T07:43:24Z,mbrodesser-Igalia
1580078376,whatwg/html,I'm defining the modal pseudo class here: https://github.com/whatwg/html/pull/9395,https://github.com/whatwg/html/pull/9387#issuecomment-1580078376,https://github.com/whatwg/html/pull/9387,Fix ::backdrop user-agent rule for popovers,2023-06-07T07:17:39Z,nt1m
1580054569,whatwg/html,"> @josepharhar @mbrodesser-Igalia Would either of you be interested in making the spec PR?  @nt1m ",https://github.com/whatwg/html/issues/9383#issuecomment-1580054569,https://github.com/whatwg/html/issues/9383,"Should ""show popover"" assert the element's popover invoker is null?",2023-06-07T07:03:09Z,mbrodesser-Igalia
1580040171,w3ctag/design-reviews,@torgo any ETA on this review? We're trying to assess when we might be ready to request CR,https://github.com/w3ctag/design-reviews/issues/837#issuecomment-1580040171,https://github.com/w3ctag/design-reviews/issues/837,"WebRTC-SVC (Scalable Video Coding) ",2023-06-07T06:56:38Z,dontcallmedom
1579885488,whatwg/html,"cc @whatwg/css ",https://github.com/whatwg/html/pull/9395#issuecomment-1579885488,https://github.com/whatwg/html/pull/9395,Define :modal pseudo-class and start using it,2023-06-07T04:53:49Z,nt1m
1579862955,whatwg/html,@josepharhar Can you solve the issue by just re-writing the UA styles to be this?  ```css /* comm,https://github.com/whatwg/html/pull/9387#issuecomment-1579862955,https://github.com/whatwg/html/pull/9387,Fix ::backdrop user-agent rule for popovers,2023-06-07T04:25:25Z,nt1m
1579767787,whatwg/html,"Looks good, may be worth fixing #8999 as well.",https://github.com/whatwg/html/pull/9393#issuecomment-1579767787,https://github.com/whatwg/html/pull/9393,Make togglePopover return a boolean,2023-06-07T02:21:33Z,nt1m
1579682793,whatwg/encoding,"Related: #27 #57. It's not clear whether web browsers want to update these, or leave legacy encoding",https://github.com/whatwg/encoding/issues/312#issuecomment-1579682793,https://github.com/whatwg/encoding/issues/312,Reflect changes in GB 18030-2022,2023-06-07T01:06:15Z,domenic
1579578415,whatwg/html,"Sure, I opened a PR: https://github.com/whatwg/html/pull/9393",https://github.com/whatwg/html/issues/9043#issuecomment-1579578415,https://github.com/whatwg/html/issues/9043,Should togglePopover() return a boolean?,2023-06-06T23:09:01Z,josepharhar
1579575030,w3ctag/design-reviews,ã“ã‚“ã«ã¡ã¯ TAG-ã•ã‚“!  Apologies for the extended delay here. We've got capacity to pick up this spec agai,https://github.com/w3ctag/design-reviews/issues/416#issuecomment-1579575030,https://github.com/w3ctag/design-reviews/issues/416,EditContext API,2023-06-06T23:04:23Z,dandclark
1579563106,w3ctag/design-reviews,@torgo @dandclark is now actively working on EditContext and has been updating the spec as well. Req,https://github.com/w3ctag/design-reviews/issues/416#issuecomment-1579563106,https://github.com/w3ctag/design-reviews/issues/416,EditContext API,2023-06-06T22:52:06Z,snianu
1579466313,whatwg/html,"> I just noticed a small bug here on the spec, the ""is modal"" check will never be true, since we set",https://github.com/whatwg/html/pull/9178#issuecomment-1579466313,https://github.com/whatwg/html/pull/9178,Only restore dialog focus if focus is in the dialog,2023-06-06T21:19:24Z,josepharhar
1579465278,whatwg/html,> Validity requirements don't affect user agents. Just conformance checkers.  Thanks for the info!,https://github.com/whatwg/html/pull/9309#issuecomment-1579465278,https://github.com/whatwg/html/pull/9309,Ignore dangling markup in target name,2023-06-06T21:18:20Z,shhnjk
1579431410,whatwg/html,CSS provides a way to do this:  ```css dialog {   overflow: auto;   overscroll-behavior: contai,https://github.com/whatwg/html/issues/7732#issuecomment-1579431410,https://github.com/whatwg/html/issues/7732,Consider preventing page scroll when modal dialog is visible,2023-06-06T20:52:47Z,simevidas
1579425737,whatwg/html,"As spec'd, startViewTransition will do the following:  1. Render one frame and snapshot it. If no ",https://github.com/whatwg/html/issues/9332#issuecomment-1579425737,https://github.com/whatwg/html/issues/9332,[View Transitions] Extend render-blocking to support Document,2023-06-06T20:47:34Z,khushalsagar
1579321674,w3ctag/design-reviews,"Thanks for your reply!    > El 5 jun 2023, a las 17:20, Amy Guy ***@***.***> escribiÃ³: >  >  > Since",https://github.com/w3ctag/design-reviews/issues/821#issuecomment-1579321674,https://github.com/w3ctag/design-reviews/issues/821,Review of DPUB-ARIA 1.1 and DPUB-AAM 1.1,2023-06-06T19:20:37Z,daniel-montalvo
1579186990,whatwg/dom,I suppose that if we added a parameter to the hide popover algorithm which tells it that the element,https://github.com/whatwg/dom/pull/1185#issuecomment-1579186990,https://github.com/whatwg/dom/pull/1185,Add before removing steps,2023-06-06T17:34:11Z,josepharhar
1579136299,whatwg/html,"> whether we can leverage presentation hints in some way instead of an ""implicit anchor element"", wh",https://github.com/whatwg/html/pull/9144#issuecomment-1579136299,https://github.com/whatwg/html/pull/9144,Add anchor attribute,2023-06-06T16:58:44Z,tabatkins
1579019376,whatwg/html,@josepharhar @mbrodesser-Igalia Would either of you be interested in making the spec PR?,https://github.com/whatwg/html/issues/9383#issuecomment-1579019376,https://github.com/whatwg/html/issues/9383,"Should ""show popover"" assert the element's popover invoker is null?",2023-06-06T15:47:34Z,nt1m
1579010359,webkit/standards-positions,It is good to hear that WebXR is available [behind a feature flag on xrOS](https://developer.apple.c,https://github.com/WebKit/standards-positions/issues/155#issuecomment-1579010359,https://github.com/WebKit/standards-positions/issues/155,WebXR Device API,2023-06-06T15:41:56Z,btutal
1578985103,whatwg/html,Filed a bug in Gecko. https://bugzilla.mozilla.org/show_bug.cgi?id=1836996,https://github.com/whatwg/html/pull/9369#issuecomment-1578985103,https://github.com/whatwg/html/pull/9369,Tighten auto popover list definition,2023-06-06T15:28:05Z,cathiechen
1578880009,whatwg/html,"> This doesn't look to be in the right place, is it?  I think it is.   From the issue's descript",https://github.com/whatwg/html/pull/9389#issuecomment-1578880009,https://github.com/whatwg/html/pull/9389,chore: add semicolon to textarea autocomplete attribute,2023-06-06T14:31:24Z,kaf-lamed-beyt
1578855961,whatwg/html,"This doesn't look to be in the right place, is it?",https://github.com/whatwg/html/pull/9389#issuecomment-1578855961,https://github.com/whatwg/html/pull/9389,chore: add semicolon to textarea autocomplete attribute,2023-06-06T14:18:18Z,keithamus
1578855657,whatwg/html,"@annevk I submitted a PR. Please take a look. ",https://github.com/whatwg/html/issues/9347#issuecomment-1578855657,https://github.com/whatwg/html/issues/9347,""" autocomplete cols;"" missing a semicolon",2023-06-06T14:18:08Z,kaf-lamed-beyt
1578535056,whatwg/html,1. OP needs to be filled out. You can count WebKit as supporting this. If implementations are failin,https://github.com/whatwg/html/pull/9093#issuecomment-1578535056,https://github.com/whatwg/html/pull/9093,Use CSS spec for top layer,2023-06-06T11:26:02Z,annevk
1578506794,whatwg/html,"The use case which triggered me to look into this is a `<form>` allowing users to provide long text ",https://github.com/whatwg/html/issues/9102#issuecomment-1578506794,https://github.com/whatwg/html/issues/9102,<textarea> should support the [pattern] attribute like the <input> element,2023-06-06T11:13:52Z,Gambloide
1578267694,whatwg/html,> Can you give concrete examples of where this would be useful?  Anywhere you want to allow the us,https://github.com/whatwg/html/issues/9102#issuecomment-1578267694,https://github.com/whatwg/html/issues/9102,<textarea> should support the [pattern] attribute like the <input> element,2023-06-06T09:16:28Z,lionel-rowe
1578173969,whatwg/html,"We decided to not throw in certain cases. Did we decide to not throw for cases where state does not ",https://github.com/whatwg/html/issues/8999#issuecomment-1578173969,https://github.com/whatwg/html/issues/8999,togglePopover() algorithm does not check popover validity when force == false and when the popover visibility state is hidden,2023-06-06T08:27:50Z,annevk
1578118625,whatwg/html,> > So one way forward could be to check for which callers that method's return value might differ f,https://github.com/whatwg/html/issues/9367#issuecomment-1578118625,https://github.com/whatwg/html/issues/9367,"When the popover attribute is removed, the hide popover algorithm will return too early",2023-06-06T07:53:19Z,mbrodesser-Igalia
1578099398,whatwg/html,"@mgol I think that's an excellent idea.  For others on the thread: in SVG, `el.className` is an [`",https://github.com/whatwg/html/issues/9379#issuecomment-1578099398,https://github.com/whatwg/html/issues/9379,Add `class` & `for` aliases for `className` and `htmlFor`,2023-06-06T07:40:30Z,jakearchibald
1578075939,whatwg/html,I know it's technically out of scope but it's good to consider SVG here. SVG has `className` with di,https://github.com/whatwg/html/issues/9379#issuecomment-1578075939,https://github.com/whatwg/html/issues/9379,Add `class` & `for` aliases for `className` and `htmlFor`,2023-06-06T07:28:36Z,mgol
1578020483,whatwg/html,@annevk Do you think it's still worth changing the spec given the recent changes to not throw?  Th,https://github.com/whatwg/html/issues/8999#issuecomment-1578020483,https://github.com/whatwg/html/issues/8999,togglePopover() algorithm does not check popover validity when force == false and when the popover visibility state is hidden,2023-06-06T06:49:29Z,nt1m
1578015173,whatwg/html,"Can you add ""Fixes #9319"" to the commit message?",https://github.com/whatwg/html/pull/9198#issuecomment-1578015173,https://github.com/whatwg/html/pull/9198,Improve popover event handling in nested showing and hiding,2023-06-06T06:44:33Z,nt1m
1578012147,whatwg/html,"Closed as I think the ""check and close popover stack"" behavior is gone from the spec and WPT.",https://github.com/whatwg/html/issues/8991#issuecomment-1578012147,https://github.com/whatwg/html/issues/8991,WPT tests for unspecified PopoverInvokerElement removing steps,2023-06-06T06:42:40Z,nt1m
1578006605,whatwg/html,Closing this issue as I don't think there's anything else to do here? #9142 wrote this in a way that,https://github.com/whatwg/html/issues/9045#issuecomment-1578006605,https://github.com/whatwg/html/issues/9045,Should popover/dialog show/hide when already shown/hidden throw?,2023-06-06T06:39:47Z,nt1m
1578001605,whatwg/html,@mfreed7 @josepharhar Would one of you be willing to drive this change?,https://github.com/whatwg/html/issues/9043#issuecomment-1578001605,https://github.com/whatwg/html/issues/9043,Should togglePopover() return a boolean?,2023-06-06T06:34:15Z,nt1m
1577996123,whatwg/html,"Closing as I think this was fixed by #9171.  @cathiechen Please feel free to reopen if that's not ",https://github.com/whatwg/html/issues/9164#issuecomment-1577996123,https://github.com/whatwg/html/issues/9164,Need to pass all the descendant of root to handle button invoker's top most popover ancestor,2023-06-06T06:31:22Z,nt1m
1577988431,whatwg/html,I think this can be closed given `element.matches(':popover-open')` can be used? Please feel free to,https://github.com/whatwg/html/issues/9054#issuecomment-1577988431,https://github.com/whatwg/html/issues/9054,Add element.popoverOpen,2023-06-06T06:25:59Z,nt1m
