id,repo,body,url,issue_url,issue_title,created_at,user
1407492021,whatwg/html,> > * Option to prompt the user for a download location >  > Why? Not following the browser behavi,https://github.com/whatwg/html/issues/4148#issuecomment-1407492021,https://github.com/whatwg/html/issues/4148,Download API,2023-01-28T21:28:33Z,Zipdox2
1407485308,whatwg/html,> How would you add monitoring of progress to the API if the download function call returns a promis,https://github.com/whatwg/html/issues/4148#issuecomment-1407485308,https://github.com/whatwg/html/issues/4148,Download API,2023-01-28T20:50:17Z,saschanaz
1407472240,whatwg/html,> Anything else can be added later.  This is the biggest trap in programming. Most of the time you,https://github.com/whatwg/html/issues/4148#issuecomment-1407472240,https://github.com/whatwg/html/issues/4148,Download API,2023-01-28T19:44:43Z,Zipdox2
1407439729,whatwg/html,"Well, because there should be a very good reason to convince implementers to add something to the we",https://github.com/whatwg/html/issues/4148#issuecomment-1407439729,https://github.com/whatwg/html/issues/4148,Download API,2023-01-28T16:56:37Z,saschanaz
1407421391,whatwg/html,"> I mean, why do you need a signal for them, you can pass them to the function and forget about them",https://github.com/whatwg/html/issues/4148#issuecomment-1407421391,https://github.com/whatwg/html/issues/4148,Download API,2023-01-28T15:21:58Z,Zipdox2
1407411465,whatwg/html,"> > Can you give at example? >  > ArrayBuffer, TypedArray, Blob  I mean, why do you need a signa",https://github.com/whatwg/html/issues/4148#issuecomment-1407411465,https://github.com/whatwg/html/issues/4148,Download API,2023-01-28T14:34:25Z,saschanaz
1407409362,whatwg/html,"> Can you give at example?  ArrayBuffer, TypedArray, Blob  > I think both should cancel the stre",https://github.com/whatwg/html/issues/4148#issuecomment-1407409362,https://github.com/whatwg/html/issues/4148,Download API,2023-01-28T14:21:50Z,Zipdox2
1407402447,whatwg/html,"To clarify, AFAIK stream readers can't cause an error. And in this case the download is reading the ",https://github.com/whatwg/html/issues/4148#issuecomment-1407402447,https://github.com/whatwg/html/issues/4148,Download API,2023-01-28T13:45:21Z,saschanaz
1407400738,whatwg/html,> If downloading a fixed size object it's a different story.  Can you give at example?  > The de,https://github.com/whatwg/html/issues/4148#issuecomment-1407400738,https://github.com/whatwg/html/issues/4148,Download API,2023-01-28T13:36:44Z,saschanaz
1407391795,whatwg/html,> Still you have ReadableStream's cancel callback to track the download cancel.  Oh yeah that's tr,https://github.com/whatwg/html/issues/4148#issuecomment-1407391795,https://github.com/whatwg/html/issues/4148,Download API,2023-01-28T12:47:13Z,Zipdox2
1407305546,whatwg/html,">getting callbacks on errors and completion, to be able to free resources after they have been downl",https://github.com/whatwg/html/issues/4148#issuecomment-1407305546,https://github.com/whatwg/html/issues/4148,Download API,2023-01-28T06:13:11Z,saschanaz
1407303200,whatwg/html,"> Being able to abort/finish a download isn't a feature you should omit, especially not when downloa",https://github.com/whatwg/html/issues/4148#issuecomment-1407303200,https://github.com/whatwg/html/issues/4148,Download API,2023-01-28T06:00:45Z,saschanaz
1407265106,whatwg/html,> What's needed here is to be able to download a file and stream without hacking with object URL and,https://github.com/whatwg/html/issues/4148#issuecomment-1407265106,https://github.com/whatwg/html/issues/4148,Download API,2023-01-28T02:44:47Z,Zipdox2
1407198123,whatwg/html,"sorry for the build bug here.  i'm not exactly sure what it's asking me to fix (as per my series of ",https://github.com/whatwg/html/pull/8791#issuecomment-1407198123,https://github.com/whatwg/html/pull/8791,additional accessibility guidance for popover,2023-01-27T23:50:35Z,scottaohara
1407049226,whatwg/html,"Hi folks, after discussing internally, the chromium and V8 position is:  - We prefer the proposed ",https://github.com/whatwg/html/issues/7233#issuecomment-1407049226,https://github.com/whatwg/html/issues/7233,CSS and JSON module scripts and CSP,2023-01-27T20:37:15Z,syg
1407045835,whatwg/html,I recommend listening for `pointerup` and/or `pointerdown` events instead of `click` events for disa,https://github.com/whatwg/html/issues/5886#issuecomment-1407045835,https://github.com/whatwg/html/issues/5886,Event bubbling on disabled form elements,2023-01-27T20:33:03Z,josepharhar
1407031793,mozilla/standards-positions,"I'll try to get a resolution on the weak/strong issue, since the consensus so far is pretty clearly ",https://github.com/mozilla/standards-positions/issues/472#issuecomment-1407031793,https://github.com/mozilla/standards-positions/issues/472,CSS @scope,2023-01-27T20:17:32Z,mirisuzanne
1406903175,whatwg/html,🎉 Thanks to everyone involved in getting this landed! A PR so large that it broke Github several ti,https://github.com/whatwg/html/pull/8717#issuecomment-1406903175,https://github.com/whatwg/html/pull/8717,"Reland ""Add popover attribute""",2023-01-27T18:10:45Z,mfreed7
1406858930,whatwg/html,I think what needed here is an implementer interest rather than a proposal (although it's also neede,https://github.com/whatwg/html/issues/4148#issuecomment-1406858930,https://github.com/whatwg/html/issues/4148,Download API,2023-01-27T17:45:00Z,saschanaz
1406827899,WICG/webcomponents,"Would be up for attending as well, but might have to be remote depending on location of the F2F.",https://github.com/WICG/webcomponents/issues/978#issuecomment-1406827899,https://github.com/WICG/webcomponents/issues/978,"Spring 2023 ""F2F""",2023-01-27T17:29:36Z,thescientist13
1406824770,w3ctag/design-reviews,For avoidance of doubt – the TAG has not closed this review. We fully expect to continue the discuss,https://github.com/w3ctag/design-reviews/issues/726#issuecomment-1406824770,https://github.com/w3ctag/design-reviews/issues/726,Early design review for the Topics API,2023-01-27T17:28:00Z,torgo
1406800748,whatwg/html,Can I get some feedback on what I proposed?,https://github.com/whatwg/html/issues/4148#issuecomment-1406800748,https://github.com/whatwg/html/issues/4148,Download API,2023-01-27T17:11:14Z,Zipdox2
1406798447,whatwg/html,I addressed the pointerevents comment and updated this PR,https://github.com/whatwg/html/pull/8717#issuecomment-1406798447,https://github.com/whatwg/html/pull/8717,"Reland ""Add popover attribute""",2023-01-27T17:09:00Z,josepharhar
1406758117,WICG/webcomponents,@Javarome don't worry. It's not possible to change the default. This issue is closed.,https://github.com/WICG/webcomponents/issues/723#issuecomment-1406758117,https://github.com/WICG/webcomponents/issues/723,Make custom elements w/ shadowRoot { display: contents } by default,2023-01-27T16:42:31Z,justinfagnani
1406753295,webkit/standards-positions,"To follow-up here, @rniwa found a further concern: https://github.com/whatwg/html/pull/8467#issuecom",https://github.com/WebKit/standards-positions/issues/56#issuecomment-1406753295,https://github.com/WebKit/standards-positions/issues/56,CustomStateSet for custom elements,2023-01-27T16:40:02Z,annevk
1406552690,WICG/webcomponents,Late to the party but I'm concerned by the fact that having `display: contents` by default would rem,https://github.com/WICG/webcomponents/issues/723#issuecomment-1406552690,https://github.com/WICG/webcomponents/issues/723,Make custom elements w/ shadowRoot { display: contents } by default,2023-01-27T14:05:54Z,Javarome
1406543960,whatwg/html,@domenic I will try hard on this issue. Please figure out the issue that I did.,https://github.com/whatwg/html/pull/8781#issuecomment-1406543960,https://github.com/whatwg/html/pull/8781,#8364isssue-solved,2023-01-27T13:58:59Z,YASHWANTHKESAGONI
1406482876,whatwg/html,A negative side-effect of `pointer-events: none` is that it renders text selection (clicking and dra,https://github.com/whatwg/html/issues/5886#issuecomment-1406482876,https://github.com/whatwg/html/issues/5886,Event bubbling on disabled form elements,2023-01-27T13:03:28Z,peterthomassen
1406477941,whatwg/html,"> It looks like adding pointer-events:none actually causes click events to be fired. This seems odd ",https://github.com/whatwg/html/issues/5886#issuecomment-1406477941,https://github.com/whatwg/html/issues/5886,Event bubbling on disabled form elements,2023-01-27T12:59:00Z,peterthomassen
1406450101,whatwg/html,"Sorry for the loooong delay, I had to switch to another topic. I made a public doc explaining the di",https://github.com/whatwg/html/issues/8481#issuecomment-1406450101,https://github.com/whatwg/html/issues/8481,"COOP inheritance for popups from cross-origin iframes. ",2023-01-27T12:38:14Z,hemeryar
1406375858,webkit/standards-positions,"Given that WebKit is participating in Interop 2023 let's resolve this as ""position: support"" in 7 da",https://github.com/WebKit/standards-positions/issues/78#issuecomment-1406375858,https://github.com/WebKit/standards-positions/issues/78,Improving event dispatching on disabled form controls,2023-01-27T11:34:15Z,annevk
1406289022,whatwg/html,I rebased this to resolve some merge conflicts with recent focus changes. I also refactored the coal,https://github.com/whatwg/html/pull/8717#issuecomment-1406289022,https://github.com/whatwg/html/pull/8717,"Reland ""Add popover attribute""",2023-01-27T10:10:40Z,annevk
1406199789,whatwg/html,"I'm sorry to say I wasn't able to get to this during this week, and I'm about to head out on a two-w",https://github.com/whatwg/html/pull/8470#issuecomment-1406199789,https://github.com/whatwg/html/pull/8470,Add the Priority Hints changes to the html spec,2023-01-27T08:58:57Z,domenic
1406189087,whatwg/html,"Only quibble I have is that both ""realm"" and ""global"" in the name seems odd, but overall it having a",https://github.com/whatwg/html/issues/7591#issuecomment-1406189087,https://github.com/whatwg/html/issues/7591,Consider not exposing ErrorEvent/PromiseRejectionEvent in ShadowRealms,2023-01-27T08:47:01Z,annevk
1406027134,webkit/standards-positions,Opened https://bugs.webkit.org/show_bug.cgi?id=251246,https://github.com/WebKit/standards-positions/issues/78#issuecomment-1406027134,https://github.com/WebKit/standards-positions/issues/78,Improving event dispatching on disabled form controls,2023-01-27T05:06:25Z,karlcow
1406008785,webkit/standards-positions,So this is part of interop-2023 effort https://wpt.fyi/results/html/semantics/disabled-elements/dis,https://github.com/WebKit/standards-positions/issues/78#issuecomment-1406008785,https://github.com/WebKit/standards-positions/issues/78,Improving event dispatching on disabled form controls,2023-01-27T04:34:03Z,karlcow
1405975455,mozilla/standards-positions,"> We're positive for the new approach. Thanks for raising. I'll submit a PR to update the dashboard ",https://github.com/mozilla/standards-positions/issues/335#issuecomment-1405975455,https://github.com/mozilla/standards-positions/issues/335,Declarative Shadow DOM,2023-01-27T03:34:42Z,mfreed7
1405875597,whatwg/html,Did you read the changes made in that PR? They are about when to update the content of the placehold,https://github.com/whatwg/html/pull/3872#issuecomment-1405875597,https://github.com/whatwg/html/pull/3872,Cleanup language around commit() being the only way to update OffscreenCanvas,2023-01-27T00:57:53Z,Kaiido
1405856868,whatwg/html,It is not the place to handle it. You can not go forcing an API call across contexts. CanvasRenderin,https://github.com/whatwg/html/pull/3872#issuecomment-1405856868,https://github.com/whatwg/html/pull/3872,Cleanup language around commit() being the only way to update OffscreenCanvas,2023-01-27T00:30:21Z,greggman
1405808446,whatwg/html,"I'll have to disagree, here seems like the exact place we need to handle that.   This PR changes wh",https://github.com/whatwg/html/pull/3872#issuecomment-1405808446,https://github.com/whatwg/html/pull/3872,Cleanup language around commit() being the only way to update OffscreenCanvas,2023-01-26T23:26:40Z,Kaiido
1405766149,whatwg/html,Thanks everyone for attending! Here are the notes from this meeting (the next one is at https://gith,https://github.com/whatwg/html/issues/8723#issuecomment-1405766149,https://github.com/whatwg/html/issues/8723,Upcoming HTML standard issue triage meeting on 1/26/2023,2023-01-26T22:38:31Z,past
1405752355,whatwg/html,> Does this not happen in other browsers?  Chrome on Android is now working on similar features an,https://github.com/whatwg/html/issues/8782#issuecomment-1405752355,https://github.com/whatwg/html/issues/8782,Tell developer when page transitions should be avoided - popStateEvent.skipTransition,2023-01-26T22:24:32Z,lazzzis
1405690542,whatwg/html,I haven't seen it on browsers outside iOS and Safari on MacOS.,https://github.com/whatwg/html/issues/8782#issuecomment-1405690542,https://github.com/whatwg/html/issues/8782,Tell developer when page transitions should be avoided - popStateEvent.skipTransition,2023-01-26T21:37:46Z,jakearchibald
1405666704,WICG/webcomponents,"Happy to attend, interested in Declarative Shadow DOM and all a11y issues as well. Beyond cross-root",https://github.com/WICG/webcomponents/issues/978#issuecomment-1405666704,https://github.com/WICG/webcomponents/issues/978,"Spring 2023 ""F2F""",2023-01-26T21:19:59Z,nolanlawson
1405637516,mozilla/standards-positions,"@tantek good point, fixed.",https://github.com/mozilla/standards-positions/pull/740#issuecomment-1405637516,https://github.com/mozilla/standards-positions/pull/740,Declarative Shadow DOM (positive),2023-01-26T20:54:35Z,zcorpan
1405627231,whatwg/html,That seems reasonable behavior to me. pointer-events:none basically removes the element from hit-tes,https://github.com/whatwg/html/issues/5886#issuecomment-1405627231,https://github.com/whatwg/html/issues/5886,Event bubbling on disabled form elements,2023-01-26T20:44:32Z,smaug----
1405596021,whatwg/html,Does this not happen in other browsers?,https://github.com/whatwg/html/issues/8782#issuecomment-1405596021,https://github.com/whatwg/html/issues/8782,Tell developer when page transitions should be avoided - popStateEvent.skipTransition,2023-01-26T20:15:10Z,Yay295
1405484569,whatwg/html,"My intent to ship was objected and I will have to wait for UseCounter data and hope that it is very ",https://github.com/whatwg/html/issues/2988#issuecomment-1405484569,https://github.com/whatwg/html/issues/2988,What's the status of <option label> in cross-browser age?,2023-01-26T19:16:39Z,josepharhar
1405451144,whatwg/html,"Based on my experimenting here with the new browser behavior: https://jsfiddle.net/jarhar/u9pdk5xf/",https://github.com/whatwg/html/issues/5886#issuecomment-1405451144,https://github.com/whatwg/html/issues/5886,Event bubbling on disabled form elements,2023-01-26T18:50:34Z,josepharhar
1405446550,whatwg/html,"The aim is to avoid a flash of previous page state, in case the previous state isn't available synch",https://github.com/whatwg/html/issues/8782#issuecomment-1405446550,https://github.com/whatwg/html/issues/8782,Tell developer when page transitions should be avoided - popStateEvent.skipTransition,2023-01-26T18:47:05Z,jakearchibald
1405432143,whatwg/html,"The new boolean attribute SGTM. I'd prefer a name which indicates that the browser has already done ",https://github.com/whatwg/html/issues/8782#issuecomment-1405432143,https://github.com/whatwg/html/issues/8782,Tell developer when page transitions should be avoided - popStateEvent.skipTransition,2023-01-26T18:34:25Z,khushalsagar
1405323501,whatwg/html,This is the wrong place to address this. Each type of context has it's own needs. If `CanvasRenderin,https://github.com/whatwg/html/pull/3872#issuecomment-1405323501,https://github.com/whatwg/html/pull/3872,Cleanup language around commit() being the only way to update OffscreenCanvas,2023-01-26T17:07:22Z,greggman
1405221704,whatwg/html,"With these changes, will [using `pointer-events: none;`](https://stackoverflow.com/a/66029445/686709",https://github.com/whatwg/html/issues/5886#issuecomment-1405221704,https://github.com/whatwg/html/issues/5886,Event bubbling on disabled form elements,2023-01-26T15:55:41Z,peterthomassen
1405128398,whatwg/html,"I think for parsing a whole document we need a streaming API as we have oft-discussed, but thus far ",https://github.com/whatwg/html/issues/8759#issuecomment-1405128398,https://github.com/whatwg/html/issues/8759,Add DOMParser option to parse declarative shadow DOM,2023-01-26T14:52:44Z,annevk
1405124920,whatwg/html,"I'm fine with ""web platform usual pattern"", and I think the rest of the champions will also agree wi",https://github.com/whatwg/html/issues/7591#issuecomment-1405124920,https://github.com/whatwg/html/issues/7591,Consider not exposing ErrorEvent/PromiseRejectionEvent in ShadowRealms,2023-01-26T14:50:04Z,caridy
1405102424,whatwg/html,I believe the only requirement 262 has on the ShadowRealm global is that it behaves like an ordinary,https://github.com/whatwg/html/issues/7591#issuecomment-1405102424,https://github.com/whatwg/html/issues/7591,Consider not exposing ErrorEvent/PromiseRejectionEvent in ShadowRealms,2023-01-26T14:38:10Z,mhofman
1405046822,mozilla/standards-positions,"Thanks for filing.  I think we could have separate fields for explainer and spec URL, where the la",https://github.com/mozilla/standards-positions/issues/739#issuecomment-1405046822,https://github.com/mozilla/standards-positions/issues/739,Meta: add issue template fields/templates to explain the maturity of the spec,2023-01-26T14:00:47Z,zcorpan
1404996929,mozilla/standards-positions,We're positive for the new approach. Thanks for raising. I'll submit a PR to update the dashboard en,https://github.com/mozilla/standards-positions/issues/335#issuecomment-1404996929,https://github.com/mozilla/standards-positions/issues/335,Declarative Shadow DOM,2023-01-26T13:18:37Z,zcorpan
1404987599,whatwg/html,I think I did it now.,https://github.com/whatwg/html/pull/8781#issuecomment-1404987599,https://github.com/whatwg/html/pull/8781,#8364isssue-solved,2023-01-26T13:11:17Z,YASHWANTHKESAGONI
1404984366,whatwg/html,"That's ok. This project might be a bit too advanced, in that case.",https://github.com/whatwg/html/pull/8781#issuecomment-1404984366,https://github.com/whatwg/html/pull/8781,#8364isssue-solved,2023-01-26T13:09:01Z,domenic
1404971952,whatwg/html,@domenic I am new to the open-source. I didn't get you.,https://github.com/whatwg/html/pull/8781#issuecomment-1404971952,https://github.com/whatwg/html/pull/8781,#8364isssue-solved,2023-01-26T13:00:51Z,YASHWANTHKESAGONI
1404804649,whatwg/html,"Please can you review my changes? ",https://github.com/whatwg/html/pull/8781#issuecomment-1404804649,https://github.com/whatwg/html/pull/8781,#8364isssue-solved,2023-01-26T10:23:20Z,YASHWANTHKESAGONI
1404787476,WICG/webcomponents,"I could try to attend, I think I'd prefer remote meeting. One possible topic would be selection + s",https://github.com/WICG/webcomponents/issues/978#issuecomment-1404787476,https://github.com/WICG/webcomponents/issues/978,"Spring 2023 ""F2F""",2023-01-26T10:08:27Z,smaug----
1404775011,whatwg/html,"yeah, I think it should be ""web platform usual pattern"".  In general the global inheriting from Eve",https://github.com/whatwg/html/issues/7591#issuecomment-1404775011,https://github.com/whatwg/html/issues/7591,Consider not exposing ErrorEvent/PromiseRejectionEvent in ShadowRealms,2023-01-26T09:57:41Z,smaug----
1404767827,whatwg/html,> You exit the event and an implicit commit happens  I don't think this is true. Currently you nee,https://github.com/whatwg/html/pull/3872#issuecomment-1404767827,https://github.com/whatwg/html/pull/3872,Cleanup language around commit() being the only way to update OffscreenCanvas,2023-01-26T09:51:21Z,Kaiido
1404764980,whatwg/html,"@callumgare thanks for filing a bug, I'm currently having a look at fixing Firefox. Just a note that",https://github.com/whatwg/html/issues/8757#issuecomment-1404764980,https://github.com/whatwg/html/issues/8757,MediaError not acccessible for a video element if using it with source elements,2023-01-26T09:48:49Z,padenot
1404760658,whatwg/html,Probably an (implementer-facing) spec example would be nice here.,https://github.com/whatwg/html/issues/8776#issuecomment-1404760658,https://github.com/whatwg/html/issues/8776,<meta> http-equiv vs name: which one wins?,2023-01-26T09:45:04Z,domenic
1404756277,whatwg/html,"I think this can be closed now, since the rewrite properly integrates with Fetch in the new ""equival",https://github.com/whatwg/html/issues/8108#issuecomment-1404756277,https://github.com/whatwg/html/issues/8108,'process a navigate fetch' doesn't load anything ever?,2023-01-26T09:41:16Z,domfarolino
1404755193,mozilla/standards-positions,"I think the change is good and should make dialog behave closer to what users expect, based on comme",https://github.com/mozilla/standards-positions/issues/734#issuecomment-1404755193,https://github.com/mozilla/standards-positions/issues/734,Request for position: new dialog initial focus algorithm,2023-01-26T09:40:19Z,zcorpan
1404743140,whatwg/html,> > There seems to be an assumption that if `commit` existed it would magically sync. >  > Yes tha,https://github.com/whatwg/html/pull/3872#issuecomment-1404743140,https://github.com/whatwg/html/pull/3872,Cleanup language around commit() being the only way to update OffscreenCanvas,2023-01-26T09:29:27Z,greggman
1404737579,whatwg/html,@domenic how can i contribute to this? Can you assign it to me as I'm new to the open-source.,https://github.com/whatwg/html/issues/8364#issuecomment-1404737579,https://github.com/whatwg/html/issues/8364,Editorial: align with JavaScript spec conventions on records,2023-01-26T09:23:57Z,YASHWANTHKESAGONI
1404710033,whatwg/html,My tentative conclusion is that everyone loses and we'll always go down all the code paths. At least,https://github.com/whatwg/html/issues/8776#issuecomment-1404710033,https://github.com/whatwg/html/issues/8776,<meta> http-equiv vs name: which one wins?,2023-01-26T08:57:10Z,annevk
1404581118,WICG/webcomponents,Will be glad to be in-person. Subjects of interest are * Declarative Custom Element * Fully function,https://github.com/WICG/webcomponents/issues/978#issuecomment-1404581118,https://github.com/WICG/webcomponents/issues/978,"Spring 2023 ""F2F""",2023-01-26T05:32:50Z,sashafirsov
1404576262,whatwg/html,"I like option 2.a personally. I don't like option 2.b at all, because it causes weird bifurcations i",https://github.com/whatwg/html/issues/7591#issuecomment-1404576262,https://github.com/whatwg/html/issues/7591,Consider not exposing ErrorEvent/PromiseRejectionEvent in ShadowRealms,2023-01-26T05:20:48Z,domenic
1404571670,whatwg/html,"> I could remind of some existing open issues, at least [whatwg/webidl#1119](https://github.com/what",https://github.com/whatwg/html/pull/5339#issuecomment-1404571670,https://github.com/whatwg/html/pull/5339,JavaScript ShadowRealm proposal integration,2023-01-26T05:11:03Z,caridy
1404569075,whatwg/html,@smaug---- @annevk what do you guys think about the notes from last month? https://github.com/whatwg,https://github.com/whatwg/html/issues/7591#issuecomment-1404569075,https://github.com/whatwg/html/issues/7591,Consider not exposing ErrorEvent/PromiseRejectionEvent in ShadowRealms,2023-01-26T05:06:14Z,caridy
1404546708,whatwg/webidl,I guess you're right that technically the spec only talks about the order defined by the type. I thi,https://github.com/whatwg/webidl/issues/1257#issuecomment-1404546708,https://github.com/whatwg/webidl/issues/1257,Make the dictionary <-> ordered map correspondence clearer about order,2023-01-26T04:13:20Z,domenic
1404525487,whatwg/webidl,I read “dictionary” and “dictionary members” there as referring to the definitional Web IDL construc,https://github.com/whatwg/webidl/issues/1257#issuecomment-1404525487,https://github.com/whatwg/webidl/issues/1257,Make the dictionary <-> ordered map correspondence clearer about order,2023-01-26T03:30:26Z,bathos
1404522679,whatwg/html,"> There seems to be an assumption that if `commit` existed it would magically sync.  Yes that was ",https://github.com/whatwg/html/pull/3872#issuecomment-1404522679,https://github.com/whatwg/html/pull/3872,Cleanup language around commit() being the only way to update OffscreenCanvas,2023-01-26T03:24:27Z,Kaiido
1404513010,whatwg/html,"Example 1: How does that compare to video? To me, canvas from a worker is similar to video. You don'",https://github.com/whatwg/html/pull/3872#issuecomment-1404513010,https://github.com/whatwg/html/pull/3872,Cleanup language around commit() being the only way to update OffscreenCanvas,2023-01-26T03:07:00Z,greggman
1404475603,WICG/webcomponents,"For topics, we might find the [Web Components Community Groups report from 2022](https://w3c.github.",https://github.com/WICG/webcomponents/issues/978#issuecomment-1404475603,https://github.com/WICG/webcomponents/issues/978,"Spring 2023 ""F2F""",2023-01-26T02:03:22Z,Westbrook
1404463537,whatwg/html,I'd like to note that there are some edge cases that are being made weird when relying only on `requ,https://github.com/whatwg/html/pull/3872#issuecomment-1404463537,https://github.com/whatwg/html/pull/3872,Cleanup language around commit() being the only way to update OffscreenCanvas,2023-01-26T01:50:05Z,Kaiido
1404384406,whatwg/html,"If you'd like to take over the PR and address the comments and merge conflicts, I think that would b",https://github.com/whatwg/html/pull/3872#issuecomment-1404384406,https://github.com/whatwg/html/pull/3872,Cleanup language around commit() being the only way to update OffscreenCanvas,2023-01-26T00:09:49Z,domenic
