id,repo,body,url,issue_url,issue_title,created_at,user
1490335898,whatwg/html,@past I'd like to nominate this issue for the next triage meeting https://github.com/whatwg/html/iss,https://github.com/whatwg/html/issues/9081#issuecomment-1490335898,https://github.com/whatwg/html/issues/9081,Clarify the sequential focusing behaviour when the current focused element is not in the sequential navigation order,2023-03-30T13:46:48Z,hsinyi
1490174840,whatwg/dom,"Right, I agree that we should change all of them together.",https://github.com/whatwg/dom/pull/1176#issuecomment-1490174840,https://github.com/whatwg/dom/pull/1176,Handle attribute changes after changing attribute,2023-03-30T11:55:24Z,annevk
1490173078,whatwg/dom,"In Gecko one can handle attribute changes before the value has been added/changed/removed or after, ",https://github.com/whatwg/dom/pull/1176#issuecomment-1490173078,https://github.com/whatwg/dom/pull/1176,Handle attribute changes after changing attribute,2023-03-30T11:53:54Z,smaug----
1490100357,w3ctag/design-reviews,@torgo : Absolutely. This is one of the [goals of Origin Trial ](https://groups.google.com/a/chromiu,https://github.com/w3ctag/design-reviews/issues/826#issuecomment-1490100357,https://github.com/w3ctag/design-reviews/issues/826,Background Blur API,2023-03-30T10:58:14Z,riju
1490018156,webkit/standards-positions,"Re `concerns: device independence`, we could see mobile operating systems such as iOS, iPadOS, and A",https://github.com/WebKit/standards-positions/issues/41#issuecomment-1490018156,https://github.com/WebKit/standards-positions/issues/41,Document Picture in Picture API,2023-03-30T09:52:26Z,beaufortfrancois
1490008373,webkit/standards-positions,FYI We have published web developer documentation at https://developer.chrome.com/docs/web-platform/,https://github.com/WebKit/standards-positions/issues/41#issuecomment-1490008373,https://github.com/WebKit/standards-positions/issues/41,Document Picture in Picture API,2023-03-30T09:45:10Z,beaufortfrancois
1490004516,whatwg/html,"If the concern is around safety aspects of `setHTML`, can the feature set be determined by CSP heade",https://github.com/whatwg/html/issues/8759#issuecomment-1490004516,https://github.com/whatwg/html/issues/8759,Add DOMParser option to parse declarative shadow DOM,2023-03-30T09:42:04Z,keithamus
1489901955,whatwg/dom,I think you are correct. I'd suggest adding a paragraph below https://dom.spec.whatwg.org/#concept-d,https://github.com/whatwg/dom/issues/1178#issuecomment-1489901955,https://github.com/whatwg/dom/issues/1178,Documents never have their node document set?,2023-03-30T08:27:53Z,annevk
1489485895,whatwg/html,"@mgiuca, let us know what you'd like to do here. As I said above, I support these changes. Once this",https://github.com/whatwg/html/pull/8754#issuecomment-1489485895,https://github.com/whatwg/html/pull/8754,Link processing: Update call to Manifest processing algorithm (interface changed),2023-03-29T23:52:20Z,marcoscaceres
1489483186,whatwg/html,"I'm worried about an API shape where   * `setHTML(string)` is safe, * `setHTML(string, {sanitizer",https://github.com/whatwg/html/issues/8759#issuecomment-1489483186,https://github.com/whatwg/html/issues/8759,Add DOMParser option to parse declarative shadow DOM,2023-03-29T23:48:13Z,jyasskin
1489475111,w3ctag/design-reviews,This feature is now handled by https://github.com/w3ctag/design-reviews/issues/829,https://github.com/w3ctag/design-reviews/issues/825#issuecomment-1489475111,https://github.com/w3ctag/design-reviews/issues/825,Transitions on specified discrete properties,2023-03-29T23:38:27Z,josepharhar
1489475102,w3ctag/design-reviews,This feature is now handled by https://github.com/w3ctag/design-reviews/issues/829,https://github.com/w3ctag/design-reviews/issues/824#issuecomment-1489475102,https://github.com/w3ctag/design-reviews/issues/824,Display and content-visibility animations,2023-03-29T23:38:26Z,josepharhar
1489424619,webkit/standards-positions,It seems like this is still one of the most wanted features for safari (from a developer perspective,https://github.com/WebKit/standards-positions/issues/97#issuecomment-1489424619,https://github.com/WebKit/standards-positions/issues/97,Customized built-in elements,2023-03-29T22:34:45Z,jens-t
1489325455,whatwg/html,@domenic ptal,https://github.com/whatwg/html/pull/9091#issuecomment-1489325455,https://github.com/whatwg/html/pull/9091,Fix a typo in User Activation processing model.,2023-03-29T21:09:08Z,mustaqahmed
1489309390,whatwg/html,Looks like this typo slipped in through a massive rewrite: https://github.com/whatwg/html/commit/0a9,https://github.com/whatwg/html/issues/9089#issuecomment-1489309390,https://github.com/whatwg/html/issues/9089,Confusing/missing words in user activation processing model,2023-03-29T20:57:53Z,mustaqahmed
1489262208,whatwg/html,That's a typo 😊!  I will send a PR now.,https://github.com/whatwg/html/issues/9089#issuecomment-1489262208,https://github.com/whatwg/html/issues/9089,Confusing/missing words in user activation processing model,2023-03-29T20:28:11Z,mustaqahmed
1489249360,whatwg/html,@mustaqahmed can you clarify what was meant in this text?,https://github.com/whatwg/html/issues/9089#issuecomment-1489249360,https://github.com/whatwg/html/issues/9089,Confusing/missing words in user activation processing model,2023-03-29T20:18:42Z,wanderview
1489233433,webkit/standards-positions,> I think this one was not actually addressed in a satisfactory way (I can’t figure out how to reope,https://github.com/WebKit/standards-positions/issues/70#issuecomment-1489233433,https://github.com/WebKit/standards-positions/issues/70,User Agent Client Hints,2023-03-29T20:06:21Z,miketaylr
1489228617,whatwg/html,The CSSWG just resolved to make it `:popover-open`: https://github.com/w3c/csswg-drafts/issues/8637#,https://github.com/whatwg/html/pull/9077#issuecomment-1489228617,https://github.com/whatwg/html/pull/9077,Rename :open to :popover-open and remove :closed,2023-03-29T20:02:59Z,josepharhar
1489210197,w3ctag/design-reviews,Here is an explainer which explains the motivation for discrete property animation in context with o,https://github.com/w3ctag/design-reviews/issues/825#issuecomment-1489210197,https://github.com/w3ctag/design-reviews/issues/825,Transitions on specified discrete properties,2023-03-29T19:51:34Z,josepharhar
1489176561,webkit/standards-positions,The relevant spec text is https://drafts.csswg.org/css-contain-2/#content-visibility-auto-state-chan,https://github.com/WebKit/standards-positions/issues/33#issuecomment-1489176561,https://github.com/WebKit/standards-positions/issues/33,ContentVisibilityAutoStateChanged event,2023-03-29T19:24:22Z,hober
1489118854,webkit/standards-positions,Marking this as `blocked` until the identified issues are addressed.,https://github.com/WebKit/standards-positions/issues/36#issuecomment-1489118854,https://github.com/WebKit/standards-positions/issues/36,Cookie Store API,2023-03-29T18:43:34Z,hober
1489115954,webkit/standards-positions,> > concerns portability: I'm not sure how to address this. Since the use cases make less sense in a,https://github.com/WebKit/standards-positions/issues/41#issuecomment-1489115954,https://github.com/WebKit/standards-positions/issues/41,Document Picture in Picture API,2023-03-29T18:41:13Z,hober
1489082937,mozilla/standards-positions,https://github.com/WebKit/standards-positions/issues/154,https://github.com/mozilla/standards-positions/issues/766#issuecomment-1489082937,https://github.com/mozilla/standards-positions/issues/766,Request for Mozilla Position on back/forward cache NotRestoredReasons API,2023-03-29T18:17:03Z,hober
1489028940,webkit/standards-positions,We need to come to a position on https://github.com/WebKit/standards-positions/issues/20 before we c,https://github.com/WebKit/standards-positions/issues/15#issuecomment-1489028940,https://github.com/WebKit/standards-positions/issues/15,User Preference Media Features Client Hints Headers,2023-03-29T17:37:36Z,hober
1489028617,webkit/standards-positions,We need to come to a position on https://github.com/WebKit/standards-positions/issues/20 before we c,https://github.com/WebKit/standards-positions/issues/70#issuecomment-1489028617,https://github.com/WebKit/standards-positions/issues/70,User Agent Client Hints,2023-03-29T17:37:21Z,hober
1489028268,webkit/standards-positions,We need to come to a position on https://github.com/WebKit/standards-positions/issues/20 before we c,https://github.com/WebKit/standards-positions/issues/156#issuecomment-1489028268,https://github.com/WebKit/standards-positions/issues/156,Report Critical-CH caused restart in NavigationTiming,2023-03-29T17:37:04Z,hober
1489011910,mozilla/standards-positions,Note that FF was supportive of aligning the sanitization requirement of HTML format of Async API wit,https://github.com/mozilla/standards-positions/issues/769#issuecomment-1489011910,https://github.com/mozilla/standards-positions/issues/769,Request for Mozilla Position on Unsanitized HTML read/write in Async Clipboard API,2023-03-29T17:26:07Z,snianu
1488962005,webkit/standards-positions,"I've replaced ""must not"" with ""should not"" in the following sentence in the spec proposal:  > Howe",https://github.com/WebKit/standards-positions/issues/141#issuecomment-1488962005,https://github.com/WebKit/standards-positions/issues/141,Eligibility for autofill,2023-03-29T16:54:47Z,schwering
1488938799,mozilla/standards-positions,"Thanks Sergey, I've responded in https://github.com/whatwg/html/pull/8801#issuecomment-1480513781",https://github.com/mozilla/standards-positions/issues/752#issuecomment-1488938799,https://github.com/mozilla/standards-positions/issues/752,Eligibility for autofill,2023-03-29T16:38:55Z,schwering
1488870132,w3ctag/design-reviews,"Hi there, we noticed an explainer is missing. Could you please update the request with an explainer?",https://github.com/w3ctag/design-reviews/issues/825#issuecomment-1488870132,https://github.com/w3ctag/design-reviews/issues/825,Transitions on specified discrete properties,2023-03-29T15:45:22Z,LeaVerou
1488853829,w3ctag/design-reviews,"Hi @riju one thing that came up in today's TAG call is the use of boolean instead of something more ",https://github.com/w3ctag/design-reviews/issues/826#issuecomment-1488853829,https://github.com/w3ctag/design-reviews/issues/826,Background Blur API,2023-03-29T15:33:44Z,torgo
1488837321,w3ctag/design-reviews,"@michael-n-cooper as discussed in today's TAG call, we're happy to close this as *satisfied* - thank",https://github.com/w3ctag/design-reviews/issues/811#issuecomment-1488837321,https://github.com/w3ctag/design-reviews/issues/811,Web Content Accessibility Guidelines (WCAG) 2.2 2023-01-30 > 2023-02-24,2023-03-29T15:23:59Z,torgo
1488746913,webkit/standards-positions,"I will take care of a new issue for core Capability Delegation support, ETA sometime next week.  Tha",https://github.com/WebKit/standards-positions/issues/137#issuecomment-1488746913,https://github.com/WebKit/standards-positions/issues/137,Capability Delegation for getDisplayMedia(),2023-03-29T14:35:37Z,mustaqahmed
1488597528,w3ctag/design-reviews,"@hadleybeeman Thanks so much! Much appreciated. ",https://github.com/w3ctag/design-reviews/issues/816#issuecomment-1488597528,https://github.com/w3ctag/design-reviews/issues/816,CR Snapshot Review for EPUB 3.3,2023-03-29T13:18:53Z,wareid
1488534014,whatwg/html,If you use a dependency outside of your control you also cannot rely on static analysis. In that cas,https://github.com/whatwg/html/issues/8759#issuecomment-1488534014,https://github.com/whatwg/html/issues/8759,Add DOMParser option to parse declarative shadow DOM,2023-03-29T12:43:45Z,annevk
1488526531,whatwg/html,"hey @domenic, anything interesting?",https://github.com/whatwg/html/issues/8369#issuecomment-1488526531,https://github.com/whatwg/html/issues/8369,"<pre>: line number ",2023-03-29T12:38:31Z,esdnm
1488509236,whatwg/html,"It's not about static analysis alone, rather about modelling API that makes it easy to reason about ",https://github.com/whatwg/html/issues/8759#issuecomment-1488509236,https://github.com/whatwg/html/issues/8759,Add DOMParser option to parse declarative shadow DOM,2023-03-29T12:26:53Z,koto
1488466242,whatwg/html,"I think what I don't understand is that if you have to do static analysis anyway and web developers ",https://github.com/whatwg/html/issues/8759#issuecomment-1488466242,https://github.com/whatwg/html/issues/8759,Add DOMParser option to parse declarative shadow DOM,2023-03-29T11:57:55Z,annevk
1488440979,whatwg/html,I agree. Passing dynamic arguments to API functions hardly counts as abstraction though. I think it',https://github.com/whatwg/html/issues/8759#issuecomment-1488440979,https://github.com/whatwg/html/issues/8759,Add DOMParser option to parse declarative shadow DOM,2023-03-29T11:37:26Z,koto
1488428933,whatwg/html,"Probably not a deal breaker, but this caused a regression in emscripten: https://github.com/emscript",https://github.com/whatwg/html/issues/8869#issuecomment-1488428933,https://github.com/whatwg/html/issues/8869,Should strict MIME type for importScripts() also be enforced on local URLs?,2023-03-29T11:32:52Z,evilpie
1488339987,whatwg/html,"That's my understanding, yeah.",https://github.com/whatwg/html/pull/9077#issuecomment-1488339987,https://github.com/whatwg/html/pull/9077,Rename :open to :popover-open and remove :closed,2023-03-29T10:28:09Z,jakearchibald
1488263139,whatwg/html,"I guess we're largely waiting for a CSS WG resolution here?  cc @whatwg/css @nt1m @jakearchibald ",https://github.com/whatwg/html/pull/9077#issuecomment-1488263139,https://github.com/whatwg/html/pull/9077,Rename :open to :popover-open and remove :closed,2023-03-29T09:33:26Z,annevk
1488253178,whatwg/html,Well it does stand out. I guess the question and point of contention is whether it's our job to ensu,https://github.com/whatwg/html/issues/8759#issuecomment-1488253178,https://github.com/whatwg/html/issues/8759,Add DOMParser option to parse declarative shadow DOM,2023-03-29T09:26:17Z,annevk
1488229167,whatwg/html,So https://en.wiktionary.org/wiki/overlay has both as acceptable. I don't mind going with this varia,https://github.com/whatwg/html/pull/9083#issuecomment-1488229167,https://github.com/whatwg/html/pull/9083,Overlayed -> overlaid,2023-03-29T09:14:57Z,annevk
1488218708,whatwg/html,"I agree with tel (already covered) and tel-national, but I'm not sure tel-country-code or the others",https://github.com/whatwg/html/issues/9086#issuecomment-1488218708,https://github.com/whatwg/html/issues/9086,"Autocomplete values for input type=""tel""",2023-03-29T09:08:19Z,annevk
1488184562,mozilla/standards-positions,"Yeah, agreed. In fact we already do this (https://bugzilla.mozilla.org/show_bug.cgi?id=1817189)",https://github.com/mozilla/standards-positions/issues/768#issuecomment-1488184562,https://github.com/mozilla/standards-positions/issues/768,overflow:overlay aliases overflow:auto,2023-03-29T08:48:05Z,emilio
1488169022,webkit/standards-positions,"@beaufortfrancois or @mustaqahmed, would you be willing to file a new issue for that purpose, with t",https://github.com/WebKit/standards-positions/issues/137#issuecomment-1488169022,https://github.com/WebKit/standards-positions/issues/137,Capability Delegation for getDisplayMedia(),2023-03-29T08:37:17Z,youennf
1488125609,whatwg/html,Small update here: outreach is still in progress. Seems like the framework that was used on the site,https://github.com/whatwg/html/issues/9042#issuecomment-1488125609,https://github.com/whatwg/html/issues/9042,popover attribute may not be web compatible,2023-03-29T08:05:39Z,nt1m
1488113180,webkit/standards-positions,@mustaqahmed filed one at https://lists.webkit.org/pipermail/webkit-dev/2022-May/032221.html,https://github.com/WebKit/standards-positions/issues/137#issuecomment-1488113180,https://github.com/WebKit/standards-positions/issues/137,Capability Delegation for getDisplayMedia(),2023-03-29T07:57:07Z,beaufortfrancois
1488095139,whatwg/webidl,"I don't have a strong opinion on this. If you want others to consider the Gecko behavior file a new ",https://github.com/whatwg/webidl/pull/1285#issuecomment-1488095139,https://github.com/whatwg/webidl/pull/1285,Clarify #named-properties-object,2023-03-29T07:41:23Z,annevk
1488092623,whatwg/webidl,Note that it's the behaviour that Gecko has had all along (because we think/thought that returning s,https://github.com/whatwg/webidl/pull/1285#issuecomment-1488092623,https://github.com/whatwg/webidl/pull/1285,Clarify #named-properties-object,2023-03-29T07:39:04Z,petervanderbeken
1488084406,whatwg/webidl,I suspect nobody really knows? But also that adding it might have some risk associated with it?,https://github.com/whatwg/webidl/pull/1285#issuecomment-1488084406,https://github.com/whatwg/webidl/pull/1285,Clarify #named-properties-object,2023-03-29T07:31:42Z,annevk
1488073090,whatwg/webidl,I did ask in https://github.com/web-platform-tests/wpt/pull/36746#issuecomment-1300384701 why we wan,https://github.com/whatwg/webidl/pull/1285#issuecomment-1488073090,https://github.com/whatwg/webidl/pull/1285,Clarify #named-properties-object,2023-03-29T07:22:19Z,petervanderbeken
1488035160,WICG/webcomponents,"@rniwa , I would create some stories on declarative template, declarative web application stack as p",https://github.com/WICG/webcomponents/issues/978#issuecomment-1488035160,https://github.com/WICG/webcomponents/issues/978,"Spring 2023 ""F2F""",2023-03-29T06:50:41Z,sashafirsov
1488010718,whatwg/dom,"I've lost too much context to come back to this, I'm sorry to say. And it appears we never got the r",https://github.com/whatwg/dom/pull/661#issuecomment-1488010718,https://github.com/whatwg/dom/pull/661,Don't store is value when it won't be useful,2023-03-29T06:22:11Z,domenic
1487983247,whatwg/html,"I think that might work! There's some complexity there in getting the exact right semantics---i.e., ",https://github.com/whatwg/html/issues/8545#issuecomment-1487983247,https://github.com/whatwg/html/issues/8545,GC for cached attr-associated elements?,2023-03-29T05:49:10Z,domenic
1487971449,whatwg/html,@domenic I added my first name,https://github.com/whatwg/html/pull/9078#issuecomment-1487971449,https://github.com/whatwg/html/pull/9078,Heading example (Issue 8366),2023-03-29T05:32:07Z,JAWS-test
1487943254,webkit/standards-positions,There is an ongoing discussion about fetch based API proposal. Please take a look at the main thread,https://github.com/WebKit/standards-positions/issues/85#issuecomment-1487943254,https://github.com/WebKit/standards-positions/issues/85,PendingBeacon API,2023-03-29T04:55:03Z,mingyc
1487935467,whatwg/html,I spent some time poring over the original PR and saw that @domenic had [suggested](https://github.c,https://github.com/whatwg/html/issues/8545#issuecomment-1487935467,https://github.com/whatwg/html/issues/8545,GC for cached attr-associated elements?,2023-03-29T04:40:55Z,alice
1487910595,whatwg/html,"장은희  2023년 3월 29일 (수) 12:41, AKSHAYA MADHURI ***@***.***>님이 작성:  > >    - At least two implementers ",https://github.com/whatwg/html/pull/9085#issuecomment-1487910595,https://github.com/whatwg/html/pull/9085,Create API top layer,2023-03-29T03:58:38Z,piw-he
1487890846,whatwg/webidl,"Thanks @domenic, could you please commit on my behalf? I don’t think I have the right permissions.",https://github.com/whatwg/webidl/pull/1285#issuecomment-1487890846,https://github.com/whatwg/webidl/pull/1285,Clarify #named-properties-object,2023-03-29T03:20:45Z,delan
1487873201,webkit/standards-positions,"An update proposal is shown in [this video](https://www.youtube.com/watch?v=Y1MY14y9Ztc). We should ",https://github.com/WebKit/standards-positions/issues/85#issuecomment-1487873201,https://github.com/WebKit/standards-positions/issues/85,PendingBeacon API,2023-03-29T02:51:17Z,marcoscaceres
1487852701,mozilla/standards-positions,"Thanks to everyone for the lively discussion, but I think that this has again gotten to the point wh",https://github.com/mozilla/standards-positions/issues/100#issuecomment-1487852701,https://github.com/mozilla/standards-positions/issues/100,RFP: WebUSB API,2023-03-29T02:17:57Z,martinthomson
1487835539,whatwg/html,"Thanks. We need the name you use to sign legal contracts with, which for most people includes their ",https://github.com/whatwg/html/pull/9078#issuecomment-1487835539,https://github.com/whatwg/html/pull/9078,Heading example (Issue 8366),2023-03-29T01:53:33Z,domenic
1487784987,webkit/standards-positions,"> Hi @hober, the request is just to make sure WebKit is good with that change  @smfr said as much ",https://github.com/WebKit/standards-positions/issues/157#issuecomment-1487784987,https://github.com/WebKit/standards-positions/issues/157,overflow:overlay aliases overflow:auto,2023-03-29T00:39:44Z,hober
1487755040,webkit/standards-positions,"Hi @hober, the request is just to make sure WebKit is good with that change and plans to implement t",https://github.com/WebKit/standards-positions/issues/157#issuecomment-1487755040,https://github.com/WebKit/standards-positions/issues/157,overflow:overlay aliases overflow:auto,2023-03-28T23:56:14Z,chrishtr
1487750847,mozilla/standards-positions,It looks like most of the discussion in https://github.com/w3c/csswg-drafts/issues/8063#issuecomment,https://github.com/mozilla/standards-positions/issues/768#issuecomment-1487750847,https://github.com/mozilla/standards-positions/issues/768,overflow:overlay aliases overflow:auto,2023-03-28T23:49:08Z,dholbert
1487718728,webkit/standards-positions,"I'm not sure what to do with this request. The CSS WG resolved to make `overflow: overlay` an alias ",https://github.com/WebKit/standards-positions/issues/157#issuecomment-1487718728,https://github.com/WebKit/standards-positions/issues/157,overflow:overlay aliases overflow:auto,2023-03-28T23:06:03Z,hober
1487717049,webkit/standards-positions,"Besides the earlier cited issue, I think this one was not actually addressed in a satisfactory way (",https://github.com/WebKit/standards-positions/issues/70#issuecomment-1487717049,https://github.com/WebKit/standards-positions/issues/70,User Agent Client Hints,2023-03-28T23:03:59Z,othermaciej
1487561466,mozilla/standards-positions,"> after the animation finished, the display style can be none with non-animating style, no?  Yes, ",https://github.com/mozilla/standards-positions/issues/762#issuecomment-1487561466,https://github.com/mozilla/standards-positions/issues/762,Display and content-visibility animations,2023-03-28T20:37:55Z,josepharhar
1487535327,whatwg/html,"@domenic I sign with the family name. If you need my full name: see my email address, which I have a",https://github.com/whatwg/html/pull/9078#issuecomment-1487535327,https://github.com/whatwg/html/pull/9078,Heading example (Issue 8366),2023-03-28T20:13:54Z,JAWS-test
1487431553,webkit/standards-positions,I'm pretty sure this is fine; I'll close this as `position: support` in a week unless anybody object,https://github.com/WebKit/standards-positions/issues/8#issuecomment-1487431553,https://github.com/WebKit/standards-positions/issues/8,CSS overflow for replaced elements,2023-03-28T18:43:21Z,hober
1487374499,webkit/standards-positions,"Barring objections, we'll mark this `position: neutral` in a week.",https://github.com/WebKit/standards-positions/issues/6#issuecomment-1487374499,https://github.com/WebKit/standards-positions/issues/6,DisplayMediaStreamConstraints.surfaceSwitching,2023-03-28T18:02:12Z,hober
1487373340,webkit/standards-positions,"Barring objections, we'll mark this `position: oppose` in a week.",https://github.com/WebKit/standards-positions/issues/119#issuecomment-1487373340,https://github.com/WebKit/standards-positions/issues/119,Programatically disabling hardware encoding/decoding in WebRTC,2023-03-28T18:01:22Z,hober
1487372825,webkit/standards-positions,"Barring objections, we'll mark this `position: support` in a week.",https://github.com/WebKit/standards-positions/issues/100#issuecomment-1487372825,https://github.com/WebKit/standards-positions/issues/100,RTCRtpTransceiver.setOfferedRtpHeaderExtensions,2023-03-28T18:00:58Z,hober
1487372033,webkit/standards-positions,> We should probably first come up on a position about capability-delegations. I do not see an issue,https://github.com/WebKit/standards-positions/issues/137#issuecomment-1487372033,https://github.com/WebKit/standards-positions/issues/137,Capability Delegation for getDisplayMedia(),2023-03-28T18:00:30Z,hober
1487249246,whatwg/html,"> Autocomplete works differently on different form controls, see https://html.spec.whatwg.org/#inapp",https://github.com/whatwg/html/issues/9065#issuecomment-1487249246,https://github.com/whatwg/html/issues/9065,Autocomplete on 'contenteditable' Elements,2023-03-28T16:31:13Z,bmathwig
1487179695,whatwg/dom,Thanks for pointing to the old issue. Let's keep tracking this discussion there. Closing this out.,https://github.com/whatwg/dom/issues/1177#issuecomment-1487179695,https://github.com/whatwg/dom/issues/1177,[Range] Should the DOM range spec include an i18n warning?,2023-03-28T15:52:39Z,sanketj
1487106100,whatwg/html,"WebKit is also interested in this.  (For maximum clarity, Chromium and Edge count as a single impl",https://github.com/whatwg/html/issues/9065#issuecomment-1487106100,https://github.com/whatwg/html/issues/9065,Autocomplete on 'contenteditable' Elements,2023-03-28T15:25:10Z,annevk
1486984974,whatwg/html,"> ...the other side, which helps. (Though what if both sides go down?)  I'd say in that particular",https://github.com/whatwg/html/issues/1766#issuecomment-1486984974,https://github.com/whatwg/html/issues/1766,Add onclose event to MessagePort,2023-03-28T14:18:35Z,raegen
