id,repo,body,url,issue_url,issue_title,created_at,user
1404374139,whatwg/html,"> `setHTML()` (and proposed friends) is going to be the new HTML parser entry point, replacing `inne",https://github.com/whatwg/html/issues/8759#issuecomment-1404374139,https://github.com/whatwg/html/issues/8759,Add DOMParser option to parse declarative shadow DOM,2023-01-25T23:57:41Z,Jamesernator
1404362184,whatwg/html,Anything holding this up? As it is the spec shows incorrect info which has bled over to MDN and mis-,https://github.com/whatwg/html/pull/3872#issuecomment-1404362184,https://github.com/whatwg/html/pull/3872,Cleanup language around commit() being the only way to update OffscreenCanvas,2023-01-25T23:36:14Z,greggman
1404346197,WICG/webcomponents,"👋  I am interested and will attend, perhaps one or more others from Igalia may as well depending on",https://github.com/WICG/webcomponents/issues/978#issuecomment-1404346197,https://github.com/WICG/webcomponents/issues/978,"Spring 2023 ""F2F""",2023-01-25T23:14:03Z,bkardell
1404339507,whatwg/html,This is https://github.com/whatwg/html/pull/3872,https://github.com/whatwg/html/issues/8777#issuecomment-1404339507,https://github.com/whatwg/html/issues/8777,The `commit` method on various canvas contexts does not exist,2023-01-25T23:06:29Z,Kaiido
1404338705,whatwg/html,>  Though with such an API you could just generate \<ul\> nesting yourself by responding to the appr,https://github.com/whatwg/html/issues/8751#issuecomment-1404338705,https://github.com/whatwg/html/issues/8751,Native support for indents,2023-01-25T23:05:32Z,acywatson
1404320658,whatwg/html,@annevk @domenic would you mind giving it another once over when you get a chance? I think I've tack,https://github.com/whatwg/html/pull/8470#issuecomment-1404320658,https://github.com/whatwg/html/pull/8470,Add the Priority Hints changes to the html spec,2023-01-25T22:41:24Z,pmeenan
1404226198,WICG/webcomponents,"I'm happy to attend, as long as it's virtual. Travel is tougher than it used to be.  +1 to pre-wor",https://github.com/WICG/webcomponents/issues/978#issuecomment-1404226198,https://github.com/WICG/webcomponents/issues/978,"Spring 2023 ""F2F""",2023-01-25T21:08:55Z,mfreed7
1404028919,whatwg/html,"Hi @nicolo-ribaudo, if you can send me (or anyone else on the call) your email address I will add yo",https://github.com/whatwg/html/issues/8723#issuecomment-1404028919,https://github.com/whatwg/html/issues/8723,Upcoming HTML standard issue triage meeting on 1/26/2023,2023-01-25T18:10:04Z,past
1403982687,WICG/webcomponents,cc @smaug----,https://github.com/WICG/webcomponents/issues/978#issuecomment-1403982687,https://github.com/WICG/webcomponents/issues/978,"Spring 2023 ""F2F""",2023-01-25T17:30:25Z,annevk
1403951454,WICG/webcomponents,"> Consider how every feature interacts with declarative shadow DOM, especially a11y  I'm biased. T",https://github.com/WICG/webcomponents/issues/978#issuecomment-1403951454,https://github.com/WICG/webcomponents/issues/978,"Spring 2023 ""F2F""",2023-01-25T17:09:44Z,leobalter
1403869597,whatwg/html,I'm not sure I follow the thought experiment which makes it hard to comment. In general it doesn't s,https://github.com/whatwg/html/issues/8759#issuecomment-1403869597,https://github.com/whatwg/html/issues/8759,Add DOMParser option to parse declarative shadow DOM,2023-01-25T16:17:20Z,annevk
1403860983,WICG/webcomponents,I'd be happy to make some time for a pre-meeting.,https://github.com/WICG/webcomponents/issues/978#issuecomment-1403860983,https://github.com/WICG/webcomponents/issues/978,"Spring 2023 ""F2F""",2023-01-25T16:11:23Z,annevk
1403852659,WICG/webcomponents,@annevk glad your interested in attending. I agree with those two points my self. One more that's to,https://github.com/WICG/webcomponents/issues/978#issuecomment-1403852659,https://github.com/WICG/webcomponents/issues/978,"Spring 2023 ""F2F""",2023-01-25T16:06:08Z,justinfagnani
1403791731,whatwg/dom,"I feel like the existing throwIfAborted() gives about the same savings in characters, without the ex",https://github.com/whatwg/dom/issues/1147#issuecomment-1403791731,https://github.com/whatwg/dom/issues/1147,Proposal: AbortSignal.wrap,2023-01-25T15:24:33Z,domenic
1403709611,mozilla/standards-positions,"Thanks. Sorry, what I meant by ""simpler"" is that I think we all feel that disallowing data URLs is t",https://github.com/mozilla/standards-positions/issues/718#issuecomment-1403709611,https://github.com/mozilla/standards-positions/issues/718,Request for Position: Remove support for data: URL in SVGUseElement,2023-01-25T14:29:10Z,RByers
1403532585,WICG/webcomponents,I would be happy to attend. If it's virtual it'd have to accommodate UTC+1 for me. I'm interested in,https://github.com/WICG/webcomponents/issues/978#issuecomment-1403532585,https://github.com/WICG/webcomponents/issues/978,"Spring 2023 ""F2F""",2023-01-25T12:27:52Z,annevk
1403383897,whatwg/dom,In https://github.com/whatwg/dom/issues/1146 I suggested a method that could be available on `EventT,https://github.com/whatwg/dom/issues/583#issuecomment-1403383897,https://github.com/whatwg/dom/issues/583,"Allow custom ""get the parent"" algorithms for EventTargets",2023-01-25T10:18:49Z,keithamus
1403380561,whatwg/dom,"Thanks, that's correct.",https://github.com/whatwg/dom/issues/1146#issuecomment-1403380561,https://github.com/whatwg/dom/issues/1146,Provide a mechanism for allowing EventTarget trees to make use of bubbling,2023-01-25T10:16:12Z,keithamus
1403359751,whatwg/html,"`media=""supports()""` is great feature, but tying it to the simpler `layer` attribute change seems to",https://github.com/whatwg/html/issues/7540#issuecomment-1403359751,https://github.com/whatwg/html/issues/7540,Allow authors to apply new css features (like cascade layers) while linking stylesheets,2023-01-25T10:00:55Z,jacobrask
1403256234,mozilla/standards-positions,"So far, we have relied on your assessment of feasibility. We have not done any specific explorations",https://github.com/mozilla/standards-positions/issues/718#issuecomment-1403256234,https://github.com/mozilla/standards-positions/issues/718,Request for Position: Remove support for data: URL in SVGUseElement,2023-01-25T08:32:34Z,mozfreddyb
1403080186,whatwg/html,"Adding agenda+ to try to probe implementers on where this falls on the effort spectrum, and/or what ",https://github.com/whatwg/html/issues/5488#issuecomment-1403080186,https://github.com/whatwg/html/issues/5488,"<input type=""time""> : Time vs. duration",2023-01-25T04:23:32Z,domenic
1403049137,whatwg/html,I've built a custom element for this for now/as a reference: https://github.com/muan/input-duration-,https://github.com/whatwg/html/issues/5488#issuecomment-1403049137,https://github.com/whatwg/html/issues/5488,"<input type=""time""> : Time vs. duration",2023-01-25T03:27:05Z,muan
1402931621,whatwg/dom,"Dupe of #583, I'm pretty sure.",https://github.com/whatwg/dom/issues/1146#issuecomment-1402931621,https://github.com/whatwg/dom/issues/1146,Provide a mechanism for allowing EventTarget trees to make use of bubbling,2023-01-25T01:43:01Z,domenic
1402827213,w3ctag/design-reviews,"Thanks, much appreciated!",https://github.com/w3ctag/design-reviews/issues/806#issuecomment-1402827213,https://github.com/w3ctag/design-reviews/issues/806,WebAuthn PRF extension,2023-01-24T23:31:06Z,MattMenke2
1402825203,w3ctag/design-reviews,> The privacy properties are unclear.  Have added a section to the explainer as suggested. This ex,https://github.com/w3ctag/design-reviews/issues/806#issuecomment-1402825203,https://github.com/w3ctag/design-reviews/issues/806,WebAuthn PRF extension,2023-01-24T23:28:29Z,agl
1402803709,mozilla/standards-positions,"In addition, for finger printing discussion, feel free to discuss that in the [spec issue](https://g",https://github.com/mozilla/standards-positions/issues/675#issuecomment-1402803709,https://github.com/mozilla/standards-positions/issues/675,Autoplay Policy Detection API,2023-01-24T23:04:30Z,alastor0325
1402795673,mozilla/standards-positions,"> it seems to me like a wrong tool for the job (the web browser can play the audible media muted, wi",https://github.com/mozilla/standards-positions/issues/675#issuecomment-1402795673,https://github.com/mozilla/standards-positions/issues/675,Autoplay Policy Detection API,2023-01-24T22:54:41Z,alastor0325
1402459670,mozilla/standards-positions,"(note, @khushalsagar sent [intent-to-ship for the same-page API](https://groups.google.com/a/chromiu",https://github.com/mozilla/standards-positions/issues/677#issuecomment-1402459670,https://github.com/mozilla/standards-positions/issues/677,Request for Position: View Transitions API,2023-01-24T19:13:32Z,dholbert
1402437234,mozilla/standards-positions,"I had been assuming, based on this comment (https://github.com/whatwg/dom/issues/831#issuecomment-12",https://github.com/mozilla/standards-positions/issues/335#issuecomment-1402437234,https://github.com/mozilla/standards-positions/issues/335,Declarative Shadow DOM,2023-01-24T18:55:39Z,mfreed7
1402376683,whatwg/html,I was [actioned](https://www.w3.org/International/track/actions/1234) by the I18N WG with looking in,https://github.com/whatwg/html/issues/8726#issuecomment-1402376683,https://github.com/whatwg/html/issues/8726,"`<meta charset=""utf-8"">` missing from intro example",2023-01-24T18:11:21Z,aphillips
1402217881,mozilla/standards-positions,"Ah, sure, sounds good to close this with a positive position.",https://github.com/mozilla/standards-positions/issues/563#issuecomment-1402217881,https://github.com/mozilla/standards-positions/issues/563,`supports(<font-technology>)`extended syntax for `@font-face`,2023-01-24T16:19:10Z,emilio
1402127454,w3ctag/design-reviews,"The privacy properties are unclear.  Is there a single random_oracle() exposed globally, which could",https://github.com/w3ctag/design-reviews/issues/806#issuecomment-1402127454,https://github.com/w3ctag/design-reviews/issues/806,WebAuthn PRF extension,2023-01-24T15:23:52Z,MattMenke2
1402112692,mozilla/standards-positions,"Note that the web compat risk of this has turned out to be higher than we'd generally like, so chrom",https://github.com/mozilla/standards-positions/issues/718#issuecomment-1402112692,https://github.com/mozilla/standards-positions/issues/718,Request for Position: Remove support for data: URL in SVGUseElement,2023-01-24T15:16:00Z,RByers
1401825483,mozilla/standards-positions,"@ekr: will note Mozilla as ""not in favor"".  Please note that other ways to resolve this such as or",https://github.com/mozilla/standards-positions/issues/728#issuecomment-1401825483,https://github.com/mozilla/standards-positions/issues/728,Request for Position: programatically disabling hardware encoding/decoding in WebRTC,2023-01-24T12:02:54Z,fippo
1401684120,whatwg/html,> using measuretext to measure text on canvas using a variable font is among the concrete needs peop,https://github.com/whatwg/html/issues/3571#issuecomment-1401684120,https://github.com/whatwg/html/issues/3571,OpenType Features and Variable Fonts for Canvas,2023-01-24T10:17:49Z,RoelN
1401501260,webkit/standards-positions,"Colleagues and I chatted about 1 and 2 and agree those are good changes. 3 is probably best left to ",https://github.com/WebKit/standards-positions/issues/124#issuecomment-1401501260,https://github.com/WebKit/standards-positions/issues/124,"Request for Position: Mixed Content - Upgrading of ""passive"" mixed content",2023-01-24T07:40:01Z,annevk
1401412992,whatwg/html,@domenic Thanks!,https://github.com/whatwg/html/issues/8773#issuecomment-1401412992,https://github.com/whatwg/html/issues/8773,Proposal: Add an `isolatehistory` attribute to iframes,2023-01-24T05:23:16Z,brandonmcconnell
1401367367,mozilla/standards-positions,"Thanks for raising the issue, but after discussion, we've concluded that we need to defer this quest",https://github.com/mozilla/standards-positions/issues/738#issuecomment-1401367367,https://github.com/mozilla/standards-positions/issues/738,Implement subset of File System Access API,2023-01-24T04:04:47Z,martinthomson
1401361781,whatwg/html,Duplicate of #6501; let's consolidate discussions there!,https://github.com/whatwg/html/issues/8773#issuecomment-1401361781,https://github.com/whatwg/html/issues/8773,Proposal: Add an `isolatehistory` attribute to iframes,2023-01-24T03:55:31Z,domenic
1401359982,whatwg/html,"One Example: http://html5doctor.com/the-hgroup-element/ ```   <hgroup>     <h1><a href=""/"">Mini ",https://github.com/whatwg/html/issues/8615#issuecomment-1401359982,https://github.com/whatwg/html/issues/8615,Add examples of <hgroup>,2023-01-24T03:51:24Z,omkarpawar2001
1401153463,whatwg/dom,> I don't really understand the objection to making it bi-state. Just modifying [html.spec.whatwg.or,https://github.com/whatwg/dom/pull/892#issuecomment-1401153463,https://github.com/whatwg/dom/pull/892,Add declarative Shadow DOM features,2023-01-23T23:36:16Z,mfreed7
1401047528,whatwg/html,"PR preview seems to have edited the OP saying there was a Wattsi build error even though all of the ",https://github.com/whatwg/html/pull/8552#issuecomment-1401047528,https://github.com/whatwg/html/pull/8552,Replace script-blocking style sheet counter with script-blocking style sheet list,2023-01-23T21:55:32Z,domfarolino
1401038838,whatwg/dom,"> Normal templates turn off speculative fetches of resources whose URLs appear within the template. ",https://github.com/whatwg/dom/issues/831#issuecomment-1401038838,https://github.com/whatwg/dom/issues/831,Declarative Shadow DOM,2023-01-23T21:48:27Z,mfreed7
1401034289,whatwg/html,"> but I'd like to know what browsers do here? [...] Maybe ""script-blocking style sheet counter"" is a",https://github.com/whatwg/html/pull/8552#issuecomment-1401034289,https://github.com/whatwg/html/pull/8552,Replace script-blocking style sheet counter with script-blocking style sheet list,2023-01-23T21:45:30Z,domfarolino
1401014981,whatwg/html,"  > To reply to [#5465 (comment)](https://github.com/whatwg/html/pull/5465#issuecomment-1397423778",https://github.com/whatwg/html/issues/8759#issuecomment-1401014981,https://github.com/whatwg/html/issues/8759,Add DOMParser option to parse declarative shadow DOM,2023-01-23T21:34:02Z,mfreed7
1400988692,whatwg/html,I've filed a new issue over there. Thanks so much for the info and the correction!  It's understan,https://github.com/whatwg/html/issues/8772#issuecomment-1400988692,https://github.com/whatwg/html/issues/8772,CSS selectors cannot reliably identify cells on the edge of their containing table if any cells in the table use the rowSpan attribute,2023-01-23T21:14:39Z,DavidJCobb
1400941314,whatwg/html,(Procedural note: CSS issues should be filed against [the CSSWG repo](https://github.com/w3c/csswg-d,https://github.com/whatwg/html/issues/8772#issuecomment-1400941314,https://github.com/whatwg/html/issues/8772,CSS selectors cannot reliably identify cells on the edge of their containing table if any cells in the table use the rowSpan attribute,2023-01-23T20:32:00Z,tabatkins
1400938053,WICG/webcomponents,@matthewp @rniwa that seems good to me.  My main ask is for a way to emit a style module at the fi,https://github.com/WICG/webcomponents/issues/939#issuecomment-1400938053,https://github.com/WICG/webcomponents/issues/939,Declarative CSS Module Scripts,2023-01-23T20:28:56Z,justinfagnani
1400934766,WICG/webcomponents,"I hope we're all back from the holiday, new years, and layoff season and can look forward to our spr",https://github.com/WICG/webcomponents/issues/978#issuecomment-1400934766,https://github.com/WICG/webcomponents/issues/978,"Spring 2023 ""F2F""",2023-01-23T20:26:05Z,justinfagnani
1400907652,whatwg/html,"I have now opened up tickets with [Firefox](https://bugzilla.mozilla.org/show_bug.cgi?id=1811917), [",https://github.com/whatwg/html/issues/8757#issuecomment-1400907652,https://github.com/whatwg/html/issues/8757,MediaError not acccessible for a video element if using it with source elements,2023-01-23T20:05:48Z,callumgare
1400777378,WICG/webcomponents,"So, using Web Animation API can seem to be a solid workaround. Instead of templating like this:  `",https://github.com/WICG/webcomponents/issues/627#issuecomment-1400777378,https://github.com/WICG/webcomponents/issues/627,Shadow dom innerhtml and CSP unsafe-inline,2023-01-23T18:16:49Z,clshortfuse
1400618748,w3ctag/design-reviews,cc @johannhof @helenyc,https://github.com/w3ctag/design-reviews/issues/808#issuecomment-1400618748,https://github.com/w3ctag/design-reviews/issues/808,Spec Review for requestStorageAccessForOrigin,2023-01-23T16:19:11Z,mreichhoff
1400572557,whatwg/html,"I assume the 'from-image' and 'none' imageOrientation options are intended to apply to ImageBitmaps ",https://github.com/whatwg/html/pull/8687#issuecomment-1400572557,https://github.com/whatwg/html/pull/8687,[WIP] Change createImageBitMaps's imageOrientation attributes,2023-01-23T15:50:01Z,aardgoose
1400552883,whatwg/html,Hello! Is this call open to anyone? I'd like to join to take part in the discussion for https://gith,https://github.com/whatwg/html/issues/8723#issuecomment-1400552883,https://github.com/whatwg/html/issues/8723,Upcoming HTML standard issue triage meeting on 1/26/2023,2023-01-23T15:36:37Z,nicolo-ribaudo
1400460865,webkit/standards-positions,My message was about “unlocking” WebKit/Safari’s implementation — a case against spec compliance pur,https://github.com/WebKit/standards-positions/issues/114#issuecomment-1400460865,https://github.com/WebKit/standards-positions/issues/114,Request for position: aligning on <link rel=prefetch>,2023-01-23T14:44:19Z,dieulot
1400284373,webkit/standards-positions,No it cannot. I'm not sure what @dieulot means as the behavior proposed here would be the same in al,https://github.com/WebKit/standards-positions/issues/114#issuecomment-1400284373,https://github.com/WebKit/standards-positions/issues/114,Request for position: aligning on <link rel=prefetch>,2023-01-23T12:46:34Z,annevk
1400194232,whatwg/html,"Somewhat related, I think we should have a pseudo-element selector for the default `<summary>` https",https://github.com/whatwg/html/issues/8610#issuecomment-1400194232,https://github.com/whatwg/html/issues/8610,Details and summary styles don't match implementations.,2023-01-23T11:29:06Z,jakearchibald
1399832574,whatwg/html,https://github.com/w3c/webappsec-permissions-policy/pull/505 is now merged.,https://github.com/whatwg/html/pull/8766#issuecomment-1399832574,https://github.com/whatwg/html/pull/8766,Update permisssions policy creation,2023-01-23T05:40:15Z,clelland
1399699591,whatwg/html,I think we still need to evaluate whether or not https://html.spec.whatwg.org/#the-javascript:-url-s,https://github.com/whatwg/html/pull/8767#issuecomment-1399699591,https://github.com/whatwg/html/pull/8767,Properly assign history policy container,2023-01-23T02:19:51Z,domfarolino
1399598675,webkit/standards-positions,"> To reiterate from the WebKit issue, as someone making a library ([instant.page](https://instant.pa",https://github.com/WebKit/standards-positions/issues/114#issuecomment-1399598675,https://github.com/WebKit/standards-positions/issues/114,Request for position: aligning on <link rel=prefetch>,2023-01-22T20:28:42Z,othermaciej
1399591513,whatwg/html,"> I don't think File System Access can provide the same protection browsers do for file downloads ",https://github.com/whatwg/html/issues/4148#issuecomment-1399591513,https://github.com/whatwg/html/issues/4148,Download API,2023-01-22T19:57:29Z,Zipdox2
1399575401,whatwg/html,I am new to the open-source can you assign this to me?,https://github.com/whatwg/html/issues/8228#issuecomment-1399575401,https://github.com/whatwg/html/issues/8228,Should <button> have `user-select: none;` by default?,2023-01-22T19:04:06Z,YASHWANTHKESAGONI
1399558968,whatwg/html,"And the download object:  {{APIRef(""HTML DOM"")}}  The **`Download`** object represents an ongoin",https://github.com/whatwg/html/issues/4148#issuecomment-1399558968,https://github.com/whatwg/html/issues/4148,Download API,2023-01-22T17:46:16Z,Zipdox2
1399550246,whatwg/html,"I propose an API like this:  {{APIRef(""HTML DOM"")}}  The **`navigator.download()`** method of th",https://github.com/whatwg/html/issues/4148#issuecomment-1399550246,https://github.com/whatwg/html/issues/4148,Download API,2023-01-22T17:15:30Z,Zipdox2
1399483726,whatwg/html,"Note that this depends on https://github.com/w3c/webappsec-permissions-policy/pull/505, which is not",https://github.com/whatwg/html/pull/8766#issuecomment-1399483726,https://github.com/whatwg/html/pull/8766,Update permisssions policy creation,2023-01-22T13:25:26Z,clelland
1399478409,mozilla/standards-positions,It's the writing part that's actually important here.,https://github.com/mozilla/standards-positions/issues/738#issuecomment-1399478409,https://github.com/mozilla/standards-positions/issues/738,Implement subset of File System Access API,2023-01-22T13:00:44Z,Zipdox2
1399470756,mozilla/standards-positions,> Opening and saving files is already possible without this API  Same could be said for reading fo,https://github.com/mozilla/standards-positions/issues/738#issuecomment-1399470756,https://github.com/mozilla/standards-positions/issues/738,Implement subset of File System Access API,2023-01-22T12:20:49Z,jimmywarting
1399413327,whatwg/html,"I don't think File System Access can provide the same protection browsers do for file downloads, nor",https://github.com/whatwg/html/issues/4148#issuecomment-1399413327,https://github.com/whatwg/html/issues/4148,Download API,2023-01-22T06:20:07Z,saschanaz
1399349639,whatwg/html,"This issue is kind of obsoleted by the existence of the File System Access API, but Mozilla refuses ",https://github.com/whatwg/html/issues/4148#issuecomment-1399349639,https://github.com/whatwg/html/issues/4148,Download API,2023-01-21T23:01:00Z,Zipdox2
1399206354,whatwg/html,"Personally I really think it should be one or the other: - either we use the ""layer rendering attri",https://github.com/whatwg/html/issues/8476#issuecomment-1399206354,https://github.com/whatwg/html/issues/8476,Canvas2D layers with filter support,2023-01-21T08:22:50Z,Kaiido
1399008313,whatwg/html,"That is a pretty glaring bug, thanks for filing this. `#she-policy-container` is the pre-rewrite equ",https://github.com/whatwg/html/issues/8725#issuecomment-1399008313,https://github.com/whatwg/html/issues/8725,document state's history policy container does not seem to be correctly updated,2023-01-20T22:06:53Z,domfarolino
1398833564,whatwg/html,"> WebGPU has run into this, but unfortunately I don't think Bikeshed can do this pattern. It always ",https://github.com/whatwg/html/issues/8743#issuecomment-1398833564,https://github.com/whatwg/html/issues/8743,Meta: should dfns in headings be viewed as exported definitions?,2023-01-20T19:24:39Z,tabatkins
1398811498,mozilla/standards-positions,"This change improves compatibility with other browsers, does not alter non-experimental behavior, an",https://github.com/mozilla/standards-positions/issues/737#issuecomment-1398811498,https://github.com/mozilla/standards-positions/issues/737,Never Unpartition Storage APIs via the Storage Access API,2023-01-20T19:02:19Z,bvandersloot-mozilla
1398319836,whatwg/html,To reply to https://github.com/whatwg/html/pull/5465#issuecomment-1397423778. I'm not sure I underst,https://github.com/whatwg/html/issues/8759#issuecomment-1398319836,https://github.com/whatwg/html/issues/8759,Add DOMParser option to parse declarative shadow DOM,2023-01-20T12:34:12Z,annevk
1398312829,whatwg/dom,"This should go to https://feedbackassistant.apple.com/ or https://bugs.webkit.org/. This repository ",https://github.com/whatwg/dom/issues/1144#issuecomment-1398312829,https://github.com/whatwg/dom/issues/1144," document.execCommand('copy') is deprecated so is it any other solution for support ios device.",2023-01-20T12:26:38Z,annevk
1398254456,whatwg/html,"> execCommand API, as well as text editors.  The `execCommand` API is very historical and is known",https://github.com/whatwg/html/issues/8751#issuecomment-1398254456,https://github.com/whatwg/html/issues/8751,Native support for indents,2023-01-20T11:31:03Z,Jamesernator
1398090257,whatwg/html,"Great! Let's close this, and feel free to point browser engineers here in the bugs you file. It's po",https://github.com/whatwg/html/issues/8757#issuecomment-1398090257,https://github.com/whatwg/html/issues/8757,MediaError not acccessible for a video element if using it with source elements,2023-01-20T08:59:13Z,domenic
1398081784,whatwg/html,"> did you find a part of the spec that distinguishes the source vs. src="""" cases?  I didn't. Looki",https://github.com/whatwg/html/issues/8757#issuecomment-1398081784,https://github.com/whatwg/html/issues/8757,MediaError not acccessible for a video element if using it with source elements,2023-01-20T08:50:05Z,callumgare
1398053040,whatwg/html,I am pretty sure after skimming the relevant parts of the spec that the `error` property should be p,https://github.com/whatwg/html/issues/8757#issuecomment-1398053040,https://github.com/whatwg/html/issues/8757,MediaError not acccessible for a video element if using it with source elements,2023-01-20T08:19:13Z,domenic
1398028426,whatwg/html,@josepharhar Yes. Thanks!,https://github.com/whatwg/html/issues/2988#issuecomment-1398028426,https://github.com/whatwg/html/issues/2988,What's the status of <option label> in cross-browser age?,2023-01-20T07:52:56Z,zcorpan
1397967482,whatwg/html,Thanks for such a fast review!  Resolved the comment. We'll leave this open (as a draft) until the,https://github.com/whatwg/html/pull/8754#issuecomment-1397967482,https://github.com/whatwg/html/pull/8754,Link processing: Update call to Manifest processing algorithm (interface changed),2023-01-20T06:17:44Z,mgiuca
