id,repo,body,url,issue_url,issue_title,created_at,user
1565255977,whatwg/html,"Hmm, according to CI, Safari does seem to have a special case after all. So we might be able to pick",https://github.com/whatwg/html/issues/9343#issuecomment-1565255977,https://github.com/whatwg/html/issues/9343,"pushState/replaceState have special handling for the empty string, which is not in the spec",2023-05-27T07:47:26Z,domenic
1565253128,whatwg/html,"Ah, great, Chrome and Firefox don't agree. Chrome's special case uses the document's base URL, Firef",https://github.com/whatwg/html/issues/9343#issuecomment-1565253128,https://github.com/whatwg/html/issues/9343,"pushState/replaceState have special handling for the empty string, which is not in the spec",2023-05-27T07:36:00Z,domenic
1565230266,whatwg/dom,So should I open the issue in Chrome and Safari?,https://github.com/whatwg/dom/issues/1201#issuecomment-1565230266,https://github.com/whatwg/dom/issues/1201,Event.composedPath() inconsistency between implementors.,2023-05-27T06:25:46Z,Jack-Works
1565148939,whatwg/html,"That separate discussion is #5802, and would be great if people were willing to tackle it.",https://github.com/whatwg/html/issues/9335#issuecomment-1565148939,https://github.com/whatwg/html/issues/9335,"""check popover algorithm"" check for open dialogs is weak",2023-05-27T01:56:33Z,domenic
1565148288,whatwg/html,Please use https://StackOverflow.com for coding help questions.,https://github.com/whatwg/html/issues/9342#issuecomment-1565148288,https://github.com/whatwg/html/issues/9342,Using <h4> in a <figure> to record title content within XHTML,2023-05-27T01:54:43Z,domenic
1565062394,whatwg/html,I agree with the comments above that we shouldn't mix the **invoker** and the **anchor**. It's possi,https://github.com/whatwg/html/issues/9311#issuecomment-1565062394,https://github.com/whatwg/html/issues/9311,Interaction between Popover API and CSS Anchor Positioning specs,2023-05-26T23:17:49Z,mfreed7
1565050871,w3c/editcontext,"Would something like this be appropriate?  ""6. [Queue a global task ](https://html.spec.whatwg.org",https://github.com/w3c/edit-context/issues/41#issuecomment-1565050871,https://github.com/w3c/edit-context/issues/41,"""text state"" updated from in parallel but also API accessible",2023-05-26T23:02:18Z,dandclark
1564856202,whatwg/html,> We found out that sites using older versions of this framework are affected: [valor-software/ngx-b,https://github.com/whatwg/html/issues/9042#issuecomment-1564856202,https://github.com/whatwg/html/issues/9042,popover attribute may not be web compatible,2023-05-26T19:50:50Z,nt1m
1564848678,whatwg/html," > I've found another one: [AlaskaAirlines/auro-popover#42](https://github.com/AlaskaAirlines/auro-",https://github.com/whatwg/html/issues/9042#issuecomment-1564848678,https://github.com/whatwg/html/issues/9042,popover attribute may not be web compatible,2023-05-26T19:42:32Z,mfreed7
1564842055,whatwg/html,"> > I wonder if we shouldn't change the spec so that removing open closes the dialog and explicitly ",https://github.com/whatwg/html/issues/9335#issuecomment-1564842055,https://github.com/whatwg/html/issues/9335,"""check popover algorithm"" check for open dialogs is weak",2023-05-26T19:35:49Z,mfreed7
1564839546,whatwg/html,"Thanks for the detailed analysis! It feels like we shouldn't require JS to implement this behavior, ",https://github.com/whatwg/html/issues/9019#issuecomment-1564839546,https://github.com/whatwg/html/issues/9019,Resetting forms on document reactivation,2023-05-26T19:33:30Z,mfreed7
1564808587,whatwg/html,> I wonder if we shouldn't change the spec so that removing open closes the dialog and explicitly re,https://github.com/whatwg/html/issues/9335#issuecomment-1564808587,https://github.com/whatwg/html/issues/9335,"""check popover algorithm"" check for open dialogs is weak",2023-05-26T19:02:57Z,nt1m
1564798947,whatwg/html,"> This isn't the case per the spec right now, the modal dialog will be hidden (display: none), but s",https://github.com/whatwg/html/issues/9335#issuecomment-1564798947,https://github.com/whatwg/html/issues/9335,"""check popover algorithm"" check for open dialogs is weak",2023-05-26T18:55:25Z,mfreed7
1564785922,whatwg/html,> Removing the open attribute on the modal dialog closes it  This isn't the case per the spec righ,https://github.com/whatwg/html/issues/9335#issuecomment-1564785922,https://github.com/whatwg/html/issues/9335,"""check popover algorithm"" check for open dialogs is weak",2023-05-26T18:42:31Z,nt1m
1564783120,whatwg/html,"Hmm, the behavior in Chromium is that `dialog0` is left showing as a popover. And that's what I'd ex",https://github.com/whatwg/html/issues/9335#issuecomment-1564783120,https://github.com/whatwg/html/issues/9335,"""check popover algorithm"" check for open dialogs is weak",2023-05-26T18:39:51Z,mfreed7
1564764177,whatwg/html,For example:  ```html <figure aria-labelledby = figure-title aria-details = figure-caption>    <,https://github.com/whatwg/html/issues/9342#issuecomment-1564764177,https://github.com/whatwg/html/issues/9342,Using <h4> in a <figure> to record title content within XHTML,2023-05-26T18:25:13Z,rthrejheytjyrtj545
1564764113,mozilla/standards-positions,"> This is great, thanks for driving this! I suggest position `positive`.  Thanks!   > Your idea",https://github.com/mozilla/standards-positions/issues/807#issuecomment-1564764113,https://github.com/mozilla/standards-positions/issues/807,Deprecation / Removal of Mutation Events,2023-05-26T18:25:08Z,mfreed7
1564763403,w3c/editcontext,Thanks -- should be fixed in #47.,https://github.com/w3c/edit-context/issues/42#issuecomment-1564763403,https://github.com/w3c/edit-context/issues/42,"Event dispatch is rather hand-wavy ",2023-05-26T18:24:21Z,dandclark
1564751205,w3c/editcontext,"@dontcallmedom , apologies for neglecting this PR. Things have moved around quite a bit since this w",https://github.com/w3c/edit-context/pull/31#issuecomment-1564751205,https://github.com/w3c/edit-context/pull/31,Add event interfaces to 'fire an event' phrases,2023-05-26T18:12:22Z,dandclark
1564750586,whatwg/html,Thanks again for your time and help.,https://github.com/whatwg/html/issues/9342#issuecomment-1564750586,https://github.com/whatwg/html/issues/9342,Using <h4> in a <figure> to record title content within XHTML,2023-05-26T18:11:47Z,KD-3240
1564746499,whatwg/html,> Authors MAY provide a figure an accessible name using aria-label or use aria-labelledby to referen,https://github.com/whatwg/html/issues/9342#issuecomment-1564746499,https://github.com/whatwg/html/issues/9342,Using <h4> in a <figure> to record title content within XHTML,2023-05-26T18:07:30Z,rthrejheytjyrtj545
1564716337,whatwg/html,> It doesn't really. Isn't tab switching quite similar case. Browsers do throttle the background tab,https://github.com/whatwg/html/issues/9315#issuecomment-1564716337,https://github.com/whatwg/html/issues/9315,Proposal: fire an event before the first rendering opportunity after activation,2023-05-26T17:40:22Z,noamr
1564703582,whatwg/html,"Thanks for the reply.  **Re: Use any element, but link it to figure with aria-labelledby.**  htt",https://github.com/whatwg/html/issues/9342#issuecomment-1564703582,https://github.com/whatwg/html/issues/9342,Using <h4> in a <figure> to record title content within XHTML,2023-05-26T17:26:31Z,KD-3240
1564691743,WICG/webcomponents,I'm interesting in particular in what happens if the nodes the `ChildNodePart` is referring to chang,https://github.com/WICG/webcomponents/issues/1010#issuecomment-1564691743,https://github.com/WICG/webcomponents/issues/1010,[dom-parts] Creation API,2023-05-26T17:15:19Z,tbondwilkinson
1564688099,WICG/webcomponents,What do you think about a fourth option where we have an `AttributePart` with a `.value` that is not,https://github.com/WICG/webcomponents/issues/1011#issuecomment-1564688099,https://github.com/WICG/webcomponents/issues/1011,[dom-parts] Attribute Grouping,2023-05-26T17:12:07Z,tbondwilkinson
1564683940,WICG/webcomponents,"I would expect parts to be deep cloned just like elements. If an attribute part reset back to empty ",https://github.com/WICG/webcomponents/issues/1012#issuecomment-1564683940,https://github.com/WICG/webcomponents/issues/1012,[dom-parts] cloneWithParts / cloneTree,2023-05-26T17:08:10Z,tbondwilkinson
1564662307,whatwg/html,"Use any element, but link it to figure with aria-labelledby.  Your argument about heading levels w",https://github.com/whatwg/html/issues/9342#issuecomment-1564662307,https://github.com/whatwg/html/issues/9342,Using <h4> in a <figure> to record title content within XHTML,2023-05-26T16:50:55Z,rthrejheytjyrtj545
1564631397,whatwg/html,It seems reasonable and is something folks have been asking for. I'm not sure about implementation c,https://github.com/whatwg/html/pull/9341#issuecomment-1564631397,https://github.com/whatwg/html/pull/9341,Re-add <source media> for media elements,2023-05-26T16:21:33Z,dalecurtis
1564485730,whatwg/html,@dalecurtis what do you think about implementing this in Chromium?  This was once implemented in C,https://github.com/whatwg/html/pull/9341#issuecomment-1564485730,https://github.com/whatwg/html/pull/9341,Re-add <source media> for media elements,2023-05-26T14:31:59Z,foolip
1564483166,whatwg/html,"Thanks, such threads are valuable for making a case so if there's more of them please do list them. ",https://github.com/whatwg/html/issues/9340#issuecomment-1564483166,https://github.com/whatwg/html/issues/9340,Proposal: Improve support for multiple target origins for Window#postMessage,2023-05-26T14:30:03Z,annevk
1564478378,whatwg/html,I don't have examples from the wild however I have seen threads like this while I was researching op,https://github.com/whatwg/html/issues/9340#issuecomment-1564478378,https://github.com/whatwg/html/issues/9340,Proposal: Improve support for multiple target origins for Window#postMessage,2023-05-26T14:26:15Z,eliasm307
1564464346,whatwg/html,"Let's limit the scope of this issue to the `media` attribute, so we can separately evaluate `srcset`",https://github.com/whatwg/html/issues/6363#issuecomment-1564464346,https://github.com/whatwg/html/issues/6363,HTML Video Element: Proposal For Reintroduction of Media in Source Elements,2023-05-26T14:16:20Z,zcorpan
1564416377,whatwg/html,Is there evidence that this is a pattern websites use in the wild? Somewhat frequently?  Why would,https://github.com/whatwg/html/issues/9340#issuecomment-1564416377,https://github.com/whatwg/html/issues/9340,Proposal: Improve support for multiple target origins for Window#postMessage,2023-05-26T13:43:13Z,annevk
1564412075,whatwg/html,"It doesn't really. Isn't tab switching quite similar case. Browsers do throttle the background tabs ",https://github.com/whatwg/html/issues/9315#issuecomment-1564412075,https://github.com/whatwg/html/issues/9315,Proposal: fire an event before the first rendering opportunity after activation,2023-05-26T13:39:37Z,smaug----
1564274832,whatwg/html,> The build fails because of #8175  That has now landed and I've rebased this PR. The build is now,https://github.com/whatwg/html/pull/8008#issuecomment-1564274832,https://github.com/whatwg/html/pull/8008,Add sizes=auto to lazy-loaded <img>,2023-05-26T11:52:08Z,zcorpan
1564258271,mozilla/standards-positions,MutationEvents have been deprecated in Gecko since 2012. We haven't been able to remove them becaus,https://github.com/mozilla/standards-positions/issues/807#issuecomment-1564258271,https://github.com/mozilla/standards-positions/issues/807,Deprecation / Removal of Mutation Events,2023-05-26T11:36:26Z,smaug----
1564225191,whatwg/dom,> the name composedPath indicates it is for DOM Node  I’m unsure what about the name suggests that,https://github.com/whatwg/dom/issues/1201#issuecomment-1564225191,https://github.com/whatwg/dom/issues/1201,Event.composedPath() inconsistency between implementors.,2023-05-26T11:06:37Z,bathos
1564206376,mozilla/standards-positions,"This is great, thanks for driving this! I suggest position `positive`.  Your ideas sound reasonabl",https://github.com/mozilla/standards-positions/issues/807#issuecomment-1564206376,https://github.com/mozilla/standards-positions/issues/807,Deprecation / Removal of Mutation Events,2023-05-26T10:51:32Z,zcorpan
1564118590,whatwg/html,I'm going to close this as we can't really reconsider the attribute names at this point.,https://github.com/whatwg/html/issues/9167#issuecomment-1564118590,https://github.com/whatwg/html/issues/9167,Should popovertarget be generic?,2023-05-26T09:46:31Z,annevk
1564069096,whatwg/html,"You also forgot about the `formtarget` attribute. We probably want to restructure ""get an element's ",https://github.com/whatwg/html/pull/9309#issuecomment-1564069096,https://github.com/whatwg/html/pull/9309,Ignore dangling markup in target name,2023-05-26T09:09:06Z,annevk
1564061997,whatwg/html,wow that's awesome,https://github.com/whatwg/html/issues/9334#issuecomment-1564061997,https://github.com/whatwg/html/issues/9334,Proposal: Meta Tag for AI Consent Management,2023-05-26T09:04:42Z,ramijwar
1564061880,webkit/standards-positions,"As @zcorpan noted in the PR, exfiltration would still be possible if the markup doesn't contain newl",https://github.com/WebKit/standards-positions/issues/188#issuecomment-1564061880,https://github.com/WebKit/standards-positions/issues/188,Ignore target names which contain both `\n` and `<` characters,2023-05-26T09:04:37Z,annevk
1563952624,whatwg/html,I've found another one: https://github.com/AlaskaAirlines/auro-popover/issues/42,https://github.com/whatwg/html/issues/9042#issuecomment-1563952624,https://github.com/whatwg/html/issues/9042,popover attribute may not be web compatible,2023-05-26T07:44:46Z,Totati
1563891561,webkit/standards-positions,"I think that still has the same fundamental problem, no? You're doing something non-standard, but no",https://github.com/WebKit/standards-positions/issues/127#issuecomment-1563891561,https://github.com/WebKit/standards-positions/issues/127,Permissions Policy: Unload,2023-05-26T06:52:24Z,annevk
1563773390,whatwg/html,I was just prototyping a version of this yesterday with a pair of style tags: ``` <style> .render,https://github.com/whatwg/html/issues/9332#issuecomment-1563773390,https://github.com/whatwg/html/issues/9332,Extend render-blocking to support other resources and Document,2023-05-26T03:48:07Z,nickcoury
1563595307,WICG/webcomponents,"Looks like Tue, July 18th 10am to 12pm PDT (5pm to 7pm UTC) is the current winner so far.",https://github.com/WICG/webcomponents/issues/999#issuecomment-1563595307,https://github.com/WICG/webcomponents/issues/999,Spring 2023 DOM Parts F2F,2023-05-25T22:38:24Z,rniwa
1563496213,whatwg/html,"> A possible solution is to fire this event if rendering is still cached, but we force it if there's",https://github.com/whatwg/html/issues/9315#issuecomment-1563496213,https://github.com/whatwg/html/issues/9315,Proposal: fire an event before the first rendering opportunity after activation,2023-05-25T20:56:00Z,khushalsagar
1563388522,w3ctag/design-reviews,FYI: this feature has been merged into the [dom spec](https://dom.spec.whatwg.org/#dom-abortsignal-a,https://github.com/w3ctag/design-reviews/issues/737#issuecomment-1563388522,https://github.com/w3ctag/design-reviews/issues/737,Design review: AbortSignal.any(),2023-05-25T19:13:33Z,shaseley
1563384205,whatwg/html,"No problem. What I suggested to you in the comment above is a move away from metadata in favor of a ",https://github.com/whatwg/html/issues/9334#issuecomment-1563384205,https://github.com/whatwg/html/issues/9334,Proposal: Meta Tag for AI Consent Management,2023-05-25T19:09:27Z,rthrejheytjyrtj545
1563382699,whatwg/html,Thank you!,https://github.com/whatwg/html/issues/9334#issuecomment-1563382699,https://github.com/whatwg/html/issues/9334,Proposal: Meta Tag for AI Consent Management,2023-05-25T19:08:08Z,brennancaldwell
1563324625,whatwg/html,"By the way, if you leave it in force something similar to DNT, you [can](//microformats.org/wiki/pro",https://github.com/whatwg/html/issues/9334#issuecomment-1563324625,https://github.com/whatwg/html/issues/9334,Proposal: Meta Tag for AI Consent Management,2023-05-25T18:22:18Z,rthrejheytjyrtj545
1563271379,whatwg/html,"These are great points! Thank you for pointing these out. I had considered just proposing `all` and ",https://github.com/whatwg/html/issues/9334#issuecomment-1563271379,https://github.com/whatwg/html/issues/9334,Proposal: Meta Tag for AI Consent Management,2023-05-25T17:35:46Z,brennancaldwell
1563247004,whatwg/dom,"cc: @annevk. It probably makes sense do to this first so specs can be updated, then un-export signal",https://github.com/whatwg/dom/pull/1202#issuecomment-1563247004,https://github.com/whatwg/dom/pull/1202,Export AbortController's signal,2023-05-25T17:15:15Z,shaseley
1563227935,whatwg/html,"Why should the author explicitly choose `none` to indicate that they do not agree? What is meant by ",https://github.com/whatwg/html/issues/9334#issuecomment-1563227935,https://github.com/whatwg/html/issues/9334,Proposal: Meta Tag for AI Consent Management,2023-05-25T16:59:12Z,rthrejheytjyrtj545
1563168752,whatwg/html,"Looks like https://github.com/whatwg/html/pull/9198 could address this one, the update in ""hide all ",https://github.com/whatwg/html/issues/9319#issuecomment-1563168752,https://github.com/whatwg/html/issues/9319,Another corner case about nested popovers,2023-05-25T16:12:21Z,cathiechen
1563167207,whatwg/html,@annevk sure,https://github.com/whatwg/html/pull/8175#issuecomment-1563167207,https://github.com/whatwg/html/pull/8175,Rename 'intrinsic dimensions' to 'natural dimensions' to match CSS,2023-05-25T16:11:08Z,zcorpan
1563150479,whatwg/html,@zcorpan can we move the IDs to the `<dfn>`? If you're done with this PR I'm happy to do it before m,https://github.com/whatwg/html/pull/8175#issuecomment-1563150479,https://github.com/whatwg/html/pull/8175,Rename 'intrinsic dimensions' to 'natural dimensions' to match CSS,2023-05-25T15:59:44Z,annevk
1563149264,whatwg/html,Thanks @schwering!,https://github.com/whatwg/html/pull/9333#issuecomment-1563149264,https://github.com/whatwg/html/pull/9333,"Fix typo ""traversible""",2023-05-25T15:58:55Z,annevk
1563130342,whatwg/html,"> > I'm hoping to write more whenever I have time. >  > Hello, just checking in on this issue! Any",https://github.com/whatwg/html/pull/9047#issuecomment-1563130342,https://github.com/whatwg/html/pull/9047,Spec :user-invalid & :user-valid,2023-05-25T15:45:22Z,nt1m
1563074766,whatwg/html," >  > I'm hoping to write more whenever I have time.  Hello, just checking in on this issue! Any",https://github.com/whatwg/html/pull/9047#issuecomment-1563074766,https://github.com/whatwg/html/pull/9047,Spec :user-invalid & :user-valid,2023-05-25T15:07:37Z,mfreed7
1563073081,whatwg/html,"Thanks for the feedback, Anne! I've updated the PR but I'll upload another patch that extends the ex",https://github.com/whatwg/html/pull/8801#issuecomment-1563073081,https://github.com/whatwg/html/pull/8801,Define eligibility for autofill,2023-05-25T15:06:32Z,schwering
1562939075,mozilla/standards-positions,"A bit of a nitpick, but what ""standard"" are we supposed to have a position on? There's a link to an ",https://github.com/mozilla/standards-positions/issues/806#issuecomment-1562939075,https://github.com/mozilla/standards-positions/issues/806,Standardizing Security Semantics for Cross-Site Cookies,2023-05-25T13:45:32Z,dveditz
1562841061,whatwg/html,"> google.com falls into the third category, but wants to clear the value on history navigation. Howe",https://github.com/whatwg/html/issues/9019#issuecomment-1562841061,https://github.com/whatwg/html/issues/9019,Resetting forms on document reactivation,2023-05-25T12:43:05Z,zcorpan
1562806561,whatwg/html,I'm happy to explore other heuristics. Just using URL's list of removable whitespace and `<` was one,https://github.com/whatwg/html/pull/9309#issuecomment-1562806561,https://github.com/whatwg/html/pull/9309,Ignore dangling markup in target name,2023-05-25T12:16:57Z,mikewest
1562793337,whatwg/html,"@mikewest ok. Many sites use minimizers and therefore no tabs or newlines, and so would still be vul",https://github.com/whatwg/html/pull/9309#issuecomment-1562793337,https://github.com/whatwg/html/pull/9309,Ignore dangling markup in target name,2023-05-25T12:09:07Z,zcorpan
1562685429,whatwg/html,"The spec says for autocomplete=off:  > The ""off"" keyword indicates either that the control's input",https://github.com/whatwg/html/issues/9019#issuecomment-1562685429,https://github.com/whatwg/html/issues/9019,Resetting forms on document reactivation,2023-05-25T10:45:01Z,zcorpan
1562650767,whatwg/html,"@zcorpan: For URLs, checking the removable whitespace was both pragmatic (since we're already walkin",https://github.com/whatwg/html/pull/9309#issuecomment-1562650767,https://github.com/whatwg/html/pull/9309,Ignore dangling markup in target name,2023-05-25T10:17:20Z,mikewest
1562605987,w3c/pointerevents,I am going to add a test in https://bugzilla.mozilla.org/show_bug.cgi?id=1529904.,https://github.com/w3c/pointerevents/issues/457#issuecomment-1562605987,https://github.com/w3c/pointerevents/issues/457,pointerout even if the pointer doesn't move?,2023-05-25T09:44:59Z,EdgarChen
1562508420,whatwg/html,"Demos: [window.open()](https://software.hixie.ch/utilities/js/live-dom-viewer/saved/11695), [window.",https://github.com/whatwg/html/issues/9310#issuecomment-1562508420,https://github.com/whatwg/html/issues/9310,"""fallback base URL"" algorithm seems wrong for popups?",2023-05-25T08:36:34Z,zcorpan
1562467410,mozilla/standards-positions,I'm rather interested in this topic as well. I would really like to see the Web Bluetooth API availa,https://github.com/mozilla/standards-positions/issues/720#issuecomment-1562467410,https://github.com/mozilla/standards-positions/issues/720,Revisiting negative positions through Add-On Gating,2023-05-25T08:06:32Z,FroggMaster
1562378601,w3c/editcontext,If it's available synchronously to the OS it cannot be synchronously available to the event loop. Th,https://github.com/w3c/edit-context/issues/41#issuecomment-1562378601,https://github.com/w3c/edit-context/issues/41,"""text state"" updated from in parallel but also API accessible",2023-05-25T06:57:53Z,annevk
1562139734,w3c/editcontext,The details under the hood of the [Text Edit Context](https://w3c.github.io/edit-context/#dfn-text-e,https://github.com/w3c/edit-context/issues/41#issuecomment-1562139734,https://github.com/w3c/edit-context/issues/41,"""text state"" updated from in parallel but also API accessible",2023-05-25T01:39:56Z,dandclark
1562055445,mozilla/standards-positions,"You don't need to use the special link, when clicking on new, you get the template chooser as seen o",https://github.com/mozilla/standards-positions/pull/793#issuecomment-1562055445,https://github.com/mozilla/standards-positions/pull/793,chore: port GitHub issue form from Webkit,2023-05-24T23:34:58Z,nschonni
1562037850,w3c/editcontext,"Was just looking at this. The lines affected here have all moved and changed, but we need to make si",https://github.com/w3c/edit-context/pull/31#issuecomment-1562037850,https://github.com/w3c/edit-context/pull/31,Add event interfaces to 'fire an event' phrases,2023-05-24T23:08:34Z,dandclark
1562036568,w3c/editcontext,@dandclark FYI..,https://github.com/w3c/edit-context/pull/31#issuecomment-1562036568,https://github.com/w3c/edit-context/pull/31,Add event interfaces to 'fire an event' phrases,2023-05-24T23:06:41Z,snianu
1561956970,webkit/standards-positions,"Thanks for pointing that out John, and apologies, we'll look into that.",https://github.com/WebKit/standards-positions/issues/191#issuecomment-1561956970,https://github.com/WebKit/standards-positions/issues/191,Standardizing Security Semantics of Cross-Site Cookies,2023-05-24T21:36:38Z,johannhof
1561929862,whatwg/html,"@annevk thanks, fixed. I found some more ""natural dimensions"" that should be ""density-corrected natu",https://github.com/whatwg/html/pull/8175#issuecomment-1561929862,https://github.com/whatwg/html/pull/8175,Rename 'intrinsic dimensions' to 'natural dimensions' to match CSS,2023-05-24T21:09:31Z,zcorpan
1561902085,whatwg/html,"> Is the tab or newline check needed? It seems simpler to just check for `<`  This change follows ",https://github.com/whatwg/html/pull/9309#issuecomment-1561902085,https://github.com/whatwg/html/pull/9309,Ignore dangling markup in target name,2023-05-24T20:44:40Z,shhnjk
1561851171,mozilla/standards-positions,"@emilio @dholbert ",https://github.com/mozilla/standards-positions/issues/794#issuecomment-1561851171,https://github.com/mozilla/standards-positions/issues/794,CSS Anchor Positioning,2023-05-24T19:59:14Z,zcorpan
1561847929,whatwg/html,Is the tab or newline check needed? It seems simpler to just check for `<`,https://github.com/whatwg/html/pull/9309#issuecomment-1561847929,https://github.com/whatwg/html/pull/9309,Ignore dangling markup in target name,2023-05-24T19:56:32Z,zcorpan
1561802012,mozilla/standards-positions,The only thing I can think of is [this script](https://github.com/bgrins/compat-utils/blob/3de6a28ce,https://github.com/mozilla/standards-positions/pull/793#issuecomment-1561802012,https://github.com/mozilla/standards-positions/pull/793,chore: port GitHub issue form from Webkit,2023-05-24T19:18:07Z,bgrins
1561800771,whatwg/html,Renewed attention on this is very exciting to see! I still feel the same about the validity of the u,https://github.com/whatwg/html/issues/6363#issuecomment-1561800771,https://github.com/whatwg/html/issues/6363,HTML Video Element: Proposal For Reintroduction of Media in Source Elements,2023-05-24T19:16:59Z,scottjehl
