id,repo,body,url,issue_url,issue_title,created_at,user
1628856902,mozilla/standards-positions,The C2PA specification can be found at https://c2pa.org/specifications/specifications/1.3/specs/C2PA,https://github.com/mozilla/standards-positions/issues/843#issuecomment-1628856902,https://github.com/mozilla/standards-positions/issues/843,Content Provenance and Authenticity,2023-07-10T12:25:55Z,lrosenthol
1628856255,webkit/standards-positions,The C2PA specification can be found at https://c2pa.org/specifications/specifications/1.3/specs/C2PA,https://github.com/WebKit/standards-positions/issues/226#issuecomment-1628856255,https://github.com/WebKit/standards-positions/issues/226,Content Provenance and Authenticity,2023-07-10T12:25:27Z,lrosenthol
1628595030,whatwg/html,"> Yeah, there's a difference between not being able to show and hiding no-opping. This was discussed",https://github.com/whatwg/html/pull/9142#issuecomment-1628595030,https://github.com/whatwg/html/pull/9142,Don't throw when popover/dialog is in requested state,2023-07-10T09:37:47Z,mbrodesser-Igalia
1628589622,whatwg/html,"> You can't really change the tagname for `<dialog>`  True.  >, so there isn't a parallel here I",https://github.com/whatwg/html/pull/9142#issuecomment-1628589622,https://github.com/whatwg/html/pull/9142,Don't throw when popover/dialog is in requested state,2023-07-10T09:34:06Z,mbrodesser-Igalia
1628570477,whatwg/html,"PTAL again, I think I included all the suggested changes.",https://github.com/whatwg/html/pull/9360#issuecomment-1628570477,https://github.com/whatwg/html/pull/9360,Add back/forward cache NotRestoredReasons,2023-07-10T09:21:11Z,rubberyuzu
1628537800,whatwg/html,> Be aware that hidePopover() called on an element without the popover attribute does throw. See htt,https://github.com/whatwg/html/pull/9142#issuecomment-1628537800,https://github.com/whatwg/html/pull/9142,Don't throw when popover/dialog is in requested state,2023-07-10T09:00:45Z,nt1m
1628520317,whatwg/html,"> > However, that doesn't cover the case when a popover is transitioning from ""showing"" to ""hidden"".",https://github.com/whatwg/html/issues/9459#issuecomment-1628520317,https://github.com/whatwg/html/issues/9459,"When atrribute value changes, do we run hiding popover algorithm regardless?",2023-07-10T08:48:48Z,mbrodesser-Igalia
1628501873,whatwg/html,"CC @nt1m @rwlbuis ",https://github.com/whatwg/html/pull/9481#issuecomment-1628501873,https://github.com/whatwg/html/pull/9481,"Set popover invoker immediately after changing popover's visibility state to ""showing""",2023-07-10T08:36:31Z,mbrodesser-Igalia
1628490967,whatwg/html,"> The current setup is consistent with dialog fwiw, `HTMLDialogElement::close()` does not throw, but",https://github.com/whatwg/html/pull/9142#issuecomment-1628490967,https://github.com/whatwg/html/pull/9142,Don't throw when popover/dialog is in requested state,2023-07-10T08:29:00Z,mbrodesser-Igalia
1628468812,whatwg/html,> Hmm yeah I see that the child popover can be showing while the parent is not showing. I suppose it,https://github.com/whatwg/html/issues/9487#issuecomment-1628468812,https://github.com/whatwg/html/issues/9487,"Showing only a child popover causes ""beforetoggle"" and ""toggle"" events but popover is invisble",2023-07-10T08:17:31Z,mbrodesser-Igalia
1628425892,whatwg/html,A test is located in html/semantics/forms/attributes-common-to-form-controls/dirname-only-if-applies,https://github.com/whatwg/html/pull/9490#issuecomment-1628425892,https://github.com/whatwg/html/pull/9490,Make dirname apply to hidden/tel/url/email inputs,2023-07-10T07:53:20Z,vinhill
1628041798,whatwg/html,"> > I think it doesn't make sense to tighten the mitigation just for target attributes, if the URL p",https://github.com/whatwg/html/pull/9309#issuecomment-1628041798,https://github.com/whatwg/html/pull/9309,Ignore dangling markup in target name,2023-07-10T03:27:30Z,shhnjk
1627773085,webkit/standards-positions,"Hi WebKit team @rniwa and @annevk, please let us know if you have any updates on this topic. Even if",https://github.com/WebKit/standards-positions/issues/97#issuecomment-1627773085,https://github.com/WebKit/standards-positions/issues/97,Customized built-in elements,2023-07-09T16:59:47Z,anarh
1627728381,webkit/standards-positions,#15 has a general concerns privacy tag on the basis of fingerprinting which is a similar concern wit,https://github.com/WebKit/standards-positions/issues/225#issuecomment-1627728381,https://github.com/WebKit/standards-positions/issues/225,Media query to indicate preference for shapes over colours,2023-07-09T14:16:50Z,lukewarlow
1627721195,webkit/standards-positions,The W3C TAG review essentially dismissed this solution and asked for something else: https://github.,https://github.com/WebKit/standards-positions/issues/219#issuecomment-1627721195,https://github.com/WebKit/standards-positions/issues/219,prefers-reduced-data,2023-07-09T13:47:00Z,annevk
1627719478,whatwg/html,"No strong opinion. While synchronous events around node tree mutations make me a bit nervous, they a",https://github.com/whatwg/html/pull/9457#issuecomment-1627719478,https://github.com/whatwg/html/pull/9457,Ignore DOM state when hiding popovers if needed,2023-07-09T13:40:41Z,annevk
1627715629,whatwg/html,We should still update HTML to point to the new locations. No need to let everyone hit redirects for,https://github.com/whatwg/html/issues/9502#issuecomment-1627715629,https://github.com/whatwg/html/issues/9502,Broken MathML links,2023-07-09T13:25:29Z,annevk
1627669241,whatwg/html,Works,https://github.com/whatwg/html/issues/9502#issuecomment-1627669241,https://github.com/whatwg/html/issues/9502,Broken MathML links,2023-07-09T10:13:56Z,lauch788
1627437979,whatwg/html,"hmm I just noticed previous redirect had been moved from .htaccess by w3c admin, I'll check what w3c",https://github.com/whatwg/html/issues/9502#issuecomment-1627437979,https://github.com/whatwg/html/issues/9502,Broken MathML links,2023-07-08T17:42:35Z,davidcarlisle
1627397110,whatwg/html,``` $ cvs diff .htaccess Index: .htaccess =======================================================,https://github.com/whatwg/html/issues/9502#issuecomment-1627397110,https://github.com/whatwg/html/issues/9502,Broken MathML links,2023-07-08T16:42:35Z,davidcarlisle
1627395461,whatwg/html,"@annevk  yes I was wondering about that. I added a redirect for the top level the other day, redirec",https://github.com/whatwg/html/issues/9502#issuecomment-1627395461,https://github.com/whatwg/html/issues/9502,Broken MathML links,2023-07-08T16:32:50Z,davidcarlisle
1627388226,whatwg/html,Could you set up redirects? There's many snapshots of HTML that will now have broken links.,https://github.com/whatwg/html/issues/9502#issuecomment-1627388226,https://github.com/whatwg/html/issues/9502,Broken MathML links,2023-07-08T16:00:21Z,annevk
1627382823,whatwg/html,they were to editors draft so same fragids but https://w3c.github.io/mathml/ (we don't build a mulip,https://github.com/whatwg/html/issues/9502#issuecomment-1627382823,https://github.com/whatwg/html/issues/9502,Broken MathML links,2023-07-08T15:38:47Z,davidcarlisle
1627189269,whatwg/html,cc @davidcarlisle @NSoiffer,https://github.com/whatwg/html/issues/9502#issuecomment-1627189269,https://github.com/whatwg/html/issues/9502,Broken MathML links,2023-07-08T12:06:02Z,annevk
1626347343,webkit/standards-positions,Having discussed this more with colleagues and given the lack of opposing feedback in this issue I s,https://github.com/WebKit/standards-positions/issues/86#issuecomment-1626347343,https://github.com/WebKit/standards-positions/issues/86,Sanitizer API,2023-07-07T23:05:30Z,annevk
1626344221,whatwg/html,@annevk [a button which resets the forms contents](https://developer.mozilla.org/en-US/docs/Web/HTML,https://github.com/whatwg/html/pull/9456#issuecomment-1626344221,https://github.com/whatwg/html/pull/9456,add dialogmodaltarget attribute,2023-07-07T22:59:13Z,keithamus
1626342009,webkit/standards-positions,Removing the position for now as we should follow the process outlined at https://github.com/WebKit/,https://github.com/WebKit/standards-positions/issues/202#issuecomment-1626342009,https://github.com/WebKit/standards-positions/issues/202,fill-color/image/origin/position CSS properties,2023-07-07T22:55:04Z,annevk
1626267266,webkit/standards-positions,"> > In my view, we've already paid the cost of mutation events. Since there are other events that fi",https://github.com/WebKit/standards-positions/issues/192#issuecomment-1626267266,https://github.com/WebKit/standards-positions/issues/192,Deprecation / Removal of Mutation Events,2023-07-07T22:12:23Z,rniwa
1626048860,whatwg/html,@keithamus what does `type=reset` mean there?,https://github.com/whatwg/html/pull/9456#issuecomment-1626048860,https://github.com/whatwg/html/pull/9456,add dialogmodaltarget attribute,2023-07-07T20:30:08Z,annevk
1625718874,whatwg/html,Sure. Content-Security-Policy is the only thing preventing `javascript:` from running. It should not,https://github.com/whatwg/html/issues/9500#issuecomment-1625718874,https://github.com/whatwg/html/issues/9500,Introduce scopes to openers,2023-07-07T17:25:24Z,SoniEx2
1625664331,whatwg/html,"Please see https://whatwg.org/faq#adding-new-features, especially step 1.",https://github.com/whatwg/html/issues/9500#issuecomment-1625664331,https://github.com/whatwg/html/issues/9500,Introduce scopes to openers,2023-07-07T16:33:00Z,domenic
1625507275,whatwg/html,Sorry for the delay. @yiyix,https://github.com/whatwg/html/pull/5826#issuecomment-1625507275,https://github.com/whatwg/html/pull/5826,Reference even more baseline concepts in CSS Inline Layout,2023-07-07T14:34:16Z,fserb
1625162864,w3ctag/design-reviews,"Hi there @natechapin, @domenic, a quick request for clarification:  > * Security and Privacy self-",https://github.com/w3ctag/design-reviews/issues/867#issuecomment-1625162864,https://github.com/w3ctag/design-reviews/issues/867,navigateEvent.sourceElement,2023-07-07T09:55:44Z,letitz
1625060436,whatwg/html,"@eeeps thanks, yeah agreed it's a bit surprising. Adding `contain-intrinsic-size` seems ok, what do ",https://github.com/whatwg/html/issues/9448#issuecomment-1625060436,https://github.com/whatwg/html/issues/9448,auto-sizes concrete object size ignoring natural dimensions is not implementable,2023-07-07T08:40:06Z,zcorpan
1625010148,whatwg/html,"> * If the `/` is preceded by an unquoted attribute value with no space, continue to treat is as par",https://github.com/whatwg/html/issues/9491#issuecomment-1625010148,https://github.com/whatwg/html/issues/9491,Allow self-closing tags everywhere,2023-07-07T08:21:41Z,jakearchibald
1624582061,whatwg/html,"@zcorpan   > It seems that so far this feature has very low adoption rate despite being supported ",https://github.com/whatwg/html/issues/3518#issuecomment-1624582061,https://github.com/whatwg/html/issues/3518,Proposal: HTML passwordrules attribute,2023-07-07T03:02:31Z,dead-claudia
1624467063,whatwg/html,@Constellation do you think it would make sense to have the limit on regular expressions only for `<,https://github.com/whatwg/html/issues/9469#issuecomment-1624467063,https://github.com/whatwg/html/issues/9469,Specify a maximal depth of backtracking for the pattern attribute on input elements,2023-07-07T00:23:55Z,annevk
1624449842,whatwg/html,Yeah this seems reasonable.,https://github.com/whatwg/html/issues/9225#issuecomment-1624449842,https://github.com/whatwg/html/issues/9225,Dirname should work with more input types,2023-07-06T23:58:07Z,annevk
1624415892,webkit/standards-positions,Suggested labels:  topic: media  venue: W3C Media WG  from: Google,https://github.com/WebKit/standards-positions/issues/223#issuecomment-1624415892,https://github.com/WebKit/standards-positions/issues/223,WebCodecs: Per-frame quantizer in VideoEncoder,2023-07-06T23:07:26Z,Djuffin
1624359783,whatwg/html,"Just to clarify, as I don't think it's made clear in the proposal yet, would it be: 1. If the `/` i",https://github.com/whatwg/html/issues/9491#issuecomment-1624359783,https://github.com/whatwg/html/issues/9491,Allow self-closing tags everywhere,2023-07-06T21:59:20Z,zealvurte
1624335944,whatwg/html,Thanks. You definitely hit the nail on the head as to why I was confused by this:  1. `disabled` m,https://github.com/whatwg/html/issues/9496#issuecomment-1624335944,https://github.com/whatwg/html/issues/9496,Improve description of `readonly` attribute,2023-07-06T21:32:24Z,aaronadamsCA
1624306851,whatwg/html,"My own feelings and [a tiny, informal poll](https://front-end.social/@eeeps/110664068280045918) lead",https://github.com/whatwg/html/issues/9448#issuecomment-1624306851,https://github.com/whatwg/html/issues/9448,auto-sizes concrete object size ignoring natural dimensions is not implementable,2023-07-06T21:03:44Z,eeeps
1624301305,whatwg/html,"I agree that this is somewhat confusing, but I think the current text is still accurate. `readonly` ",https://github.com/whatwg/html/issues/9496#issuecomment-1624301305,https://github.com/whatwg/html/issues/9496,Improve description of `readonly` attribute,2023-07-06T20:58:24Z,annevk
1624222077,whatwg/html,"@cunlic add every single custom element that doesn't need children in it to the equation, but it req",https://github.com/whatwg/html/issues/9491#issuecomment-1624222077,https://github.com/whatwg/html/issues/9491,Allow self-closing tags everywhere,2023-07-06T19:45:20Z,WebReflection
1624171670,whatwg/html,"I'm not really bothered about the ability to self-close a div, but it would be very nice if self-clo",https://github.com/whatwg/html/issues/9491#issuecomment-1624171670,https://github.com/whatwg/html/issues/9491,Allow self-closing tags everywhere,2023-07-06T18:59:25Z,cunlic
1624127354,whatwg/html,"My XHTML point was an answer to outdated tools that, if legacy enough, wonâ€™t have issues with Jakeâ€™s",https://github.com/whatwg/html/issues/9491#issuecomment-1624127354,https://github.com/whatwg/html/issues/9491,Allow self-closing tags everywhere,2023-07-06T18:21:15Z,WebReflection
1624016458,whatwg/html,If you wish to use xhtml you can set the content-type of your server responses to `application/xhtml,https://github.com/whatwg/html/issues/9491#issuecomment-1624016458,https://github.com/whatwg/html/issues/9491,Allow self-closing tags everywhere,2023-07-06T17:04:57Z,keithamus
1624016182,whatwg/html,> @past I am interested in joining the call and contributing to the issues if any.  Which issue do,https://github.com/whatwg/html/issues/9474#issuecomment-1624016182,https://github.com/whatwg/html/issues/9474,Upcoming HTML standard issue triage meeting on 7/13/2023,2023-07-06T17:04:44Z,past
1624004115,whatwg/html,"if parsers are already available I don't get the concern ... enable a lightweight, not throwing, XHT",https://github.com/whatwg/html/issues/9491#issuecomment-1624004115,https://github.com/whatwg/html/issues/9491,Allow self-closing tags everywhere,2023-07-06T16:55:05Z,WebReflection
1623995499,whatwg/html,> > The snippet is what an attacker would use as user-generated content that is allowed by the page',https://github.com/whatwg/html/issues/9491#issuecomment-1623995499,https://github.com/whatwg/html/issues/9491,Allow self-closing tags everywhere,2023-07-06T16:47:46Z,zcorpan
1623961386,whatwg/html,Also 19 instances in [GitHub code search](https://github.com/search?q=passwordrules%3D+language%3Aht,https://github.com/whatwg/html/issues/3518#issuecomment-1623961386,https://github.com/whatwg/html/issues/3518,Proposal: HTML passwordrules attribute,2023-07-06T16:20:49Z,zcorpan
1623950016,webkit/standards-positions,"It seems that analysis is ignoring a couple aspects, such as Chromium's current implementation not b",https://github.com/WebKit/standards-positions/issues/200#issuecomment-1623950016,https://github.com/WebKit/standards-positions/issues/200,Making unload opt-in via Permissions Policy,2023-07-06T16:13:24Z,annevk
1623940647,whatwg/html,Checking usage in httparchive: currently 22 pages use a `passwordrules` attribute on `input` (out of,https://github.com/whatwg/html/issues/3518#issuecomment-1623940647,https://github.com/whatwg/html/issues/3518,Proposal: HTML passwordrules attribute,2023-07-06T16:09:19Z,zcorpan
1623939283,whatwg/html,"> Gecko with my patch from https://bugzilla.mozilla.org/show_bug.cgi?id=543435 reports 0 as well as ",https://github.com/whatwg/html/issues/9030#issuecomment-1623939283,https://github.com/whatwg/html/issues/9030,History length/index are not synchronously initialized in new navigables,2023-07-06T16:08:26Z,domfarolino
1623916421,webkit/standards-positions,It seems this might be https://github.com/whatwg/html/pull/9360 and thus it's WHATWG?,https://github.com/WebKit/standards-positions/issues/154#issuecomment-1623916421,https://github.com/WebKit/standards-positions/issues/154,Back/forward cache NotRestoredReasons API,2023-07-06T15:53:05Z,annevk
1623912733,whatwg/html,"> However, that doesn't cover the case when a popover is transitioning from ""showing"" to ""hidden"". S",https://github.com/whatwg/html/issues/9459#issuecomment-1623912733,https://github.com/whatwg/html/issues/9459,"When atrribute value changes, do we run hiding popover algorithm regardless?",2023-07-06T15:50:28Z,josepharhar
1623909006,webkit/standards-positions,FYI there's an [Intent to Ship for this over at blink-dev](https://groups.google.com/a/chromium.org/,https://github.com/WebKit/standards-positions/issues/154#issuecomment-1623909006,https://github.com/WebKit/standards-positions/issues/154,Back/forward cache NotRestoredReasons API,2023-07-06T15:47:49Z,miketaylr
1623906023,whatwg/html,Corresponding change is being merged in chromium: https://chromium-review.googlesource.com/c/chromiu,https://github.com/whatwg/html/pull/9481#issuecomment-1623906023,https://github.com/whatwg/html/pull/9481,"Set popover invoker immediately after changing popover's visibility state to ""showing""",2023-07-06T15:45:48Z,josepharhar
1623900510,whatwg/html,> [](https://bugzilla.mozilla.org/show_bug.cgi?id=1615315) >  > An exploit here could be something,https://github.com/whatwg/html/issues/9491#issuecomment-1623900510,https://github.com/whatwg/html/issues/9491,Allow self-closing tags everywhere,2023-07-06T15:41:59Z,bogger33
1623876042,whatwg/html,"maybe this is worth clarifying for the sake of this discussion, and I don't know if @jakearchibald h",https://github.com/whatwg/html/issues/9491#issuecomment-1623876042,https://github.com/whatwg/html/issues/9491,Allow self-closing tags everywhere,2023-07-06T15:25:07Z,WebReflection
1623864712,whatwg/html,"> You can use HTML elements in XML (which you might also call XHTML).  imagine it's 22 years I am ",https://github.com/whatwg/html/issues/9491#issuecomment-1623864712,https://github.com/whatwg/html/issues/9491,Allow self-closing tags everywhere,2023-07-06T15:17:42Z,WebReflection
1623850119,whatwg/html,> I agree with what you are saying but I am also hearing HTML as it is won't ever change from now on,https://github.com/whatwg/html/issues/9491#issuecomment-1623850119,https://github.com/whatwg/html/issues/9491,Allow self-closing tags everywhere,2023-07-06T15:08:08Z,zcorpan
1623835793,whatwg/html,> not sure I am following that neither ... you are creating invalid layout on purpose  The snippet,https://github.com/whatwg/html/issues/9491#issuecomment-1623835793,https://github.com/whatwg/html/issues/9491,Allow self-closing tags everywhere,2023-07-06T14:59:30Z,zcorpan
1623827639,whatwg/html,"> > You can use XML. >  > to see no image and have no HTML at all on the page, even with correct l",https://github.com/whatwg/html/issues/9491#issuecomment-1623827639,https://github.com/whatwg/html/issues/9491,Allow self-closing tags everywhere,2023-07-06T14:54:41Z,zcorpan
1623807172,whatwg/html,I agree with what you are saying but I am also hearing HTML as it is won't ever change from now on .,https://github.com/whatwg/html/issues/9491#issuecomment-1623807172,https://github.com/whatwg/html/issues/9491,Allow self-closing tags everywhere,2023-07-06T14:42:57Z,WebReflection
1623798182,w3c/pointerevents,"FYI: the content of the moved section (from Section 12 into Section 4.1.4) remains unchanged except ",https://github.com/w3c/pointerevents/pull/476#issuecomment-1623798182,https://github.com/w3c/pointerevents/pull/476,"Editorial changes: move tilt calculation section, normalize header tags",2023-07-06T14:37:29Z,mustaqahmed
1623794848,whatwg/html,"> OK, but the only example is a malformed layout with an old XSS thing from the 90s' ... does anyone",https://github.com/whatwg/html/issues/9491#issuecomment-1623794848,https://github.com/whatwg/html/issues/9491,Allow self-closing tags everywhere,2023-07-06T14:35:22Z,keithamus
1623780226,whatwg/html,"OK, but the only example is a malformed layout with an old XSS thing from the 90s' ... does anyone e",https://github.com/whatwg/html/issues/9491#issuecomment-1623780226,https://github.com/whatwg/html/issues/9491,Allow self-closing tags everywhere,2023-07-06T14:26:09Z,WebReflection
1623777608,whatwg/html,"> > However, the problem lies with user land libraries >  > I wonder if these concerns were raised",https://github.com/whatwg/html/issues/9491#issuecomment-1623777608,https://github.com/whatwg/html/issues/9491,Allow self-closing tags everywhere,2023-07-06T14:24:30Z,keithamus
1623774776,whatwg/html,"> However, the problem lies with user land libraries  I wonder if these concerns were raised when ",https://github.com/whatwg/html/issues/9491#issuecomment-1623774776,https://github.com/whatwg/html/issues/9491,Allow self-closing tags everywhere,2023-07-06T14:22:40Z,WebReflection
1623771028,whatwg/html,> > Declaring self closing mode on a page and using a library which does not support/detect will exp,https://github.com/whatwg/html/issues/9491#issuecomment-1623771028,https://github.com/whatwg/html/issues/9491,Allow self-closing tags everywhere,2023-07-06T14:20:15Z,keithamus
1623764122,whatwg/html,"> the doctype has in browsers is to prevent browsers from using quirks mode to render the document ",https://github.com/whatwg/html/issues/9491#issuecomment-1623764122,https://github.com/whatwg/html/issues/9491,Allow self-closing tags everywhere,2023-07-06T14:15:44Z,WebReflection
1623761925,whatwg/html,"Iâ€™ll also add that, from previous discussions weâ€™d had with implementors about other proposals that ",https://github.com/whatwg/html/issues/9491#issuecomment-1623761925,https://github.com/whatwg/html/issues/9491,Allow self-closing tags everywhere,2023-07-06T14:14:19Z,sideshowbarker
1623739179,whatwg/html,"(Fat-fingered the close button somehow, when I was editing my previous comment; I hadnâ€™t intended to",https://github.com/whatwg/html/issues/9491#issuecomment-1623739179,https://github.com/whatwg/html/issues/9491,Allow self-closing tags everywhere,2023-07-06T14:03:42Z,sideshowbarker
1623736857,whatwg/html,Worth adding a reminder here that the only effect the doctype has in browsers is to prevent browsers,https://github.com/whatwg/html/issues/9491#issuecomment-1623736857,https://github.com/whatwg/html/issues/9491,Allow self-closing tags everywhere,2023-07-06T14:02:10Z,sideshowbarker
1623727309,whatwg/html,> Declaring self closing mode on a page and using a library which does not support/detect will expos,https://github.com/whatwg/html/issues/9491#issuecomment-1623727309,https://github.com/whatwg/html/issues/9491,Allow self-closing tags everywhere,2023-07-06T13:56:18Z,WebReflection
1623719545,whatwg/html,"> if there's any way to enable this, parser should throw  You can use XML.",https://github.com/whatwg/html/issues/9491#issuecomment-1623719545,https://github.com/whatwg/html/issues/9491,Allow self-closing tags everywhere,2023-07-06T13:51:39Z,zcorpan
1623716846,whatwg/html,"> it's like saying, if you switch to Python 3 but you use Python 2 tools to lint your code expect is",https://github.com/whatwg/html/issues/9491#issuecomment-1623716846,https://github.com/whatwg/html/issues/9491,Allow self-closing tags everywhere,2023-07-06T13:49:53Z,keithamus
1623709835,whatwg/html,> Sites that opt in will expose themselves to XSS issues if they also use a sanitizer that doesn't s,https://github.com/whatwg/html/issues/9491#issuecomment-1623709835,https://github.com/whatwg/html/issues/9491,Allow self-closing tags everywhere,2023-07-06T13:45:08Z,WebReflection
1623704056,mozilla/standards-positions,I agree fwiw.,https://github.com/mozilla/standards-positions/issues/840#issuecomment-1623704056,https://github.com/mozilla/standards-positions/issues/840,Lazy loading for iframes,2023-07-06T13:41:15Z,emilio
1623702790,whatwg/html,Sites that opt in will expose themselves to XSS issues if they also use a sanitizer that doesn't sup,https://github.com/whatwg/html/issues/9491#issuecomment-1623702790,https://github.com/whatwg/html/issues/9491,Allow self-closing tags everywhere,2023-07-06T13:40:26Z,zcorpan
1623677284,whatwg/html,"it's opt in, it won't cause issues to developers opting in + it's not about scripting neither, it's ",https://github.com/whatwg/html/issues/9491#issuecomment-1623677284,https://github.com/whatwg/html/issues/9491,Allow self-closing tags everywhere,2023-07-06T13:23:27Z,WebReflection
1623657180,whatwg/html,I think we shouldn't introduce new parser flags that change parsing behavior. They cause XSS issues.,https://github.com/whatwg/html/issues/9491#issuecomment-1623657180,https://github.com/whatwg/html/issues/9491,Allow self-closing tags everywhere,2023-07-06T13:12:12Z,zcorpan
1623648013,whatwg/html,"I have ""*[a tiny DÃ©jÃ  vu](https://github.com/whatwg/html/issues/721#issuecomment-620706165)*""  <su",https://github.com/whatwg/html/issues/9491#issuecomment-1623648013,https://github.com/whatwg/html/issues/9491,Allow self-closing tags everywhere,2023-07-06T13:06:00Z,WebReflection
