id,repo,body,url,issue_url,issue_title,created_at,user
1385440779,whatwg/dom,Note that @justinfagnani proposed something for this a while back here: https://github.com/WICG/webc,https://github.com/whatwg/dom/issues/910#issuecomment-1385440779,https://github.com/whatwg/dom/issues/910,Should there be a declarative version of adoptedStyleSheets?,2023-01-17T13:41:16Z,matthewp
1385439300,whatwg/dom,"> The downsides of this approach, which this issue tries to tackle, are...  Aren't `<link>`s also ",https://github.com/whatwg/dom/issues/910#issuecomment-1385439300,https://github.com/whatwg/dom/issues/910,Should there be a declarative version of adoptedStyleSheets?,2023-01-17T13:40:06Z,matthewp
1385318815,whatwg/html,As @hsivonen notes in https://github.com/whatwg/dom/issues/831#issuecomment-1385294521 we need to up,https://github.com/whatwg/html/pull/5465#issuecomment-1385318815,https://github.com/whatwg/html/pull/5465,Add declarative Shadow DOM features,2023-01-17T12:00:20Z,annevk
1385294521,whatwg/dom,Normal templates turn off speculative fetches of resources whose URLs appear within the template. In,https://github.com/whatwg/dom/issues/831#issuecomment-1385294521,https://github.com/whatwg/dom/issues/831,Declarative Shadow DOM,2023-01-17T11:37:43Z,hsivonen
1385048673,whatwg/html,"I'm no longer happy with C's navigable, because it's too confusing with C's node navigable. I now th",https://github.com/whatwg/html/issues/8713#issuecomment-1385048673,https://github.com/whatwg/html/issues/8713,"""Nested navigable"" and ""child navigable"" are easy to confuse",2023-01-17T08:58:32Z,domenic
1385014728,whatwg/html,"That seems ok, though note that https://github.com/whatwg/html/pull/8008 makes `sizes` optional in s",https://github.com/whatwg/html/issues/7116#issuecomment-1385014728,https://github.com/whatwg/html/issues/7116,IMG tag: Omitting the sizes attribute when using width descriptors should be deemed correct.,2023-01-17T08:27:11Z,zcorpan
1384818896,whatwg/html,Yes please! (But I'm not a maintainer so please wait for a maintainer to give the green signal.) @an,https://github.com/whatwg/html/issues/7116#issuecomment-1384818896,https://github.com/whatwg/html/issues/7116,IMG tag: Omitting the sizes attribute when using width descriptors should be deemed correct.,2023-01-17T04:30:11Z,ADTC
1384802070,whatwg/html,"Hi, could I work on this?  > If the srcset attribute is present and has any image candidate string",https://github.com/whatwg/html/issues/7116#issuecomment-1384802070,https://github.com/whatwg/html/issues/7116,IMG tag: Omitting the sizes attribute when using width descriptors should be deemed correct.,2023-01-17T03:58:59Z,tlylt
1384786710,whatwg/html,This is a case of https://github.com/whatwg/html/issues/5461. The spec gives requirements on what au,https://github.com/whatwg/html/issues/8738#issuecomment-1384786710,https://github.com/whatwg/html/issues/8738,Image Srcset: what happens when some image candidate strings do not have width descriptor?,2023-01-17T03:24:41Z,domenic
1384784462,whatwg/html,@domfarolino you were most familiar with this part of the rewrite. Would you be able to take this on,https://github.com/whatwg/html/issues/8725#issuecomment-1384784462,https://github.com/whatwg/html/issues/8725,document state's history policy container does not seem to be correctly updated,2023-01-17T03:20:12Z,domenic
1384618224,whatwg/html,"> I removed the ""implementations can warn"" language as that would require us to acknowledge ""none"" a",https://github.com/whatwg/html/pull/8710#issuecomment-1384618224,https://github.com/whatwg/html/pull/8710,"Rename createImageBitMaps's imageOrientation from ""none"" to ""from-image""",2023-01-16T22:11:53Z,yiyix
1384392138,w3ctag/design-reviews,We looked at this today in a breakout. We don't think there are any architectural issues with it and,https://github.com/w3ctag/design-reviews/issues/801#issuecomment-1384392138,https://github.com/w3ctag/design-reviews/issues/801,baseline-source,2023-01-16T17:58:24Z,LeaVerou
1384381893,whatwg/html,"@domenic Okay, done.",https://github.com/whatwg/html/pull/8699#issuecomment-1384381893,https://github.com/whatwg/html/pull/8699,Editorial: Add alternatives for broken drafts.csswg.org reference links,2023-01-16T17:49:15Z,gibson042
1384323612,whatwg/html,"I already started having a look but I got blocked because of #8725. Anyway, I'll move forward with a",https://github.com/whatwg/html/pull/8447#issuecomment-1384323612,https://github.com/whatwg/html/pull/8447,Move origin into policy container. (#8302),2023-01-16T16:56:08Z,antosart
1384259321,mozilla/standards-positions,Getting the session history in a bit better shape in HTML spec is requirement for this. https://gith,https://github.com/mozilla/standards-positions/issues/543#issuecomment-1384259321,https://github.com/mozilla/standards-positions/issues/543,Navigation API,2023-01-16T16:08:11Z,smaug----
1384017489,whatwg/html,"I think this would really benefit from @antosart and @domenic's review as it touches history, naviga",https://github.com/whatwg/html/pull/8447#issuecomment-1384017489,https://github.com/whatwg/html/pull/8447,Move origin into policy container. (#8302),2023-01-16T12:57:17Z,annevk
1384002209,whatwg/html,There are still a couple of unresolved comment threads. It appears this also needs rebasing.,https://github.com/whatwg/html/pull/8199#issuecomment-1384002209,https://github.com/whatwg/html/pull/8199,Implement dialog initial focus proposal,2023-01-16T12:42:45Z,annevk
1383927052,whatwg/html,@mfreed7 can you please remove the `parseFromString()` changes from this PR so we can get this stand,https://github.com/whatwg/html/pull/5465#issuecomment-1383927052,https://github.com/whatwg/html/pull/5465,Add declarative Shadow DOM features,2023-01-16T11:43:21Z,annevk
1383911129,whatwg/dom,I put your build fixes in #1143 and rebased this. I also pushed a fixup commit to correct a number o,https://github.com/whatwg/dom/pull/892#issuecomment-1383911129,https://github.com/whatwg/dom/pull/892,Add declarative Shadow DOM features,2023-01-16T11:32:40Z,annevk
1383617396,whatwg/html,"Sorry, that's OP. I should have said first reply.",https://github.com/whatwg/html/issues/8627#issuecomment-1383617396,https://github.com/whatwg/html/issues/8627,setHTML() and declarative shadow roots,2023-01-16T07:52:19Z,annevk
1383616593,whatwg/html,I followed up with FedCM and Notifications.,https://github.com/whatwg/html/pull/6360#issuecomment-1383616593,https://github.com/whatwg/html/pull/6360,Meta: mark DOM manipulation task source as dfn,2023-01-16T07:51:19Z,annevk
1383509231,whatwg/html,This appears to be fixed now that Bikeshed has switched to WebRef. I have successfully linked to the,https://github.com/whatwg/html/pull/6360#issuecomment-1383509231,https://github.com/whatwg/html/pull/6360,Meta: mark DOM manipulation task source as dfn,2023-01-16T05:20:43Z,domenic
1383138703,whatwg/html,"Oh, I deleted my comment because I'd misread 8726, and after I reread it I wasn't still sure my comm",https://github.com/whatwg/html/issues/8728#issuecomment-1383138703,https://github.com/whatwg/html/issues/8728,Should the spec clarify that character encoding declarations are not actually required?,2023-01-15T12:29:02Z,pshaughn
1383024553,whatwg/html,"No, I don't.",https://github.com/whatwg/html/pull/8699#issuecomment-1383024553,https://github.com/whatwg/html/pull/8699,Editorial: Add alternatives for broken drafts.csswg.org reference links,2023-01-15T02:05:05Z,domenic
1383011000,whatwg/html,@domenic you don't think it'd be weird to not have the official URLs at all?,https://github.com/whatwg/html/pull/8699#issuecomment-1383011000,https://github.com/whatwg/html/pull/8699,Editorial: Add alternatives for broken drafts.csswg.org reference links,2023-01-15T01:08:26Z,gibson042
1377992970,whatwg/html,> > WebKit's implementation has been updated to support the latest semantics as of [commits.webkit.o,https://github.com/whatwg/html/pull/5465#issuecomment-1377992970,https://github.com/whatwg/html/pull/5465,Add declarative Shadow DOM features,2023-01-10T22:45:14Z,rniwa
1377564237,whatwg/html,> WebKit's implementation has been updated to support the latest semantics as of [commits.webkit.org,https://github.com/whatwg/html/pull/5465#issuecomment-1377564237,https://github.com/whatwg/html/pull/5465,Add declarative Shadow DOM features,2023-01-10T16:54:44Z,mfreed7
1334379201,whatwg/html,"> Also, this (and the previous commit) build locally for me, but don't seem to build on github. Advi",https://github.com/whatwg/html/pull/5465#issuecomment-1334379201,https://github.com/whatwg/html/pull/5465,Add declarative Shadow DOM features,2022-12-01T20:15:22Z,mfreed7
1266365280,whatwg/html,"Still some validation errors on the build output:  ``` ""file:/whatwg/output/index.html"":76742.332",https://github.com/whatwg/html/pull/5465#issuecomment-1266365280,https://github.com/whatwg/html/pull/5465,Add declarative Shadow DOM features,2022-10-04T03:57:45Z,domenic
1088650593,whatwg/html,Referencing the work being done by Open UI on [`<selectmenu>`](https://open-ui.org/components/select,https://github.com/whatwg/html/issues/3567#issuecomment-1088650593,https://github.com/whatwg/html/issues/3567,Have some way of opening `<dialog>` elements without JavaScript,2022-04-05T12:35:34Z,willrowe