id,repo,body,url,issue_url,issue_title,created_at,user
1623632009,whatwg/html,PR: https://github.com/whatwg/html/pull/9493,https://github.com/whatwg/html/issues/9448#issuecomment-1623632009,https://github.com/whatwg/html/issues/9448,auto-sizes concrete object size ignoring natural dimensions is not implementable,2023-07-06T12:55:00Z,zcorpan
1623599642,whatwg/html,@dtapuska I suspect this can be closed?,https://github.com/whatwg/html/pull/4606#issuecomment-1623599642,https://github.com/whatwg/html/pull/4606,Add disallowdocumentaccess iframe attribute to force a creation of a new agent cluster map,2023-07-06T12:31:36Z,annevk
1623268849,whatwg/html,@johannesodland indeed! Good call.  Ideally the applied style rules don't change from initial layo,https://github.com/whatwg/html/issues/9448#issuecomment-1623268849,https://github.com/whatwg/html/issues/9448,auto-sizes concrete object size ignoring natural dimensions is not implementable,2023-07-06T09:06:28Z,zcorpan
1623234018,mozilla/standards-positions,No dashboard entry as this is an extension of `contenteditable` (which also has no dashboard entry).,https://github.com/mozilla/standards-positions/issues/839#issuecomment-1623234018,https://github.com/mozilla/standards-positions/issues/839,"contenteditable=""plaintext-only""",2023-07-06T08:42:03Z,zcorpan
1623230267,mozilla/standards-positions,"We support lazy-loaded images, and the feature makes sense for `iframe` for similar reasons. Initial",https://github.com/mozilla/standards-positions/issues/840#issuecomment-1623230267,https://github.com/mozilla/standards-positions/issues/840,Lazy loading for iframes,2023-07-06T08:39:16Z,zcorpan
1623225159,whatwg/html,> Is it helpful to have stricter syntax constraints around `auto` so that we can use a selector in t,https://github.com/whatwg/html/issues/9448#issuecomment-1623225159,https://github.com/whatwg/html/issues/9448,auto-sizes concrete object size ignoring natural dimensions is not implementable,2023-07-06T08:35:19Z,johannesodland
1623221272,mozilla/standards-positions,"+1 for solving web-compat issues, but standardizing the behavior (at least roughly for the important",https://github.com/mozilla/standards-positions/issues/839#issuecomment-1623221272,https://github.com/mozilla/standards-positions/issues/839,"contenteditable=""plaintext-only""",2023-07-06T08:32:48Z,masayuki-nakano
1623108620,whatwg/html,@eeeps thank you!,https://github.com/whatwg/html/issues/9448#issuecomment-1623108620,https://github.com/whatwg/html/issues/9448,auto-sizes concrete object size ignoring natural dimensions is not implementable,2023-07-06T07:07:57Z,zcorpan
1623106296,whatwg/html,"> > * in the sizes parsing algorithm: if the computed value of contain is not size, then map auto to",https://github.com/whatwg/html/issues/9448#issuecomment-1623106296,https://github.com/whatwg/html/issues/9448,auto-sizes concrete object size ignoring natural dimensions is not implementable,2023-07-06T07:05:56Z,zcorpan
1622718570,webkit/standards-positions,Let's discuss before assigning a position.,https://github.com/WebKit/standards-positions/issues/201#issuecomment-1622718570,https://github.com/WebKit/standards-positions/issues/201,border-boundary CSS property,2023-07-06T00:12:56Z,othermaciej
1622699455,webkit/standards-positions,If this is accepted I'll reopen https://github.com/WebKit/standards-positions/issues/201.,https://github.com/WebKit/standards-positions/pull/221#issuecomment-1622699455,https://github.com/WebKit/standards-positions/pull/221,"Remove ""not considering"" position",2023-07-05T23:53:04Z,annevk
1622625169,webkit/standards-positions,"I've labelled it as the Web Apps WG based on the GitHub repository but I'm not entirely sure that's ",https://github.com/WebKit/standards-positions/issues/220#issuecomment-1622625169,https://github.com/WebKit/standards-positions/issues/220,Credential Management API - PasswordCredential,2023-07-05T22:40:44Z,lukewarlow
1622614665,whatwg/html,Another research note:  I was worried that even though ~80% of `<img>`s with `srcset`+`w` have `he,https://github.com/whatwg/html/issues/9448#issuecomment-1622614665,https://github.com/whatwg/html/issues/9448,auto-sizes concrete object size ignoring natural dimensions is not implementable,2023-07-05T22:26:53Z,eeeps
1622607332,webkit/standards-positions,A clarification that came up in the Mozilla standards position issue:  This change was not discuss,https://github.com/WebKit/standards-positions/issues/218#issuecomment-1622607332,https://github.com/WebKit/standards-positions/issues/218,WebCodecs AudioEncoder bitrateMode,2023-07-05T22:20:51Z,tguilbert-google
1622566458,whatwg/html,"I'll remove the `do-not-merge` label now too since the Chromium implementation for this has landed, ",https://github.com/whatwg/html/pull/9210#issuecomment-1622566458,https://github.com/whatwg/html/pull/9210,Use module referrer policy for descendant fetches,2023-07-05T21:43:32Z,domfarolino
1622543147,w3c/pointerevents,@patrickhlauke Please take a look.,https://github.com/w3c/pointerevents/pull/476#issuecomment-1622543147,https://github.com/w3c/pointerevents/pull/476,"Editorial changes: move tilt calculation section, normalize header tags",2023-07-05T21:27:18Z,mustaqahmed
1622522374,whatwg/html,Removing `needs-tests` label since WPTs have been uploaded.,https://github.com/whatwg/html/pull/9210#issuecomment-1622522374,https://github.com/whatwg/html/pull/9210,Use module referrer policy for descendant fetches,2023-07-05T21:14:36Z,domfarolino
1622452274,whatwg/html,"Yeah, there's a difference between not being able to show and hiding no-opping. This was discussed i",https://github.com/whatwg/html/pull/9142#issuecomment-1622452274,https://github.com/whatwg/html/pull/9142,Don't throw when popover/dialog is in requested state,2023-07-05T20:28:13Z,annevk
1622445292,w3c/pointerevents,Today we landed a [use-counter](https://chromium-review.googlesource.com/c/chromium/src/+/4666230) i,https://github.com/w3c/pointerevents/issues/472#issuecomment-1622445292,https://github.com/w3c/pointerevents/issues/472,consider to change the behavior of getCoalescedEvents on non-SecureContext,2023-07-05T20:24:35Z,mustaqahmed
1622332138,whatwg/html,"The current setup is consistent with dialog fwiw, `HTMLDialogElement::close()` does not throw, but `",https://github.com/whatwg/html/pull/9142#issuecomment-1622332138,https://github.com/whatwg/html/pull/9142,Don't throw when popover/dialog is in requested state,2023-07-05T19:20:00Z,nt1m
1622293273,whatwg/html,Thanks for clarifying. @nt1m @annevk do yall have any thoughts?,https://github.com/whatwg/html/pull/9457#issuecomment-1622293273,https://github.com/whatwg/html/pull/9457,Ignore DOM state when hiding popovers if needed,2023-07-05T18:48:50Z,josepharhar
1622248654,webkit/standards-positions,"Modulo compatibility with deployed content, converging on the above seems reasonable.  Usage of th",https://github.com/WebKit/standards-positions/issues/36#issuecomment-1622248654,https://github.com/WebKit/standards-positions/issues/36,Cookie Store API,2023-07-05T18:15:37Z,inexorabletash
1622242292,w3ctag/design-reviews,"> Donâ€™t you have the same problem with explicit fallbacks as well, if none of the specified fallback",https://github.com/w3ctag/design-reviews/issues/848#issuecomment-1622242292,https://github.com/w3ctag/design-reviews/issues/848,Specification review for CSS Anchor Positioning,2023-07-05T18:10:45Z,tabatkins
1622209930,whatwg/html,"Ok, yeah I suppose that making hidePopover throw on a disconnected popover doesnt necessarily go aga",https://github.com/whatwg/html/pull/9142#issuecomment-1622209930,https://github.com/whatwg/html/pull/9142,Don't throw when popover/dialog is in requested state,2023-07-05T17:45:24Z,josepharhar
1622172256,whatwg/html,"Oh weird, this definitely isn't right. Based on the [chromium implementation](https://source.chromi",https://github.com/whatwg/html/issues/9468#issuecomment-1622172256,https://github.com/whatwg/html/issues/9468,Should step 7 of  https://html.spec.whatwg.org/#hide-popover-algorithm be a while loop?,2023-07-05T17:17:10Z,josepharhar
1622164514,w3ctag/design-reviews,"Donâ€™t you have the same problem with explicit fallbacks as well, if none of the specified fallbacks ",https://github.com/w3ctag/design-reviews/issues/848#issuecomment-1622164514,https://github.com/w3ctag/design-reviews/issues/848,Specification review for CSS Anchor Positioning,2023-07-05T17:10:29Z,LeaVerou
1622159355,whatwg/html,Hmm yeah I see that the child popover can be showing while the parent is not showing. I suppose it w,https://github.com/whatwg/html/issues/9487#issuecomment-1622159355,https://github.com/whatwg/html/issues/9487,"Showing only a child popover causes ""beforetoggle"" and ""toggle"" events but popover is invisble",2023-07-05T17:06:13Z,josepharhar
1622149334,w3ctag/design-reviews,We've considered ways that we might avoid unnecessary upgrades for local networks (potentially build,https://github.com/w3ctag/design-reviews/issues/853#issuecomment-1622149334,https://github.com/w3ctag/design-reviews/issues/853,HTTPS Upgrades,2023-07-05T16:58:49Z,christhompson
1622132397,whatwg/html,> I think the first test in html/browsers/browsing-the-web/navigating-across-documents/initial-empty,https://github.com/whatwg/html/issues/9030#issuecomment-1622132397,https://github.com/whatwg/html/issues/9030,History length/index are not synchronously initialized in new navigables,2023-07-05T16:51:31Z,hsivonen
1622097202,whatwg/html,"Doing it the Gecko&spec way is more consistent: On every level, bogosity and absence work the same. ",https://github.com/whatwg/html/issues/8789#issuecomment-1622097202,https://github.com/whatwg/html/issues/8789,HTML cross-document encoding inheritance with bogus Content-Type charset,2023-07-05T16:25:12Z,hsivonen
1622094319,w3ctag/design-reviews,"There is no fallback, it just stays where you told it to stay. There's plenty of reasons to not do a",https://github.com/w3ctag/design-reviews/issues/848#issuecomment-1622094319,https://github.com/w3ctag/design-reviews/issues/848,Specification review for CSS Anchor Positioning,2023-07-05T16:23:09Z,tabatkins
1622056417,w3ctag/design-reviews,"Hi @reillyeon,    We looked at this today during our plenary call. First, we do agree that the use",https://github.com/w3ctag/design-reviews/issues/842#issuecomment-1622056417,https://github.com/w3ctag/design-reviews/issues/842,Isolated Web Apps,2023-07-05T16:01:57Z,LeaVerou
1621961632,whatwg/html,"Correct, the use counter is triggered during a serialization whenever an attribute value contains â€œ",https://github.com/whatwg/html/issues/6235#issuecomment-1621961632,https://github.com/whatwg/html/issues/6235,"Escape ""<"" and "">"" in attributes",2023-07-05T15:10:59Z,securityMB
1621953211,whatwg/html,OK. The use counter https://chromestatus.com/metrics/feature/timeline/popularity/4527 is currently a,https://github.com/whatwg/html/issues/6235#issuecomment-1621953211,https://github.com/whatwg/html/issues/6235,"Escape ""<"" and "">"" in attributes",2023-07-05T15:06:46Z,zcorpan
1621898750,whatwg/html,"FYI, two other bits of feedback (in addition to the above) that I'm currently tracking: * FreedomSc",https://github.com/whatwg/html/pull/9400#issuecomment-1621898750,https://github.com/whatwg/html/pull/9400,Add name attribute for grouping details elements into an exclusive accordion,2023-07-05T14:38:39Z,dbaron
1621896774,whatwg/html,PR at https://github.com/whatwg/html/pull/9490  Is there interest from WebKit and Chromium?,https://github.com/whatwg/html/issues/9225#issuecomment-1621896774,https://github.com/whatwg/html/issues/9225,Dirname should work with more input types,2023-07-05T14:37:28Z,zcorpan
1621895729,whatwg/html,@zcorpan Yes. AFAIR since M113. Still under the #enable-experimental-web-platform-features flag thou,https://github.com/whatwg/html/issues/6235#issuecomment-1621895729,https://github.com/whatwg/html/issues/6235,"Escape ""<"" and "">"" in attributes",2023-07-05T14:36:54Z,securityMB
1621856702,whatwg/html,@securityMB has the change shipped in Chrome Stable yet?,https://github.com/whatwg/html/issues/6235#issuecomment-1621856702,https://github.com/whatwg/html/issues/6235,"Escape ""<"" and "">"" in attributes",2023-07-05T14:17:35Z,zcorpan
1621813810,whatwg/html,*This is a comment from the [Accessible Platform Architectures (APA) Working Group](https://www.w3.o,https://github.com/whatwg/html/issues/7732#issuecomment-1621813810,https://github.com/whatwg/html/issues/7732,Consider preventing page scroll when modal dialog is visible,2023-07-05T13:55:37Z,matatk
1621685920,whatwg/html,"> * in the sizes parsing algorithm: if the computed value of contain is not size, then map auto to 1",https://github.com/whatwg/html/issues/9448#issuecomment-1621685920,https://github.com/whatwg/html/issues/9448,auto-sizes concrete object size ignoring natural dimensions is not implementable,2023-07-05T12:44:58Z,emilio
1621372035,whatwg/dom,You can attach data to the `Error` class:  ```js const reason = new Error('User clicked Kill Now',https://github.com/whatwg/dom/issues/1215#issuecomment-1621372035,https://github.com/whatwg/dom/issues/1215,Variable strength aborting,2023-07-05T09:24:53Z,keithamus
1621288624,whatwg/html,IMO the requirements are:  - it should be possible to use any CSS layout/sizing features - an `im,https://github.com/whatwg/html/issues/9448#issuecomment-1621288624,https://github.com/whatwg/html/issues/9448,auto-sizes concrete object size ignoring natural dimensions is not implementable,2023-07-05T08:33:07Z,zcorpan
1621288141,w3ctag/design-reviews,"Yes, there's no way to coordinate among browsers. The end state is what we want to standardise on. H",https://github.com/w3ctag/design-reviews/issues/738#issuecomment-1621288141,https://github.com/w3ctag/design-reviews/issues/738,early design review: Permissions-Policy: unload,2023-07-05T08:32:47Z,fergald
1621096681,whatwg/webidl,I'm happy to implement `cause` attribute in Chromium.,https://github.com/whatwg/webidl/pull/1179#issuecomment-1621096681,https://github.com/whatwg/webidl/pull/1179,Normative: Add DOMException cause,2023-07-05T06:17:36Z,yuki3
1621049620,webkit/standards-positions,"Anecdotally, I work on a SaaS provider that embeds forms in third-party websites, usually used as ""c",https://github.com/WebKit/standards-positions/issues/50#issuecomment-1621049620,https://github.com/WebKit/standards-positions/issues/50,CHIPS (Cookies Having Independent Partitioned State),2023-07-05T05:29:36Z,Sora2455
1620880641,whatwg/dom,I feel like there are cases where you want feedback to affect related operations.  Give up on a se,https://github.com/whatwg/dom/issues/1082#issuecomment-1620880641,https://github.com/whatwg/dom/issues/1082,Timeout AbortSignal (or AbortController) that gets input from the operation,2023-07-05T01:07:54Z,bojavou
1620839158,whatwg/html,"I'm OOO until Tuesday, but I _think_ James already wrote tests for #3989.",https://github.com/whatwg/html/pull/9464#issuecomment-1620839158,https://github.com/whatwg/html/pull/9464,Snapshot fallback base URL for about:-schemed Documents,2023-07-04T23:53:15Z,domenic
1620651884,whatwg/html,> I suspect http://localhost:8080/#the-javascript:-url-special-case also needs to copy over the abou,https://github.com/whatwg/html/pull/9464#issuecomment-1620651884,https://github.com/whatwg/html/pull/9464,Snapshot fallback base URL for about:-schemed Documents,2023-07-04T19:36:49Z,domfarolino
1620633709,webkit/standards-positions,with plain basic or general cookie auth network attacker gains persistence: they can intercept the c,https://github.com/WebKit/standards-positions/issues/212#issuecomment-1620633709,https://github.com/WebKit/standards-positions/issues/212,"RFC7616: Support ",2023-07-04T19:09:49Z,rojer
1620584016,w3ctag/design-reviews,"Some details to add to @noamr's response.  > What happens when both documents opt in, but there is",https://github.com/w3ctag/design-reviews/issues/851#issuecomment-1620584016,https://github.com/w3ctag/design-reviews/issues/851,Cross-document View Transitions API,2023-07-04T17:55:33Z,khushalsagar
1620545542,whatwg/dom,> We (node) shipped (are shipping) our own helper to add a listener without the stopImmediatePropaga,https://github.com/whatwg/dom/issues/1195#issuecomment-1620545542,https://github.com/whatwg/dom/issues/1195,Userland AbortSignal,2023-07-04T17:05:43Z,bojavou
1620523148,whatwg/webidl,> Let me hereby declare that you can consider WebKit as a supportive implementer. You'll need to get,https://github.com/whatwg/webidl/pull/1179#issuecomment-1620523148,https://github.com/whatwg/webidl/pull/1179,Normative: Add DOMException cause,2023-07-04T16:39:13Z,petervanderbeken
1620515474,webkit/standards-positions,"Yeah, couple of things to add to what John said above:  1. There is no change in position as we do",https://github.com/WebKit/standards-positions/issues/36#issuecomment-1620515474,https://github.com/WebKit/standards-positions/issues/36,Cookie Store API,2023-07-04T16:29:58Z,annevk
1620514684,whatwg/webidl,"> The gain is spec alignment and matching the design philosophy of the feature, which reduces the li",https://github.com/whatwg/webidl/pull/1179#issuecomment-1620514684,https://github.com/whatwg/webidl/pull/1179,Normative: Add DOMException cause,2023-07-04T16:29:07Z,saschanaz
1620493042,whatwg/html,"That's true, but then we'd have to change a whole lot more, to pass through that flag and make it do",https://github.com/whatwg/html/pull/9430#issuecomment-1620493042,https://github.com/whatwg/html/pull/9430,Clarify the fake token step in fragment parsing,2023-07-04T16:06:26Z,annevk
1620479549,mozilla/standards-positions,Setting initial state does not require JS.  It can be done by using an `open` attribute in the marku,https://github.com/mozilla/standards-positions/issues/831#issuecomment-1620479549,https://github.com/mozilla/standards-positions/issues/831,"Request for Mozilla Position: exclusive accordions with <details name="""">",2023-07-04T15:54:18Z,dbaron
1620473206,whatwg/webidl,"The gain is spec alignment and matching the design philosophy of the feature, which reduces the like",https://github.com/whatwg/webidl/pull/1179#issuecomment-1620473206,https://github.com/whatwg/webidl/pull/1179,Normative: Add DOMException cause,2023-07-04T15:48:34Z,ljharb
1620441407,webkit/standards-positions,It's not clear to me how you can be safe from network attackers without TLS?,https://github.com/WebKit/standards-positions/issues/212#issuecomment-1620441407,https://github.com/WebKit/standards-positions/issues/212,"RFC7616: Support ",2023-07-04T15:23:58Z,annevk
1620414162,whatwg/webidl,[OP](https://github.com/whatwg/webidl/pull/1179#issue-1337844223) needs to be filled out and @domeni,https://github.com/whatwg/webidl/pull/1179#issuecomment-1620414162,https://github.com/whatwg/webidl/pull/1179,Normative: Add DOMException cause,2023-07-04T15:04:04Z,annevk
1620413725,w3ctag/design-reviews,(Chrome hat back on)  I'm interested to understand the TAG's concerns a little deeper. I can see t,https://github.com/w3ctag/design-reviews/issues/831#issuecomment-1620413725,https://github.com/w3ctag/design-reviews/issues/831,Eligibility for autofill,2023-07-04T15:03:42Z,stephenmcgruer
1620409445,w3ctag/design-reviews,"> We'd also suggest requesting feedback from the Web Payments working group if that's not something ",https://github.com/w3ctag/design-reviews/issues/831#issuecomment-1620409445,https://github.com/w3ctag/design-reviews/issues/831,Eligibility for autofill,2023-07-04T15:00:35Z,stephenmcgruer
1620330955,w3c/pointerevents,"sorry, that slipped me by. will review later today. thank you @mustaqahmed ",https://github.com/w3c/pointerevents/pull/473#issuecomment-1620330955,https://github.com/w3c/pointerevents/pull/473,Clarify pointercancel coordinates,2023-07-04T14:17:32Z,patrickhlauke
1620328880,w3c/pointerevents,"This is ready for review, please take a look.",https://github.com/w3c/pointerevents/pull/473#issuecomment-1620328880,https://github.com/w3c/pointerevents/pull/473,Clarify pointercancel coordinates,2023-07-04T14:16:05Z,mustaqahmed
1620303525,whatwg/html,">   Sorry, I was wrong.  Looks like 6.6 of [hide popovers until](https://html.spec.whatwg.org/#h",https://github.com/whatwg/html/issues/9468#issuecomment-1620303525,https://github.com/whatwg/html/issues/9468,Should step 7 of  https://html.spec.whatwg.org/#hide-popover-algorithm be a while loop?,2023-07-04T14:00:16Z,cathiechen
1620299720,whatwg/html,We currently have interop on this point: The attributes of the context node are ignored: https://sof,https://github.com/whatwg/html/pull/9430#issuecomment-1620299720,https://github.com/whatwg/html/pull/9430,Clarify the fake token step in fragment parsing,2023-07-04T13:57:46Z,hsivonen
1620212296,whatwg/dom,@WebReflection Thank you for giving your thoughts!! I agree with your idea about the interface. :),https://github.com/whatwg/dom/issues/1214#issuecomment-1620212296,https://github.com/whatwg/dom/issues/1214,another version of `Element.prototype.contains` that considers slotted elements as children,2023-07-04T13:02:52Z,canalun
1620170910,webkit/standards-positions,I donâ€™t know if weâ€™ve had a chance to communicate our latest analysis but itâ€™s important for us that,https://github.com/WebKit/standards-positions/issues/36#issuecomment-1620170910,https://github.com/WebKit/standards-positions/issues/36,Cookie Store API,2023-07-04T12:36:04Z,johnwilander
1620123515,whatwg/dom,We (node) shipped (are shipping) our own helper to add a listener without the stopImmediatePropagati,https://github.com/whatwg/dom/issues/1195#issuecomment-1620123515,https://github.com/whatwg/dom/issues/1195,Userland AbortSignal,2023-07-04T12:05:02Z,benjamingr
1619981977,mozilla/standards-positions,"The proposed solution explicitly talks about setAttribute or open attributes, in addition to user in",https://github.com/mozilla/standards-positions/issues/831#issuecomment-1619981977,https://github.com/mozilla/standards-positions/issues/831,"Request for Mozilla Position: exclusive accordions with <details name="""">",2023-07-04T10:27:44Z,smaug----
1619979577,whatwg/html,`data` and `javascript` are there (rows 23 and 24). I had missed to tick some checkboxes for those (,https://github.com/whatwg/html/issues/9158#issuecomment-1619979577,https://github.com/whatwg/html/issues/9158,Consider a different process for standardizing registerProtocolHandler schemes,2023-07-04T10:26:02Z,zcorpan
1619965150,whatwg/html,"""If element's [popover](https://html.spec.whatwg.org/multipage/popover.html#attr-popover) attribute ",https://github.com/whatwg/html/issues/9468#issuecomment-1619965150,https://github.com/whatwg/html/issues/9468,Should step 7 of  https://html.spec.whatwg.org/#hide-popover-algorithm be a while loop?,2023-07-04T10:16:05Z,cathiechen
1619936264,w3ctag/design-reviews,Re: gradually flipping; I'm a bit unsure how that would work in terms of spec text. Wouldn't that be,https://github.com/w3ctag/design-reviews/issues/738#issuecomment-1619936264,https://github.com/w3ctag/design-reviews/issues/738,early design review: Permissions-Policy: unload,2023-07-04T09:58:32Z,cynthia
1619907651,webkit/standards-positions,Is https://bugs.webkit.org/show_bug.cgi?id=258504 an indication that WebKit's position has changed?,https://github.com/WebKit/standards-positions/issues/36#issuecomment-1619907651,https://github.com/WebKit/standards-positions/issues/36,Cookie Store API,2023-07-04T09:40:45Z,rik
1619849794,whatwg/html,@past I am interested in joining the call and contributing to the issues if any.,https://github.com/whatwg/html/issues/9474#issuecomment-1619849794,https://github.com/whatwg/html/issues/9474,Upcoming HTML standard issue triage meeting on 7/13/2023,2023-07-04T09:06:32Z,3shool
1619732730,whatwg/html,"Done ðŸ‘ ",https://github.com/whatwg/html/pull/9407#issuecomment-1619732730,https://github.com/whatwg/html/pull/9407,Propagate fetch referrer in dynamic imports,2023-07-04T07:58:59Z,nicolo-ribaudo
1619722534,w3ctag/design-reviews,"Hi @schwering   > However, payment service providers have voiced their interest. Happy to ask them",https://github.com/w3ctag/design-reviews/issues/831#issuecomment-1619722534,https://github.com/w3ctag/design-reviews/issues/831,Eligibility for autofill,2023-07-04T07:52:29Z,torgo
1619711291,whatwg/html,"Yes IMO this still makes sense - for Blink's ScriptRegexp, the reasoning is described at crbug.com/9",https://github.com/whatwg/html/issues/9469#issuecomment-1619711291,https://github.com/whatwg/html/issues/9469,Specify a maximal depth of backtracking for the pattern attribute on input elements,2023-07-04T07:47:25Z,schuay
1619707116,w3ctag/design-reviews,"Looks good, however I see potential issues:  In local networks, having `http` instead of `https` f",https://github.com/w3ctag/design-reviews/issues/853#issuecomment-1619707116,https://github.com/w3ctag/design-reviews/issues/853,HTTPS Upgrades,2023-07-04T07:45:43Z,ylafon
1619685091,w3ctag/design-reviews,"Hi @johannhof given that, we're going to set the milestone of early September to check back on this.",https://github.com/w3ctag/design-reviews/issues/808#issuecomment-1619685091,https://github.com/w3ctag/design-reviews/issues/808,requestStorageAccessFor,2023-07-04T07:36:28Z,torgo
1619668461,w3ctag/design-reviews,Hi @fergald thanks for that - I'm noting negative signals from Firefox and Webkit. Has there been an,https://github.com/w3ctag/design-reviews/issues/738#issuecomment-1619668461,https://github.com/w3ctag/design-reviews/issues/738,early design review: Permissions-Policy: unload,2023-07-04T07:26:31Z,torgo
